Tarih,Hisse,open,high,low,close,volume,YuksekKapanis_Fark,AcilisKapanis_Fark,AcilisKapanisFark_Ort,AcilisKapanisFark_OrtalamayaGoreDegisim,AcilisKapanisFarkOrt_MaxSon10,HacimOrtalama,%Hacim_HacimOrtalama,Fark_Orani,Kosul,rsi,MACD_12_26_9,MACDh_12_26_9,MACDs_12_26_9,Tarih1,prev_close,%Deg,isPivot,pointpos,destek,direnc,Tsinyal_Banker_Dip,Tsinyal_Banker_DipKarar
17-11-2025 10:00,GEREL,16.9,18.31,16.82,18.31,6145728.0,0.0,1.41,0.11,1158.93,1.41,903873.8,579.93,0.0,True,77.56,0.21,0.11,0.1,2025-11-17,16.65,9.97,0,,15.76,ATH,False,False
17-11-2025 10:00,OSMEN,8.78,8.95,8.77,8.93,416290.0,0.02,0.15,0.0,3650.0,0.15,181690.9,129.12,0.13,True,47.23,-0.12,0.03,-0.15,2025-11-17,8.77,1.82,0,,ATL,9.06,True,False
17-11-2025 10:00,SKYMD,12.21,12.52,12.21,12.45,1084946.0,0.07,0.24,0.01,3328.57,0.24,393100.4,176.0,0.29,True,57.3,-0.08,0.03,-0.1,2025-11-17,12.17,2.3,0,,12.12,12.78,True,True
17-11-2025 10:00,SEGYO,6.2,6.66,6.17,6.66,18187489.0,0.0,0.46,0.1,350.98,0.46,5796071.9,213.79,0.0,True,74.5,0.11,0.14,-0.03,2025-11-17,6.06,9.9,0,,5.13,ATH,False,False
17-11-2025 10:00,SAMAT,6.15,6.3,6.07,6.26,282821.0,0.04,0.11,0.02,400.0,0.11,91081.1,210.52,0.36,True,56.9,-0.01,0.02,-0.03,2025-11-17,6.18,1.29,0,,6.0,6.49,False,False
17-11-2025 10:00,DURDO,3.58,3.67,3.58,3.66,1077182.0,0.01,0.08,0.01,700.0,0.08,307959.7,249.78,0.12,True,65.07,-0.0,0.01,-0.01,2025-11-17,3.58,2.23,0,,3.55,3.82,False,False
17-11-2025 10:00,GMTAS,44.24,45.24,44.2,45.18,671077.0,0.06,0.94,0.0,23400.0,0.94,229605.4,192.27,0.06,True,56.32,-0.19,0.01,-0.2,2025-11-17,44.1,2.45,0,,44.3,45.36,True,True
17-11-2025 10:00,ESCAR,19.05,19.39,18.85,19.33,578038.0,0.06,0.28,0.01,1900.0,0.28,293196.5,97.15,0.21,True,57.19,-0.02,0.03,-0.05,2025-11-17,19.08,1.31,0,,18.7,19.42,False,False
17-11-2025 10:00,PNSUT,11.16,11.39,11.15,11.36,208508.0,0.03,0.2,0.0,19900.0,0.2,115528.7,80.48,0.15,True,51.76,-0.1,0.01,-0.11,2025-11-17,11.1,2.34,0,,11.02,11.86,True,True
17-11-2025 10:00,PENTA,13.87,14.2,13.87,14.15,546364.0,0.05,0.28,0.01,4566.67,0.28,208476.9,162.07,0.18,True,55.62,-0.11,0.03,-0.14,2025-11-17,13.8,2.54,0,,14.03,15.76,True,False
17-11-2025 10:00,PCILT,22.72,23.48,22.72,23.28,256848.0,0.2,0.56,0.03,1900.0,0.56,73152.3,251.11,0.36,True,55.29,-0.21,0.05,-0.25,2025-11-17,22.66,2.74,0,,23.08,23.58,True,True
17-11-2025 10:00,BRKVY,84.95,88.0,84.35,87.95,381771.0,0.05,3.0,0.6,400.0,3.0,137574.1,177.5,0.02,True,73.28,0.82,0.49,0.33,2025-11-17,84.7,3.84,0,,81.5,93.5,False,False
17-11-2025 10:00,OZYSR,38.5,40.5,37.2,40.36,423313.0,0.14,1.86,0.21,777.36,1.86,90134.9,369.64,0.08,True,70.2,0.33,0.05,0.28,2025-11-17,39.1,3.22,0,,36.5,ATH,False,False
17-11-2025 10:00,BULGS,42.64,45.36,42.62,45.12,4938175.0,0.24,2.48,0.34,620.93,2.48,1617271.0,205.34,0.1,True,66.9,0.02,0.34,-0.32,2025-11-17,42.42,6.36,0,,40.84,48.7,False,False
17-11-2025 10:00,BURCE,32.44,34.12,31.26,34.1,234446.0,0.02,1.66,0.11,1466.04,1.66,87366.3,168.35,0.01,True,47.76,-1.05,0.11,-1.16,2025-11-17,32.5,4.92,0,,34.0,40.0,True,True
17-11-2025 10:00,INFO,3.9,4.12,3.89,4.08,14708229.0,0.04,0.18,0.01,1400.0,0.18,3409225.3,331.42,0.22,True,59.23,-0.07,0.03,-0.09,2025-11-17,3.86,5.7,0,,ATL,4.42,True,False
17-11-2025 10:00,CEMAS,5.43,5.66,5.43,5.65,16867704.0,0.01,0.22,0.03,780.0,0.22,6407626.7,163.24,0.05,True,64.84,-0.0,0.01,-0.02,2025-11-17,5.43,4.05,0,,5.35,6.3,False,False
17-11-2025 10:00,ETILR,4.06,4.14,4.06,4.12,1136757.0,0.02,0.06,0.01,1100.0,0.06,437149.2,160.04,0.33,True,58.55,-0.03,0.01,-0.04,2025-11-17,4.04,1.98,0,,3.99,4.46,True,False
17-11-2025 10:00,GLRYH,4.31,4.43,4.31,4.41,2979854.0,0.02,0.1,0.0,9900.0,0.1,1200986.6,148.12,0.2,True,47.67,-0.09,0.02,-0.1,2025-11-17,4.29,2.8,0,,4.17,5.15,True,False
17-11-2025 10:00,ODAS,5.29,5.4,5.28,5.38,10008445.0,0.02,0.09,0.0,8900.0,0.09,3557188.6,181.36,0.22,True,56.42,-0.03,0.01,-0.04,2025-11-17,5.24,2.67,0,,5.27,5.48,False,False
17-11-2025 10:00,HATEK,19.85,21.46,19.78,21.3,5215594.0,0.16,1.45,0.27,439.03,1.45,2812443.8,85.45,0.11,True,79.88,0.72,0.16,0.56,2025-11-17,19.69,8.18,0,,16.56,ATH,False,False
17-11-2025 10:00,CONSE,3.17,3.25,3.17,3.24,1397197.0,0.01,0.07,0.0,1650.0,0.07,551916.1,153.15,0.14,True,60.9,-0.02,0.01,-0.03,2025-11-17,3.15,2.86,0,,3.13,3.48,True,False
17-11-2025 10:00,KRDMA,24.74,25.68,24.72,25.54,484812.0,0.14,0.8,0.03,2400.0,0.8,159511.9,203.93,0.18,True,60.27,-0.16,0.08,-0.24,2025-11-17,24.58,3.91,0,,24.6,25.76,True,False
17-11-2025 10:00,EKOS,26.14,28.2,26.14,28.12,2075551.0,0.08,1.98,0.18,976.09,1.98,447618.2,363.69,0.04,True,77.61,0.05,0.19,-0.15,2025-11-17,26.02,8.07,0,,25.44,28.92,False,False
17-11-2025 10:00,GLRMK,171.1,174.7,170.5,174.1,439863.0,0.6,3.0,0.32,837.5,3.0,139032.0,216.38,0.2,True,55.77,-1.32,0.57,-1.89,2025-11-17,169.1,2.96,0,,164.0,176.0,False,False
17-11-2025 10:00,KRVGD,2.53,2.58,2.52,2.58,1678555.0,0.0,0.05,0.0,1150.0,0.05,768939.9,118.29,0.0,True,59.4,-0.0,0.01,-0.01,2025-11-17,2.52,2.38,0,,2.48,2.61,False,False
17-11-2025 10:00,KZGYO,24.72,26.44,24.56,26.22,949364.0,0.22,1.5,0.14,941.67,1.5,159277.7,496.04,0.15,True,75.85,-0.02,0.17,-0.2,2025-11-17,24.4,7.46,0,,24.16,27.64,True,False
17-11-2025 10:00,IHYAY,2.26,2.35,2.26,2.33,2880426.0,0.02,0.07,0.0,1.576259869579679e+17,0.07,994436.8,189.65,0.29,True,48.83,-0.02,-0.0,-0.02,2025-11-17,2.26,3.1,0,,2.32,2.37,False,False
17-11-2025 10:00,LIDER,78.65,83.3,78.65,82.9,397457.0,0.4,4.25,0.34,1150.0,4.25,126218.1,214.9,0.09,True,80.4,2.42,-0.12,2.54,2025-11-17,78.65,5.4,0,,65.75,ATH,False,False
17-11-2025 10:00,ECZYT,349.25,356.25,346.0,356.0,199946.0,0.25,6.75,1.3,419.23,6.75,83456.7,139.58,0.04,True,77.08,4.02,0.81,3.21,2025-11-17,346.5,2.74,0,,332.0,ATH,False,False
17-11-2025 10:00,ECOGR,29.48,29.6,29.08,29.6,2998903.0,0.0,0.12,0.01,900.0,0.12,1371235.5,118.7,0.0,True,100.0,1.65,0.13,1.52,2025-11-17,26.92,9.96,0,,22.26,ATH,False,False
17-11-2025 10:00,DYOBY,13.26,13.68,13.26,13.56,218081.0,0.12,0.3,0.02,1400.0,0.3,89810.8,142.82,0.4,True,65.23,-0.04,0.03,-0.08,2025-11-17,13.22,2.57,0,,13.15,13.64,True,True
17-11-2025 10:00,BARMA,21.48,23.34,21.38,23.34,3796943.0,0.0,1.86,0.22,745.45,1.86,557294.0,581.32,0.0,True,80.4,0.34,0.18,0.16,2025-11-17,21.22,9.99,0,,20.08,ATH,False,False
17-11-2025 10:00,MARTI,3.09,3.17,3.09,3.16,2835459.0,0.01,0.07,0.01,677.78,0.07,1575905.9,79.93,0.14,True,58.63,-0.02,0.01,-0.03,2025-11-17,3.07,2.93,0,,3.06,3.45,False,False
17-11-2025 10:00,ALKLC,68.1,74.15,68.1,74.15,1398878.0,0.0,6.05,0.58,943.1,6.05,213740.4,554.48,0.0,True,63.2,-0.97,0.47,-1.45,2025-11-17,67.45,9.93,0,,69.2,77.9,True,True
17-11-2025 10:00,GOODY,15.37,15.67,15.37,15.6,303789.0,0.07,0.23,0.02,995.24,0.23,115941.1,162.02,0.3,True,65.0,-0.01,0.04,-0.05,2025-11-17,15.29,2.03,0,,15.16,16.73,False,False
17-11-2025 10:00,AKYHO,3.03,3.1,3.01,3.1,602352.0,0.0,0.07,0.01,600.0,0.07,180763.5,233.23,0.0,True,60.66,-0.01,0.01,-0.01,2025-11-17,3.04,1.97,0,,2.98,3.27,False,False
17-11-2025 10:00,FONET,2.8,2.93,2.79,2.9,15361356.0,0.03,0.1,0.0,4900.0,0.1,4110207.0,273.74,0.3,True,63.33,-0.02,0.01,-0.02,2025-11-17,2.77,4.69,0,,2.79,3.07,True,False
17-11-2025 10:00,FADE,13.58,13.75,13.45,13.73,199104.0,0.02,0.15,0.02,733.33,0.15,69534.1,186.34,0.13,True,55.71,-0.07,0.04,-0.11,2025-11-17,13.51,1.63,0,,13.41,14.39,True,False
17-11-2025 10:00,HURGZ,5.5,5.99,5.5,5.99,2639958.0,0.0,0.49,0.05,942.55,0.49,448651.9,488.42,0.0,True,72.86,-0.01,0.03,-0.04,2025-11-17,5.45,9.91,0,,5.46,6.0,True,True
17-11-2025 10:00,ARASE,57.0,58.65,57.0,58.2,186888.0,0.45,1.2,0.06,1746.15,1.2,53730.8,247.82,0.37,True,59.07,-0.38,0.16,-0.53,2025-11-17,56.85,2.37,0,,56.0,60.85,True,False
17-11-2025 10:00,HUNER,3.5,3.58,3.49,3.57,3444884.0,0.01,0.07,0.0,2233.33,0.07,986106.1,249.34,0.14,True,64.23,-0.01,0.01,-0.03,2025-11-17,3.46,3.18,0,,3.48,3.92,False,False
17-11-2025 10:00,AGROT,6.98,7.13,6.97,7.1,2686321.0,0.03,0.12,0.01,1233.33,0.12,891620.9,201.29,0.25,True,64.31,-0.01,0.02,-0.04,2025-11-17,6.93,2.45,0,,6.89,7.31,True,False
17-11-2025 10:00,YEOTK,36.7,38.0,36.6,37.86,2483928.0,0.14,1.16,0.12,850.82,1.16,545371.7,355.46,0.12,True,67.02,0.06,0.11,-0.05,2025-11-17,36.48,3.78,0,,36.14,39.0,False,False
17-11-2025 10:00,TATGD,12.86,13.13,12.86,13.09,295320.0,0.04,0.23,0.02,1337.5,0.23,95909.7,207.91,0.17,True,49.92,-0.11,0.03,-0.14,2025-11-17,12.91,1.39,0,,13.03,14.45,True,False
17-11-2025 10:00,EUPWR,27.52,28.34,27.5,28.12,1690357.0,0.22,0.6,0.03,2207.69,0.6,386019.2,337.89,0.37,True,58.47,-0.21,0.07,-0.28,2025-11-17,27.3,3.0,0,,27.72,30.26,True,False
17-11-2025 10:00,AYDEM,18.21,18.62,18.2,18.54,611424.0,0.08,0.33,0.01,2438.46,0.33,240233.8,154.51,0.24,True,55.27,-0.12,0.03,-0.16,2025-11-17,18.12,2.32,0,,18.08,19.33,True,True
17-11-2025 10:00,ARTMS,40.56,43.34,40.52,42.84,960046.0,0.5,2.28,0.2,1063.27,2.28,180067.9,433.16,0.22,True,61.25,-0.38,0.18,-0.56,2025-11-17,40.2,6.57,0,,39.34,43.06,False,False
17-11-2025 10:00,ATATP,147.2,152.1,146.3,152.1,476395.0,0.0,4.9,0.18,2622.22,4.9,148933.9,219.87,0.0,True,55.19,-1.91,0.25,-2.16,2025-11-17,145.9,4.25,0,,148.8,174.8,True,True
17-11-2025 10:00,GENTS,10.4,11.08,10.25,11.04,7075786.0,0.04,0.64,0.03,1782.35,0.64,1515901.7,366.77,0.06,True,58.45,-0.15,0.03,-0.18,2025-11-17,10.17,8.55,0,,10.06,11.8,True,True
17-11-2025 10:00,ISDMR,35.26,35.92,35.26,35.82,425365.0,0.1,0.56,0.02,3011.11,0.56,277369.3,53.36,0.18,True,56.81,-0.19,0.07,-0.26,2025-11-17,35.2,1.76,0,,35.3,35.9,True,False
14-11-2025 17:00,AKFIS,21.74,22.3,21.68,22.3,702885.0,0.0,0.56,0.03,1766.67,0.56,350002.5,100.82,0.0,True,48.5,-0.27,0.07,-0.34,2025-11-14,22.02,1.27,0,,ATL,22.38,True,False
14-11-2025 17:00,AKGRT,6.67,6.75,6.66,6.74,2029041.0,0.01,0.07,0.01,900.0,0.07,1006207.1,101.65,0.14,True,50.1,-0.05,0.01,-0.05,2025-11-14,6.67,1.05,0,,6.73,7.13,True,True
14-11-2025 17:00,VAKFN,2.26,2.33,2.23,2.32,79478963.0,0.01,0.06,0.0,1900.0,0.06,22845821.1,247.89,0.17,True,73.73,0.03,0.0,0.03,2025-11-14,2.23,4.04,0,,2.17,ATH,False,False
14-11-2025 17:00,KRPLS,7.65,8.1,7.64,8.0,2502542.0,0.1,0.35,0.02,1300.0,0.35,345179.3,625.0,0.29,True,61.67,-0.04,0.02,-0.06,2025-11-14,7.77,2.96,0,,7.69,9.06,True,True
14-11-2025 17:00,FROTO,93.3,94.45,93.1,94.4,1633145.0,0.05,1.1,0.03,3566.67,1.1,874916.1,86.66,0.05,True,48.91,-0.46,0.02,-0.48,2025-11-14,94.7,-0.32,0,,93.5,98.95,True,True
14-11-2025 17:00,MTRKS,23.78,24.08,23.78,24.02,118264.0,0.06,0.24,0.01,2900.0,0.24,68260.1,73.25,0.25,True,42.72,-0.25,0.04,-0.29,2025-11-14,24.16,-0.58,0,,ATL,25.24,True,True
14-11-2025 17:00,AKENR,9.95,10.06,9.94,10.05,583011.0,0.01,0.1,0.0,9900.0,0.1,325518.3,79.1,0.1,True,47.65,-0.05,0.01,-0.05,2025-11-14,10.03,0.2,0,,9.98,10.25,False,False
14-11-2025 17:00,MGROS,499.0,505.5,498.25,504.0,390992.0,1.5,5.0,0.25,1900.0,5.0,235363.9,66.12,0.3,True,56.64,-0.43,-0.11,-0.32,2025-11-14,503.5,0.1,0,,482.25,515.0,False,False
14-11-2025 17:00,MOGAN,8.35,8.48,8.34,8.48,655989.0,0.0,0.13,0.0,6400.0,0.13,317965.4,106.31,0.0,True,43.71,-0.11,0.02,-0.13,2025-11-14,8.42,0.71,0,,ATL,8.78,True,True
14-11-2025 17:00,KCHOL,162.7,164.3,162.5,164.0,3129837.0,0.3,1.3,0.01,12900.0,1.3,1965026.8,59.28,0.23,True,45.84,-0.65,-0.04,-0.61,2025-11-14,165.0,-0.61,0,,159.0,166.7,False,False
14-11-2025 17:00,JANTS,18.98,19.15,18.96,19.15,369093.0,0.0,0.17,0.0,3300.0,0.17,167841.4,119.91,0.0,True,39.01,-0.19,0.02,-0.2,2025-11-14,19.24,-0.47,0,,ATL,21.48,True,True
14-11-2025 17:00,KOZAL,32.94,33.7,32.8,33.7,41448918.0,0.0,0.76,0.11,603.7,0.76,23521972.7,76.21,0.0,True,73.24,0.75,-0.07,0.82,2025-11-14,32.7,3.06,0,,27.36,ATH,False,False
14-11-2025 17:00,KLSER,27.96,28.26,27.92,28.26,162331.0,0.0,0.3,0.01,3650.0,0.3,103344.8,57.08,0.0,True,39.53,-0.35,0.07,-0.42,2025-11-14,28.18,0.28,0,,ATL,32.5,True,False
14-11-2025 17:00,TUPRS,197.0,199.3,196.7,198.9,3441819.0,0.4,1.9,0.18,955.56,1.9,1733665.6,98.53,0.21,True,58.36,0.69,-0.02,0.71,2025-11-14,197.7,0.61,0,,195.9,199.6,False,False
14-11-2025 17:00,BORLS,11.91,13.2,11.91,12.84,19572508.0,0.36,0.93,0.09,933.33,0.93,8668966.6,125.78,0.39,True,44.35,-0.75,0.07,-0.83,2025-11-14,13.23,-2.95,0,,11.91,14.8,True,True
14-11-2025 17:00,SMRTG,25.04,25.36,25.0,25.3,329949.0,0.06,0.26,0.02,983.33,0.26,127998.3,157.78,0.23,True,51.82,-0.13,0.06,-0.19,2025-11-14,25.02,1.12,0,,24.96,25.84,True,True
14-11-2025 17:00,KOCMT,2.74,2.8,2.74,2.8,2502738.0,0.0,0.06,0.0,5900.0,0.06,1478261.5,69.3,0.0,True,56.0,-0.01,0.0,-0.01,2025-11-14,2.76,1.45,0,,2.72,2.92,False,False
14-11-2025 17:00,EUREN,7.11,7.27,7.09,7.26,10408048.0,0.01,0.15,0.01,1400.0,0.15,4460733.9,133.33,0.07,True,53.33,-0.02,-0.0,-0.02,2025-11-14,7.2,0.83,0,,6.94,7.58,False,False
14-11-2025 17:00,PRDGS,6.01,6.16,6.0,6.16,623571.0,0.0,0.15,0.01,1566.67,0.15,267895.0,132.77,0.0,True,48.99,-0.09,0.01,-0.1,2025-11-14,6.06,1.65,0,,ATL,6.69,True,True
14-11-2025 17:00,TEZOL,11.85,11.95,11.81,11.95,390899.0,0.0,0.1,0.01,1328.57,0.1,175236.7,123.07,0.0,True,37.21,-0.15,0.02,-0.17,2025-11-14,11.9,0.42,0,,ATL,13.2,True,False
14-11-2025 17:00,BMSTL,93.6,97.85,93.45,97.45,1092134.0,0.4,3.85,0.36,984.51,3.85,538924.4,102.65,0.1,True,78.14,2.95,0.17,2.78,2025-11-14,92.45,5.41,0,,80.35,ATH,False,False
14-11-2025 17:00,PGSUS,202.5,204.4,202.3,203.9,2170177.0,0.5,1.4,0.01,13900.0,1.4,1435887.1,51.14,0.36,True,47.83,-0.4,-0.04,-0.36,2025-11-14,204.6,-0.34,0,,201.0,206.7,False,False
14-11-2025 17:00,PASEU,135.1,142.0,134.1,142.0,1392607.0,0.0,6.9,1.19,479.83,6.9,513691.3,171.1,0.0,True,72.63,1.56,0.96,0.61,2025-11-14,130.0,9.23,0,,128.3,143.2,False,False
14-11-2025 17:00,KONKA,14.01,14.29,13.92,14.29,240065.0,0.0,0.28,0.01,5500.0,0.28,130670.2,83.72,0.0,True,48.26,-0.1,0.02,-0.12,2025-11-14,14.3,-0.07,0,,13.97,14.48,True,True
14-11-2025 17:00,OYYAT,40.0,40.42,39.42,40.34,109028.0,0.08,0.34,0.02,1445.45,0.34,65594.7,66.21,0.24,True,39.83,-0.92,0.21,-1.14,2025-11-14,39.7,1.61,0,,39.32,43.1,True,False
14-11-2025 17:00,BALSU,17.36,18.45,17.29,18.45,1362096.0,0.0,1.09,0.05,2080.0,1.09,368020.1,270.11,0.0,True,61.01,-0.15,0.03,-0.18,2025-11-14,18.07,2.1,0,,17.4,18.49,False,False
14-11-2025 17:00,KIMMR,14.72,14.98,14.72,14.98,159190.0,0.0,0.26,0.02,1633.33,0.26,79278.6,100.8,0.0,True,49.09,-0.16,0.02,-0.18,2025-11-14,14.8,1.22,0,,ATL,15.84,True,True
14-11-2025 17:00,SAHOL,74.9,75.45,74.85,75.45,4328228.0,0.0,0.55,0.02,2100.0,0.55,2407722.1,79.76,0.0,True,42.02,-0.41,0.03,-0.44,2025-11-14,75.85,-0.53,0,,73.9,80.75,False,False
14-11-2025 15:00,ALFAS,40.68,44.32,40.58,43.56,1453274.0,0.76,2.88,0.22,1221.1,2.88,204417.0,610.94,0.26,True,75.63,-0.13,0.19,-0.32,2025-11-14,41.0,6.24,0,,40.56,46.5,True,True
14-11-2025 15:00,DESA,13.62,14.31,13.5,14.31,1207615.0,0.0,0.69,0.14,403.65,0.69,386528.9,212.43,0.0,True,73.76,0.09,0.16,-0.07,2025-11-14,13.01,9.99,0,,12.66,15.72,False,False
14-11-2025 15:00,KLKIM,31.64,32.98,31.36,32.98,668391.0,0.0,1.34,0.16,737.5,1.34,185074.0,261.15,0.0,True,71.08,0.06,0.13,-0.07,2025-11-14,31.58,4.43,0,,31.2,35.92,False,False
14-11-2025 15:00,OZSUB,20.7,22.4,20.68,22.08,1932172.0,0.32,1.38,0.12,1031.15,1.38,1169198.2,65.26,0.23,True,60.76,0.44,0.05,0.4,2025-11-14,21.24,3.95,0,,18.8,22.98,False,False
14-11-2025 15:00,TUCLK,9.04,9.28,9.0,9.26,2034046.0,0.02,0.22,0.01,1471.43,0.22,579579.3,250.95,0.09,True,55.1,-0.03,0.01,-0.05,2025-11-14,9.17,0.98,0,,9.0,9.29,False,False
14-11-2025 14:00,GUBRF,313.75,317.25,312.75,316.25,405280.0,1.0,2.5,0.12,1900.0,2.5,228880.2,77.07,0.4,True,55.88,1.17,-0.51,1.68,2025-11-14,315.5,0.24,0,,310.75,324.0,False,False
14-11-2025 14:00,DITAS,36.4,37.42,36.2,37.34,529116.0,0.08,0.94,0.21,351.92,0.94,191985.3,175.6,0.09,True,69.2,0.52,0.1,0.42,2025-11-14,35.54,5.06,0,,34.54,38.68,False,False
14-11-2025 14:00,VKING,36.18,37.66,35.94,37.66,956287.0,0.0,1.48,0.33,351.22,1.48,325569.6,193.73,0.0,True,83.77,0.66,0.29,0.37,2025-11-14,34.24,9.99,0,,33.5,ATH,False,False
14-11-2025 13:00,MERKO,13.88,14.52,13.86,14.37,2114244.0,0.15,0.49,0.05,900.0,0.49,509746.1,314.76,0.31,True,66.44,-0.04,0.04,-0.08,2025-11-14,13.85,3.75,0,,13.81,15.18,False,False
14-11-2025 13:00,ADESE,2.24,2.39,2.23,2.37,86760366.0,0.02,0.13,0.01,900.0,0.13,24144749.3,259.33,0.15,True,49.3,-0.08,0.03,-0.11,2025-11-14,2.27,4.41,0,,2.21,3.25,True,False
14-11-2025 13:00,TRCAS,39.24,40.56,39.22,40.2,678120.0,0.36,0.96,0.12,713.56,0.96,141901.9,377.88,0.37,True,60.66,-0.25,0.21,-0.46,2025-11-14,39.2,2.55,1,40.56,38.42,40.56,True,False
14-11-2025 11:00,SERNT,8.9,9.01,8.83,8.98,1006675.0,0.03,0.08,0.0,1900.0,0.08,518743.2,94.06,0.37,True,46.79,-0.1,0.04,-0.14,2025-11-14,8.82,1.81,0,,8.72,9.03,True,False
14-11-2025 11:00,METRO,5.12,5.26,5.09,5.24,2215428.0,0.02,0.12,0.02,445.45,0.12,1125761.0,96.79,0.17,True,48.0,-0.09,0.02,-0.1,2025-11-14,5.11,2.54,0,,ATL,5.93,True,False
14-11-2025 11:00,INVEO,9.82,9.95,9.8,9.94,1650147.0,0.01,0.12,0.02,605.88,0.12,934303.4,76.62,0.08,True,51.41,-0.08,0.02,-0.1,2025-11-14,9.76,1.84,0,,9.67,10.81,True,False
14-11-2025 11:00,MOBTL,7.14,7.4,7.1,7.36,1738373.0,0.04,0.22,0.01,2100.0,0.22,684315.1,154.03,0.18,True,45.77,-0.13,0.01,-0.14,2025-11-14,7.17,2.65,1,7.4,7.03,7.4,True,True
14-11-2025 11:00,SURGY,50.9,51.5,50.5,51.4,360817.0,0.1,0.5,0.03,1566.67,0.5,234935.8,53.58,0.2,True,50.65,-0.17,0.02,-0.19,2025-11-14,51.35,0.1,0,,50.25,55.0,True,True
14-11-2025 11:00,FRIGO,11.93,12.11,11.92,12.09,1318108.0,0.02,0.16,0.02,540.0,0.16,744477.4,77.05,0.12,True,63.08,0.05,0.05,-0.0,2025-11-14,11.85,2.03,0,,10.8,12.24,False,False
14-11-2025 10:00,YKBNK,31.9,32.32,31.86,32.24,23576595.0,0.08,0.34,0.02,1600.0,0.34,11748597.8,100.68,0.24,True,49.37,-0.15,0.03,-0.18,2025-11-14,32.02,0.69,0,,31.84,32.5,False,False
14-11-2025 10:00,ALTNY,61.4,66.6,61.35,65.35,12597987.0,1.25,3.95,0.37,967.57,3.95,1424679.6,784.27,0.32,True,74.17,0.03,0.35,-0.32,2025-11-14,61.8,5.74,1,66.6,61.15,66.6,False,False
14-11-2025 10:00,TEKTU,11.09,11.95,10.7,11.88,6167829.0,0.07,0.79,0.16,387.65,0.79,1471977.8,319.02,0.09,True,64.33,-0.04,0.21,-0.24,2025-11-14,11.19,6.17,1,11.95,9.79,11.95,False,False
14-11-2025 10:00,ECILC,85.75,88.4,85.35,87.75,2626589.0,0.65,2.0,0.19,952.63,2.0,779186.7,237.09,0.33,True,71.82,0.68,0.23,0.45,2025-11-14,85.0,3.24,0,,78.5,88.0,False,False
14-11-2025 10:00,ALKA,9.75,10.44,9.72,10.25,5470239.0,0.19,0.5,0.03,1512.9,0.5,917972.6,495.9,0.38,True,60.49,-0.14,0.06,-0.21,2025-11-14,9.71,5.56,0,,9.67,11.6,True,True
14-11-2025 10:00,ENKAI,73.35,74.65,73.25,74.6,1929260.0,0.05,1.25,0.1,1150.0,1.25,991446.3,94.59,0.04,True,53.52,-0.24,0.09,-0.33,2025-11-14,73.8,1.08,1,74.65,72.55,74.65,False,False
14-11-2025 10:00,IZMDC,6.0,6.11,6.0,6.09,1584331.0,0.02,0.09,0.01,718.18,0.09,543523.9,191.49,0.22,True,53.34,-0.03,0.02,-0.05,2025-11-14,6.04,0.83,0,,5.91,6.12,False,False
14-11-2025 10:00,ORCAY,3.8,3.98,3.72,3.97,3256719.0,0.01,0.17,0.01,1114.29,0.17,741528.0,339.19,0.06,True,55.95,-0.01,0.01,-0.01,2025-11-14,3.85,3.12,2,3.72,3.72,4.07,False,False
14-11-2025 10:00,CRDFA,37.6,41.8,37.38,41.7,495592.0,0.1,4.1,0.33,1127.54,4.1,117539.2,321.64,0.02,True,58.92,-0.76,0.2,-0.96,2025-11-14,38.0,9.74,3,,39.0,47.48,True,True
14-11-2025 10:00,CVKMD,18.46,19.41,18.44,19.34,13466809.0,0.07,0.88,0.1,807.22,0.88,3087868.3,336.12,0.08,True,68.39,-0.03,0.15,-0.18,2025-11-14,18.37,5.28,0,,17.64,21.44,False,False
14-11-2025 10:00,NTGAZ,10.57,10.86,10.5,10.85,1101204.0,0.01,0.28,0.01,2445.45,0.28,346807.2,217.53,0.04,True,54.87,-0.05,0.01,-0.06,2025-11-14,10.6,2.36,2,10.5,10.5,11.01,False,False
14-11-2025 10:00,MNDRS,15.53,16.07,15.49,16.07,3616153.0,0.0,0.54,0.07,682.61,0.54,972221.5,271.95,0.0,True,77.41,0.21,0.02,0.19,2025-11-14,15.49,3.74,0,,13.7,16.08,False,False
13-11-2025 17:00,VAKBN,26.28,26.78,26.26,26.68,19273495.0,0.1,0.4,0.05,700.0,0.4,5927241.2,225.17,0.25,True,73.25,0.38,0.03,0.35,2025-11-13,26.04,2.46,0,,23.88,ATH,False,False
13-11-2025 17:00,YESIL,2.46,2.61,2.43,2.61,34473941.0,0.0,0.15,0.02,650.0,0.15,8551287.1,303.14,0.0,True,62.15,-0.01,0.03,-0.04,2025-11-13,2.38,9.66,0,,2.35,2.77,False,False
13-11-2025 17:00,YYAPI,2.31,2.44,2.28,2.44,62385783.0,0.0,0.13,0.02,465.22,0.13,34838351.3,79.07,0.0,True,63.65,-0.01,0.02,-0.04,2025-11-13,2.22,9.91,0,,2.18,2.86,False,False
13-11-2025 17:00,MEKAG,4.31,4.45,4.29,4.45,1733066.0,0.0,0.14,0.01,1172.73,0.14,663554.1,161.18,0.0,True,59.47,-0.02,0.01,-0.03,2025-11-13,4.3,3.49,0,,4.22,4.6,True,False
13-11-2025 17:00,ARDYZ,26.56,28.12,26.32,27.96,2041117.0,0.16,1.4,0.2,586.27,1.4,566456.2,260.33,0.11,True,74.56,0.1,0.22,-0.12,2025-11-13,25.66,8.96,1,28.12,25.66,28.12,False,False
13-11-2025 17:00,SMRVA,379.0,404.5,373.75,404.5,434298.0,0.0,25.5,3.15,709.52,25.5,87370.1,397.08,0.0,True,79.71,4.69,1.69,3.0,2025-11-13,374.5,8.01,0,,372.25,407.0,False,False
13-11-2025 17:00,BLCYT,27.36,27.62,27.32,27.62,121579.0,0.0,0.26,0.02,1525.0,0.26,68531.7,77.41,0.0,True,52.81,-0.16,0.07,-0.23,2025-11-13,27.5,0.44,0,,26.44,27.84,False,False
13-11-2025 17:00,IHEVA,2.47,2.49,2.45,2.49,567666.0,0.0,0.02,0.0,1900.0,0.02,149974.5,278.51,0.0,True,40.22,-0.02,0.0,-0.03,2025-11-13,2.5,-0.4,0,,2.43,2.53,True,True
13-11-2025 17:00,GESAN,44.36,44.54,44.2,44.52,325784.0,0.02,0.16,0.02,566.67,0.16,200011.9,62.88,0.12,True,39.21,-0.6,0.16,-0.76,2025-11-13,44.1,0.95,0,,43.98,49.22,True,True
13-11-2025 17:00,ENERY,9.26,9.98,9.25,9.95,17588777.0,0.03,0.69,0.05,1177.78,0.69,2715816.5,547.64,0.04,True,70.35,-0.01,0.04,-0.05,2025-11-13,9.31,6.87,0,,9.22,10.45,True,True
13-11-2025 17:00,MNDTR,6.88,7.07,6.88,7.03,1413116.0,0.04,0.15,0.01,1263.64,0.15,382664.0,269.28,0.27,True,44.31,-0.14,0.03,-0.17,2025-11-13,6.87,2.33,0,,6.79,9.02,True,False
13-11-2025 17:00,MARBL,13.74,14.19,13.59,14.19,485181.0,0.0,0.45,0.04,997.56,0.45,178854.0,171.27,0.0,True,55.48,-0.12,0.02,-0.14,2025-11-13,13.7,3.58,2,13.59,13.59,14.96,True,True
13-11-2025 17:00,CANTE,2.32,2.44,2.32,2.44,494603999.0,0.0,0.12,0.02,400.0,0.12,101014402.8,389.64,0.0,True,63.42,-0.04,0.03,-0.06,2025-11-13,2.22,9.91,0,,2.21,2.87,True,False
13-11-2025 16:00,ZEDUR,8.18,8.98,8.14,8.95,1668321.0,0.03,0.77,0.06,1162.3,0.77,336398.0,395.94,0.04,True,75.75,-0.02,0.05,-0.07,2025-11-13,8.34,7.31,2,8.14,8.14,9.21,True,True
13-11-2025 16:00,ENJSA,76.55,77.75,76.2,77.6,378566.0,0.15,1.05,0.3,250.0,1.05,193731.4,95.41,0.14,True,65.13,-0.02,0.29,-0.3,2025-11-13,75.5,2.78,1,77.75,74.3,77.75,False,False
13-11-2025 16:00,EGEPO,7.22,7.8,7.22,7.79,3495633.0,0.01,0.57,0.09,547.73,0.57,667809.9,423.45,0.02,True,73.43,-0.01,0.07,-0.08,2025-11-13,7.11,9.56,0,,7.0,7.9,False,False
13-11-2025 16:00,DENGE,3.57,3.79,3.56,3.76,18557947.0,0.03,0.19,0.03,442.86,0.19,5343494.6,247.3,0.16,True,69.45,0.04,0.02,0.02,2025-11-13,3.46,8.67,0,,3.3,ATH,False,False
13-11-2025 16:00,NTHOL,48.56,49.5,48.5,49.38,486663.0,0.12,0.82,0.01,6733.33,0.82,258692.2,88.12,0.15,True,49.25,-0.42,0.07,-0.49,2025-11-13,48.54,1.73,0,,48.2,52.3,True,True
13-11-2025 15:00,CEMZY,35.94,41.0,35.94,40.5,3406651.0,0.5,4.56,0.01,37900.0,4.56,749995.7,354.22,0.11,True,48.96,-1.35,0.01,-1.36,2025-11-13,39.92,1.45,3,,39.42,42.66,True,True
13-11-2025 15:00,BTCIM,4.11,4.19,4.1,4.18,19752367.0,0.01,0.07,0.0,1300.0,0.07,10459975.4,88.84,0.14,True,49.01,-0.05,0.02,-0.06,2025-11-13,4.11,1.7,1,4.19,4.09,4.19,True,False
13-11-2025 15:00,USAK,3.51,3.67,3.5,3.67,35168514.0,0.0,0.16,0.04,357.14,0.16,21015018.0,67.35,0.0,True,71.76,0.05,0.03,0.02,2025-11-13,3.4,7.94,0,,3.27,3.88,False,False
13-11-2025 14:00,QUAGR,5.51,5.92,5.51,5.91,94140326.0,0.01,0.4,0.03,1190.32,0.4,43415969.8,116.83,0.02,True,31.69,-0.44,0.03,-0.47,2025-11-13,6.12,-3.43,0,,5.51,6.8,True,True
13-11-2025 14:00,ANSGR,22.0,22.4,22.0,22.38,1200312.0,0.02,0.38,0.01,3700.0,0.38,634890.9,89.06,0.05,True,48.6,-0.22,0.05,-0.27,2025-11-13,22.12,1.18,0,,21.96,23.76,True,True
13-11-2025 13:00,TERA,275.75,281.25,274.0,281.0,963915.0,0.25,5.25,0.25,2000.0,5.25,565171.5,70.55,0.05,True,54.23,1.13,-1.23,2.36,2025-11-13,280.75,0.09,2,274.0,274.0,303.0,False,False
13-11-2025 13:00,IMASM,4.66,4.91,4.65,4.84,24521734.0,0.07,0.18,0.03,592.31,0.18,7560555.3,224.34,0.39,True,57.63,-0.09,0.04,-0.14,2025-11-13,4.52,7.08,0,,4.46,5.77,True,False
13-11-2025 13:00,ESEN,7.17,7.31,7.15,7.28,14254400.0,0.03,0.11,0.01,685.71,0.11,4011298.9,255.36,0.27,True,67.59,0.01,0.02,-0.01,2025-11-13,7.12,2.25,0,,7.06,7.46,False,False
13-11-2025 12:00,EMKEL,55.25,57.2,55.25,57.2,4041229.0,0.0,1.95,0.1,1850.0,1.95,1879902.5,114.97,0.0,True,53.49,-1.25,0.56,-1.82,2025-11-13,52.0,10.0,0,,53.85,75.2,True,False
13-11-2025 12:00,DGNMO,5.75,5.93,5.75,5.88,506791.0,0.05,0.13,0.01,1344.44,0.13,163317.6,210.31,0.38,True,55.21,-0.06,0.02,-0.08,2025-11-13,5.7,3.16,1,5.93,5.7,5.93,True,False
13-11-2025 12:00,IPEKE,75.85,79.3,75.8,79.1,3638636.0,0.2,3.25,0.25,1174.51,3.25,1994206.1,82.46,0.06,True,71.66,0.87,0.39,0.48,2025-11-13,74.0,6.89,0,,69.4,ATH,False,False
13-11-2025 12:00,OYAKC,22.02,22.44,22.0,22.38,7515131.0,0.06,0.36,0.08,373.68,0.36,2776884.6,170.63,0.17,True,68.38,0.01,0.09,-0.08,2025-11-13,21.62,3.52,1,22.44,21.18,22.44,False,False
13-11-2025 11:00,TOASO,232.5,237.2,232.5,236.8,1446649.0,0.4,4.3,0.58,641.38,4.3,511431.7,182.86,0.09,True,67.48,0.09,0.92,-0.83,2025-11-13,231.2,2.42,0,,223.9,ATH,False,False
13-11-2025 11:00,BOBET,18.8,19.1,18.8,19.05,532513.0,0.05,0.25,0.01,2677.78,0.25,147311.2,261.49,0.2,True,54.97,-0.12,0.04,-0.16,2025-11-13,18.72,1.76,1,19.1,18.66,19.1,True,False
13-11-2025 10:00,HALKB,26.9,27.24,26.88,27.16,10044005.0,0.08,0.26,0.02,1525.0,0.26,4213905.6,138.35,0.31,True,56.09,-0.06,0.04,-0.1,2025-11-13,26.78,1.42,0,,26.68,29.28,False,False
13-11-2025 10:00,A1YEN,32.1,33.18,32.1,32.96,714002.0,0.22,0.86,0.1,726.92,0.86,465566.6,53.36,0.26,True,60.66,0.09,0.07,0.02,2025-11-13,31.98,3.06,0,,30.38,33.5,False,False
13-11-2025 10:00,MANAS,12.51,12.98,12.26,12.98,19188536.0,0.0,0.47,0.05,900.0,0.47,2304001.4,732.84,0.0,True,99.77,0.7,0.05,0.65,2025-11-13,11.8,10.0,1,12.98,9.76,ATH,False,False
13-11-2025 10:00,DOGUB,56.5,66.8,56.5,65.1,1106587.0,1.7,8.6,0.86,900.0,8.6,124595.5,788.14,0.2,True,54.49,-0.21,-0.81,0.6,2025-11-13,62.75,3.75,3,,56.5,69.7,False,False
13-11-2025 10:00,DMSAS,9.89,9.99,9.87,9.98,545934.0,0.01,0.09,0.01,800.0,0.09,182538.8,199.08,0.11,True,67.8,0.05,0.0,0.05,2025-11-13,9.9,0.81,0,,9.39,ATH,False,False
13-11-2025 10:00,CIMSA,42.8,44.34,42.8,44.12,6518836.0,0.22,1.32,0.13,947.62,1.32,1202023.3,442.32,0.17,True,62.73,-0.34,0.15,-0.49,2025-11-13,42.6,3.57,0,,42.26,45.78,True,False
13-11-2025 10:00,CCOLA,55.05,55.65,54.65,55.5,1591015.0,0.15,0.45,0.08,462.5,0.45,648876.5,145.2,0.33,True,63.1,0.08,0.07,0.01,2025-11-13,55.0,0.91,0,,52.9,56.05,False,False
13-11-2025 10:00,OSTIM,3.36,3.4,3.36,3.39,3995239.0,0.01,0.03,0.0,900.0,0.03,1441881.4,177.09,0.33,True,45.92,-0.02,-0.0,-0.02,2025-11-13,3.36,0.89,1,3.4,3.33,3.4,False,False
13-11-2025 10:00,PEKGY,12.63,12.89,12.62,12.82,69393453.0,0.07,0.19,0.01,1166.67,0.19,24557326.9,182.58,0.37,True,65.31,0.04,0.02,0.03,2025-11-13,12.61,1.67,0,,12.3,12.98,False,False
13-11-2025 10:00,SELVA,1.95,2.02,1.94,2.01,4721630.0,0.01,0.06,0.0,1900.0,0.06,2253479.3,109.53,0.17,True,49.4,-0.02,0.0,-0.02,2025-11-13,1.97,2.03,2,1.94,1.94,2.06,False,False
13-11-2025 10:00,BEYAZ,27.94,28.68,27.94,28.56,169105.0,0.12,0.62,0.04,1622.22,0.62,99519.8,69.92,0.19,True,37.21,-0.57,0.03,-0.6,2025-11-13,28.28,0.99,0,,27.92,32.78,True,True
13-11-2025 10:00,SILVR,2.83,2.96,2.81,2.96,753265.0,0.0,0.13,0.01,983.33,0.13,297156.0,153.49,0.0,True,53.7,-0.03,0.0,-0.03,2025-11-13,2.84,4.23,3,,2.83,3.12,True,True
13-11-2025 10:00,HOROZ,59.65,60.5,59.4,60.3,187839.0,0.2,0.65,0.14,364.29,0.65,105166.6,78.61,0.31,True,48.57,-0.61,0.1,-0.71,2025-11-13,59.7,1.01,0,,58.6,63.9,True,True
13-11-2025 10:00,ARSAN,2.91,3.11,2.91,3.1,9998828.0,0.01,0.19,0.01,1627.27,0.19,2190137.8,356.54,0.05,True,62.19,-0.03,0.01,-0.04,2025-11-13,2.89,7.27,0,,2.87,3.15,True,True
13-11-2025 10:00,FENER,11.63,12.1,11.46,11.99,25549676.0,0.11,0.36,0.02,1900.0,0.36,11259894.6,126.91,0.31,True,73.49,0.37,0.0,0.36,2025-11-13,11.49,4.35,0,,9.95,ATH,False,False
12-11-2025 17:00,CGCAM,35.54,37.18,35.24,36.84,1647171.0,0.34,1.3,0.07,1705.56,1.3,611255.0,169.47,0.26,True,63.27,0.12,0.16,-0.04,2025-11-12,36.0,2.33,0,,34.14,37.74,False,False
12-11-2025 17:00,BUCIM,6.17,6.32,6.17,6.31,1449957.0,0.01,0.14,0.01,1066.67,0.14,503921.3,187.73,0.07,True,52.93,-0.05,0.02,-0.07,2025-11-12,6.15,2.6,0,,6.07,7.22,False,False
12-11-2025 17:00,DMRGD,26.56,27.02,26.5,26.96,431163.0,0.06,0.4,0.02,2400.0,0.4,271837.3,58.61,0.15,True,59.09,0.15,0.04,0.11,2025-11-12,27.0,-0.15,0,,24.82,27.5,False,False
12-11-2025 17:00,DOFER,55.9,65.45,55.9,65.45,352353.0,0.0,9.55,0.58,1560.87,9.55,122339.7,188.01,0.0,True,69.11,-0.57,0.21,-0.78,2025-11-12,59.5,10.0,1,65.45,55.8,ATH,False,False
12-11-2025 17:00,KRONT,15.86,16.34,15.81,16.22,450173.0,0.12,0.36,0.02,1465.22,0.36,153605.2,193.07,0.33,True,54.31,-0.14,0.03,-0.17,2025-11-12,15.81,2.59,0,,15.57,17.08,True,True
12-11-2025 16:00,SKTAS,5.13,5.6,5.06,5.55,11335071.0,0.05,0.42,0.03,1172.73,0.42,2404945.5,371.32,0.12,True,66.25,-0.01,0.03,-0.05,2025-11-12,5.1,8.82,0,,4.97,5.81,False,False
12-11-2025 14:00,IZFAS,139.6,148.0,139.6,146.5,494459.0,1.5,6.9,0.73,845.21,6.9,117594.5,320.48,0.22,True,71.55,-0.06,0.82,-0.88,2025-11-12,137.5,6.55,1,148.0,136.3,148.0,False,False
12-11-2025 13:00,FLAP,9.51,9.87,9.51,9.8,393078.0,0.07,0.29,0.0,9566.67,0.29,161509.9,143.38,0.24,True,56.74,-0.06,0.03,-0.09,2025-11-12,9.38,4.48,1,9.87,9.03,9.87,False,False
12-11-2025 13:00,ONCSM,247.7,259.5,247.5,257.75,775868.0,1.75,10.05,1.94,419.38,10.05,319826.5,142.59,0.17,True,78.08,6.26,1.97,4.29,2025-11-12,236.0,9.22,1,259.5,219.1,259.5,False,False
12-11-2025 12:00,ESCOM,3.19,3.32,3.17,3.31,7892814.0,0.01,0.12,0.0,2900.0,0.12,3406697.7,131.69,0.08,True,48.6,-0.07,0.0,-0.07,2025-11-12,3.17,4.42,0,,3.09,3.62,True,True
12-11-2025 11:00,SASA,2.88,3.06,2.88,3.01,1051224479.0,0.05,0.13,0.01,2066.67,0.13,220840426.8,376.01,0.38,True,71.76,-0.01,0.01,-0.02,2025-11-12,2.88,4.51,1,3.06,2.77,3.06,False,False
12-11-2025 11:00,BINHO,10.28,10.91,10.27,10.89,16737395.0,0.02,0.61,0.04,1286.36,0.61,4782648.2,249.96,0.03,True,60.94,-0.14,0.05,-0.19,2025-11-12,10.27,6.04,0,,10.0,11.64,True,False
12-11-2025 11:00,PENGD,8.6,8.94,8.6,8.91,2063898.0,0.03,0.31,0.01,4328.57,0.31,705918.8,192.37,0.1,True,59.77,-0.05,0.01,-0.05,2025-11-12,8.55,4.21,0,,8.34,8.95,False,False
12-11-2025 11:00,ALTIN,72.59,73.4,72.15,73.25,7784697.0,0.15,0.66,0.11,494.59,0.66,4606523.0,68.99,0.23,True,67.28,0.88,-0.07,0.95,2025-11-12,73.64,-0.53,2,72.15,72.15,73.96,False,False
12-11-2025 10:00,FORMT,4.01,4.15,4.01,4.11,19120539.0,0.04,0.1,0.0,3233.33,0.1,7188440.2,165.99,0.4,True,56.43,-0.0,-0.01,0.01,2025-11-12,3.97,3.53,1,4.15,3.95,4.15,False,False
12-11-2025 10:00,MEGMT,38.0,40.34,37.3,40.3,3113676.0,0.04,2.3,0.26,784.62,2.3,1359414.0,129.05,0.02,True,60.34,-0.29,0.27,-0.56,2025-11-12,37.68,6.95,0,,36.12,44.04,True,False
12-11-2025 10:00,LINK,312.5,327.0,311.0,326.0,461119.0,1.0,13.5,0.75,1700.0,13.5,164991.7,179.48,0.07,True,58.37,-1.38,-0.79,-0.59,2025-11-12,312.0,4.49,0,,308.5,341.5,False,False
12-11-2025 10:00,TSPOR,1.28,1.32,1.28,1.31,141258113.0,0.01,0.03,0.01,400.0,0.03,83938704.6,68.29,0.33,True,51.63,-0.02,0.0,-0.02,2025-11-12,1.27,3.15,1,1.32,1.23,1.32,True,False
12-11-2025 10:00,VRGYO,3.05,3.14,3.05,3.12,6625682.0,0.02,0.07,0.0,6900.0,0.07,3568233.1,85.69,0.29,True,45.43,-0.06,0.01,-0.07,2025-11-12,3.03,2.97,1,3.14,2.96,3.14,True,False
11-11-2025 17:00,ODINE,281.0,300.0,279.75,296.75,896321.0,3.25,15.75,1.5,950.0,15.75,393415.4,127.83,0.21,True,83.87,8.72,0.15,8.56,2025-11-11,280.5,5.79,0,,260.5,ATH,False,False
11-11-2025 17:00,DCTTR,29.12,29.9,29.04,29.84,710432.0,0.06,0.72,0.06,1185.71,0.72,447056.3,58.91,0.08,True,49.88,-0.43,0.06,-0.49,2025-11-11,29.34,1.7,0,,27.86,32.82,True,False
11-11-2025 17:00,GENIL,195.4,200.4,195.0,200.4,352811.0,0.0,5.0,0.5,900.0,5.0,199724.5,76.65,0.0,True,76.93,3.98,0.49,3.49,2025-11-11,194.0,3.3,0,,173.2,ATH,False,False
11-11-2025 17:00,GLYHO,11.27,11.46,11.26,11.43,2402376.0,0.03,0.16,0.02,841.18,0.16,1480740.8,62.24,0.19,True,51.21,-0.04,-0.0,-0.03,2025-11-11,11.39,0.35,0,,10.97,11.65,False,False
11-11-2025 16:00,ULUFA,3.7,3.94,3.67,3.88,24521736.0,0.06,0.18,0.01,2471.43,0.18,5108119.6,380.05,0.33,True,59.54,-0.03,0.01,-0.04,2025-11-11,3.77,2.92,0,,3.6,3.98,False,False
11-11-2025 16:00,AHSGY,52.35,54.15,52.3,53.85,257985.0,0.3,1.5,0.21,597.67,1.5,127984.7,101.57,0.2,True,49.56,-0.78,0.11,-0.89,2025-11-11,52.95,1.7,1,54.15,50.7,54.15,True,True
11-11-2025 16:00,SKBNK,8.24,8.52,8.14,8.5,18709150.0,0.02,0.26,0.01,1900.0,0.26,7622787.1,145.44,0.08,True,63.17,0.02,-0.0,0.03,2025-11-11,8.41,1.07,0,,8.01,ATH,False,False
11-11-2025 15:00,MHRGY,3.86,4.14,3.74,4.14,4918476.0,0.0,0.28,0.01,3400.0,0.28,2630073.0,87.01,0.0,True,62.69,-0.0,-0.0,0.0,2025-11-11,4.0,3.5,2,3.74,3.74,4.21,False,False
11-11-2025 15:00,BAHKM,52.35,53.25,51.2,53.25,287146.0,0.0,0.9,0.06,1536.36,0.9,105128.6,173.14,0.0,True,47.05,-0.55,0.1,-0.65,2025-11-11,52.3,1.82,0,,53.2,54.3,True,True
11-11-2025 15:00,EDATA,5.52,5.58,5.42,5.58,2362575.0,0.0,0.06,0.0,1900.0,0.06,711440.0,232.08,0.0,True,44.89,-0.04,-0.0,-0.03,2025-11-11,5.63,-0.89,2,5.42,5.42,5.73,True,True
11-11-2025 14:00,SEYKM,6.23,6.48,6.21,6.48,258116.0,0.0,0.25,0.05,431.91,0.25,96049.0,168.73,0.0,True,62.5,-0.01,0.03,-0.04,2025-11-11,6.1,6.23,0,,5.99,6.49,False,False
11-11-2025 12:00,KZBGY,14.0,14.28,13.99,14.22,2236585.0,0.06,0.22,0.01,3042.86,0.22,1454041.8,53.82,0.27,True,35.06,-0.4,0.03,-0.43,2025-11-11,13.95,1.94,0,,13.8,16.2,False,False
11-11-2025 12:00,AHGAZ,27.98,29.0,27.84,28.92,1775938.0,0.08,0.94,0.11,724.56,0.94,697493.1,154.62,0.09,True,70.19,0.04,0.13,-0.08,2025-11-11,27.62,4.71,0,,27.26,29.3,False,False
11-11-2025 12:00,KLYPV,58.3,60.85,58.2,60.75,432308.0,0.1,2.45,0.15,1533.33,2.45,143530.6,201.2,0.04,True,62.88,-0.24,0.06,-0.29,2025-11-11,58.75,3.4,0,,59.15,61.4,True,True
11-11-2025 11:00,AEFES,14.37,14.56,14.36,14.53,18292285.0,0.03,0.16,0.02,742.11,0.16,7389422.0,147.55,0.19,True,55.9,-0.06,0.02,-0.08,2025-11-11,14.21,2.25,0,,14.28,14.59,True,True
11-11-2025 11:00,ICUGS,3.04,3.23,3.03,3.2,10983144.0,0.03,0.16,0.01,1677.78,0.16,3318330.5,230.98,0.19,True,48.57,-0.06,-0.0,-0.06,2025-11-11,3.11,2.89,1,3.23,ATL,3.23,True,True
11-11-2025 11:00,IEYHO,48.44,50.35,48.44,50.25,15462156.0,0.1,1.81,0.09,1933.71,1.81,8113079.2,90.58,0.06,True,65.17,1.56,-0.29,1.84,2025-11-11,48.06,4.56,0,,39.16,ATH,False,False
11-11-2025 10:00,TNZTP,23.04,23.96,22.82,23.82,1457543.0,0.14,0.78,0.1,712.5,0.78,324764.3,348.8,0.18,True,76.77,0.18,0.09,0.09,2025-11-11,22.96,3.75,1,23.96,22.18,23.96,False,False
11-11-2025 10:00,YAYLA,32.06,34.2,32.06,33.72,1214426.0,0.48,1.66,0.07,2415.15,1.66,302015.6,302.11,0.29,True,70.69,0.44,0.08,0.36,2025-11-11,32.34,4.27,1,34.2,30.66,34.2,False,False
11-11-2025 10:00,LRSHO,5.88,6.08,5.81,6.07,11001708.0,0.01,0.19,0.02,955.56,0.19,3025670.3,263.61,0.05,True,57.02,-0.05,0.01,-0.06,2025-11-11,5.87,3.41,0,,ATL,6.19,True,True
11-11-2025 10:00,AGHOL,26.34,27.0,26.16,26.92,2212196.0,0.08,0.58,0.01,9566.67,0.58,674342.0,228.05,0.14,True,62.01,0.02,-0.03,0.05,2025-11-11,26.34,2.2,2,26.16,26.16,27.12,False,False
11-11-2025 10:00,LIDFA,4.31,4.6,4.3,4.52,21009779.0,0.08,0.21,0.02,1300.0,0.21,3255589.8,545.34,0.38,True,76.69,0.04,0.02,0.01,2025-11-11,4.22,7.11,1,4.6,4.11,4.6,False,False
11-11-2025 10:00,KLRHO,131.5,134.8,129.4,134.8,407106.0,0.0,3.3,0.3,1000.0,3.3,178651.3,127.88,0.0,True,54.03,-0.36,-0.19,-0.17,2025-11-11,131.7,2.35,2,129.4,129.4,142.0,False,False
11-11-2025 10:00,EGGUB,104.8,111.6,103.5,110.0,673043.0,1.6,5.2,0.67,676.12,5.2,168779.0,298.77,0.31,True,62.89,-0.53,0.64,-1.17,2025-11-11,104.1,5.67,1,111.6,99.9,111.6,False,False
11-11-2025 10:00,GIPTA,67.0,69.9,66.55,69.3,1571675.0,0.6,2.3,0.14,1603.7,2.3,746127.5,110.64,0.26,True,34.37,-4.23,0.44,-4.67,2025-11-11,66.85,3.66,2,66.55,66.55,92.4,True,True
11-11-2025 10:00,BMSCH,20.0,20.94,19.83,20.7,868711.0,0.24,0.7,0.07,900.0,0.7,256622.2,238.52,0.34,True,48.66,-0.37,0.02,-0.38,2025-11-11,20.0,3.5,1,20.94,19.4,20.94,True,True
10-11-2025 17:00,SOKM,47.92,48.46,47.88,48.36,1613232.0,0.1,0.44,0.07,547.06,0.44,677325.3,138.18,0.23,True,60.76,0.32,-0.04,0.36,2025-11-10,47.64,1.51,0,,47.26,48.56,False,False
10-11-2025 17:00,YIGIT,25.86,26.44,25.8,26.38,506015.0,0.06,0.52,0.01,4233.33,0.52,173325.5,191.94,0.12,True,52.49,-0.18,0.02,-0.2,2025-11-10,26.18,0.76,0,,26.3,27.06,True,True
10-11-2025 16:00,PRKAB,38.6,42.1,38.6,41.12,1193991.0,0.98,2.52,0.17,1382.35,2.52,216515.4,451.46,0.39,True,61.32,-0.47,0.17,-0.64,2025-11-10,38.8,5.98,1,42.1,39.6,42.1,True,True
10-11-2025 16:00,AVHOL,43.34,44.62,43.34,44.28,371163.0,0.34,0.94,0.13,646.03,0.94,157386.0,135.83,0.36,True,58.57,-0.27,0.15,-0.42,2025-11-10,42.88,3.26,0,,42.6,45.96,True,False
10-11-2025 15:00,GWIND,24.64,25.1,24.58,25.08,716022.0,0.02,0.44,0.03,1366.67,0.44,358511.7,99.72,0.05,True,56.48,-0.14,0.05,-0.19,2025-11-10,24.58,2.03,0,,24.36,25.18,True,False
10-11-2025 14:00,LYDHO,186.0,198.3,185.0,198.0,524896.0,0.3,12.0,2.04,488.24,12.0,310676.5,68.95,0.03,True,64.17,-1.63,1.99,-3.62,2025-11-10,182.0,8.79,0,,177.5,226.1,False,False
10-11-2025 14:00,MIATK,37.56,39.68,37.54,39.48,14286443.0,0.2,1.92,0.09,2033.33,1.92,4336773.5,229.43,0.1,True,55.04,-0.34,-0.16,-0.18,2025-11-10,39.28,0.51,0,,37.2,40.78,False,False
10-11-2025 14:00,KCAER,12.04,12.35,12.0,12.34,2995748.0,0.01,0.3,0.01,3233.33,0.3,1525384.8,96.39,0.03,True,48.24,-0.22,0.05,-0.27,2025-11-10,12.08,2.15,0,,11.85,12.95,True,False
10-11-2025 13:00,BORSK,23.48,24.38,23.44,24.32,1240383.0,0.06,0.84,0.15,460.0,0.84,407706.7,204.23,0.07,True,58.85,-0.15,0.01,-0.16,2025-11-10,23.52,3.4,0,,22.62,24.74,True,True
10-11-2025 13:00,BRSAN,535.0,555.0,534.5,551.0,891611.0,4.0,16.0,1.8,788.89,16.0,483383.4,84.45,0.25,True,74.8,12.46,3.75,8.72,2025-11-10,512.0,7.62,1,555.0,483.0,555.0,False,False
10-11-2025 12:00,PLTUR,26.4,26.78,26.38,26.7,490407.0,0.08,0.3,0.05,500.0,0.3,229236.0,113.93,0.27,True,54.46,-0.12,0.0,-0.13,2025-11-10,25.98,2.77,0,,25.62,27.6,False,False
10-11-2025 12:00,OBAMS,42.48,44.2,42.4,43.94,1406777.0,0.26,1.46,0.14,928.17,1.46,433205.1,224.74,0.18,True,63.26,-0.24,0.1,-0.34,2025-11-10,42.64,3.05,0,,40.9,ATH,False,False
10-11-2025 12:00,ONRYT,82.55,84.45,82.35,84.05,101352.0,0.4,1.5,0.14,1011.11,1.5,61790.8,64.02,0.27,True,54.79,0.18,-0.04,0.22,2025-11-10,83.9,0.18,0,,81.95,85.0,False,False
10-11-2025 11:00,MERIT,23.08,23.56,22.94,23.52,1068815.0,0.04,0.44,0.06,658.62,0.44,406043.9,163.23,0.09,True,73.68,0.22,0.08,0.14,2025-11-10,22.78,3.25,0,,22.06,ATH,False,False
10-11-2025 11:00,TURSG,13.24,13.91,13.24,13.84,17879204.0,0.07,0.6,0.04,1438.46,0.6,9336397.6,91.5,0.12,True,69.83,0.11,0.08,0.03,2025-11-10,13.2,4.85,0,,12.55,14.04,False,False
10-11-2025 10:00,KFEIN,9.51,10.05,9.51,10.0,2797530.0,0.05,0.49,0.03,1431.25,0.49,863014.8,224.16,0.1,True,62.66,-0.06,0.01,-0.07,2025-11-10,9.51,5.15,2,9.51,9.51,ATH,True,True
10-11-2025 10:00,SAYAS,52.2,54.0,51.55,53.65,337440.0,0.35,1.45,0.24,491.84,1.45,166690.5,102.44,0.24,True,59.97,0.01,0.22,-0.21,2025-11-10,52.55,2.09,0,,50.8,54.5,False,False
10-11-2025 10:00,TTKOM,56.1,57.15,55.3,57.0,13992723.0,0.15,0.9,0.14,520.69,0.9,5002676.0,179.7,0.17,True,68.95,0.75,-0.07,0.82,2025-11-10,55.8,2.15,0,,54.5,ATH,False,False
10-11-2025 10:00,KTLEV,13.88,16.19,13.85,16.19,83903616.0,0.0,2.31,0.28,719.15,2.31,16461085.5,409.71,0.0,True,69.99,0.17,0.07,0.1,2025-11-10,14.72,9.99,1,16.19,13.82,ATH,False,False
07-11-2025 17:00,EGSER,3.39,3.41,3.37,3.41,1011322.0,0.0,0.02,0.0,1900.0,0.02,483670.2,109.09,0.0,True,45.49,-0.01,-0.0,-0.01,2025-11-07,3.42,-0.29,2,3.37,3.37,3.45,False,False
07-11-2025 15:00,POLHO,18.39,18.85,18.38,18.76,1441272.0,0.09,0.37,0.0,5.20728706914714e+16,0.37,491128.1,193.46,0.24,True,50.35,-0.12,-0.0,-0.11,2025-11-07,18.71,0.27,0,,18.5,19.2,False,False
07-11-2025 15:00,IHLGM,2.94,3.03,2.93,3.01,27734774.0,0.02,0.07,0.01,900.0,0.07,8974370.7,209.04,0.29,True,57.38,-0.0,0.0,-0.01,2025-11-07,2.91,3.44,0,,2.91,3.09,False,False
07-11-2025 15:00,IHGZT,2.03,2.12,2.03,2.1,38051287.0,0.02,0.07,0.01,600.0,0.07,18984548.5,100.43,0.29,True,66.2,0.04,0.0,0.04,2025-11-07,2.01,4.48,0,,2.01,ATH,False,False
07-11-2025 14:00,BNTAS,6.84,6.9,6.81,6.89,522192.0,0.01,0.05,0.0,4900.0,0.05,326670.6,59.85,0.2,True,48.67,-0.06,0.02,-0.08,2025-11-07,6.83,0.88,0,,6.8,6.95,True,True
07-11-2025 12:00,BESLR,14.18,14.69,14.16,14.64,1412059.0,0.05,0.46,0.03,1252.94,0.46,572210.1,146.77,0.11,True,58.13,-0.03,0.06,-0.09,2025-11-07,14.39,1.74,2,14.16,14.16,14.99,False,False
07-11-2025 12:00,FORTE,76.85,80.0,76.5,79.2,327177.0,0.8,2.35,0.09,2664.71,2.35,122876.7,166.26,0.34,True,62.24,0.85,-0.2,1.05,2025-11-07,78.1,1.41,2,76.5,76.5,ATH,False,False
07-11-2025 12:00,LILAK,29.98,30.64,29.98,30.46,672193.0,0.18,0.48,0.02,1900.0,0.48,369266.4,82.03,0.37,True,49.86,-0.09,-0.0,-0.09,2025-11-07,30.46,0.0,0,,29.96,31.06,False,False
07-11-2025 11:00,DMLKT,5.96,5.97,5.96,5.97,2317933.0,0.0,0.01,0.0,900.0,0.01,1127417.9,105.6,0.0,True,48.89,-0.0,0.0,-0.01,2025-11-07,5.96,0.17,1,5.97,5.96,5.98,True,False
07-11-2025 10:00,KOZAA,87.6,89.7,87.5,89.25,1611749.0,0.45,1.65,0.04,3566.67,1.65,558822.8,188.42,0.27,True,56.97,-0.36,0.22,-0.58,2025-11-07,87.35,2.18,0,,87.25,89.8,False,False
07-11-2025 10:00,IHLAS,3.39,3.52,3.37,3.51,56223586.0,0.01,0.12,0.01,2300.0,0.12,16995918.2,230.81,0.08,True,63.19,0.02,-0.01,0.03,2025-11-07,3.36,4.46,0,,3.34,3.62,False,False
07-11-2025 10:00,GLCVY,72.65,77.8,72.3,77.2,1018670.0,0.6,4.55,0.46,889.13,4.55,139609.7,629.66,0.13,True,77.16,0.41,0.36,0.05,2025-11-07,72.5,6.48,1,77.8,71.15,77.8,False,False
06-11-2025 17:00,KATMR,3.63,3.94,3.55,3.94,202228040.0,0.0,0.31,0.03,839.39,0.31,49516699.6,308.4,0.0,True,71.75,0.12,-0.01,0.14,2025-11-06,3.59,9.75,0,,3.54,ATH,False,False
06-11-2025 17:00,INDES,8.58,8.7,8.58,8.68,1326631.0,0.02,0.1,0.02,455.56,0.1,606009.7,118.91,0.2,True,65.55,0.01,0.04,-0.03,2025-11-06,8.46,2.6,0,,8.36,8.87,False,False
06-11-2025 17:00,DSTKF,712.5,726.0,709.5,724.0,913409.0,2.0,11.5,2.2,422.73,11.5,217839.7,319.3,0.17,True,82.9,18.91,2.73,16.18,2025-11-06,698.0,3.72,0,,641.5,ATH,False,False
06-11-2025 17:00,TCKRC,49.56,50.5,49.44,50.3,175960.0,0.2,0.74,0.07,927.78,0.74,108747.4,61.81,0.27,True,61.85,-0.05,0.08,-0.14,2025-11-06,49.44,1.74,0,,ATL,ATH,False,False
06-11-2025 16:00,TUKAS,2.92,3.02,2.91,3.02,65183528.0,0.0,0.1,0.0,2400.0,0.1,24530592.3,165.72,0.0,True,62.89,-0.0,-0.0,-0.0,2025-11-06,2.95,2.37,0,,2.9,3.06,False,False
06-11-2025 16:00,TDGYO,29.82,31.9,29.74,31.7,2071680.0,0.2,1.88,0.25,652.0,1.88,339923.5,509.45,0.11,True,76.02,0.55,0.22,0.33,2025-11-06,29.0,9.31,0,,27.1,ATH,False,False
06-11-2025 16:00,KAREL,10.23,10.74,10.21,10.7,6086096.0,0.04,0.47,0.07,591.18,0.47,2281810.4,166.72,0.09,True,74.85,-0.02,0.1,-0.11,2025-11-06,10.0,7.0,0,,9.87,ATH,False,False
06-11-2025 15:00,GARAN,136.0,137.3,136.0,137.0,8035562.0,0.3,1.0,0.14,614.29,1.0,3470360.6,131.55,0.3,True,63.13,0.29,0.25,0.04,2025-11-06,135.0,1.48,0,,132.3,ATH,False,False
06-11-2025 15:00,BOSSA,7.17,7.27,7.17,7.25,869038.0,0.02,0.08,0.01,1042.86,0.08,405297.5,114.42,0.25,True,52.94,-0.05,0.02,-0.07,2025-11-06,7.14,1.54,0,,7.12,7.26,False,False
06-11-2025 15:00,RUZYE,14.28,15.1,14.21,15.08,5472853.0,0.02,0.8,0.1,692.08,0.8,2055560.0,166.25,0.02,True,65.06,-0.15,0.15,-0.3,2025-11-06,13.95,8.1,0,,13.91,ATH,False,False
06-11-2025 15:00,ISCTR,13.15,13.32,13.14,13.28,91442773.0,0.04,0.13,0.02,465.22,0.13,55495223.3,64.78,0.31,True,67.76,0.07,0.01,0.06,2025-11-06,13.1,1.37,0,,12.79,ATH,False,False
06-11-2025 15:00,AKBNK,62.05,62.6,62.0,62.55,20113617.0,0.05,0.5,0.09,455.56,0.5,11454570.9,75.59,0.1,True,68.43,0.24,0.14,0.1,2025-11-06,61.2,2.21,0,,60.65,ATH,False,False
06-11-2025 15:00,XBANK,15207.56,15343.16,15200.8,15329.78,166011943.0,13.38,122.22,24.88,391.3,122.22,102106233.2,62.59,0.11,True,67.63,58.62,23.86,34.75,2025-11-06,15097.37,1.54,0,,14857.57,ATH,False,False
06-11-2025 15:00,KRDMD,27.7,28.14,27.66,28.04,10662153.0,0.1,0.34,0.01,3300.0,0.34,4727763.1,125.52,0.29,True,53.62,-0.16,0.04,-0.2,2025-11-06,27.7,1.23,0,,27.34,28.18,False,False
06-11-2025 14:00,TATEN,21.72,23.74,21.71,23.45,5722800.0,0.29,1.72,0.24,622.51,1.72,2471424.8,131.56,0.17,True,77.84,0.62,,,2025-11-06,22.1,6.11,0,,19.16,ATH,False,False
06-11-2025 14:00,HEDEF,77.95,82.0,77.6,81.2,1932191.0,0.8,3.25,0.28,1040.35,3.25,924562.7,108.98,0.25,True,58.53,-1.64,,,2025-11-06,76.65,5.94,0,,74.0,ATH,False,False
06-11-2025 14:00,DOHOL,17.32,17.53,17.32,17.5,7718544.0,0.03,0.18,0.03,462.5,0.18,2167703.2,256.07,0.17,True,64.9,-0.01,,,2025-11-06,17.12,2.22,0,,16.95,ATH,False,False
06-11-2025 13:00,ULKER,112.8,114.6,112.7,114.1,1290953.0,0.5,1.3,0.31,319.35,1.3,715546.4,80.41,0.38,True,78.85,1.05,,,2025-11-06,110.5,3.26,0,,107.5,ATH,False,False
06-11-2025 13:00,CEOEM,26.9,28.88,26.86,28.36,1882178.0,0.52,1.46,0.12,1116.67,1.46,268387.2,601.29,0.36,True,67.57,-0.08,,,2025-11-06,27.04,4.88,0,,26.7,ATH,False,False
06-11-2025 13:00,SUNTK,42.12,43.62,42.0,43.5,470258.0,0.12,1.38,0.21,557.14,1.38,206499.3,127.73,0.09,True,67.43,0.09,,,2025-11-06,41.1,5.84,0,,40.44,ATH,False,False
06-11-2025 12:00,KRDMB,25.06,25.16,25.02,25.16,149094.0,0.0,0.1,0.0,4900.0,0.1,92285.5,61.56,0.0,True,38.3,-0.25,,,2025-11-06,25.0,0.64,0,,24.96,ATH,False,False
06-11-2025 11:00,BIMAS,537.5,547.5,534.5,546.0,3075183.0,1.5,8.5,0.9,844.44,8.5,874222.2,251.76,0.18,True,76.22,0.05,,,2025-11-06,529.5,3.12,0,,523.0,ATH,False,False
06-11-2025 11:00,AKFYE,17.89,18.38,17.88,18.28,2582011.0,0.1,0.39,0.07,465.22,0.39,940237.9,174.61,0.26,True,72.4,0.17,,,2025-11-06,18.05,1.27,0,,17.31,ATH,False,False
06-11-2025 11:00,GOZDE,22.68,23.2,22.68,23.14,706788.0,0.06,0.46,0.01,3733.33,0.46,373555.3,89.21,0.13,True,65.56,0.04,,,2025-11-06,22.32,3.67,0,,22.0,ATH,False,False
06-11-2025 10:00,HDFGS,4.35,5.08,4.35,4.93,32367054.0,0.15,0.58,0.06,900.0,0.58,4665738.5,593.72,0.26,True,41.47,-0.35,,,2025-11-06,4.83,2.07,3,,4.35,ATH,False,False
06-11-2025 10:00,TCELL,98.4,101.0,98.05,100.5,17305527.0,0.5,2.1,0.13,1455.56,2.1,6575154.8,163.2,0.24,True,66.51,0.52,,,2025-11-06,97.7,2.87,0,,96.05,100.8,False,False
06-11-2025 10:00,A1CAP,13.27,13.78,13.21,13.68,7797111.0,0.1,0.41,0.05,791.3,0.41,2051046.9,280.15,0.24,True,62.41,-0.01,,,2025-11-06,13.23,3.4,1,13.78,13.0,13.78,False,False
06-11-2025 10:00,DAPGM,13.24,13.62,13.18,13.58,15132650.0,0.04,0.34,0.03,1072.41,0.34,3858953.2,292.14,0.12,True,59.1,-0.1,,,2025-11-06,13.19,2.96,0,,13.03,ATH,False,False
06-11-2025 10:00,NIBAS,24.0,25.36,23.9,25.1,1096878.0,0.26,1.1,0.09,1070.21,1.1,219064.2,400.71,0.24,True,60.62,-0.18,,,2025-11-06,23.96,4.76,2,23.9,23.9,26.3,False,False
06-11-2025 10:00,SANFM,7.43,7.62,7.4,7.62,1590278.0,0.0,0.19,0.03,578.57,0.19,471795.7,237.07,0.0,True,61.54,-0.02,,,2025-11-06,7.47,2.01,0,,7.31,7.73,False,False
05-11-2025 17:00,KRTEK,29.08,30.76,29.0,30.5,1335420.0,0.26,1.42,0.12,1103.39,1.42,538654.0,147.92,0.18,True,45.69,-1.11,,,2025-11-05,30.02,1.6,0,,28.2,ATH,False,False
05-11-2025 17:00,BIENY,42.1,43.98,41.76,43.62,3733841.0,0.36,1.52,0.33,366.26,1.52,1059923.9,252.27,0.24,True,85.26,0.41,,,2025-11-05,40.1,8.78,0,,40.0,ATH,False,False
05-11-2025 16:00,YYLGD,11.27,11.56,11.27,11.55,2513461.0,0.01,0.28,0.01,3400.0,0.28,870158.7,188.85,0.04,True,62.72,,,,2025-11-05,11.4,1.32,0,,11.19,ATH,False,False
05-11-2025 16:00,KLSYN,5.88,6.07,5.88,6.03,2829814.0,0.04,0.15,0.02,614.29,0.15,485519.0,482.84,0.27,True,72.77,,,,2025-11-05,5.78,4.33,0,,5.76,ATH,False,False
05-11-2025 16:00,ENTRA,11.41,11.97,11.4,11.88,10439741.0,0.09,0.47,0.06,683.33,0.47,1792821.2,482.31,0.19,True,69.86,,,,2025-11-05,11.45,3.76,0,,11.2,ATH,False,False
05-11-2025 16:00,BRLSM,14.97,15.25,14.96,15.2,397768.0,0.05,0.23,0.02,1337.5,0.23,212543.6,87.15,0.22,True,51.22,,,,2025-11-05,15.1,0.66,1,15.25,14.86,15.25,False,False
05-11-2025 16:00,ENDAE,16.55,16.86,16.55,16.86,642102.0,0.0,0.31,0.03,1092.31,0.31,252916.8,153.88,0.0,True,63.86,,,,2025-11-05,16.55,1.87,0,,16.26,16.98,False,False
05-11-2025 16:00,AKSA,11.67,12.04,11.67,12.0,8601389.0,0.04,0.33,0.02,1220.0,0.33,2270826.4,278.78,0.12,True,51.7,,,,2025-11-05,11.74,2.21,0,,ATL,ATH,False,False
05-11-2025 16:00,ALBRK,8.34,8.46,8.34,8.44,2597468.0,0.02,0.1,0.01,809.09,0.1,1142887.6,127.27,0.2,True,61.36,,,,2025-11-05,8.35,1.08,0,,8.29,ATH,False,False
05-11-2025 16:00,ELITE,35.16,36.7,35.08,36.4,686685.0,0.3,1.24,0.1,1115.69,1.24,190767.2,259.96,0.24,True,75.04,,,,2025-11-05,35.58,2.3,0,,34.88,ATH,False,False
05-11-2025 16:00,KRSTL,12.1,12.4,12.09,12.32,1869167.0,0.08,0.22,0.06,272.88,0.22,687315.5,171.95,0.36,True,71.99,,,,2025-11-05,11.85,3.97,0,,11.44,ATH,False,False
05-11-2025 16:00,DOAS,180.6,183.4,180.5,183.4,414633.0,0.0,2.8,0.31,803.23,2.8,196980.6,110.49,0.0,True,61.93,,,,2025-11-05,181.2,1.21,0,,ATL,ATH,False,False
05-11-2025 16:00,ALVES,28.58,28.98,28.56,28.92,863756.0,0.06,0.34,0.02,2025.0,0.34,559275.6,54.44,0.18,True,50.7,,,,2025-11-05,28.78,0.49,0,,28.1,29.52,False,False
05-11-2025 16:00,TKFEN,81.65,82.7,81.65,82.6,734165.0,0.1,0.95,0.02,4650.0,0.95,311588.6,135.62,0.11,True,46.58,,,,2025-11-05,81.35,1.54,1,82.7,ATL,82.7,False,False
05-11-2025 16:00,FZLGY,14.15,14.53,14.12,14.49,2688583.0,0.04,0.34,0.0,33900.0,0.34,1514248.8,77.55,0.12,True,54.21,,,,2025-11-05,14.3,1.33,0,,14.08,ATH,False,False
05-11-2025 16:00,GSDHO,4.76,4.81,4.76,4.8,860666.0,0.01,0.04,0.0,1233.33,0.04,509243.9,69.01,0.25,True,44.88,,,,2025-11-05,4.78,0.42,0,,4.74,ATH,False,False
05-11-2025 15:00,TKNSA,27.2,27.76,27.18,27.6,943081.0,0.16,0.4,0.07,440.54,0.4,397038.6,137.53,0.4,True,68.5,,,,2025-11-05,27.18,1.55,0,,ATL,27.62,False,False
05-11-2025 15:00,BLUME,55.3,56.65,55.2,56.45,339137.0,0.2,1.15,0.08,1433.33,1.15,174725.2,94.1,0.17,True,53.96,,,,2025-11-05,55.75,1.26,1,56.65,54.45,56.65,False,False
05-11-2025 14:00,BAGFS,33.56,34.78,33.54,34.46,470326.0,0.32,0.9,0.06,1451.72,0.9,125423.5,274.99,0.36,True,53.31,,,,2025-11-05,33.9,1.65,0,,33.48,ATH,False,False
05-11-2025 14:00,MAGEN,29.44,30.4,29.38,30.38,1790587.0,0.02,0.94,0.18,416.48,0.94,990138.6,80.84,0.02,True,74.76,,,,2025-11-05,28.5,6.6,0,,27.74,ATH,False,False
05-11-2025 13:00,PAPIL,17.61,18.74,17.33,18.74,12017582.0,0.0,1.13,0.18,538.42,1.13,3711860.4,223.76,0.0,True,88.92,,,,2025-11-05,17.39,7.76,0,,ATL,ATH,False,False
05-11-2025 12:00,ARMGD,36.56,37.3,36.48,37.26,415200.0,0.04,0.7,0.06,993.75,0.7,171800.4,141.68,0.06,True,60.7,,,,2025-11-05,36.72,1.47,0,,36.34,ATH,False,False
05-11-2025 11:00,RYSAS,15.23,15.53,15.22,15.52,3392051.0,0.01,0.29,0.06,417.86,0.29,677270.1,400.84,0.03,True,75.73,,,,2025-11-05,15.0,3.47,0,,14.81,ATH,False,False
05-11-2025 11:00,BIGEN,11.11,11.41,11.1,11.37,2873940.0,0.04,0.26,0.03,900.0,0.26,1193869.8,140.72,0.15,True,65.05,,,,2025-11-05,11.14,2.06,0,,11.04,ATH,False,False
05-11-2025 11:00,ARCLK,112.4,113.5,112.1,113.4,442322.0,0.1,1.0,0.09,1011.11,1.0,249353.5,77.39,0.1,True,52.6,,,,2025-11-05,112.1,1.16,0,,111.1,ATH,False,False
05-11-2025 11:00,PETKM,17.52,17.98,17.49,17.97,18094169.0,0.01,0.45,0.04,1084.21,0.45,6821436.6,165.25,0.02,True,70.32,,,,2025-11-05,17.43,3.1,0,,17.26,ATH,False,False
05-11-2025 11:00,VESTL,33.94,34.18,33.88,34.12,1242580.0,0.06,0.18,0.03,462.5,0.18,514612.7,141.46,0.33,True,49.62,,,,2025-11-05,33.92,0.59,0,,ATL,ATH,False,False
05-11-2025 10:00,VSNMD,136.4,140.6,135.6,139.5,1737496.0,1.1,3.1,0.19,1531.58,3.1,474862.7,265.89,0.35,True,70.7,,,,2025-11-05,135.5,2.95,1,140.6,ATL,140.6,False,False
04-11-2025 17:00,BERA,19.13,19.6,19.05,19.49,9516803.0,0.11,0.36,0.02,1614.29,0.36,2017459.3,371.72,0.31,True,61.54,,,,2025-11-04,19.17,1.67,1,19.6,18.9,19.6,False,False
04-11-2025 17:00,EFOR,143.3,148.9,143.3,148.9,236851.0,0.0,5.6,0.58,865.52,5.6,137036.1,72.84,0.0,True,69.38,,,,2025-11-04,143.8,3.55,0,,137.2,ATH,False,False
04-11-2025 16:00,KAYSE,18.2,19.39,18.19,19.29,4170105.0,0.1,1.09,0.1,1047.37,1.09,824718.6,405.64,0.09,True,83.74,,,,2025-11-04,18.25,5.7,0,,17.9,ATH,False,False
04-11-2025 15:00,ALCTL,126.4,136.0,126.4,136.0,2163468.0,0.0,9.6,0.82,1070.73,9.6,482876.9,348.04,0.0,True,,,,,2025-11-04,123.7,9.94,1,136.0,119.8,ATH,False,False
04-11-2025 13:00,SRVGY,3.2,3.29,3.2,3.29,17530974.0,0.0,0.09,0.0,2150.0,0.09,3634273.6,382.38,0.0,True,,,,,2025-11-04,3.22,2.17,0,,3.18,ATH,False,False
