Tarih,Hisse,open,high,low,close,volume,YuksekKapanis_Fark,AcilisKapanis_Fark,AcilisKapanisFark_Ort,AcilisKapanisFark_OrtalamayaGoreDegisim,AcilisKapanisFarkOrt_MaxSon10,HacimOrtalama,%Hacim_HacimOrtalama,Fark_Orani,Kosul,rsi,MACD_12_26_9,MACDh_12_26_9,MACDs_12_26_9,Tarih1,prev_close,%Deg,isPivot,pointpos,destek,direnc,Tsinyal_Banker_Dip,Tsinyal_Banker_DipKarar
18-11-2025 14:00,GEREL,18.82,19.45,18.81,19.28,3192393.0,0.17,0.46,0.09,434.88,0.46,1299410.8,145.68,0.37,True,84.18,0.55,0.06,0.49,2025-11-18,18.31,5.3,0,,16.62,ATH,False,False
18-11-2025 13:00,MEGMT,39.52,40.38,39.22,40.38,1532303.0,0.0,0.86,0.08,975.0,0.86,709065.4,116.1,0.0,True,65.7,0.23,0.18,0.05,2025-11-18,39.04,3.43,0,,36.84,41.2,False,False
18-11-2025 13:00,IPEKE,78.25,82.8,78.1,82.55,2842494.0,0.25,4.3,0.31,1287.1,4.3,972078.8,192.41,0.06,True,73.25,0.7,0.26,0.43,2025-11-18,77.6,6.38,0,,73.25,ATH,False,False
18-11-2025 13:00,DOAS,184.9,188.3,184.8,187.7,389589.0,0.6,2.8,0.42,566.67,2.8,240188.5,62.2,0.21,True,66.73,1.12,0.34,0.78,2025-11-18,183.6,2.23,0,,178.2,190.4,False,False
18-11-2025 13:00,ENERY,9.88,10.01,9.88,10.0,4882640.0,0.01,0.12,0.03,313.79,0.12,2659448.6,83.6,0.08,True,71.56,0.09,0.02,0.07,2025-11-18,9.75,2.56,0,,9.22,ATH,False,False
18-11-2025 13:00,ALVES,26.6,26.94,26.6,26.92,924086.0,0.02,0.32,0.03,1130.77,0.32,497547.7,85.73,0.06,True,65.35,0.07,0.08,-0.01,2025-11-18,26.36,2.12,0,,25.8,28.22,False,False
18-11-2025 12:00,SAFKR,26.66,27.16,26.66,27.1,790826.0,0.06,0.44,0.03,1366.67,0.44,466488.7,69.53,0.14,True,66.78,0.15,0.08,0.07,2025-11-18,26.6,1.88,0,,25.68,27.34,False,False
18-11-2025 12:00,BRSAN,481.0,495.25,480.25,492.25,849889.0,3.0,11.25,1.15,878.26,11.25,234987.4,261.67,0.27,True,58.82,-2.86,2.19,-5.05,2025-11-18,480.5,2.45,0,,470.0,544.0,True,False
18-11-2025 12:00,PNSUT,11.38,11.54,11.27,11.54,423099.0,0.0,0.16,0.02,627.27,0.16,130846.9,223.35,0.0,True,61.27,0.0,0.03,-0.02,2025-11-18,11.26,2.49,0,,11.04,11.86,False,False
18-11-2025 12:00,KZBGY,11.51,11.96,11.51,11.86,5719414.0,0.1,0.35,0.09,276.34,0.35,2934244.2,94.92,0.29,True,55.44,-0.24,0.18,-0.42,2025-11-18,11.39,4.13,0,,10.55,14.12,True,False
18-11-2025 12:00,DITAS,38.98,41.26,38.36,41.1,418646.0,0.16,2.12,0.28,651.77,2.12,182040.7,129.97,0.08,True,78.17,0.97,0.21,0.76,2025-11-18,38.36,7.14,0,,35.5,ATH,False,False
18-11-2025 11:00,AKENR,10.8,11.38,10.79,11.36,6029133.0,0.02,0.56,0.1,489.47,0.56,3902893.7,54.48,0.04,True,72.45,0.28,0.1,0.18,2025-11-18,11.05,2.81,0,,9.92,ATH,False,False
18-11-2025 11:00,ISFIN,19.31,19.61,19.31,19.58,338516.0,0.03,0.27,0.03,694.12,0.27,120040.1,182.0,0.11,True,62.28,0.01,0.04,-0.02,2025-11-18,19.16,2.19,0,,18.93,20.58,True,False
18-11-2025 11:00,BIOEN,20.4,20.88,20.36,20.84,356298.0,0.04,0.44,0.09,383.52,0.44,234801.0,51.74,0.09,True,68.08,0.08,0.12,-0.04,2025-11-18,20.44,1.96,0,,19.37,22.52,False,False
18-11-2025 11:00,AVOD,4.02,4.14,4.01,4.11,402969.0,0.03,0.09,0.0,2900.0,0.09,258563.8,55.85,0.33,True,60.63,0.0,0.01,-0.01,2025-11-18,4.04,1.73,0,,3.84,4.63,False,False
18-11-2025 11:00,GENIL,186.3,189.4,186.2,188.8,135820.0,0.6,2.5,0.6,316.67,2.5,61137.8,122.15,0.24,True,57.11,0.13,0.86,-0.73,2025-11-18,185.8,1.61,0,,168.2,198.8,False,False
18-11-2025 10:00,TCELL,92.8,94.55,92.7,94.45,5456453.0,0.1,1.65,0.16,931.25,1.65,2258968.0,141.55,0.06,True,54.39,-0.41,0.14,-0.55,2025-11-18,93.1,1.45,0,,92.3,96.8,True,True
18-11-2025 10:00,MAKTK,13.29,14.32,13.29,14.27,3199550.0,0.05,0.98,0.14,620.59,0.98,675925.9,373.36,0.05,True,69.38,0.06,0.11,-0.04,2025-11-18,13.56,5.24,0,,12.8,ATH,False,False
18-11-2025 10:00,SASA,2.88,2.92,2.87,2.91,291564056.0,0.01,0.03,0.0,650.0,0.03,106270967.3,174.36,0.33,True,52.07,0.0,0.0,-0.0,2025-11-18,2.9,0.34,0,,2.82,2.94,False,False
18-11-2025 10:00,MARTI,3.17,3.19,3.15,3.19,2172824.0,0.0,0.02,0.0,566.67,0.02,1084010.8,100.44,0.0,True,60.13,0.01,0.01,0.0,2025-11-18,3.16,0.95,0,,3.02,3.21,False,False
18-11-2025 10:00,SRVGY,3.15,3.16,3.12,3.16,3015355.0,0.0,0.01,0.0,900.0,0.01,1948523.0,54.75,0.0,True,56.75,0.0,0.01,-0.0,2025-11-18,3.15,0.32,0,,3.05,3.18,False,False
18-11-2025 10:00,KLRHO,135.3,138.1,133.8,137.3,553942.0,0.8,2.0,0.32,525.0,2.0,263315.6,110.37,0.4,True,67.97,1.31,0.4,0.91,2025-11-18,135.4,1.4,0,,122.6,140.2,False,False
18-11-2025 10:00,SAHOL,75.8,76.8,75.4,76.75,7443749.0,0.05,0.95,0.19,400.0,0.95,3607754.7,106.33,0.05,True,58.8,0.08,0.14,-0.06,2025-11-18,76.3,0.59,0,,74.75,80.75,False,False
18-11-2025 10:00,TSKB,12.11,12.43,12.1,12.4,19530062.0,0.03,0.29,0.04,663.16,0.29,4608031.7,323.83,0.1,True,72.64,0.04,0.06,-0.01,2025-11-18,11.98,3.51,0,,11.73,13.2,False,False
18-11-2025 10:00,CCOLA,54.05,55.15,54.05,54.95,1025987.0,0.2,0.9,0.11,757.14,0.9,633061.9,62.07,0.22,True,57.02,-0.02,0.06,-0.08,2025-11-18,54.35,1.1,0,,53.55,55.8,False,False
18-11-2025 10:00,BURCE,34.86,38.0,33.82,37.18,347310.0,0.82,2.32,0.35,570.52,2.32,93165.1,272.79,0.35,True,68.64,0.2,0.4,-0.2,2025-11-18,35.24,5.51,0,,31.26,40.0,False,False
18-11-2025 10:00,TSPOR,1.27,1.28,1.26,1.28,87465788.0,0.0,0.01,0.0,150.0,0.01,47150281.6,85.5,0.0,True,58.49,0.0,0.0,0.0,2025-11-18,1.27,0.79,0,,1.23,1.29,False,False
18-11-2025 10:00,TTKOM,55.25,56.4,55.1,56.35,8241660.0,0.05,1.1,0.03,4300.0,1.1,3560921.0,131.45,0.05,True,52.8,-0.17,-0.05,-0.12,2025-11-18,55.4,1.71,0,,55.35,56.8,False,False
18-11-2025 10:00,ULKER,113.9,115.7,113.1,115.6,1795340.0,0.1,1.7,0.26,553.85,1.7,555412.9,223.24,0.06,True,64.49,0.54,0.15,0.39,2025-11-18,114.0,1.4,0,,110.5,ATH,False,False
18-11-2025 10:00,THYAO,267.5,269.5,267.0,269.5,6469715.0,0.0,2.0,0.1,1900.0,2.0,3000664.5,115.61,0.0,True,48.39,-0.97,0.18,-1.14,2025-11-18,268.5,0.37,0,,266.75,271.5,True,True
18-11-2025 10:00,PGSUS,203.5,205.4,203.0,205.3,3701529.0,0.1,1.8,0.24,650.0,1.8,1749238.4,111.61,0.06,True,53.55,-0.08,0.05,-0.13,2025-11-18,204.0,0.64,0,,203.0,208.3,False,False
18-11-2025 10:00,EUPWR,28.5,30.06,28.5,30.02,5590580.0,0.04,1.52,0.21,630.77,1.52,1523989.4,266.84,0.03,True,74.52,0.3,0.2,0.1,2025-11-18,28.7,4.6,0,,27.06,30.26,False,False
18-11-2025 10:00,KCHOL,166.9,169.4,166.6,169.3,6716859.0,0.1,2.4,0.65,269.23,2.4,3163253.8,112.34,0.04,True,64.03,0.83,0.4,0.43,2025-11-18,167.8,0.89,0,,161.9,174.0,False,False
18-11-2025 10:00,PETKM,16.8,16.99,16.69,16.98,12879207.0,0.01,0.18,0.03,500.0,0.18,7769216.4,65.77,0.06,True,60.03,0.09,0.01,0.08,2025-11-18,16.8,1.07,0,,16.25,17.45,False,False
18-11-2025 10:00,FRIGO,12.63,12.77,12.62,12.77,1754465.0,0.0,0.14,0.03,311.76,0.14,811873.8,116.1,0.0,True,84.61,0.2,0.02,0.18,2025-11-18,12.62,1.19,0,,10.8,ATH,False,False
18-11-2025 10:00,FROTO,94.45,95.15,93.5,95.1,2376919.0,0.05,0.65,0.04,1525.0,0.65,1207484.6,96.85,0.08,True,54.27,-0.01,0.07,-0.08,2025-11-18,94.6,0.53,0,,92.7,95.8,False,False
18-11-2025 10:00,GARAN,127.5,129.8,127.2,129.6,9161709.0,0.2,2.1,0.22,854.55,2.1,3886418.3,135.74,0.1,True,54.26,-0.32,0.04,-0.36,2025-11-18,128.0,1.25,0,,127.2,130.6,False,False
18-11-2025 10:00,MGROS,501.5,508.0,499.25,508.0,618896.0,0.0,6.5,0.55,1081.82,6.5,281890.8,119.55,0.0,True,58.09,0.79,0.26,0.52,2025-11-18,504.0,0.79,0,,497.75,508.5,False,False
18-11-2025 10:00,GIPTA,65.65,71.85,65.65,71.85,3971062.0,0.0,6.2,0.79,679.87,6.2,458054.7,766.94,0.0,True,79.07,0.97,0.93,0.04,2025-11-18,65.35,9.95,0,,57.7,73.4,False,False
18-11-2025 10:00,GMTAS,45.38,46.3,45.18,46.2,406908.0,0.1,0.82,0.1,703.92,0.82,165574.9,145.75,0.12,True,63.73,0.2,0.11,0.09,2025-11-18,45.38,1.81,0,,43.32,46.7,False,False
18-11-2025 10:00,HATEK,20.96,21.7,19.95,21.56,4188538.0,0.14,0.6,0.01,4185.71,0.6,1115505.8,275.48,0.23,True,71.0,0.73,-0.01,0.73,2025-11-18,20.78,3.75,0,,16.56,ATH,False,False
18-11-2025 10:00,HEKTS,3.25,3.3,3.24,3.3,25855679.0,0.0,0.05,0.01,614.29,0.05,10969299.5,135.71,0.0,True,58.26,0.01,0.01,0.01,2025-11-18,3.27,0.92,0,,3.12,3.41,False,False
18-11-2025 10:00,IHLAS,3.32,3.53,3.28,3.48,81134058.0,0.05,0.16,0.02,966.67,0.16,17952929.7,351.93,0.31,True,71.09,0.03,0.01,0.02,2025-11-18,3.32,4.82,0,,3.24,3.69,False,False
18-11-2025 10:00,ISCTR,12.19,12.4,12.14,12.38,134855120.0,0.02,0.19,0.01,1257.14,0.19,57487079.1,134.58,0.11,True,53.35,-0.04,0.0,-0.04,2025-11-18,12.24,1.14,0,,12.22,12.47,False,False
18-11-2025 10:00,OYAKC,21.46,21.72,21.36,21.7,5268456.0,0.02,0.24,0.02,1400.0,0.24,2616527.6,101.35,0.08,True,50.36,-0.04,0.01,-0.04,2025-11-18,21.6,0.46,0,,21.14,21.96,False,False
18-11-2025 10:00,KARSN,9.49,9.63,9.44,9.61,3017227.0,0.02,0.12,0.01,700.0,0.12,1347647.0,123.89,0.17,True,57.95,-0.0,0.01,-0.02,2025-11-18,9.5,1.16,0,,9.26,9.97,False,False
18-11-2025 10:00,BJKAS,1.84,1.85,1.83,1.85,16288373.0,0.0,0.01,0.0,900.0,0.01,5656791.7,187.94,0.0,True,62.64,0.0,0.0,0.0,2025-11-18,1.84,0.54,0,,1.8,1.86,False,False
18-11-2025 10:00,IHLGM,2.73,2.81,2.72,2.79,14184829.0,0.02,0.06,0.01,566.67,0.06,3984545.4,256.0,0.33,True,64.2,0.01,0.01,0.0,2025-11-18,2.73,2.2,0,,2.67,2.81,False,False
18-11-2025 10:00,XU030,11520.52,11671.46,11493.41,11671.45,781621053.0,0.01,150.93,21.56,600.21,150.93,331282397.7,135.94,0.0,True,60.2,20.88,16.53,4.35,2025-11-18,11577.69,0.81,0,,11317.61,11988.97,False,False
18-11-2025 10:00,ALARK,88.75,91.85,88.7,91.15,5562985.0,0.7,2.4,0.26,841.18,2.4,1077428.6,416.32,0.29,True,70.29,0.31,0.13,0.18,2025-11-18,88.25,3.29,0,,87.65,ATH,False,False
18-11-2025 10:00,BIMAS,537.0,551.0,534.0,550.5,1547589.0,0.5,13.5,1.5,800.0,13.5,629408.0,145.88,0.04,True,56.12,-2.42,1.1,-3.52,2025-11-18,540.0,1.94,0,,532.5,574.0,True,True
18-11-2025 10:00,ALKLC,76.3,81.55,75.8,81.55,3357557.0,0.0,5.25,0.54,881.31,5.25,645654.1,420.02,0.0,True,81.78,1.58,1.0,0.58,2025-11-18,74.15,9.98,0,,66.9,87.5,False,False
18-11-2025 10:00,ARCLK,105.0,106.6,104.7,106.3,264337.0,0.3,1.3,0.25,420.0,1.3,173473.9,52.38,0.23,True,58.4,0.35,0.1,0.25,2025-11-18,105.9,0.38,0,,102.8,106.8,False,False
18-11-2025 10:00,BARMA,23.88,25.1,23.74,24.8,4438247.0,0.3,0.92,0.09,945.45,0.92,965316.5,359.77,0.33,True,83.47,0.8,0.19,0.62,2025-11-18,23.34,6.26,0,,20.08,ATH,False,False
18-11-2025 10:00,XBANK,14349.07,14599.04,14302.09,14588.18,282663135.0,10.86,239.11,22.59,958.24,239.11,118703445.1,138.13,0.05,True,59.25,-3.04,15.45,-18.48,2025-11-18,14397.43,1.32,0,,14246.01,15066.03,False,False
18-11-2025 10:00,BEYAZ,27.8,28.08,27.56,28.06,260135.0,0.02,0.26,0.05,381.48,0.26,106071.9,145.24,0.08,True,53.68,-0.12,0.1,-0.21,2025-11-18,27.66,1.45,0,,26.92,28.24,False,False
18-11-2025 10:00,AGHOL,26.54,27.28,26.3,27.28,2866924.0,0.0,0.74,0.05,1270.37,0.74,700469.0,309.29,0.0,True,68.94,0.11,0.05,0.06,2025-11-18,26.54,2.79,0,,25.86,27.94,False,False
18-11-2025 10:00,XU100,10657.25,10768.39,10636.38,10768.16,1485726814.0,0.23,110.91,18.31,505.7,110.91,654872961.1,126.87,0.0,True,61.36,22.62,15.82,6.8,2025-11-18,10698.13,0.65,0,,10440.44,11044.47,False,False
18-11-2025 10:00,ARDYZ,28.58,30.44,28.34,30.06,4580178.0,0.38,1.48,0.27,448.15,1.48,1007294.0,354.7,0.26,True,77.87,0.57,0.19,0.38,2025-11-18,28.54,5.33,0,,26.48,ATH,False,False
18-11-2025 10:00,YKBNK,32.0,32.76,31.76,32.7,47428296.0,0.06,0.7,0.07,960.61,0.7,17689087.1,168.12,0.09,True,61.36,0.03,0.05,-0.03,2025-11-18,32.1,1.87,0,,31.56,33.92,False,False
18-11-2025 10:00,AEFES,14.43,14.85,14.35,14.76,26282294.0,0.09,0.33,0.04,685.71,0.33,8478002.9,210.01,0.27,True,65.6,0.07,0.02,0.05,2025-11-18,14.48,1.93,0,,14.1,15.09,False,False
18-11-2025 10:00,AKBNK,58.05,59.15,57.8,59.05,30584110.0,0.1,1.0,0.08,1150.0,1.0,11435231.5,167.46,0.1,True,57.35,-0.05,0.06,-0.11,2025-11-18,58.35,1.2,0,,57.8,59.3,False,False
18-11-2025 10:00,ATATP,163.1,172.4,160.0,171.6,2074842.0,0.8,8.5,1.68,405.95,8.5,355216.6,484.11,0.09,True,84.29,3.48,1.76,1.72,2025-11-18,160.4,6.98,0,,144.8,174.8,False,False
17-11-2025 17:00,KLSER,28.56,28.98,28.54,28.96,217113.0,0.02,0.4,0.06,614.29,0.4,99318.0,118.6,0.05,True,60.66,0.0,0.12,-0.12,2025-11-17,28.12,2.99,1,28.98,27.88,28.98,False,False
17-11-2025 17:00,DURDO,3.83,3.93,3.82,3.93,1890399.0,0.0,0.1,0.04,177.78,0.1,667831.3,183.07,0.0,True,85.64,0.07,0.03,0.03,2025-11-17,3.58,9.78,0,,3.52,ATH,False,False
17-11-2025 17:00,DSTKF,752.5,767.0,750.0,767.0,248957.0,0.0,14.5,1.05,1280.95,14.5,108787.8,128.85,0.0,True,66.57,7.37,-0.42,7.79,2025-11-17,749.5,2.33,0,,688.0,768.0,False,False
17-11-2025 17:00,SURGY,50.9,53.5,50.7,53.5,2328616.0,0.0,2.6,0.23,1055.56,2.6,466383.1,399.29,0.0,True,68.23,0.04,0.15,-0.11,2025-11-17,51.3,4.29,0,,50.35,55.0,False,False
17-11-2025 17:00,ANSGR,22.26,22.4,22.24,22.4,729566.0,0.0,0.14,0.03,366.67,0.14,429551.5,69.84,0.0,True,57.31,-0.01,0.05,-0.06,2025-11-17,21.92,2.19,0,,21.92,22.54,False,False
17-11-2025 17:00,TRCAS,39.54,40.28,39.48,40.28,332486.0,0.0,0.74,0.02,3600.0,0.74,146933.0,126.28,0.0,True,58.36,0.1,0.07,0.03,2025-11-17,40.12,0.4,0,,39.34,40.56,False,False
17-11-2025 17:00,ARMGD,36.88,37.38,36.88,37.32,567527.0,0.06,0.44,0.11,307.41,0.44,204126.6,178.03,0.14,True,66.33,0.23,0.11,0.12,2025-11-17,36.12,3.32,0,,35.06,37.9,False,False
17-11-2025 17:00,GLYHO,11.24,11.47,11.23,11.46,2784139.0,0.01,0.22,0.02,1057.89,0.22,1227288.2,126.85,0.05,True,55.8,0.01,0.01,-0.0,2025-11-17,11.28,1.6,0,,11.09,11.52,False,False
17-11-2025 17:00,KRONT,15.42,15.7,15.36,15.69,139696.0,0.01,0.27,0.03,864.29,0.27,84920.8,64.5,0.04,True,50.75,-0.12,0.04,-0.15,2025-11-17,15.15,3.56,0,,15.02,16.7,False,False
17-11-2025 17:00,PEKGY,12.7,12.93,12.67,12.87,112354775.0,0.06,0.17,0.02,962.5,0.17,34605434.1,224.67,0.35,True,63.82,0.04,0.01,0.03,2025-11-17,12.62,1.98,2,12.67,12.67,13.1,False,False
17-11-2025 17:00,HOROZ,59.85,60.45,59.6,60.45,137405.0,0.0,0.6,0.02,2300.0,0.6,91483.8,50.2,0.0,True,52.94,-0.01,0.06,-0.07,2025-11-17,60.05,0.67,0,,58.75,61.35,False,False
17-11-2025 17:00,OZYSR,40.84,43.0,40.76,43.0,2562553.0,0.0,2.16,0.44,388.69,2.16,433411.0,491.25,0.0,True,79.08,0.83,0.24,0.59,2025-11-17,39.1,9.97,0,,37.2,ATH,False,False
17-11-2025 17:00,OBAMS,39.44,39.92,39.44,39.86,591926.0,0.06,0.42,0.01,6900.0,0.42,309930.3,90.99,0.14,True,44.36,-0.28,0.08,-0.36,2025-11-17,39.36,1.27,0,,39.16,40.24,True,False
17-11-2025 17:00,TURSG,12.69,12.91,12.62,12.9,14416181.0,0.01,0.21,0.0,6900.0,0.21,5734548.1,151.39,0.05,True,48.91,-0.01,0.0,-0.01,2025-11-17,12.84,0.47,2,12.62,12.62,13.16,False,False
17-11-2025 17:00,SMRVA,419.25,432.0,419.0,432.0,416516.0,0.0,12.75,1.48,764.41,12.75,123811.6,236.41,0.0,True,77.17,10.0,-0.34,10.34,2025-11-17,413.0,4.6,1,432.0,372.25,ATH,False,False
17-11-2025 16:00,GESAN,44.76,47.46,44.56,47.38,2776486.0,0.08,2.62,0.36,619.78,2.62,550896.5,403.99,0.03,True,77.11,0.2,0.32,-0.12,2025-11-17,43.84,8.07,0,,43.3,49.22,False,False
17-11-2025 16:00,AGROT,7.43,7.62,7.42,7.62,11619326.0,0.0,0.19,0.07,192.31,0.19,2702442.1,329.96,0.0,True,86.47,0.11,0.07,0.04,2025-11-17,6.93,9.96,0,,6.89,7.73,False,False
17-11-2025 16:00,EGEGY,25.62,26.62,25.62,26.54,660144.0,0.08,0.92,0.16,482.28,0.92,229367.6,187.81,0.09,True,74.35,0.12,0.15,-0.03,2025-11-17,25.14,5.57,1,26.62,24.68,26.62,False,False
17-11-2025 15:00,MAGEN,32.86,34.18,32.74,34.1,1026554.0,0.08,1.24,0.21,479.44,1.24,517415.2,98.4,0.06,True,70.77,0.44,0.15,0.29,2025-11-17,32.22,5.83,0,,30.52,ATH,False,False
17-11-2025 15:00,BLCYT,29.16,29.86,28.9,29.82,388824.0,0.04,0.66,0.21,214.29,0.66,205423.5,89.28,0.06,True,82.68,0.42,0.2,0.22,2025-11-17,28.1,6.12,0,,27.18,ATH,False,False
17-11-2025 14:00,GSDHO,4.46,4.51,4.44,4.5,2199819.0,0.01,0.04,0.01,263.64,0.04,1056229.9,108.27,0.25,True,72.11,0.01,0.02,-0.01,2025-11-17,4.35,3.45,0,,4.32,4.78,False,False
17-11-2025 14:00,MTRKS,24.68,25.3,24.68,25.16,310783.0,0.14,0.48,0.14,247.83,0.48,132788.3,134.04,0.29,True,70.89,0.05,0.16,-0.11,2025-11-17,24.08,4.49,0,,23.64,25.24,False,False
17-11-2025 14:00,HALKB,27.92,28.34,27.9,28.24,8851906.0,0.1,0.32,0.03,841.18,0.32,5761789.2,53.63,0.31,True,71.8,0.23,0.1,0.12,2025-11-17,27.04,4.44,0,,26.7,29.28,False,False
17-11-2025 14:00,SANFM,6.91,7.11,6.89,7.1,2055180.0,0.01,0.19,0.03,578.57,0.19,680497.1,202.01,0.05,True,68.14,0.0,0.05,-0.05,2025-11-17,6.79,4.57,1,7.11,6.58,7.11,False,False
17-11-2025 13:00,EGEPO,7.78,7.97,7.78,7.96,1364310.0,0.01,0.18,0.02,650.0,0.18,650623.0,109.69,0.06,True,66.11,0.11,0.02,0.09,2025-11-17,7.58,5.01,0,,7.45,8.19,False,False
17-11-2025 13:00,PRKAB,37.94,40.2,37.5,40.2,732607.0,0.0,2.26,0.32,610.69,2.26,226280.0,223.76,0.0,True,71.66,0.21,0.37,-0.16,2025-11-17,36.56,9.96,0,,36.0,42.1,False,False
17-11-2025 13:00,AVGYO,11.47,11.76,11.4,11.75,327876.0,0.01,0.28,0.04,566.67,0.28,168099.3,95.05,0.04,True,59.05,-0.09,0.09,-0.18,2025-11-17,11.28,4.17,0,,10.98,11.89,False,False
17-11-2025 13:00,ESCAR,19.57,19.88,19.55,19.88,703579.0,0.0,0.31,0.07,349.28,0.31,336337.4,109.19,0.0,True,68.36,0.1,0.1,0.0,2025-11-17,19.08,4.19,0,,18.81,20.68,False,False
17-11-2025 13:00,ALCTL,110.4,112.5,110.4,112.1,168399.0,0.4,1.7,0.18,844.44,1.7,82282.6,104.66,0.24,True,56.99,-0.57,0.51,-1.08,2025-11-17,107.8,3.99,0,,106.5,112.7,False,False
17-11-2025 13:00,PATEK,28.48,29.02,28.4,28.92,3285645.0,0.1,0.44,0.12,279.31,0.44,1609523.2,104.14,0.23,True,68.09,0.03,0.18,-0.15,2025-11-17,27.76,4.18,0,,27.12,29.68,False,False
17-11-2025 13:00,IHGZT,1.86,1.94,1.86,1.94,20163293.0,0.0,0.08,0.01,1233.33,0.08,6343493.9,217.86,0.0,True,64.01,-0.0,0.01,-0.01,2025-11-17,1.83,6.01,0,,1.82,2.14,False,False
17-11-2025 12:00,HKTM,12.63,12.76,12.62,12.73,467598.0,0.03,0.1,0.02,525.0,0.1,310650.2,50.52,0.3,True,59.21,-0.01,0.03,-0.04,2025-11-17,12.42,2.5,0,,12.25,13.34,True,False
17-11-2025 12:00,ESCOM,3.21,3.27,3.2,3.27,5354293.0,0.0,0.06,0.01,500.0,0.06,2070010.9,158.66,0.0,True,56.36,-0.02,0.01,-0.03,2025-11-17,3.16,3.48,0,,3.13,3.37,False,False
17-11-2025 12:00,HTTBT,48.36,50.2,48.36,49.74,265019.0,0.46,1.38,0.33,323.31,1.38,114629.9,131.2,0.33,True,76.13,0.18,0.34,-0.16,2025-11-17,46.66,6.6,1,50.2,45.7,50.2,False,False
17-11-2025 12:00,DAPGM,11.83,12.17,11.82,12.12,6534673.0,0.05,0.29,0.05,530.43,0.29,3751948.9,74.17,0.17,True,57.5,-0.03,0.05,-0.09,2025-11-17,12.0,1.0,0,,11.52,12.38,False,False
17-11-2025 12:00,LYDHO,180.7,189.6,180.0,189.6,269283.0,0.0,8.9,0.84,959.52,8.9,116142.5,131.86,0.0,True,63.44,-0.3,1.26,-1.56,2025-11-17,177.6,6.76,0,,170.0,197.0,False,False
17-11-2025 12:00,MERCN,17.8,18.22,17.79,18.15,1407099.0,0.07,0.35,0.04,775.0,0.35,905002.0,55.48,0.2,True,49.91,-0.26,0.07,-0.34,2025-11-17,17.58,3.24,0,,17.47,19.87,True,True
17-11-2025 12:00,BOBET,18.85,19.0,18.83,18.99,470350.0,0.01,0.14,0.03,382.76,0.14,168926.7,178.43,0.07,True,60.91,-0.03,0.04,-0.07,2025-11-17,18.61,2.04,0,,18.52,19.1,False,False
17-11-2025 11:00,HUBVC,2.96,3.02,2.94,3.01,1074734.0,0.01,0.05,0.0,900.0,0.05,640966.3,67.67,0.2,True,44.12,-0.06,0.0,-0.06,2025-11-17,2.98,1.01,0,,2.93,3.3,False,False
17-11-2025 11:00,KAYSE,17.41,17.55,17.4,17.54,340151.0,0.01,0.13,0.01,2066.67,0.13,168030.8,102.43,0.08,True,55.48,-0.08,0.03,-0.11,2025-11-17,17.2,1.98,0,,17.2,17.85,True,False
17-11-2025 11:00,NTGAZ,10.94,11.16,10.94,11.14,1059279.0,0.02,0.2,0.02,900.0,0.2,443844.9,138.66,0.1,True,69.19,0.04,0.05,-0.01,2025-11-17,10.84,2.77,0,,10.5,11.32,False,False
17-11-2025 11:00,SKYMD,12.43,12.72,12.43,12.69,890116.0,0.03,0.26,0.03,664.71,0.26,457906.0,94.39,0.12,True,67.26,-0.04,0.05,-0.09,2025-11-17,12.17,4.27,0,,12.05,12.78,False,False
17-11-2025 11:00,TEZOL,12.16,12.42,12.15,12.37,410172.0,0.05,0.21,0.04,377.27,0.21,249409.8,64.46,0.24,True,65.37,-0.06,0.07,-0.13,2025-11-17,11.9,3.95,0,,11.77,13.2,False,False
17-11-2025 11:00,BAGFS,28.84,29.3,28.82,29.3,170967.0,0.0,0.46,0.09,411.11,0.46,87966.7,94.35,0.0,True,59.25,-0.19,0.17,-0.36,2025-11-17,28.58,2.52,0,,28.14,33.62,True,False
17-11-2025 11:00,AKFYE,17.13,17.24,17.12,17.23,418942.0,0.01,0.1,0.01,669.23,0.1,184142.7,127.51,0.1,True,61.42,-0.0,0.02,-0.02,2025-11-17,16.98,1.47,0,,16.94,17.3,False,False
17-11-2025 11:00,MIATK,37.32,39.2,37.3,38.92,6261165.0,0.28,1.6,0.17,852.38,1.6,1840981.9,240.1,0.18,True,72.11,-0.1,0.17,-0.27,2025-11-17,36.8,5.76,0,,36.64,40.88,True,False
17-11-2025 11:00,PAPIL,15.77,16.05,15.76,16.0,1435351.0,0.05,0.23,0.0,22900.0,0.23,917974.9,56.36,0.22,True,53.81,-0.11,0.05,-0.16,2025-11-17,15.65,2.24,0,,15.52,16.3,True,False
17-11-2025 11:00,GUBRF,317.25,323.5,317.25,322.25,515684.0,1.25,5.0,0.32,1438.46,5.0,227087.2,127.09,0.25,True,65.68,1.4,0.34,1.06,2025-11-17,314.25,2.55,0,,310.75,324.0,False,False
17-11-2025 11:00,YIGIT,24.32,24.82,24.32,24.8,337530.0,0.02,0.48,0.02,2300.0,0.48,171969.6,96.27,0.04,True,61.87,-0.14,0.09,-0.23,2025-11-17,23.94,3.59,0,,23.82,24.84,True,False
17-11-2025 11:00,YYLGD,10.39,10.66,10.39,10.62,799532.0,0.04,0.23,0.02,995.24,0.23,512323.7,56.06,0.17,True,58.97,-0.1,0.03,-0.13,2025-11-17,10.25,3.61,1,10.66,10.23,10.66,True,False
17-11-2025 11:00,ANGEN,11.53,12.26,11.53,12.12,4869977.0,0.14,0.59,0.06,883.33,0.59,931116.6,423.03,0.24,True,79.44,0.04,0.07,-0.03,2025-11-17,11.29,7.35,0,,11.22,12.32,False,False
17-11-2025 11:00,BOSSA,6.89,6.96,6.88,6.95,427101.0,0.01,0.06,0.01,1100.0,0.06,280449.4,52.29,0.17,True,55.17,-0.01,0.0,-0.01,2025-11-17,6.81,2.06,0,,6.77,7.38,False,False
17-11-2025 11:00,TUPRS,197.8,201.1,197.7,200.8,3481737.0,0.3,3.0,0.19,1478.95,3.0,2280519.6,52.67,0.1,True,61.39,0.96,0.14,0.81,2025-11-17,199.2,0.8,0,,195.9,201.7,False,False
17-11-2025 11:00,ASELS,180.1,184.5,180.0,184.5,7045766.0,0.0,4.4,0.75,486.67,4.4,3711977.5,89.81,0.0,True,66.02,-0.98,1.1,-2.08,2025-11-17,176.0,4.83,0,,171.5,188.8,False,False
17-11-2025 11:00,OSMEN,8.92,9.15,8.89,9.14,696595.0,0.01,0.22,0.02,1000.0,0.22,226746.8,207.21,0.05,True,59.95,-0.09,0.05,-0.14,2025-11-17,8.77,4.22,1,9.15,8.7,9.15,True,False
17-11-2025 11:00,ECZYT,355.75,364.75,355.75,363.75,163190.0,1.0,8.0,1.88,326.67,8.0,92718.1,76.01,0.12,True,82.29,5.1,1.57,3.52,2025-11-17,346.5,4.98,0,,332.0,ATH,False,False
17-11-2025 11:00,ELITE,30.74,31.36,30.74,31.32,202016.0,0.04,0.58,0.02,2316.67,0.58,128549.7,57.15,0.07,True,56.42,-0.34,0.16,-0.5,2025-11-17,30.22,3.64,0,,29.92,36.66,True,False
17-11-2025 11:00,KRDMB,21.84,22.08,21.84,22.04,296273.0,0.04,0.2,0.0,4900.0,0.2,109903.7,169.58,0.2,True,55.56,-0.13,0.09,-0.22,2025-11-17,21.5,2.51,1,22.08,21.4,22.08,True,False
17-11-2025 11:00,ENKAI,74.2,75.5,74.1,75.2,1610234.0,0.3,1.0,0.05,1718.18,1.0,928251.6,73.47,0.3,True,61.11,-0.01,0.15,-0.16,2025-11-17,74.0,1.62,1,75.5,73.1,75.5,False,False
17-11-2025 11:00,DERHL,14.49,14.84,14.48,14.81,1581579.0,0.03,0.32,0.04,788.89,0.32,761640.4,107.65,0.09,True,55.52,-0.22,0.07,-0.29,2025-11-17,14.23,4.08,0,,14.12,16.53,True,False
17-11-2025 11:00,EDIP,32.36,32.9,32.36,32.84,216213.0,0.06,0.48,0.06,757.14,0.48,95697.9,125.93,0.12,True,62.45,-0.17,0.19,-0.36,2025-11-17,31.98,2.69,0,,31.36,36.92,True,False
17-11-2025 10:00,SEGYO,6.2,6.66,6.17,6.66,18187489.0,0.0,0.46,0.1,350.98,0.46,5796071.9,213.79,0.0,True,74.51,0.11,0.15,-0.03,2025-11-17,6.06,9.9,1,6.66,5.34,ATH,False,False
17-11-2025 10:00,BRKVY,84.95,88.0,84.35,87.95,381771.0,0.05,3.0,0.6,400.0,3.0,137574.1,177.5,0.02,True,73.38,0.83,0.48,0.35,2025-11-17,84.7,3.84,0,,81.5,93.5,False,False
17-11-2025 10:00,EKOS,26.14,28.2,26.14,28.12,2075551.0,0.08,1.98,0.18,976.09,1.98,447618.2,363.69,0.04,True,77.65,0.05,0.19,-0.14,2025-11-17,26.02,8.07,1,28.2,25.44,28.2,False,False
17-11-2025 10:00,ARTMS,40.56,43.34,40.52,42.84,960046.0,0.5,2.28,0.2,1063.27,2.28,180067.9,433.16,0.22,True,61.3,-0.37,0.17,-0.55,2025-11-17,40.2,6.57,0,,39.34,43.06,False,False
17-11-2025 10:00,HUNER,3.5,3.58,3.49,3.57,3444884.0,0.01,0.07,0.0,2233.33,0.07,986106.1,249.34,0.14,True,64.26,-0.01,0.01,-0.03,2025-11-17,3.46,3.18,0,,3.48,3.92,False,False
17-11-2025 10:00,HURGZ,5.5,5.99,5.5,5.99,2639958.0,0.0,0.49,0.05,942.55,0.49,448651.9,488.42,0.0,True,72.89,-0.01,0.03,-0.04,2025-11-17,5.45,9.91,0,,5.45,6.0,True,True
17-11-2025 10:00,FONET,2.8,2.93,2.79,2.9,15361356.0,0.03,0.1,0.0,4900.0,0.1,4110207.0,273.74,0.3,True,63.37,-0.02,0.01,-0.02,2025-11-17,2.77,4.69,0,,2.75,3.07,True,False
17-11-2025 10:00,KZGYO,24.72,26.44,24.56,26.22,949364.0,0.22,1.5,0.14,941.67,1.5,159277.7,496.04,0.15,True,75.87,-0.03,0.17,-0.2,2025-11-17,24.4,7.46,0,,24.16,27.64,True,False
17-11-2025 10:00,AKYHO,3.03,3.1,3.01,3.1,602352.0,0.0,0.07,0.01,600.0,0.07,180763.5,233.23,0.0,True,60.69,-0.01,0.01,-0.01,2025-11-17,3.04,1.97,2,3.01,3.01,3.27,False,False
17-11-2025 10:00,ECOGR,29.48,29.6,29.08,29.6,2998903.0,0.0,0.12,0.01,900.0,0.12,1371235.5,118.7,0.0,True,100.0,1.66,0.13,1.52,2025-11-17,26.92,9.96,1,29.6,22.26,ATH,False,False
17-11-2025 10:00,IHYAY,2.26,2.35,2.26,2.33,2880426.0,0.02,0.07,0.0,1.576259869579679e+17,0.07,994436.8,189.65,0.29,True,48.84,-0.02,-0.0,-0.02,2025-11-17,2.26,3.1,2,2.26,2.26,2.37,False,False
17-11-2025 10:00,ODAS,5.29,5.4,5.28,5.38,10008445.0,0.02,0.09,0.0,8900.0,0.09,3557188.6,181.36,0.22,True,56.45,-0.03,0.01,-0.04,2025-11-17,5.24,2.67,0,,5.17,5.48,False,False
17-11-2025 10:00,INFO,3.9,4.12,3.89,4.08,14708229.0,0.04,0.18,0.01,1400.0,0.18,3409225.3,331.42,0.22,True,59.32,-0.07,0.03,-0.09,2025-11-17,3.86,5.7,0,,3.82,4.42,True,False
17-11-2025 10:00,DYOBY,13.26,13.68,13.26,13.56,218081.0,0.12,0.3,0.02,1400.0,0.3,89810.8,142.82,0.4,True,65.25,-0.04,0.03,-0.08,2025-11-17,13.22,2.57,0,,13.15,13.64,True,True
17-11-2025 10:00,TATGD,12.86,13.13,12.86,13.09,295320.0,0.04,0.23,0.02,1337.5,0.23,95909.7,207.91,0.17,True,49.89,-0.11,0.03,-0.14,2025-11-17,12.91,1.39,0,,12.81,14.45,True,False
17-11-2025 10:00,ISDMR,35.26,35.92,35.26,35.82,425365.0,0.1,0.56,0.02,3011.11,0.56,277369.3,53.36,0.18,True,56.85,-0.19,0.07,-0.26,2025-11-17,35.2,1.76,0,,34.98,35.9,True,False
17-11-2025 10:00,KRDMA,24.74,25.68,24.72,25.54,484812.0,0.14,0.8,0.03,2400.0,0.8,159511.9,203.93,0.18,True,60.29,-0.16,0.08,-0.24,2025-11-17,24.58,3.91,0,,24.48,25.76,True,False
17-11-2025 10:00,SAMAT,6.15,6.3,6.07,6.26,282821.0,0.04,0.11,0.02,400.0,0.11,91081.1,210.52,0.36,True,56.93,-0.01,0.02,-0.03,2025-11-17,6.18,1.29,0,,6.0,6.49,False,False
17-11-2025 10:00,YEOTK,36.7,38.0,36.6,37.86,2483928.0,0.14,1.16,0.12,850.82,1.16,545371.7,355.46,0.12,True,67.04,0.05,0.11,-0.06,2025-11-17,36.48,3.78,0,,36.14,39.0,False,False
17-11-2025 10:00,GLRMK,171.1,174.7,170.5,174.1,439863.0,0.6,3.0,0.32,837.5,3.0,139032.0,216.38,0.2,True,55.79,-1.32,0.57,-1.89,2025-11-17,169.1,2.96,0,,164.0,176.0,False,False
17-11-2025 10:00,ARASE,57.0,58.65,57.0,58.2,186888.0,0.45,1.2,0.06,1746.15,1.2,53730.8,247.82,0.37,True,59.08,-0.37,0.15,-0.53,2025-11-17,56.85,2.37,0,,56.0,60.85,True,False
17-11-2025 10:00,PENTA,13.87,14.2,13.87,14.15,546364.0,0.05,0.28,0.01,4566.67,0.28,208476.9,162.07,0.18,True,55.63,-0.11,0.03,-0.14,2025-11-17,13.8,2.54,0,,13.76,15.76,True,False
17-11-2025 10:00,FADE,13.58,13.75,13.45,13.73,199104.0,0.02,0.15,0.02,733.33,0.15,69534.1,186.34,0.13,True,55.76,-0.07,0.04,-0.11,2025-11-17,13.51,1.63,0,,13.41,14.39,True,False
17-11-2025 10:00,CONSE,3.17,3.25,3.17,3.24,1397197.0,0.01,0.07,0.0,1650.0,0.07,551916.1,153.15,0.14,True,60.91,-0.02,0.01,-0.03,2025-11-17,3.15,2.86,0,,3.13,3.48,True,False
17-11-2025 10:00,KRVGD,2.53,2.58,2.52,2.58,1678555.0,0.0,0.05,0.0,1150.0,0.05,768939.9,118.29,0.0,True,59.41,-0.0,0.01,-0.01,2025-11-17,2.52,2.38,0,,2.49,2.61,False,False
17-11-2025 10:00,AYDEM,18.21,18.62,18.2,18.54,611424.0,0.08,0.33,0.01,2438.46,0.33,240233.8,154.51,0.24,True,55.28,-0.12,0.03,-0.16,2025-11-17,18.12,2.32,0,,17.97,19.33,True,True
17-11-2025 10:00,BULGS,42.64,45.36,42.62,45.12,4938175.0,0.24,2.48,0.34,620.93,2.48,1617271.0,205.34,0.1,True,66.95,0.02,0.34,-0.32,2025-11-17,42.42,6.36,0,,40.84,48.7,False,False
17-11-2025 10:00,ETILR,4.06,4.14,4.06,4.12,1136757.0,0.02,0.06,0.01,1100.0,0.06,437149.2,160.04,0.33,True,58.61,-0.03,0.01,-0.04,2025-11-17,4.04,1.98,0,,3.99,4.46,True,False
17-11-2025 10:00,GLRYH,4.31,4.43,4.31,4.41,2979854.0,0.02,0.1,0.0,9900.0,0.1,1200986.6,148.12,0.2,True,47.7,-0.09,0.02,-0.1,2025-11-17,4.29,2.8,0,,4.17,5.15,True,False
17-11-2025 10:00,CEMAS,5.43,5.66,5.43,5.65,16867704.0,0.01,0.22,0.03,780.0,0.22,6407626.7,163.24,0.05,True,64.87,-0.0,0.01,-0.02,2025-11-17,5.43,4.05,1,5.66,5.35,5.66,False,False
17-11-2025 10:00,GOODY,15.37,15.67,15.37,15.6,303789.0,0.07,0.23,0.02,995.24,0.23,115941.1,162.02,0.3,True,65.04,-0.01,0.04,-0.05,2025-11-17,15.29,2.03,0,,15.12,16.73,False,False
17-11-2025 10:00,LIDER,78.65,83.3,78.65,82.9,397457.0,0.4,4.25,0.34,1150.0,4.25,126218.1,214.9,0.09,True,80.4,2.42,-0.12,2.54,2025-11-17,78.65,5.4,0,,65.75,ATH,False,False
17-11-2025 10:00,PCILT,22.72,23.48,22.72,23.28,256848.0,0.2,0.56,0.03,1900.0,0.56,73152.3,251.11,0.36,True,55.3,-0.21,0.05,-0.26,2025-11-17,22.66,2.74,0,,22.48,23.58,True,True
17-11-2025 10:00,GENTS,10.4,11.08,10.25,11.04,7075786.0,0.04,0.64,0.03,1782.35,0.64,1515901.7,366.77,0.06,True,58.45,-0.15,0.03,-0.18,2025-11-17,10.17,8.55,0,,10.06,11.8,True,True
14-11-2025 17:00,KIMMR,14.72,14.98,14.72,14.98,159190.0,0.0,0.26,0.02,1633.33,0.26,79278.6,100.8,0.0,True,49.0,-0.16,0.02,-0.18,2025-11-14,14.8,1.22,0,,ATL,15.84,True,True
14-11-2025 17:00,KOZAL,32.94,33.7,32.8,33.7,41448918.0,0.0,0.76,0.11,603.7,0.76,23521972.7,76.21,0.0,True,73.26,0.75,-0.07,0.82,2025-11-14,32.7,3.06,0,,27.36,ATH,False,False
14-11-2025 17:00,KRPLS,7.65,8.1,7.64,8.0,2502542.0,0.1,0.35,0.02,1300.0,0.35,345179.3,625.0,0.29,True,61.71,-0.04,0.02,-0.06,2025-11-14,7.77,2.96,1,8.1,7.63,8.1,True,True
14-11-2025 17:00,JANTS,18.98,19.15,18.96,19.15,369093.0,0.0,0.17,0.0,3300.0,0.17,167841.4,119.91,0.0,True,39.03,-0.18,0.02,-0.2,2025-11-14,19.24,-0.47,0,,18.94,21.48,True,True
14-11-2025 17:00,KOCMT,2.74,2.8,2.74,2.8,2502738.0,0.0,0.06,0.0,5900.0,0.06,1478261.5,69.3,0.0,True,56.06,-0.01,0.0,-0.01,2025-11-14,2.76,1.45,0,,2.73,2.92,False,False
14-11-2025 17:00,KONKA,14.01,14.29,13.92,14.29,240065.0,0.0,0.28,0.01,5500.0,0.28,130670.2,83.72,0.0,True,48.31,-0.11,0.02,-0.13,2025-11-14,14.3,-0.07,0,,13.91,14.48,True,True
14-11-2025 17:00,MOGAN,8.35,8.48,8.34,8.48,655989.0,0.0,0.13,0.0,6400.0,0.13,317965.4,106.31,0.0,True,43.73,-0.11,0.02,-0.13,2025-11-14,8.42,0.71,0,,8.31,8.78,True,True
14-11-2025 17:00,VAKFN,2.26,2.33,2.23,2.32,79478963.0,0.01,0.06,0.0,1900.0,0.06,22845821.1,247.89,0.17,True,73.77,0.03,0.0,0.03,2025-11-14,2.23,4.04,0,,2.17,ATH,False,False
14-11-2025 17:00,BORLS,11.91,13.2,11.91,12.84,19572508.0,0.36,0.93,0.09,933.33,0.93,8668966.6,125.78,0.39,True,44.39,-0.75,0.07,-0.83,2025-11-14,13.23,-2.95,0,,11.91,14.8,True,True
14-11-2025 17:00,AKGRT,6.67,6.75,6.66,6.74,2029041.0,0.01,0.07,0.01,900.0,0.07,1006207.1,101.65,0.14,True,50.11,-0.05,0.01,-0.05,2025-11-14,6.67,1.05,0,,6.59,7.13,True,True
14-11-2025 17:00,EUREN,7.11,7.27,7.09,7.26,10408048.0,0.01,0.15,0.01,1400.0,0.15,4460733.9,133.33,0.07,True,53.42,-0.02,-0.0,-0.02,2025-11-14,7.2,0.83,0,,7.07,7.58,False,False
14-11-2025 17:00,PRDGS,6.01,6.16,6.0,6.16,623571.0,0.0,0.15,0.01,1566.67,0.15,267895.0,132.77,0.0,True,49.02,-0.09,0.01,-0.1,2025-11-14,6.06,1.65,0,,5.94,6.69,True,True
14-11-2025 17:00,OYYAT,40.0,40.42,39.42,40.34,109028.0,0.08,0.34,0.02,1445.45,0.34,65594.7,66.21,0.24,True,39.69,-0.94,0.22,-1.16,2025-11-14,39.7,1.61,0,,39.32,43.1,True,False
14-11-2025 17:00,AKFIS,21.74,22.3,21.68,22.3,702885.0,0.0,0.56,0.03,1766.67,0.56,350002.5,100.82,0.0,True,48.5,-0.28,0.07,-0.35,2025-11-14,22.02,1.27,0,,21.62,22.38,True,False
14-11-2025 17:00,SMRTG,25.04,25.36,25.0,25.3,329949.0,0.06,0.26,0.02,983.33,0.26,127998.3,157.78,0.23,True,51.87,-0.13,0.06,-0.19,2025-11-14,25.02,1.12,0,,24.96,25.84,True,True
14-11-2025 17:00,BMSTL,93.6,97.85,93.45,97.45,1092134.0,0.4,3.85,0.36,984.51,3.85,538924.4,102.65,0.1,True,78.17,2.96,0.16,2.8,2025-11-14,92.45,5.41,0,,80.35,ATH,False,False
14-11-2025 17:00,BALSU,17.36,18.45,17.29,18.45,1362096.0,0.0,1.09,0.05,2080.0,1.09,368020.1,270.11,0.0,True,61.05,-0.14,0.03,-0.17,2025-11-14,18.07,2.1,0,,17.17,18.49,False,False
14-11-2025 17:00,PASEU,135.1,142.0,134.1,142.0,1392607.0,0.0,6.9,1.19,479.83,6.9,513691.3,171.1,0.0,True,72.64,1.57,0.95,0.62,2025-11-14,130.0,9.23,1,142.0,128.3,143.2,False,False
14-11-2025 15:00,KLKIM,31.64,32.98,31.36,32.98,668391.0,0.0,1.34,0.16,737.5,1.34,185074.0,261.15,0.0,True,71.12,0.06,0.13,-0.08,2025-11-14,31.58,4.43,0,,31.2,ATH,False,False
14-11-2025 15:00,DESA,13.62,14.31,13.5,14.31,1207615.0,0.0,0.69,0.14,403.65,0.69,386528.9,212.43,0.0,True,73.79,0.09,0.16,-0.07,2025-11-14,13.01,9.99,1,14.31,12.66,15.72,False,False
14-11-2025 15:00,TUCLK,9.04,9.28,9.0,9.26,2034046.0,0.02,0.22,0.01,1471.43,0.22,579579.3,250.95,0.09,True,55.16,-0.03,0.01,-0.04,2025-11-14,9.17,0.98,2,9.0,9.0,9.29,False,False
14-11-2025 15:00,ALFAS,40.68,44.32,40.58,43.56,1453274.0,0.76,2.88,0.22,1221.1,2.88,204417.0,610.94,0.26,True,75.69,-0.13,0.19,-0.32,2025-11-14,41.0,6.24,2,40.58,40.58,46.5,True,True
14-11-2025 15:00,OZSUB,20.7,22.4,20.68,22.08,1932172.0,0.32,1.38,0.12,1031.15,1.38,1169198.2,65.26,0.23,True,60.77,0.44,0.05,0.4,2025-11-14,21.24,3.95,0,,18.8,22.98,False,False
14-11-2025 14:00,VKING,36.18,37.66,35.94,37.66,956287.0,0.0,1.48,0.33,351.22,1.48,325569.6,193.73,0.0,True,83.79,0.66,0.3,0.36,2025-11-14,34.24,9.99,0,,33.5,ATH,False,False
14-11-2025 13:00,ADESE,2.24,2.39,2.23,2.37,86760366.0,0.02,0.13,0.01,900.0,0.13,24144749.3,259.33,0.15,True,49.32,-0.08,0.03,-0.11,2025-11-14,2.27,4.41,0,,2.21,3.25,True,False
14-11-2025 13:00,MERKO,13.88,14.52,13.86,14.37,2114244.0,0.15,0.49,0.05,900.0,0.49,509746.1,314.76,0.31,True,66.46,-0.04,0.04,-0.08,2025-11-14,13.85,3.75,0,,13.81,15.18,False,False
14-11-2025 11:00,MOBTL,7.14,7.4,7.1,7.36,1738373.0,0.04,0.22,0.01,2100.0,0.22,684315.1,154.03,0.18,True,45.76,-0.13,0.01,-0.14,2025-11-14,7.17,2.65,1,7.4,7.03,7.4,True,True
14-11-2025 11:00,SERNT,8.9,9.01,8.83,8.98,1006675.0,0.03,0.08,0.0,1900.0,0.08,518743.2,94.06,0.37,True,46.88,-0.1,0.04,-0.14,2025-11-14,8.82,1.81,0,,8.72,9.03,True,False
14-11-2025 11:00,ANELE,15.12,15.3,15.09,15.25,163478.0,0.05,0.13,0.02,490.91,0.13,82641.9,97.81,0.38,True,47.17,-0.09,0.02,-0.11,2025-11-14,15.15,0.66,0,,15.05,15.61,True,False
14-11-2025 11:00,METRO,5.12,5.26,5.09,5.24,2215428.0,0.02,0.12,0.02,445.45,0.12,1125761.0,96.79,0.17,True,48.11,-0.09,0.02,-0.1,2025-11-14,5.11,2.54,0,,ATL,5.93,True,False
14-11-2025 11:00,INVEO,9.82,9.95,9.8,9.94,1650147.0,0.01,0.12,0.02,605.88,0.12,934303.4,76.62,0.08,True,51.45,-0.08,0.02,-0.1,2025-11-14,9.76,1.84,0,,9.67,10.81,True,False
14-11-2025 10:00,MNDRS,15.53,16.07,15.49,16.07,3616153.0,0.0,0.54,0.07,682.61,0.54,972221.5,271.95,0.0,True,77.49,0.21,0.02,0.19,2025-11-14,15.49,3.74,0,,13.7,16.08,False,False
14-11-2025 10:00,CRDFA,37.6,41.8,37.38,41.7,495592.0,0.1,4.1,0.33,1127.54,4.1,117539.2,321.64,0.02,True,58.83,-0.76,0.2,-0.96,2025-11-14,38.0,9.74,3,,39.0,47.48,True,True
14-11-2025 10:00,CVKMD,18.46,19.41,18.44,19.34,13466809.0,0.07,0.88,0.1,807.22,0.88,3087868.3,336.12,0.08,True,68.42,-0.03,0.15,-0.18,2025-11-14,18.37,5.28,0,,17.64,21.44,False,False
14-11-2025 10:00,IZMDC,6.0,6.11,6.0,6.09,1584331.0,0.02,0.09,0.01,718.18,0.09,543523.9,191.49,0.22,True,53.38,-0.03,0.02,-0.05,2025-11-14,6.04,0.83,0,,5.91,6.12,False,False
14-11-2025 10:00,TEKTU,11.09,11.95,10.7,11.88,6167829.0,0.07,0.79,0.16,387.65,0.79,1471977.8,319.02,0.09,True,64.42,-0.04,0.2,-0.24,2025-11-14,11.19,6.17,1,11.95,9.79,11.95,False,False
14-11-2025 10:00,ECILC,85.75,88.4,85.35,87.75,2626589.0,0.65,2.0,0.19,952.63,2.0,779186.7,237.09,0.33,True,71.88,0.64,0.25,0.39,2025-11-14,85.0,3.24,0,,78.5,88.0,False,False
14-11-2025 10:00,ALTNY,61.4,66.6,61.35,65.35,12597987.0,1.25,3.95,0.37,967.57,3.95,1424679.6,784.27,0.32,True,74.22,0.03,0.35,-0.31,2025-11-14,61.8,5.74,1,66.6,61.15,66.6,False,False
14-11-2025 10:00,ORCAY,3.8,3.98,3.72,3.97,3256719.0,0.01,0.17,0.01,1114.29,0.17,741528.0,339.19,0.06,True,55.89,-0.01,0.01,-0.02,2025-11-14,3.85,3.12,2,3.72,3.72,4.07,False,False
14-11-2025 10:00,ALKA,9.75,10.44,9.72,10.25,5470239.0,0.19,0.5,0.03,1512.9,0.5,917972.6,495.9,0.38,True,60.55,-0.14,0.06,-0.21,2025-11-14,9.71,5.56,0,,9.67,11.6,True,True
13-11-2025 17:00,MNDTR,6.88,7.07,6.88,7.03,1413116.0,0.04,0.15,0.01,1263.64,0.15,382664.0,269.28,0.27,True,44.32,-0.14,0.03,-0.17,2025-11-13,6.87,2.33,0,,6.79,ATH,True,False
13-11-2025 17:00,CANTE,2.32,2.44,2.32,2.44,494603999.0,0.0,0.12,0.02,400.0,0.12,101014402.8,389.64,0.0,True,63.44,-0.04,0.03,-0.06,2025-11-13,2.22,9.91,0,,2.21,2.87,True,False
13-11-2025 17:00,MEKAG,4.31,4.45,4.29,4.45,1733066.0,0.0,0.14,0.01,1172.73,0.14,663554.1,161.18,0.0,True,59.53,-0.02,0.01,-0.03,2025-11-13,4.3,3.49,0,,4.22,4.6,True,False
13-11-2025 17:00,YESIL,2.46,2.61,2.43,2.61,34473941.0,0.0,0.15,0.02,650.0,0.15,8551287.1,303.14,0.0,True,62.17,-0.01,0.03,-0.04,2025-11-13,2.38,9.66,0,,2.35,2.77,False,False
13-11-2025 17:00,IHEVA,2.47,2.49,2.45,2.49,567666.0,0.0,0.02,0.0,1900.0,0.02,149974.5,278.51,0.0,True,40.27,-0.02,0.0,-0.03,2025-11-13,2.5,-0.4,0,,2.43,2.53,True,True
13-11-2025 17:00,YYAPI,2.31,2.44,2.28,2.44,62385783.0,0.0,0.13,0.02,465.22,0.13,34838351.3,79.07,0.0,True,63.65,-0.01,0.03,-0.04,2025-11-13,2.22,9.91,0,,2.18,2.86,False,False
13-11-2025 17:00,VAKBN,26.28,26.78,26.26,26.68,19273495.0,0.1,0.4,0.05,700.0,0.4,5927241.2,225.17,0.25,True,73.36,0.38,0.03,0.36,2025-11-13,26.04,2.46,0,,23.88,ATH,False,False
13-11-2025 17:00,MARBL,13.74,14.19,13.59,14.19,485181.0,0.0,0.45,0.04,997.56,0.45,178854.0,171.27,0.0,True,55.54,-0.12,0.02,-0.13,2025-11-13,13.7,3.58,2,13.59,13.59,14.96,True,True
13-11-2025 16:00,NTHOL,48.56,49.5,48.5,49.38,486663.0,0.12,0.82,0.01,6733.33,0.82,258692.2,88.12,0.15,True,49.27,-0.42,0.06,-0.48,2025-11-13,48.54,1.73,0,,48.2,52.3,True,True
13-11-2025 16:00,ZEDUR,8.18,8.98,8.14,8.95,1668321.0,0.03,0.77,0.06,1162.3,0.77,336398.0,395.94,0.04,True,75.83,-0.03,0.05,-0.07,2025-11-13,8.34,7.31,2,8.14,8.14,ATH,True,True
13-11-2025 16:00,DENGE,3.57,3.79,3.56,3.76,18557947.0,0.03,0.19,0.03,442.86,0.19,5343494.6,247.3,0.16,True,69.6,0.04,0.02,0.02,2025-11-13,3.46,8.67,0,,3.3,ATH,False,False
13-11-2025 16:00,ENJSA,76.55,77.75,76.2,77.6,378566.0,0.15,1.05,0.3,250.0,1.05,193731.4,95.41,0.14,True,65.3,-0.01,0.28,-0.29,2025-11-13,75.5,2.78,1,77.75,74.3,77.75,False,False
13-11-2025 15:00,BTCIM,4.11,4.19,4.1,4.18,19752367.0,0.01,0.07,0.0,1300.0,0.07,10459975.4,88.84,0.14,True,48.99,-0.05,0.02,-0.06,2025-11-13,4.11,1.7,1,4.19,4.09,4.19,True,False
13-11-2025 15:00,CEMZY,35.94,41.0,35.94,40.5,3406651.0,0.5,4.56,0.01,37900.0,4.56,749995.7,354.22,0.11,True,49.04,-1.31,-0.01,-1.3,2025-11-13,39.92,1.45,3,,39.42,42.66,True,True
13-11-2025 15:00,USAK,3.51,3.67,3.5,3.67,35168514.0,0.0,0.16,0.04,357.14,0.16,21015018.0,67.35,0.0,True,71.77,0.05,0.04,0.01,2025-11-13,3.4,7.94,0,,3.27,ATH,False,False
13-11-2025 14:00,QUAGR,5.51,5.92,5.51,5.91,94140326.0,0.01,0.4,0.03,1190.32,0.4,43415969.8,116.83,0.02,True,31.68,-0.44,0.03,-0.47,2025-11-13,6.12,-3.43,0,,5.51,6.8,True,True
13-11-2025 13:00,TERA,275.75,281.25,274.0,281.0,963915.0,0.25,5.25,0.25,2000.0,5.25,565171.5,70.55,0.05,True,54.22,1.31,-1.32,2.63,2025-11-13,280.75,0.09,2,274.0,274.0,303.0,False,False
13-11-2025 13:00,ESEN,7.17,7.31,7.15,7.28,14254400.0,0.03,0.11,0.01,685.71,0.11,4011298.9,255.36,0.27,True,67.68,0.01,0.02,-0.01,2025-11-13,7.12,2.25,0,,7.06,7.46,False,False
13-11-2025 12:00,EMKEL,55.25,57.2,55.25,57.2,4041229.0,0.0,1.95,0.1,1850.0,1.95,1879902.5,114.97,0.0,True,53.49,-1.21,0.55,-1.76,2025-11-13,52.0,10.0,0,,53.85,75.2,True,False
13-11-2025 12:00,DGNMO,5.75,5.93,5.75,5.88,506791.0,0.05,0.13,0.01,1344.44,0.13,163317.6,210.31,0.38,True,55.34,-0.06,0.02,-0.08,2025-11-13,5.7,3.16,1,5.93,5.7,5.93,True,False
13-11-2025 11:00,TOASO,232.5,237.2,232.5,236.8,1446649.0,0.4,4.3,0.58,641.38,4.3,511431.7,182.86,0.09,True,67.96,0.2,0.87,-0.66,2025-11-13,231.2,2.42,0,,223.9,ATH,False,False
13-11-2025 10:00,MANAS,12.51,12.98,12.26,12.98,19188536.0,0.0,0.47,0.05,900.0,0.47,2304001.4,732.84,0.0,True,99.87,0.7,0.04,0.66,2025-11-13,11.8,10.0,1,12.98,9.76,ATH,False,False
13-11-2025 10:00,OSTIM,3.36,3.4,3.36,3.39,3995239.0,0.01,0.03,0.0,900.0,0.03,1441881.4,177.09,0.33,True,46.0,-0.02,-0.0,-0.02,2025-11-13,3.36,0.89,1,3.4,3.33,3.4,False,False
13-11-2025 10:00,FENER,11.63,12.1,11.46,11.99,25549676.0,0.11,0.36,0.02,1900.0,0.36,11259894.6,126.91,0.31,True,73.55,0.37,0.0,0.36,2025-11-13,11.49,4.35,0,,9.95,ATH,False,False
13-11-2025 10:00,SELVA,1.95,2.02,1.94,2.01,4721630.0,0.01,0.06,0.0,1900.0,0.06,2253479.3,109.53,0.17,True,49.48,-0.02,0.0,-0.02,2025-11-13,1.97,2.03,2,1.94,1.94,2.06,False,False
13-11-2025 10:00,ARSAN,2.91,3.11,2.91,3.1,9998828.0,0.01,0.19,0.01,1627.27,0.19,2190137.8,356.54,0.05,True,62.29,-0.03,0.01,-0.04,2025-11-13,2.89,7.27,0,,2.87,3.15,True,True
13-11-2025 10:00,CIMSA,42.8,44.34,42.8,44.12,6518836.0,0.22,1.32,0.13,947.62,1.32,1202023.3,442.32,0.17,True,62.95,-0.32,0.15,-0.47,2025-11-13,42.6,3.57,0,,42.26,45.78,True,False
13-11-2025 10:00,SILVR,2.83,2.96,2.81,2.96,753265.0,0.0,0.13,0.01,983.33,0.13,297156.0,153.49,0.0,True,53.74,-0.03,0.0,-0.03,2025-11-13,2.84,4.23,3,,2.83,3.12,True,True
13-11-2025 10:00,DOGUB,56.5,66.8,56.5,65.1,1106587.0,1.7,8.6,0.86,900.0,8.6,124595.5,788.14,0.2,True,54.56,-0.12,-0.85,0.72,2025-11-13,62.75,3.75,3,,56.5,69.7,False,False
13-11-2025 10:00,DMSAS,9.89,9.99,9.87,9.98,545934.0,0.01,0.09,0.01,800.0,0.09,182538.8,199.08,0.11,True,67.93,0.05,0.0,0.05,2025-11-13,9.9,0.81,0,,9.39,ATH,False,False
13-11-2025 10:00,A1YEN,32.1,33.18,32.1,32.96,714002.0,0.22,0.86,0.1,726.92,0.86,465566.6,53.36,0.26,True,60.75,0.1,0.06,0.04,2025-11-13,31.98,3.06,0,,30.38,33.5,False,False
12-11-2025 17:00,DOFER,55.9,65.45,55.9,65.45,352353.0,0.0,9.55,0.58,1560.87,9.55,122339.7,188.01,0.0,True,69.22,-0.58,0.22,-0.79,2025-11-12,59.5,10.0,1,65.45,55.8,ATH,False,False
12-11-2025 17:00,DMRGD,26.56,27.02,26.5,26.96,431163.0,0.06,0.4,0.02,2400.0,0.4,271837.3,58.61,0.15,True,59.35,0.15,0.03,0.12,2025-11-12,27.0,-0.15,0,,24.82,27.5,False,False
12-11-2025 17:00,BUCIM,6.17,6.32,6.17,6.31,1449957.0,0.01,0.14,0.01,1066.67,0.14,503921.3,187.73,0.07,True,52.99,-0.05,0.02,-0.06,2025-11-12,6.15,2.6,0,,6.07,ATH,False,False
12-11-2025 17:00,CGCAM,35.54,37.18,35.24,36.84,1647171.0,0.34,1.3,0.07,1705.56,1.3,611255.0,169.47,0.26,True,63.3,0.09,0.17,-0.08,2025-11-12,36.0,2.33,0,,34.14,37.74,False,False
12-11-2025 16:00,SKTAS,5.13,5.6,5.06,5.55,11335071.0,0.05,0.42,0.03,1172.73,0.42,2406118.9,371.09,0.12,True,66.57,-0.0,0.03,-0.03,2025-11-12,5.1,8.82,0,,4.97,5.81,False,False
12-11-2025 14:00,IZFAS,139.6,148.0,139.6,146.5,494459.0,1.5,6.9,0.73,845.21,6.9,117327.6,321.43,0.22,True,71.88,-0.04,0.82,-0.85,2025-11-12,137.5,6.55,1,148.0,136.3,148.0,False,False
12-11-2025 13:00,ONCSM,247.7,259.5,247.5,257.75,775868.0,1.75,10.05,1.94,419.38,10.05,319826.5,142.59,0.17,True,78.3,6.61,1.8,4.8,2025-11-12,236.0,9.22,1,259.5,219.1,259.5,False,False
12-11-2025 13:00,FLAP,9.51,9.87,9.51,9.8,393078.0,0.07,0.29,0.0,9566.67,0.29,161509.9,143.38,0.24,True,56.89,-0.05,0.03,-0.08,2025-11-12,9.38,4.48,1,9.87,9.03,9.87,False,False
12-11-2025 11:00,BINHO,10.28,10.91,10.27,10.89,16737395.0,0.02,0.61,0.04,1286.36,0.61,4776911.2,250.38,0.03,True,61.17,-0.13,0.05,-0.18,2025-11-12,10.27,6.04,0,,10.0,11.64,True,True
12-11-2025 11:00,ALTIN,72.59,73.4,72.15,73.25,7856716.0,0.15,0.66,0.11,494.59,0.66,4613724.9,70.29,0.23,True,67.56,0.91,-0.08,0.99,2025-11-12,73.64,-0.53,2,72.15,72.15,73.96,False,False
12-11-2025 11:00,PENGD,8.6,8.94,8.6,8.91,2063898.0,0.03,0.31,0.01,4328.57,0.31,705918.9,192.37,0.1,True,59.98,-0.04,0.01,-0.05,2025-11-12,8.55,4.21,0,,8.34,8.95,False,False
12-11-2025 10:00,LINK,312.5,327.0,311.0,326.0,461119.0,1.0,13.5,0.75,1700.0,13.5,164991.7,179.48,0.07,True,58.43,-1.37,-0.79,-0.57,2025-11-12,312.0,4.49,0,,308.5,341.5,False,False
12-11-2025 10:00,FORMT,4.01,4.15,4.01,4.11,19120539.0,0.04,0.1,0.0,3233.33,0.1,7188440.2,165.99,0.4,True,56.57,-0.0,-0.01,0.01,2025-11-12,3.97,3.53,1,4.15,3.95,4.15,False,False
12-11-2025 10:00,VRGYO,3.05,3.14,3.05,3.12,6625682.0,0.02,0.07,0.0,6900.0,0.07,3568233.1,85.69,0.29,True,45.54,-0.06,0.01,-0.07,2025-11-12,3.03,2.97,1,3.14,2.96,3.14,True,False
11-11-2025 17:00,ODINE,281.0,300.0,279.75,296.75,896321.0,3.25,15.75,1.5,950.0,15.75,393415.4,127.83,0.21,True,84.02,9.08,-0.01,9.09,2025-11-11,280.5,5.79,0,,260.5,ATH,False,False
11-11-2025 17:00,DCTTR,29.12,29.9,29.04,29.84,710432.0,0.06,0.72,0.06,1185.71,0.72,447056.3,58.91,0.08,True,50.1,-0.43,0.06,-0.49,2025-11-11,29.34,1.7,0,,27.86,ATH,True,False
11-11-2025 16:00,AHSGY,52.35,54.15,52.3,53.85,257985.0,0.3,1.5,0.21,597.67,1.5,127984.7,101.57,0.2,True,49.21,-0.9,0.17,-1.07,2025-11-11,52.95,1.7,1,54.15,50.7,54.15,True,False
11-11-2025 16:00,ULUFA,3.7,3.94,3.67,3.88,24521736.0,0.06,0.18,0.01,2471.43,0.18,5108119.6,380.05,0.33,True,59.55,-0.03,0.01,-0.04,2025-11-11,3.77,2.92,0,,3.6,3.98,False,False
11-11-2025 16:00,SKBNK,8.24,8.52,8.14,8.5,18709150.0,0.02,0.26,0.01,1900.0,0.26,7622787.1,145.44,0.08,True,63.3,0.02,-0.0,0.02,2025-11-11,8.41,1.07,0,,8.01,ATH,False,False
11-11-2025 15:00,MHRGY,3.86,4.14,3.74,4.14,4918476.0,0.0,0.28,0.01,3400.0,0.28,2630073.0,87.01,0.0,True,62.79,-0.0,-0.0,0.0,2025-11-11,4.0,3.5,2,3.74,3.74,4.21,False,False
11-11-2025 15:00,BAHKM,52.35,53.25,51.2,53.25,287146.0,0.0,0.9,0.06,1536.36,0.9,105128.6,173.14,0.0,True,47.79,-0.47,0.06,-0.53,2025-11-11,52.3,1.82,0,,ATL,54.3,True,True
11-11-2025 15:00,EDATA,5.52,5.58,5.42,5.58,2362575.0,0.0,0.06,0.0,1900.0,0.06,711440.0,232.08,0.0,True,44.84,-0.04,0.0,-0.04,2025-11-11,5.63,-0.89,2,5.42,5.42,5.73,False,False
11-11-2025 14:00,SEYKM,6.23,6.48,6.21,6.48,258116.0,0.0,0.25,0.05,431.91,0.25,96049.0,168.73,0.0,True,62.83,-0.0,0.03,-0.03,2025-11-11,6.1,6.23,0,,5.99,6.49,False,False
11-11-2025 12:00,AHGAZ,27.98,29.0,27.84,28.92,1775938.0,0.08,0.94,0.11,724.56,0.94,697493.1,154.62,0.09,True,70.38,0.01,0.14,-0.13,2025-11-11,27.62,4.71,0,,27.26,ATH,False,False
11-11-2025 12:00,KLYPV,58.3,60.85,58.2,60.75,432308.0,0.1,2.45,0.15,1533.33,2.45,143530.6,201.2,0.04,True,63.29,-0.2,0.04,-0.24,2025-11-11,58.75,3.4,0,,ATL,61.4,True,True
11-11-2025 11:00,ICUGS,3.04,3.23,3.03,3.2,10983144.0,0.03,0.16,0.01,1677.78,0.16,3318330.5,230.98,0.19,True,48.82,-0.06,-0.0,-0.05,2025-11-11,3.11,2.89,1,3.23,ATL,3.23,True,True
11-11-2025 11:00,IEYHO,48.44,50.35,48.44,50.25,15462156.0,0.1,1.81,0.09,1933.71,1.81,8113079.2,90.58,0.06,True,65.08,1.68,-0.35,2.02,2025-11-11,48.06,4.56,0,,39.16,ATH,False,False
11-11-2025 10:00,LIDFA,4.31,4.6,4.3,4.52,21009779.0,0.08,0.21,0.02,1300.0,0.21,3255589.8,545.34,0.38,True,77.02,0.04,0.02,0.01,2025-11-11,4.22,7.11,1,4.6,4.11,4.6,False,False
11-11-2025 10:00,BMSCH,20.0,20.94,19.83,20.7,868711.0,0.24,0.7,0.07,900.0,0.7,256622.2,238.52,0.34,True,49.05,-0.31,-0.01,-0.3,2025-11-11,20.0,3.5,1,20.94,19.4,20.94,True,True
11-11-2025 10:00,TNZTP,23.04,23.96,22.82,23.82,1457543.0,0.14,0.78,0.1,712.5,0.78,324764.3,348.8,0.18,True,77.94,0.21,0.07,0.14,2025-11-11,22.96,3.75,1,23.96,22.18,23.96,False,False
11-11-2025 10:00,YAYLA,32.06,34.2,32.06,33.72,1214426.0,0.48,1.66,0.07,2415.15,1.66,302015.6,302.11,0.29,True,71.2,0.44,0.09,0.35,2025-11-11,32.34,4.27,1,34.2,30.66,34.2,False,False
11-11-2025 10:00,LRSHO,5.88,6.08,5.81,6.07,11001708.0,0.01,0.19,0.02,955.56,0.19,3025670.3,263.61,0.05,True,57.71,-0.05,0.01,-0.06,2025-11-11,5.87,3.41,0,,ATL,6.19,True,True
10-11-2025 17:00,SOKM,47.92,48.46,47.88,48.36,1613232.0,0.1,0.44,0.07,547.06,0.44,677325.3,138.18,0.23,True,61.0,0.44,-0.09,0.53,2025-11-10,47.64,1.51,0,,47.26,48.56,False,False
10-11-2025 16:00,AVHOL,43.34,44.62,43.34,44.28,371163.0,0.34,0.94,0.13,646.03,0.94,157386.0,135.83,0.36,True,59.24,-0.32,0.18,-0.5,2025-11-10,42.88,3.26,0,,42.6,ATH,True,False
10-11-2025 15:00,GWIND,24.64,25.1,24.58,25.08,716022.0,0.02,0.44,0.03,1366.67,0.44,358511.7,99.72,0.05,True,57.4,-0.15,0.05,-0.19,2025-11-10,24.58,2.03,0,,24.36,25.18,True,True
10-11-2025 14:00,KCAER,12.04,12.35,12.0,12.34,2995748.0,0.01,0.3,0.01,3233.33,0.3,1525384.8,96.39,0.03,True,48.65,-0.21,0.04,-0.25,2025-11-10,12.08,2.15,0,,11.85,12.95,True,False
10-11-2025 13:00,BORSK,23.48,24.38,23.44,24.32,1240383.0,0.06,0.84,0.15,460.0,0.84,407706.7,204.23,0.07,True,58.92,-0.22,0.03,-0.25,2025-11-10,23.52,3.4,0,,22.62,24.74,True,False
10-11-2025 12:00,ONRYT,82.55,84.45,82.35,84.05,101352.0,0.4,1.5,0.14,1011.11,1.5,61790.8,64.02,0.27,True,56.06,0.48,-0.15,0.63,2025-11-10,83.9,0.18,0,,81.95,85.0,False,False
10-11-2025 12:00,PLTUR,26.4,26.78,26.38,26.7,490407.0,0.08,0.3,0.05,500.0,0.3,229236.0,113.93,0.27,True,54.94,-0.15,0.02,-0.17,2025-11-10,25.98,2.77,0,,25.62,27.6,False,False
10-11-2025 11:00,MERIT,23.08,23.56,22.94,23.52,1068815.0,0.04,0.44,0.06,658.62,0.44,406043.9,163.23,0.09,True,77.53,0.32,0.03,0.28,2025-11-10,22.78,3.25,0,,22.06,ATH,False,False
10-11-2025 10:00,KFEIN,9.51,10.05,9.51,10.0,2797530.0,0.05,0.49,0.03,1431.25,0.49,863014.8,224.16,0.1,True,63.81,-0.05,0.01,-0.06,2025-11-10,9.51,5.15,2,9.51,9.51,ATH,True,True
10-11-2025 10:00,KTLEV,13.88,16.19,13.85,16.19,83903616.0,0.0,2.31,0.28,719.15,2.31,16461085.5,409.71,0.0,True,70.15,0.13,0.09,0.04,2025-11-10,14.72,9.99,1,16.19,13.82,ATH,True,True
10-11-2025 10:00,SAYAS,52.2,54.0,51.55,53.65,337440.0,0.35,1.45,0.24,491.84,1.45,166690.5,102.44,0.24,True,60.65,0.08,0.2,-0.13,2025-11-10,52.55,2.09,0,,50.8,ATH,False,False
07-11-2025 17:00,EGSER,3.39,3.41,3.37,3.41,1011322.0,0.0,0.02,0.0,1900.0,0.02,483670.2,109.09,0.0,True,45.5,-0.01,,,2025-11-07,3.42,-0.29,2,3.37,3.37,3.45,False,False
07-11-2025 15:00,POLHO,18.39,18.85,18.38,18.76,1441272.0,0.09,0.37,0.0,5.20728706914714e+16,0.37,491128.1,193.46,0.24,True,50.68,-0.1,,,2025-11-07,18.71,0.27,0,,18.5,19.2,False,False
07-11-2025 14:00,BNTAS,6.84,6.9,6.81,6.89,522192.0,0.01,0.05,0.0,4900.0,0.05,326670.6,59.85,0.2,True,56.65,-0.02,,,2025-11-07,6.83,0.88,0,,6.8,6.95,False,False
07-11-2025 12:00,FORTE,76.85,80.0,76.5,79.2,327177.0,0.8,2.35,0.09,2664.71,2.35,122876.7,166.26,0.34,True,64.28,0.9,,,2025-11-07,78.1,1.41,2,76.5,76.5,ATH,False,False
07-11-2025 12:00,BESLR,14.18,14.69,14.16,14.64,1412059.0,0.05,0.46,0.03,1252.94,0.46,572210.1,146.77,0.11,True,57.19,0.02,,,2025-11-07,14.39,1.74,2,14.16,14.16,ATH,False,False
07-11-2025 12:00,LILAK,29.98,30.64,29.98,30.46,672193.0,0.18,0.48,0.02,1900.0,0.48,369266.4,82.03,0.37,True,53.2,0.02,,,2025-11-07,30.46,0.0,0,,29.96,31.06,False,False
07-11-2025 11:00,DMLKT,5.96,5.97,5.96,5.97,2317933.0,0.0,0.01,0.0,900.0,0.01,1127417.9,105.6,0.0,True,50.21,-0.0,,,2025-11-07,5.96,0.17,1,5.97,5.96,5.98,False,False
07-11-2025 10:00,KOZAA,87.6,89.7,87.5,89.25,1611749.0,0.45,1.65,0.04,3566.67,1.65,558822.8,188.42,0.27,True,60.41,,,,2025-11-07,87.35,2.18,0,,87.25,89.8,False,False
06-11-2025 17:00,TCKRC,49.56,50.5,49.44,50.3,175960.0,0.2,0.74,0.07,927.78,0.74,108747.4,61.81,0.27,True,73.11,,,,2025-11-06,49.44,1.74,0,,ATL,ATH,False,False
06-11-2025 17:00,KATMR,3.63,3.94,3.55,3.94,202228040.0,0.0,0.31,0.03,839.39,0.31,49516699.6,308.4,0.0,True,72.87,,,,2025-11-06,3.59,9.75,0,,3.54,ATH,False,False
06-11-2025 17:00,INDES,8.58,8.7,8.58,8.68,1326631.0,0.02,0.1,0.02,455.56,0.1,606009.7,118.91,0.2,True,72.91,,,,2025-11-06,8.46,2.6,0,,8.36,ATH,False,False
06-11-2025 16:00,TDGYO,29.82,31.9,29.74,31.7,2071680.0,0.2,1.88,0.25,652.0,1.88,339923.5,509.45,0.11,True,77.32,,,,2025-11-06,29.0,9.31,0,,ATL,ATH,False,False
06-11-2025 16:00,KAREL,10.23,10.74,10.21,10.7,6086096.0,0.04,0.47,0.07,591.18,0.47,2281810.4,166.72,0.09,True,84.62,,,,2025-11-06,10.0,7.0,0,,ATL,ATH,False,False
06-11-2025 16:00,TUKAS,2.92,3.02,2.91,3.02,65183528.0,0.0,0.1,0.0,2400.0,0.1,24530592.3,165.72,0.0,True,62.52,,,,2025-11-06,2.95,2.37,0,,2.9,ATH,False,False
06-11-2025 15:00,KRDMD,27.7,28.14,27.66,28.04,10662153.0,0.1,0.34,0.01,3300.0,0.34,4727763.1,125.52,0.29,True,53.49,,,,2025-11-06,27.7,1.23,0,,ATL,28.18,False,False
06-11-2025 15:00,RUZYE,14.28,15.1,14.21,15.08,5472853.0,0.02,0.8,0.1,692.08,0.8,2055560.0,166.25,0.02,True,69.47,,,,2025-11-06,13.95,8.1,0,,13.91,ATH,False,False
06-11-2025 14:00,DOHOL,17.32,17.53,17.32,17.5,7718544.0,0.03,0.18,0.03,462.5,0.18,2167703.2,256.07,0.17,True,71.23,,,,2025-11-06,17.12,2.22,0,,ATL,ATH,False,False
06-11-2025 14:00,TATEN,21.72,23.74,21.71,23.45,5722800.0,0.29,1.72,0.24,622.51,1.72,2471424.8,131.56,0.17,True,79.29,,,,2025-11-06,22.1,6.11,0,,ATL,ATH,False,False
06-11-2025 14:00,HEDEF,77.95,82.0,77.6,81.2,1932191.0,0.8,3.25,0.28,1040.35,3.25,924562.7,108.98,0.25,True,61.22,,,,2025-11-06,76.65,5.94,0,,74.0,ATH,False,False
06-11-2025 13:00,SUNTK,42.12,43.62,42.0,43.5,470258.0,0.12,1.38,0.21,557.14,1.38,206499.3,127.73,0.09,True,67.61,,,,2025-11-06,41.1,5.84,0,,ATL,ATH,False,False
06-11-2025 13:00,CEOEM,26.9,28.88,26.86,28.36,1882178.0,0.52,1.46,0.12,1116.67,1.46,268387.2,601.29,0.36,True,70.14,,,,2025-11-06,27.04,4.88,0,,26.7,ATH,False,False
06-11-2025 11:00,GOZDE,22.68,23.2,22.68,23.14,706788.0,0.06,0.46,0.01,3733.33,0.46,373555.3,89.21,0.13,True,69.42,,,,2025-11-06,22.32,3.67,0,,22.0,ATH,False,False
06-11-2025 10:00,A1CAP,13.27,13.78,13.21,13.68,7797111.0,0.1,0.41,0.05,791.3,0.41,2051046.9,280.15,0.24,True,66.98,,,,2025-11-06,13.23,3.4,1,13.78,ATL,13.78,False,False
06-11-2025 10:00,NIBAS,24.0,25.36,23.9,25.1,1096878.0,0.26,1.1,0.09,1070.21,1.1,219064.2,400.71,0.24,True,60.54,,,,2025-11-06,23.96,4.76,2,23.9,23.9,ATH,False,False
06-11-2025 10:00,HDFGS,4.35,5.08,4.35,4.93,32367054.0,0.15,0.58,0.06,900.0,0.58,4665738.5,593.72,0.26,True,44.49,,,,2025-11-06,4.83,2.07,3,,4.35,ATH,False,False
05-11-2025 17:00,KRTEK,29.08,30.76,29.0,30.5,1335420.0,0.26,1.42,0.12,1103.39,1.42,538654.0,147.92,0.18,True,,,,,2025-11-05,30.02,1.6,0,,ATL,ATH,False,False
05-11-2025 17:00,BIENY,42.1,43.98,41.76,43.62,3733841.0,0.36,1.52,0.33,366.26,1.52,1059923.9,252.27,0.24,True,,,,,2025-11-05,40.1,8.78,0,,ATL,ATH,False,False
05-11-2025 16:00,KLSYN,5.88,6.07,5.88,6.03,2829814.0,0.04,0.15,0.02,614.29,0.15,485519.0,482.84,0.27,True,,,,,2025-11-05,5.78,4.33,0,,ATL,ATH,False,False
05-11-2025 16:00,KRSTL,12.1,12.4,12.09,12.32,1869167.0,0.08,0.22,0.06,272.88,0.22,687315.5,171.95,0.36,True,,,,,2025-11-05,11.85,3.97,0,,ATL,ATH,False,False
05-11-2025 16:00,AKSA,11.67,12.04,11.67,12.0,8601389.0,0.04,0.33,0.02,1220.0,0.33,2270826.4,278.78,0.12,True,,,,,2025-11-05,11.74,2.21,0,,ATL,ATH,False,False
05-11-2025 16:00,ALBRK,8.34,8.46,8.34,8.44,2597468.0,0.02,0.1,0.01,809.09,0.1,1142887.6,127.27,0.2,True,,,,,2025-11-05,8.35,1.08,0,,8.29,ATH,False,False
05-11-2025 16:00,BRLSM,14.97,15.25,14.96,15.2,397768.0,0.05,0.23,0.02,1337.5,0.23,212543.6,87.15,0.22,True,,,,,2025-11-05,15.1,0.66,1,15.25,14.86,15.25,False,False
05-11-2025 16:00,ENTRA,11.41,11.97,11.4,11.88,10439741.0,0.09,0.47,0.06,683.33,0.47,1792821.2,482.31,0.19,True,,,,,2025-11-05,11.45,3.76,0,,ATL,ATH,False,False
05-11-2025 16:00,ENDAE,16.55,16.86,16.55,16.86,642102.0,0.0,0.31,0.03,1092.31,0.31,252916.8,153.88,0.0,True,,,,,2025-11-05,16.55,1.87,0,,ATL,ATH,False,False
05-11-2025 16:00,TKFEN,81.65,82.7,81.65,82.6,734165.0,0.1,0.95,0.02,4650.0,0.95,311588.6,135.62,0.11,True,,,,,2025-11-05,81.35,1.54,1,82.7,ATL,82.7,False,False
05-11-2025 16:00,FZLGY,14.15,14.53,14.12,14.49,2688583.0,0.04,0.34,0.0,33900.0,0.34,1514248.8,77.55,0.12,True,,,,,2025-11-05,14.3,1.33,0,,14.08,ATH,False,False
05-11-2025 15:00,BLUME,55.3,56.65,55.2,56.45,339137.0,0.2,1.15,0.08,1433.33,1.15,174725.2,94.1,0.17,True,,,,,2025-11-05,55.75,1.26,1,56.65,ATL,56.65,False,False
05-11-2025 15:00,TKNSA,27.2,27.76,27.18,27.6,943081.0,0.16,0.4,0.07,440.54,0.4,397038.6,137.53,0.4,True,,,,,2025-11-05,27.18,1.55,0,,ATL,ATH,False,False
