Tarih,Hisse,open,high,low,close,volume,YuksekKapanis_Fark,AcilisKapanis_Fark,AcilisKapanisFark_Ort,AcilisKapanisFark_OrtalamayaGoreDegisim,AcilisKapanisFarkOrt_MaxSon10,HacimOrtalama,%Hacim_HacimOrtalama,Fark_Orani,Kosul,rsi,MACD_12_26_9,MACDh_12_26_9,MACDs_12_26_9,Tarih1,prev_close,%Deg,isPivot,pointpos,destek,direnc,Tsinyal_Banker_Dip,Tsinyal_Banker_DipKarar
11-11-2025 15:00,BAHKM,52.35,53.25,51.2,53.25,287146.0,0.0,0.9,0.06,1536.36,0.9,105128.6,173.14,0.0,True,47.24,-0.53,0.09,-0.63,2025-11-11,52.3,1.82,0,,53.2,56.7,True,True
11-11-2025 15:00,MHRGY,3.86,4.14,3.74,4.14,4918476.0,0.0,0.28,0.01,3400.0,0.28,2630073.0,87.01,0.0,True,62.72,-0.0,-0.01,0.0,2025-11-11,4.0,3.5,0,,3.8,4.21,False,False
11-11-2025 15:00,EDATA,5.52,5.58,5.42,5.58,2362575.0,0.0,0.06,0.0,1900.0,0.06,711440.0,232.08,0.0,True,45.1,-0.03,-0.0,-0.03,2025-11-11,5.63,-0.89,0,,5.55,5.73,True,True
11-11-2025 15:00,FENER,10.38,11.15,10.36,11.15,72379397.0,0.0,0.77,0.09,719.15,0.77,10860556.1,566.44,0.0,True,80.01,0.09,0.07,0.02,2025-11-11,10.14,9.96,0,,9.89,ATH,False,False
11-11-2025 14:00,SEYKM,6.23,6.48,6.21,6.48,258116.0,0.0,0.25,0.05,431.91,0.25,96049.0,168.73,0.0,True,62.28,-0.01,0.03,-0.04,2025-11-11,6.1,6.23,0,,6.14,6.49,False,False
11-11-2025 13:00,CGCAM,34.7,35.82,34.68,35.52,751397.0,0.3,0.82,0.02,4455.56,0.82,376003.9,99.84,0.37,True,51.93,-0.41,0.12,-0.54,2025-11-11,34.78,2.13,0,,34.14,36.8,True,False
11-11-2025 12:00,KZBGY,14.0,14.28,13.99,14.22,2236585.0,0.06,0.22,0.01,3042.86,0.22,1454041.8,53.82,0.27,True,35.24,-0.4,0.03,-0.43,2025-11-11,13.95,1.94,0,,13.8,16.2,False,False
11-11-2025 12:00,KLYPV,58.3,60.85,58.2,60.75,432308.0,0.1,2.45,0.15,1533.33,2.45,143530.6,201.2,0.04,True,62.87,-0.22,0.05,-0.27,2025-11-11,58.75,3.4,0,,59.15,61.4,True,True
11-11-2025 12:00,AHGAZ,27.98,29.0,27.84,28.92,1775938.0,0.08,0.94,0.11,724.56,0.94,697493.1,154.62,0.09,True,70.21,0.05,0.12,-0.08,2025-11-11,27.62,4.71,0,,27.26,29.3,False,False
11-11-2025 12:00,AKYHO,3.06,3.18,3.06,3.18,1019523.0,0.0,0.12,0.01,1233.33,0.12,332026.3,207.06,0.0,True,60.22,-0.01,0.0,-0.02,2025-11-11,3.1,2.58,0,,3.05,3.19,False,False
11-11-2025 11:00,MEGMT,37.48,38.98,37.2,38.76,3116542.0,0.22,1.28,0.03,3900.0,1.28,1365451.3,128.24,0.17,True,49.21,-0.9,-0.11,-0.79,2025-11-11,36.22,7.01,0,,36.12,44.04,False,False
11-11-2025 11:00,AEFES,14.37,14.56,14.36,14.53,18292285.0,0.03,0.16,0.02,742.11,0.16,7389422.0,147.55,0.19,True,56.06,-0.06,0.02,-0.08,2025-11-11,14.21,2.25,0,,14.28,14.59,True,True
11-11-2025 11:00,CRFSA,119.9,123.7,119.9,123.0,124801.0,0.7,3.1,0.13,2284.62,3.1,71378.6,74.84,0.23,True,52.76,-0.03,-0.48,0.45,2025-11-11,121.1,1.57,0,,119.2,133.3,False,False
11-11-2025 11:00,ICUGS,3.04,3.23,3.03,3.2,10983144.0,0.03,0.16,0.01,1677.78,0.16,3318330.5,230.98,0.19,True,48.71,-0.06,-0.0,-0.05,2025-11-11,3.11,2.89,0,,3.17,3.46,True,True
11-11-2025 11:00,IEYHO,48.44,50.35,48.44,50.25,15462156.0,0.1,1.81,0.09,1933.71,1.81,8113079.2,90.58,0.06,True,65.09,1.51,-0.27,1.78,2025-11-11,48.06,4.56,0,,39.16,ATH,False,False
11-11-2025 10:00,FRIGO,12.1,12.24,12.07,12.24,1765665.0,0.0,0.14,0.02,460.0,0.14,801266.6,120.36,0.0,True,64.78,0.07,-0.0,0.07,2025-11-11,12.12,0.99,0,,11.9,ATH,False,False
11-11-2025 10:00,BMSTL,81.55,82.9,81.55,82.65,249168.0,0.25,1.1,0.12,856.52,1.1,128697.4,93.61,0.23,True,59.09,0.53,-0.2,0.73,2025-11-11,82.0,0.79,0,,81.3,84.2,False,False
11-11-2025 10:00,BMSCH,20.0,20.94,19.83,20.7,868711.0,0.24,0.7,0.07,900.0,0.7,256622.2,238.52,0.34,True,49.23,-0.33,0.0,-0.33,2025-11-11,20.0,3.5,0,,19.4,23.24,True,True
11-11-2025 10:00,KRVGD,2.63,2.65,2.56,2.65,2360530.0,0.0,0.02,0.0,900.0,0.02,812927.0,190.37,0.0,True,60.16,-0.0,0.01,-0.01,2025-11-11,2.63,0.76,0,,2.58,2.69,False,False
11-11-2025 10:00,ECILC,82.4,88.0,82.3,86.65,4486734.0,1.35,4.25,0.45,844.44,4.25,1777958.6,152.35,0.32,True,63.26,-0.22,0.56,-0.79,2025-11-11,82.0,5.67,0,,74.0,91.3,False,False
11-11-2025 10:00,LRSHO,5.88,6.08,5.81,6.07,11001708.0,0.01,0.19,0.02,955.56,0.19,3025670.3,263.61,0.05,True,57.27,-0.04,0.01,-0.06,2025-11-11,5.87,3.41,0,,5.78,6.19,True,True
11-11-2025 10:00,MARBL,14.51,14.96,14.13,14.96,1186742.0,0.0,0.45,0.04,922.73,0.45,411955.0,188.08,0.0,True,68.73,0.13,0.05,0.09,2025-11-11,14.45,3.53,0,,13.93,ATH,False,False
11-11-2025 10:00,EGGUB,104.8,111.6,103.5,110.0,673043.0,1.6,5.2,0.67,676.12,5.2,168779.0,298.77,0.31,True,62.91,-0.5,0.63,-1.13,2025-11-11,104.1,5.67,0,,99.9,115.0,False,False
11-11-2025 10:00,KLRHO,131.5,134.8,129.4,134.8,407106.0,0.0,3.3,0.3,1000.0,3.3,178651.3,127.88,0.0,True,53.58,-0.44,-0.15,-0.29,2025-11-11,131.7,2.35,0,,120.2,142.0,False,False
11-11-2025 10:00,MANAS,10.37,10.73,9.85,10.73,35782211.0,0.0,0.36,0.04,900.0,0.36,3909534.6,815.26,0.0,True,98.49,0.54,0.05,0.49,2025-11-11,9.76,9.94,0,,9.76,ATH,False,False
11-11-2025 10:00,LIDFA,4.31,4.6,4.3,4.52,21009779.0,0.08,0.21,0.02,1300.0,0.21,3255589.8,545.34,0.38,True,76.7,0.04,0.02,0.02,2025-11-11,4.22,7.11,0,,4.11,ATH,False,False
11-11-2025 10:00,GIPTA,67.0,69.9,66.55,69.3,1571675.0,0.6,2.3,0.14,1603.7,2.3,746127.5,110.64,0.26,True,34.22,-4.17,0.41,-4.58,2025-11-11,66.85,3.66,0,,66.85,92.4,True,True
11-11-2025 10:00,AGHOL,26.34,27.0,26.16,26.92,2212196.0,0.08,0.58,0.01,9566.67,0.58,674342.0,228.05,0.14,True,62.06,0.02,-0.03,0.05,2025-11-11,26.34,2.2,0,,26.16,27.12,False,False
11-11-2025 10:00,YAYLA,32.06,34.2,32.06,33.72,1214426.0,0.48,1.66,0.07,2415.15,1.66,302015.6,302.11,0.29,True,70.59,0.44,0.08,0.36,2025-11-11,32.34,4.27,0,,30.66,ATH,False,False
11-11-2025 10:00,TNZTP,23.04,23.96,22.82,23.82,1457543.0,0.14,0.78,0.1,712.5,0.78,324764.3,348.8,0.18,True,76.61,0.19,0.08,0.1,2025-11-11,22.96,3.75,0,,22.18,ATH,False,False
11-11-2025 10:00,GLRYH,4.93,5.14,4.84,5.09,21343849.0,0.05,0.16,0.03,416.13,0.16,3711124.8,475.13,0.31,True,74.69,0.04,0.04,-0.0,2025-11-11,4.8,6.04,0,,4.59,5.14,False,False
11-11-2025 10:00,ALTIN,72.15,72.82,71.98,72.69,10230018.0,0.13,0.54,0.09,480.65,0.54,3462486.5,195.45,0.24,True,83.33,0.83,0.18,0.65,2025-11-11,71.4,1.81,0,,67.25,ATH,False,False
10-11-2025 17:00,SOKM,47.92,48.46,47.88,48.36,1613232.0,0.1,0.44,0.07,547.06,0.44,677325.3,138.18,0.23,True,60.69,0.33,-0.04,0.37,2025-11-10,47.64,1.51,0,,47.26,48.56,False,False
10-11-2025 17:00,DOFER,60.8,62.05,60.4,62.05,198975.0,0.0,1.25,0.03,4066.67,1.25,109122.0,82.34,0.0,True,53.08,-0.04,-0.08,0.04,2025-11-10,62.0,0.08,0,,59.9,63.45,False,False
10-11-2025 17:00,KONKA,15.15,15.54,15.02,15.43,944582.0,0.11,0.28,0.02,1650.0,0.28,314540.0,200.31,0.39,True,55.26,-0.1,0.03,-0.13,2025-11-10,15.08,2.32,1,15.54,14.8,15.54,True,False
10-11-2025 17:00,KLKIM,31.96,32.36,31.88,32.36,389702.0,0.0,0.4,0.01,3900.0,0.4,174233.1,123.67,0.0,True,41.79,-0.36,0.02,-0.38,2025-11-10,32.3,0.19,0,,ATL,32.84,True,True
10-11-2025 17:00,YIGIT,25.86,26.44,25.8,26.38,506015.0,0.06,0.52,0.01,4233.33,0.52,173325.5,191.94,0.12,True,53.01,-0.16,0.01,-0.17,2025-11-10,26.18,0.76,0,,26.3,27.06,True,True
10-11-2025 16:00,AVHOL,43.34,44.62,43.34,44.28,371163.0,0.34,0.94,0.13,646.03,0.94,157386.0,135.83,0.36,True,59.02,-0.23,0.14,-0.37,2025-11-10,42.88,3.26,0,,42.6,45.96,True,False
10-11-2025 16:00,PRKAB,38.6,42.1,38.6,41.12,1193991.0,0.98,2.52,0.17,1382.35,2.52,216515.4,451.46,0.39,True,61.85,-0.37,0.13,-0.49,2025-11-10,38.8,5.98,1,42.1,39.6,42.1,True,True
10-11-2025 15:00,ANELE,15.78,15.99,15.72,15.95,143579.0,0.04,0.17,0.01,1445.45,0.17,68308.9,110.19,0.24,True,51.27,-0.05,-0.0,-0.04,2025-11-10,15.95,0.0,0,,15.74,16.19,False,False
10-11-2025 15:00,BULGS,42.96,44.9,42.82,44.9,6356050.0,0.0,1.94,0.33,480.84,1.94,2412196.9,163.5,0.0,True,66.3,-0.21,0.4,-0.6,2025-11-10,40.82,10.0,0,,40.18,52.15,False,False
10-11-2025 15:00,GWIND,24.64,25.1,24.58,25.08,716022.0,0.02,0.44,0.03,1366.67,0.44,358511.7,99.72,0.05,True,56.96,-0.12,0.04,-0.16,2025-11-10,24.58,2.03,0,,24.36,25.18,True,False
10-11-2025 14:00,KCAER,12.04,12.35,12.0,12.34,2995748.0,0.01,0.3,0.01,3233.33,0.3,1525384.8,96.39,0.03,True,48.56,-0.2,0.04,-0.24,2025-11-10,12.08,2.15,0,,11.85,12.95,True,False
10-11-2025 14:00,LYDHO,186.0,198.3,185.0,198.0,524896.0,0.3,12.0,2.04,488.24,12.0,310676.5,68.95,0.03,True,64.66,-0.65,1.53,-2.18,2025-11-10,182.0,8.79,0,,177.5,226.1,False,False
10-11-2025 14:00,SEGYO,6.06,6.49,6.06,6.42,9199949.0,0.07,0.36,0.04,823.08,0.36,2705816.4,240.01,0.19,True,75.78,0.12,0.02,0.1,2025-11-10,5.94,8.08,0,,5.86,ATH,False,False
10-11-2025 14:00,MIATK,37.56,39.68,37.54,39.48,14286443.0,0.2,1.92,0.09,2033.33,1.92,4336773.5,229.43,0.1,True,55.37,-0.31,-0.17,-0.14,2025-11-10,39.28,0.51,0,,37.2,40.78,False,False
10-11-2025 14:00,FORMT,4.02,4.24,4.02,4.22,38450231.0,0.02,0.2,0.02,900.0,0.2,9812067.1,291.87,0.1,True,80.94,0.02,0.02,-0.01,2025-11-10,3.94,7.11,0,,3.91,ATH,False,False
10-11-2025 13:00,ENERY,9.35,9.59,9.34,9.58,2722952.0,0.01,0.23,0.01,1433.33,0.23,1591944.8,71.05,0.04,True,49.87,-0.1,0.01,-0.11,2025-11-10,9.41,1.81,0,,9.33,10.45,True,True
10-11-2025 13:00,LINK,323.25,333.0,320.75,331.5,263884.0,1.5,8.25,1.45,468.97,8.25,157236.5,67.83,0.18,True,71.0,1.28,1.54,-0.26,2025-11-10,310.5,6.76,0,,308.5,350.0,False,False
10-11-2025 13:00,BRSAN,535.0,555.0,534.5,551.0,891611.0,4.0,16.0,1.8,788.89,16.0,483383.4,84.45,0.25,True,74.87,13.06,3.47,9.6,2025-11-10,512.0,7.62,1,555.0,483.0,555.0,False,False
10-11-2025 13:00,BORSK,23.48,24.38,23.44,24.32,1240383.0,0.06,0.84,0.15,460.0,0.84,407706.7,204.23,0.07,True,58.98,-0.16,0.01,-0.18,2025-11-10,23.52,3.4,0,,22.62,24.74,True,True
10-11-2025 12:00,OBAMS,42.48,44.2,42.4,43.94,1406777.0,0.26,1.46,0.14,928.17,1.46,433205.1,224.74,0.18,True,63.3,-0.18,0.08,-0.26,2025-11-10,42.64,3.05,0,,40.9,45.46,False,False
10-11-2025 12:00,TEKTU,12.48,12.99,12.48,12.98,3889327.0,0.01,0.5,0.04,1062.79,0.5,2017140.1,92.81,0.02,True,43.93,-0.31,0.08,-0.39,2025-11-10,13.86,-6.35,0,,12.48,13.86,False,False
10-11-2025 12:00,A1YEN,32.5,33.14,32.36,33.12,417786.0,0.02,0.62,0.09,604.55,0.62,272710.5,53.2,0.03,True,65.37,0.19,0.14,0.05,2025-11-10,31.62,4.74,0,,29.78,33.62,False,False
10-11-2025 12:00,PLTUR,26.4,26.78,26.38,26.7,490407.0,0.08,0.3,0.05,500.0,0.3,229236.0,113.93,0.27,True,54.93,-0.12,0.0,-0.12,2025-11-10,25.98,2.77,0,,25.62,27.6,False,False
10-11-2025 11:00,METRO,5.7,5.81,5.68,5.79,1863783.0,0.02,0.09,0.01,1400.0,0.09,1223201.5,52.37,0.22,True,44.44,-0.07,-0.01,-0.07,2025-11-10,5.69,1.76,0,,5.65,6.31,False,False
10-11-2025 11:00,ADESE,2.98,3.14,2.97,3.14,46613867.0,0.0,0.16,0.03,451.72,0.16,25684846.8,81.48,0.0,True,41.01,-0.16,-0.0,-0.15,2025-11-10,3.1,1.29,0,,3.1,3.25,True,True
10-11-2025 11:00,MERIT,23.08,23.56,22.94,23.52,1068815.0,0.04,0.44,0.06,658.62,0.44,406043.9,163.23,0.09,True,73.7,0.25,0.07,0.18,2025-11-10,22.78,3.25,0,,22.06,ATH,False,False
10-11-2025 11:00,TURSG,13.24,13.91,13.24,13.84,17879204.0,0.07,0.6,0.04,1438.46,0.6,9336397.6,91.5,0.12,True,69.95,0.13,0.07,0.06,2025-11-10,13.2,4.85,0,,12.55,14.04,False,False
10-11-2025 10:00,KTLEV,13.88,16.19,13.85,16.19,83903616.0,0.0,2.31,0.28,719.15,2.31,16461085.5,409.71,0.0,True,69.94,0.17,0.07,0.09,2025-11-10,14.72,9.99,1,16.19,13.82,ATH,False,False
10-11-2025 10:00,VAKFN,2.07,2.12,2.05,2.12,61461839.0,0.0,0.05,0.0,1150.0,0.05,20193800.4,204.36,0.0,True,67.15,0.01,0.01,0.0,2025-11-10,2.04,3.92,1,2.12,1.99,ATH,False,False
10-11-2025 10:00,HOROZ,60.15,62.8,60.1,62.65,633445.0,0.15,2.5,0.08,3025.0,2.5,166216.3,281.1,0.06,True,53.92,-0.3,-0.1,-0.19,2025-11-10,61.45,1.95,2,60.1,60.1,63.5,False,False
10-11-2025 10:00,SAYAS,52.2,54.0,51.55,53.65,337440.0,0.35,1.45,0.24,491.84,1.45,166690.5,102.44,0.24,True,60.04,0.06,0.19,-0.13,2025-11-10,52.55,2.09,0,,50.8,54.5,False,False
10-11-2025 10:00,YEOTK,36.82,39.0,36.8,38.4,4203694.0,0.6,1.58,0.07,2157.14,1.58,990189.4,324.53,0.38,True,64.22,0.03,-0.09,0.11,2025-11-10,36.76,4.46,1,39.0,36.6,39.0,False,False
10-11-2025 10:00,KFEIN,9.51,10.05,9.51,10.0,2797530.0,0.05,0.49,0.03,1431.25,0.49,863014.8,224.16,0.1,True,62.73,-0.05,0.01,-0.06,2025-11-10,9.51,5.15,2,9.51,9.51,10.29,True,True
10-11-2025 10:00,MGROS,501.0,512.5,501.0,511.0,1305616.0,1.5,10.0,1.05,852.38,10.0,622241.5,109.82,0.15,True,82.24,10.96,1.19,9.77,2025-11-10,499.0,2.4,1,512.5,452.5,512.5,False,False
10-11-2025 10:00,CIMSA,44.88,45.7,44.5,45.54,2329326.0,0.16,0.66,0.0,16400.0,0.66,1100947.1,111.57,0.24,True,59.88,-0.04,0.02,-0.06,2025-11-10,44.66,1.97,0,,44.4,45.74,False,False
10-11-2025 10:00,SURGY,49.98,52.2,49.8,52.0,2280016.0,0.2,2.02,0.16,1194.87,2.02,593190.4,284.36,0.1,True,69.1,0.4,0.16,0.25,2025-11-10,49.98,4.04,0,,49.2,ATH,False,False
10-11-2025 10:00,TERA,258.25,274.25,253.0,273.75,4052211.0,0.5,15.5,0.65,2284.62,15.5,1259724.8,221.67,0.03,True,74.06,9.03,-0.49,9.51,2025-11-10,256.0,6.93,2,253.0,253.0,ATH,False,False
10-11-2025 10:00,TTKOM,56.1,57.15,55.3,57.0,13992723.0,0.15,0.9,0.14,520.69,0.9,5002676.0,179.7,0.17,True,68.83,0.61,-0.0,0.61,2025-11-10,55.8,2.15,0,,54.5,ATH,False,False
10-11-2025 10:00,PEKGY,12.51,12.98,12.33,12.87,101428775.0,0.11,0.36,0.04,778.05,0.36,47980680.7,111.4,0.31,True,75.46,0.19,0.01,0.17,2025-11-10,12.45,3.37,1,12.98,11.5,12.98,False,False
10-11-2025 10:00,HATEK,16.25,16.91,15.92,16.82,2033843.0,0.09,0.57,0.08,640.26,0.57,501118.3,305.86,0.16,True,68.88,0.11,0.07,0.04,2025-11-10,16.24,3.57,0,,15.05,16.87,False,False
10-11-2025 10:00,EKOS,27.68,28.92,27.68,28.64,2469220.0,0.28,0.96,0.03,3328.57,0.96,657462.7,275.57,0.29,True,61.56,-0.02,-0.0,-0.02,2025-11-10,27.6,3.77,1,28.92,27.28,28.92,False,False
10-11-2025 10:00,DOGUB,59.4,63.4,58.9,63.4,548401.0,0.0,4.0,0.43,830.23,4.0,81000.2,577.04,0.0,True,79.54,2.24,0.74,1.5,2025-11-10,57.65,9.97,0,,43.0,65.35,False,False
10-11-2025 10:00,OYAKC,22.08,22.6,21.84,22.54,11632934.0,0.06,0.46,0.03,1433.33,0.46,4261966.4,172.95,0.13,True,72.67,0.11,0.02,0.09,2025-11-10,21.98,2.55,0,,21.78,ATH,False,False
10-11-2025 10:00,FROTO,97.35,98.85,97.35,98.55,4461830.0,0.3,1.2,0.19,515.38,1.2,1828936.0,143.96,0.25,True,57.7,-0.38,0.2,-0.58,2025-11-10,97.1,1.49,0,,94.9,101.4,False,False
10-11-2025 10:00,TUPRS,198.8,201.6,197.2,200.8,5830378.0,0.8,2.0,0.17,1076.47,2.0,1768757.8,229.63,0.4,True,67.67,0.86,0.04,0.82,2025-11-10,198.0,1.41,0,,196.5,201.0,False,False
07-11-2025 17:00,EGSER,3.39,3.41,3.37,3.41,1011322.0,0.0,0.02,0.0,1900.0,0.02,483670.2,109.09,0.0,True,46.45,-0.01,-0.0,-0.0,2025-11-07,3.42,-0.29,2,3.37,3.37,3.45,False,False
07-11-2025 17:00,OZYSR,38.06,39.18,37.44,39.18,357259.0,0.0,1.12,0.19,495.74,1.12,155125.8,130.3,0.0,True,63.0,0.4,-0.01,0.41,2025-11-07,38.3,2.3,0,,36.2,ATH,False,False
07-11-2025 16:00,DMSAS,9.61,9.74,9.59,9.71,862725.0,0.03,0.1,0.03,284.62,0.1,349872.5,146.58,0.3,True,72.16,0.05,0.02,0.02,2025-11-07,9.4,3.3,0,,9.39,ATH,False,False
07-11-2025 15:00,EGEPO,7.57,7.76,7.57,7.71,825730.0,0.05,0.14,0.0,13900.0,0.14,386973.7,113.38,0.36,True,49.56,-0.05,-0.0,-0.05,2025-11-07,7.69,0.26,1,7.76,7.5,7.76,True,True
07-11-2025 15:00,FLAP,9.69,10.21,9.65,10.15,1001947.0,0.06,0.46,0.03,1252.94,0.46,170884.5,486.33,0.13,True,68.44,-0.03,0.04,-0.07,2025-11-07,9.77,3.89,1,10.21,9.59,10.21,False,False
07-11-2025 15:00,IHGZT,2.03,2.12,2.03,2.1,38051287.0,0.02,0.07,0.01,600.0,0.07,18984548.5,100.43,0.29,True,66.42,0.04,0.0,0.04,2025-11-07,2.01,4.48,0,,2.01,ATH,False,False
07-11-2025 15:00,IHLGM,2.94,3.03,2.93,3.01,27734774.0,0.02,0.07,0.01,900.0,0.07,8974370.7,209.04,0.29,True,58.2,-0.0,0.0,-0.0,2025-11-07,2.91,3.44,0,,2.91,3.09,False,False
07-11-2025 15:00,POLHO,18.39,18.85,18.38,18.76,1441272.0,0.09,0.37,0.0,5.20728706914714e+16,0.37,491128.1,193.46,0.24,True,52.44,-0.04,-0.04,0.0,2025-11-07,18.71,0.27,0,,18.5,19.2,False,False
07-11-2025 14:00,BNTAS,6.84,6.9,6.81,6.89,522192.0,0.01,0.05,0.0,4900.0,0.05,326670.6,59.85,0.2,True,50.51,-0.03,0.01,-0.04,2025-11-07,6.83,0.88,0,,6.8,6.95,True,False
07-11-2025 14:00,MTRKS,26.84,27.98,26.68,27.92,399720.0,0.06,1.08,0.06,1587.5,1.08,130130.5,207.17,0.06,True,59.9,-0.29,0.09,-0.38,2025-11-07,26.48,5.44,0,,26.26,29.16,True,True
07-11-2025 14:00,LIDER,66.5,68.55,66.3,68.2,111102.0,0.35,1.7,0.17,930.3,1.7,41895.7,165.19,0.21,True,62.54,0.2,0.05,0.15,2025-11-07,66.05,3.26,0,,65.5,68.8,False,False
07-11-2025 13:00,ESCOM,3.43,3.61,3.41,3.58,22298414.0,0.03,0.15,0.01,1400.0,0.15,5750216.4,287.78,0.2,True,63.5,0.02,-0.0,0.02,2025-11-07,3.47,3.17,2,3.41,3.41,3.62,False,False
07-11-2025 13:00,DENGE,3.46,3.68,3.45,3.67,44901722.0,0.01,0.21,0.03,677.78,0.21,8496673.5,428.46,0.05,True,70.69,0.01,0.03,-0.01,2025-11-07,3.35,9.55,1,3.68,3.32,3.68,False,False
07-11-2025 13:00,DITAS,30.9,32.26,30.86,32.26,2232338.0,0.0,1.36,0.26,431.25,1.36,475062.0,369.9,0.0,True,78.38,0.61,0.17,0.44,2025-11-07,29.34,9.95,0,,29.24,ATH,False,False
07-11-2025 13:00,IMASM,5.57,5.77,5.52,5.77,29976392.0,0.0,0.2,0.04,426.32,0.2,14251201.4,110.34,0.0,True,67.79,0.02,0.04,-0.03,2025-11-07,5.25,9.9,1,5.77,5.18,6.35,True,False
07-11-2025 12:00,LILAK,29.98,30.64,29.98,30.46,672193.0,0.18,0.48,0.02,1900.0,0.48,369266.4,82.03,0.37,True,51.93,-0.01,-0.03,0.02,2025-11-07,30.46,0.0,0,,29.96,31.06,False,False
07-11-2025 12:00,GMTAS,42.52,43.68,42.22,43.36,527537.0,0.32,0.84,0.03,2525.0,0.84,125063.6,321.81,0.38,True,51.59,0.02,-0.08,0.09,2025-11-07,43.38,-0.05,2,42.22,42.22,44.2,False,False
07-11-2025 12:00,BESLR,14.18,14.69,14.16,14.64,1412059.0,0.05,0.46,0.03,1252.94,0.46,572210.1,146.77,0.11,True,58.55,0.02,0.03,-0.01,2025-11-07,14.39,1.74,2,14.16,14.16,14.99,False,False
07-11-2025 12:00,FORTE,76.85,80.0,76.5,79.2,327177.0,0.8,2.35,0.09,2664.71,2.35,122876.7,166.26,0.34,True,62.14,0.73,-0.13,0.86,2025-11-07,78.1,1.41,2,76.5,76.5,ATH,False,False
07-11-2025 11:00,IPEKE,74.0,74.95,73.8,74.75,910744.0,0.2,0.75,0.09,733.33,0.75,456927.6,99.32,0.27,True,57.55,-0.24,0.12,-0.36,2025-11-07,72.65,2.89,0,,72.65,75.65,True,False
07-11-2025 11:00,KOZAL,27.6,28.62,27.56,28.36,42204140.0,0.26,0.76,0.11,603.7,0.76,12153783.3,247.25,0.34,True,76.67,0.22,0.09,0.13,2025-11-07,27.32,3.81,0,,26.5,ATH,False,False
07-11-2025 11:00,DMLKT,5.96,5.97,5.96,5.97,2317933.0,0.0,0.01,0.0,900.0,0.01,1127417.9,105.6,0.0,True,49.06,-0.0,0.0,-0.01,2025-11-07,5.96,0.17,1,5.97,5.96,5.98,True,False
07-11-2025 11:00,IHAAS,44.26,44.96,44.2,44.96,240637.0,0.0,0.7,0.19,272.34,0.7,98876.8,143.37,0.0,True,75.6,0.65,0.01,0.64,2025-11-07,43.78,2.7,0,,42.64,ATH,False,False
07-11-2025 10:00,CANTE,2.7,2.87,2.69,2.84,592780694.0,0.03,0.14,0.03,438.46,0.14,166377232.1,256.29,0.21,True,83.62,0.06,0.02,0.04,2025-11-07,2.68,5.97,1,2.87,2.55,2.87,False,False
07-11-2025 10:00,KOZAA,87.6,89.7,87.5,89.25,1611749.0,0.45,1.65,0.04,3566.67,1.65,558822.8,188.42,0.27,True,57.83,-0.13,0.11,-0.24,2025-11-07,87.35,2.18,0,,87.25,89.8,False,False
07-11-2025 10:00,KLSER,31.76,32.9,31.52,32.8,673695.0,0.1,1.04,0.1,961.22,1.04,129678.6,419.51,0.1,True,66.24,0.08,0.04,0.04,2025-11-07,31.76,3.27,2,31.52,31.52,33.34,False,False
07-11-2025 10:00,CEMZY,44.2,47.9,44.12,47.44,2019883.0,0.46,3.24,0.08,4163.16,3.24,776719.4,160.05,0.14,True,51.7,-0.99,0.2,-1.19,2025-11-07,44.06,7.67,0,,40.9,48.8,True,False
07-11-2025 10:00,PNSUT,12.12,12.3,12.08,12.26,398048.0,0.04,0.14,0.02,636.84,0.14,154188.6,158.16,0.29,True,53.29,-0.04,0.02,-0.06,2025-11-07,12.14,0.99,0,,11.83,12.33,False,False
07-11-2025 10:00,ORCAY,3.86,4.06,3.85,4.05,3290454.0,0.01,0.19,0.01,1166.67,0.19,848387.0,287.85,0.05,True,42.06,-0.07,-0.05,-0.02,2025-11-07,4.12,-1.7,0,,3.84,4.48,False,False
07-11-2025 10:00,EMKEL,71.4,75.2,69.75,74.35,7298743.0,0.85,2.95,0.08,3587.5,2.95,2481730.3,194.1,0.29,True,74.26,3.29,-0.06,3.35,2025-11-07,71.3,4.28,1,75.2,59.45,75.2,False,False
07-11-2025 10:00,SELVA,2.08,2.22,2.05,2.18,11422148.0,0.04,0.1,0.01,1011.11,0.1,3106508.9,267.68,0.4,True,50.43,-0.0,-0.01,0.0,2025-11-07,2.14,1.87,2,2.05,2.05,2.27,False,False
07-11-2025 10:00,TRCAS,40.88,42.34,40.52,42.32,1190763.0,0.02,1.44,0.14,900.0,1.44,357509.7,233.07,0.01,True,77.32,0.64,0.09,0.54,2025-11-07,40.78,3.78,0,,39.06,ATH,False,False
07-11-2025 10:00,GLCVY,72.65,77.8,72.3,77.2,1018670.0,0.6,4.55,0.46,889.13,4.55,139609.7,629.66,0.13,True,76.76,0.54,0.29,0.25,2025-11-07,72.5,6.48,1,77.8,71.15,77.8,False,False
07-11-2025 10:00,IHLAS,3.39,3.52,3.37,3.51,56223586.0,0.01,0.12,0.01,2300.0,0.12,16995918.2,230.81,0.08,True,63.43,0.02,-0.01,0.02,2025-11-07,3.36,4.46,0,,3.34,3.62,False,False
06-11-2025 17:00,TCKRC,49.56,50.5,49.44,50.3,175960.0,0.2,0.74,0.07,927.78,0.74,108747.4,61.81,0.27,True,61.53,-0.01,0.07,-0.07,2025-11-06,49.44,1.74,0,,48.4,52.8,False,False
06-11-2025 17:00,INDES,8.58,8.7,8.58,8.68,1326631.0,0.02,0.1,0.02,455.56,0.1,606009.7,118.91,0.2,True,66.39,0.04,0.02,0.02,2025-11-06,8.46,2.6,0,,8.36,8.87,False,False
06-11-2025 17:00,TATGD,14.31,14.6,14.29,14.59,642691.0,0.01,0.28,0.03,865.52,0.28,280555.6,129.08,0.04,True,62.87,0.03,-0.01,0.04,2025-11-06,14.41,1.25,1,14.6,14.11,14.6,False,False
06-11-2025 17:00,TSPOR,1.38,1.44,1.36,1.43,317736568.0,0.01,0.05,0.0,1150.0,0.05,94507941.8,236.2,0.2,True,64.23,0.02,-0.0,0.02,2025-11-06,1.38,3.62,0,,1.29,ATH,False,False
06-11-2025 17:00,IZMDC,6.56,6.58,6.55,6.58,677903.0,0.0,0.02,0.0,900.0,0.02,310203.9,118.53,0.0,True,47.94,-0.01,-0.0,-0.01,2025-11-06,6.55,0.46,0,,6.53,6.93,False,False
06-11-2025 17:00,SMRVA,378.5,407.0,374.5,407.0,439789.0,0.0,28.5,3.75,660.0,28.5,181567.6,142.22,0.0,True,81.58,9.73,1.83,7.9,2025-11-06,370.0,10.0,1,407.0,301.75,ATH,False,False
06-11-2025 17:00,AKENR,11.15,11.33,11.13,11.33,1922501.0,0.0,0.18,0.01,2900.0,0.18,1156478.8,66.24,0.0,True,54.85,0.03,-0.06,0.08,2025-11-06,11.25,0.71,0,,11.11,12.24,False,False
06-11-2025 17:00,KATMR,3.63,3.94,3.55,3.94,202228040.0,0.0,0.31,0.03,839.39,0.31,49516699.6,308.4,0.0,True,71.65,0.1,-0.0,0.11,2025-11-06,3.59,9.75,0,,3.54,ATH,False,False
06-11-2025 17:00,CEMAS,5.52,5.73,5.5,5.69,14999743.0,0.04,0.17,0.02,794.74,0.17,5739759.0,161.33,0.24,True,70.26,0.0,0.02,-0.02,2025-11-06,5.48,3.83,1,5.73,5.45,5.73,False,False
06-11-2025 17:00,DSTKF,712.5,726.0,709.5,724.0,913409.0,2.0,11.5,2.2,422.73,11.5,217839.7,319.3,0.17,True,82.26,19.17,2.58,16.58,2025-11-06,698.0,3.72,0,,641.5,ATH,False,False
06-11-2025 16:00,TDGYO,29.82,31.9,29.74,31.7,2071680.0,0.2,1.88,0.25,652.0,1.88,339923.5,509.45,0.11,True,76.3,0.71,0.13,0.58,2025-11-06,29.0,9.31,0,,27.1,ATH,False,False
06-11-2025 16:00,HALKB,27.14,27.52,27.02,27.42,8936152.0,0.1,0.28,0.06,366.67,0.28,3651591.1,144.72,0.36,True,69.14,0.1,0.07,0.03,2025-11-06,26.76,2.47,0,,26.46,27.52,False,False
06-11-2025 16:00,KAREL,10.23,10.74,10.21,10.7,6086096.0,0.04,0.47,0.07,591.18,0.47,2281810.4,166.72,0.09,True,74.95,0.03,0.07,-0.04,2025-11-06,10.0,7.0,0,,9.87,10.82,False,False
06-11-2025 16:00,TUKAS,2.92,3.02,2.91,3.02,65183528.0,0.0,0.1,0.0,2400.0,0.1,24530592.3,165.72,0.0,True,63.37,0.0,-0.0,0.01,2025-11-06,2.95,2.37,0,,2.9,3.06,False,False
06-11-2025 16:00,GENTS,10.19,11.12,10.18,11.11,8996205.0,0.01,0.92,0.11,767.92,0.92,1936462.2,364.57,0.01,True,84.45,0.16,0.05,0.11,2025-11-06,10.12,9.78,0,,10.01,ATH,False,False
06-11-2025 16:00,SKTAS,5.27,5.65,5.23,5.65,8751743.0,0.0,0.38,0.05,616.98,0.38,3162941.9,176.7,0.0,True,66.75,0.01,0.04,-0.02,2025-11-06,5.14,9.92,0,,5.01,6.08,False,False
06-11-2025 15:00,YKBNK,34.04,34.46,34.02,34.38,31097119.0,0.08,0.34,0.02,1788.89,0.34,15368945.7,102.34,0.24,True,63.65,0.19,0.02,0.18,2025-11-06,33.98,1.18,0,,33.12,34.4,False,False
06-11-2025 15:00,XBANK,15207.56,15343.16,15200.8,15329.78,166011943.0,13.38,122.22,24.88,391.3,122.22,102106233.2,62.59,0.11,True,68.53,80.34,14.18,66.17,2025-11-06,15097.37,1.54,0,,14857.57,15354.4,False,False
06-11-2025 15:00,AKBNK,62.05,62.6,62.0,62.55,20113617.0,0.05,0.5,0.09,455.56,0.5,11454570.9,75.59,0.1,True,68.92,0.33,0.08,0.25,2025-11-06,61.2,2.21,0,,60.65,63.1,False,False
06-11-2025 15:00,BOSSA,7.17,7.27,7.17,7.25,869038.0,0.02,0.08,0.01,1042.86,0.08,405297.5,114.42,0.25,True,53.03,-0.04,0.02,-0.05,2025-11-06,7.14,1.54,0,,7.12,7.26,True,False
06-11-2025 15:00,KRDMD,27.7,28.14,27.66,28.04,10662153.0,0.1,0.34,0.01,3300.0,0.34,4727763.1,125.52,0.29,True,53.98,-0.09,0.0,-0.09,2025-11-06,27.7,1.23,0,,27.34,28.18,False,False
06-11-2025 15:00,INVEO,10.73,10.93,10.7,10.91,2154622.0,0.02,0.18,0.01,1284.62,0.18,1161930.0,85.43,0.11,True,58.32,-0.04,0.03,-0.07,2025-11-06,10.6,2.92,1,10.93,10.57,10.93,True,True
06-11-2025 15:00,GARAN,136.0,137.3,136.0,137.0,8035562.0,0.3,1.0,0.14,614.29,1.0,3470360.6,131.55,0.3,True,64.29,0.56,0.12,0.44,2025-11-06,135.0,1.48,0,,132.3,138.9,False,False
06-11-2025 15:00,ISCTR,13.15,13.32,13.14,13.28,91442773.0,0.04,0.13,0.02,465.22,0.13,55495223.3,64.78,0.31,True,68.14,0.09,0.01,0.08,2025-11-06,13.1,1.37,0,,12.79,ATH,False,False
06-11-2025 15:00,RUZYE,14.28,15.1,14.21,15.08,5472853.0,0.02,0.8,0.1,692.08,0.8,2055560.0,166.25,0.02,True,64.49,-0.08,0.09,-0.17,2025-11-06,13.95,8.1,0,,13.91,16.9,True,False
06-11-2025 14:00,ECZYT,324.75,335.5,324.25,332.75,279304.0,2.75,8.0,0.9,788.89,8.0,153345.1,82.14,0.34,True,65.18,5.84,-1.21,7.05,2025-11-06,329.0,1.14,1,335.5,259.75,335.5,False,False
06-11-2025 14:00,ENKAI,76.7,77.55,76.65,77.35,2334543.0,0.2,0.65,0.07,900.0,0.65,1097076.6,112.8,0.31,True,65.26,0.07,0.14,-0.08,2025-11-06,75.7,2.18,0,,75.3,78.6,False,False
06-11-2025 14:00,ARSAN,3.11,3.23,3.11,3.2,4096408.0,0.03,0.09,0.01,1400.0,0.09,1449591.3,182.59,0.33,True,65.45,0.02,-0.0,0.02,2025-11-06,3.11,2.89,0,,3.08,3.24,False,False
06-11-2025 14:00,TATEN,86.9,94.95,86.85,93.8,1430700.0,1.15,6.9,0.96,622.51,6.9,617856.2,131.56,0.17,True,77.37,2.14,0.47,1.67,2025-11-06,88.4,6.11,0,,76.65,ATH,False,False
06-11-2025 14:00,DOHOL,17.32,17.53,17.32,17.5,7718544.0,0.03,0.18,0.03,462.5,0.18,2167703.2,256.07,0.17,True,65.59,0.04,0.03,0.01,2025-11-06,17.12,2.22,0,,16.95,17.62,False,False
06-11-2025 14:00,HEDEF,77.95,82.0,77.6,81.2,1932191.0,0.8,3.25,0.28,1040.35,3.25,924562.7,108.98,0.25,True,59.1,-0.91,0.49,-1.4,2025-11-06,76.65,5.94,0,,74.0,88.5,True,False
06-11-2025 14:00,GOODY,16.21,16.46,16.18,16.4,697297.0,0.06,0.19,0.03,533.33,0.19,165559.0,321.18,0.32,True,63.69,0.0,0.02,-0.02,2025-11-06,16.18,1.36,0,,15.99,16.61,False,False
06-11-2025 13:00,CEOEM,26.9,28.88,26.86,28.36,1882178.0,0.52,1.46,0.12,1116.67,1.46,268387.2,601.29,0.36,True,66.47,-0.01,0.03,-0.04,2025-11-06,27.04,4.88,0,,26.7,29.24,False,False
06-11-2025 13:00,SAHOL,81.2,82.2,81.15,82.1,6197762.0,0.1,0.9,0.11,682.61,0.9,3744873.9,65.5,0.11,True,61.9,-0.02,0.14,-0.16,2025-11-06,80.2,2.37,0,,79.85,83.6,False,False
06-11-2025 13:00,KCHOL,171.9,174.4,171.9,174.0,4607776.0,0.4,2.1,0.15,1300.0,2.1,2813309.3,63.78,0.19,True,61.24,0.21,0.18,0.04,2025-11-06,171.0,1.75,0,,169.9,176.6,False,False
06-11-2025 13:00,ULKER,112.8,114.6,112.7,114.1,1290953.0,0.5,1.3,0.31,319.35,1.3,715546.4,80.41,0.38,True,78.76,1.1,0.35,0.75,2025-11-06,110.5,3.26,0,,107.5,ATH,False,False
06-11-2025 13:00,SUNTK,42.12,43.62,42.0,43.5,470258.0,0.12,1.38,0.21,557.14,1.38,206499.3,127.73,0.09,True,66.46,0.19,0.13,0.06,2025-11-06,41.1,5.84,0,,40.44,ATH,False,False
06-11-2025 12:00,KRDMB,25.06,25.16,25.02,25.16,149094.0,0.0,0.1,0.0,4900.0,0.1,92285.5,61.56,0.0,True,40.89,-0.17,0.01,-0.18,2025-11-06,25.0,0.64,0,,24.96,26.3,False,False
06-11-2025 12:00,ONCSM,216.3,228.1,216.0,228.1,985796.0,0.0,11.8,2.2,436.36,11.8,266682.4,269.65,0.0,True,74.18,2.11,1.94,0.18,2025-11-06,207.4,9.98,0,,201.3,ATH,False,False
06-11-2025 11:00,AKFYE,17.89,18.38,17.88,18.28,2582011.0,0.1,0.39,0.07,465.22,0.39,940237.9,174.61,0.26,True,72.61,0.18,0.07,0.11,2025-11-06,18.05,1.27,0,,17.31,ATH,False,False
06-11-2025 11:00,CCOLA,55.05,56.0,55.0,55.8,2679029.0,0.2,0.75,0.17,328.57,0.75,1596413.5,67.82,0.27,True,85.14,0.84,0.18,0.66,2025-11-06,54.95,1.55,0,,51.75,ATH,False,False
06-11-2025 11:00,GOZDE,22.68,23.2,22.68,23.14,706788.0,0.06,0.46,0.01,3733.33,0.46,373555.3,89.21,0.13,True,66.21,0.12,0.08,0.04,2025-11-06,22.32,3.67,0,,22.0,ATH,False,False
06-11-2025 11:00,BIMAS,537.5,547.5,534.5,546.0,3075183.0,1.5,8.5,0.9,844.44,8.5,874222.2,251.76,0.18,True,71.93,-0.32,2.01,-2.34,2025-11-06,529.5,3.12,0,,523.0,547.5,False,False
06-11-2025 10:00,ODINE,233.1,241.2,233.1,239.9,395873.0,1.3,6.8,2.0,240.0,6.8,173734.2,127.86,0.19,True,79.77,5.11,1.21,3.9,2025-11-06,232.0,3.41,0,,215.8,ATH,False,False
06-11-2025 10:00,NIBAS,24.0,25.36,23.9,25.1,1096878.0,0.26,1.1,0.09,1070.21,1.1,219064.2,400.71,0.24,True,61.84,0.04,-0.08,0.12,2025-11-06,23.96,4.76,2,23.9,23.9,26.3,False,False
06-11-2025 10:00,TCELL,98.4,101.0,98.05,100.5,17305527.0,0.5,2.1,0.13,1455.56,2.1,6575154.8,163.2,0.24,True,64.67,0.16,0.27,-0.11,2025-11-06,97.7,2.87,0,,96.05,100.8,False,False
06-11-2025 10:00,SANFM,7.43,7.62,7.4,7.62,1590278.0,0.0,0.19,0.03,578.57,0.19,471795.7,237.07,0.0,True,62.74,0.02,0.01,0.01,2025-11-06,7.47,2.01,0,,7.31,7.73,False,False
06-11-2025 10:00,A1CAP,13.27,13.78,13.21,13.68,7797111.0,0.1,0.41,0.05,791.3,0.41,2051046.9,280.15,0.24,True,61.09,-0.01,0.03,-0.03,2025-11-06,13.23,3.4,1,13.78,13.0,13.78,False,False
06-11-2025 10:00,HDFGS,4.35,5.08,4.35,4.93,32367054.0,0.15,0.58,0.06,900.0,0.58,4665738.5,593.72,0.26,True,42.47,-0.25,-0.02,-0.23,2025-11-06,4.83,2.07,3,,4.35,6.34,True,True
06-11-2025 10:00,BINHO,11.24,11.5,11.14,11.49,17250500.0,0.01,0.25,0.01,1566.67,0.25,7370555.2,134.05,0.04,True,59.85,-0.03,0.03,-0.06,2025-11-06,11.19,2.68,0,,11.01,11.58,True,False
06-11-2025 10:00,DAPGM,13.24,13.62,13.18,13.58,15132650.0,0.04,0.34,0.03,1072.41,0.34,3858953.2,292.14,0.12,True,58.07,-0.06,0.04,-0.1,2025-11-06,13.19,2.96,0,,13.03,14.6,True,False
05-11-2025 17:00,BIENY,42.1,43.98,41.76,43.62,3733841.0,0.36,1.52,0.33,366.26,1.52,1059923.9,252.27,0.24,True,83.75,0.32,0.3,0.03,2025-11-05,40.1,8.78,0,,40.0,ATH,False,False
05-11-2025 17:00,BLCYT,25.46,28.38,25.02,28.38,4872556.0,0.0,2.92,0.26,1006.06,2.92,593425.9,721.09,0.0,True,84.14,0.43,0.2,0.23,2025-11-05,25.8,10.0,0,,25.0,ATH,False,False
05-11-2025 17:00,MOBTL,8.12,8.32,8.03,8.29,4112719.0,0.03,0.17,0.03,529.63,0.17,1275379.5,222.47,0.18,True,61.86,0.04,0.0,0.03,2025-11-05,8.0,3.62,0,,7.54,8.55,False,False
05-11-2025 17:00,KRTEK,29.08,30.76,29.0,30.5,1335420.0,0.26,1.42,0.12,1103.39,1.42,538654.0,147.92,0.18,True,46.12,-1.03,0.12,-1.16,2025-11-05,30.02,1.6,0,,28.2,40.74,True,True
05-11-2025 17:00,DMRGD,27.14,27.62,27.04,27.54,763348.0,0.08,0.4,0.01,2757.14,0.4,275711.5,176.86,0.2,True,47.41,-0.33,0.07,-0.41,2025-11-05,27.44,0.36,1,27.62,26.86,27.62,True,True
05-11-2025 16:00,DOAS,180.6,183.4,180.5,183.4,414633.0,0.0,2.8,0.31,803.23,2.8,196980.6,110.49,0.0,True,63.53,0.43,0.15,0.28,2025-11-05,181.2,1.21,0,,178.7,183.6,False,False
05-11-2025 16:00,ENDAE,16.55,16.86,16.55,16.86,642102.0,0.0,0.31,0.03,1092.31,0.31,252916.8,153.88,0.0,True,65.53,0.06,-0.01,0.07,2025-11-05,16.55,1.87,0,,16.26,16.98,False,False
05-11-2025 16:00,ELITE,35.16,36.7,35.08,36.4,686685.0,0.3,1.24,0.1,1115.69,1.24,190767.2,259.96,0.24,True,75.5,0.27,-0.03,0.29,2025-11-05,35.58,2.3,0,,34.88,ATH,False,False
05-11-2025 16:00,AKSA,11.67,12.04,11.67,12.0,8601389.0,0.04,0.33,0.02,1220.0,0.33,2270826.4,278.78,0.12,True,52.99,-0.13,0.01,-0.14,2025-11-05,11.74,2.21,0,,11.96,12.65,True,True
05-11-2025 16:00,KLSYN,5.88,6.07,5.88,6.03,2829814.0,0.04,0.15,0.02,614.29,0.15,485519.0,482.84,0.27,True,70.78,0.01,0.02,-0.01,2025-11-05,5.78,4.33,0,,5.76,6.08,False,False
05-11-2025 16:00,ALBRK,8.34,8.46,8.34,8.44,2597468.0,0.02,0.1,0.01,809.09,0.1,1142887.6,127.27,0.2,True,65.92,0.03,-0.01,0.03,2025-11-05,8.35,1.08,0,,8.29,8.52,False,False
05-11-2025 16:00,ALFAS,44.56,46.5,44.3,46.06,1955724.0,0.44,1.5,0.24,530.25,1.5,329694.6,493.19,0.29,True,75.48,0.14,0.14,0.0,2025-11-05,43.52,5.84,1,46.5,43.36,46.5,False,False
05-11-2025 16:00,KRSTL,12.1,12.4,12.09,12.32,1869167.0,0.08,0.22,0.06,272.88,0.22,687315.5,171.95,0.36,True,71.44,0.11,0.05,0.07,2025-11-05,11.85,3.97,0,,11.44,ATH,False,False
05-11-2025 16:00,TKFEN,81.65,82.7,81.65,82.6,734165.0,0.1,0.95,0.02,4650.0,0.95,311588.6,135.62,0.11,True,50.19,-0.61,0.01,-0.62,2025-11-05,81.35,1.54,1,82.7,81.45,82.7,True,True
05-11-2025 16:00,VBTYZ,18.78,19.01,18.77,19.0,138631.0,0.01,0.22,0.01,1900.0,0.22,79302.5,74.81,0.05,True,56.02,-0.02,-0.01,-0.01,2025-11-05,18.87,0.69,0,,18.62,19.59,False,False
05-11-2025 16:00,ALVES,28.58,28.98,28.56,28.92,863756.0,0.06,0.34,0.02,2025.0,0.34,559275.6,54.44,0.18,True,54.97,-0.0,-0.06,0.05,2025-11-05,28.78,0.49,0,,28.1,29.52,False,False
05-11-2025 16:00,ANSGR,23.58,23.88,23.56,23.88,2875825.0,0.0,0.3,0.05,552.17,0.3,865363.7,232.33,0.0,True,64.59,0.04,0.03,0.01,2025-11-05,23.44,1.88,0,,23.2,23.94,False,False
05-11-2025 16:00,BRLSM,14.97,15.25,14.96,15.2,397768.0,0.05,0.23,0.02,1337.5,0.23,212543.6,87.15,0.22,True,54.46,-0.04,-0.0,-0.04,2025-11-05,15.1,0.66,1,15.25,14.86,15.25,False,False
05-11-2025 16:00,MOGAN,9.62,10.34,9.62,10.18,6752408.0,0.16,0.56,0.05,998.04,0.56,984762.2,585.69,0.29,True,75.32,0.04,0.02,0.02,2025-11-05,9.67,5.27,0,,9.56,ATH,False,False
05-11-2025 16:00,NTHOL,50.15,51.45,50.15,51.45,589919.0,0.0,1.3,0.15,790.41,1.3,254966.8,131.37,0.0,True,67.7,0.19,0.07,0.12,2025-11-05,49.64,3.65,0,,48.9,ATH,False,False
05-11-2025 16:00,OZSUB,19.95,20.26,19.8,20.2,306114.0,0.06,0.25,0.06,290.63,0.25,181186.3,68.95,0.24,True,68.87,0.23,0.02,0.2,2025-11-05,19.42,4.02,0,,19.36,ATH,False,False
05-11-2025 16:00,AYDEM,19.32,19.73,19.32,19.64,565483.0,0.09,0.32,0.02,1500.0,0.32,234572.1,141.07,0.28,True,62.87,0.07,-0.01,0.07,2025-11-05,19.43,1.08,0,,19.22,19.68,False,False
05-11-2025 16:00,ENTRA,11.41,11.97,11.4,11.88,10439741.0,0.09,0.47,0.06,683.33,0.47,1792821.2,482.31,0.19,True,70.87,0.06,0.02,0.04,2025-11-05,11.45,3.76,0,,11.2,11.89,False,False
05-11-2025 16:00,QUAGR,9.04,9.37,9.03,9.31,22246278.0,0.06,0.27,0.04,558.54,0.27,6320525.5,251.97,0.22,True,76.98,0.06,0.04,0.02,2025-11-05,8.8,5.8,0,,8.7,ATH,False,False
05-11-2025 16:00,FZLGY,14.15,14.53,14.12,14.49,2688583.0,0.04,0.34,0.0,33900.0,0.34,1514248.8,77.55,0.12,True,55.08,-0.04,-0.0,-0.04,2025-11-05,14.3,1.33,0,,14.08,14.8,False,False
05-11-2025 16:00,YYLGD,11.27,11.56,11.27,11.55,2513461.0,0.01,0.28,0.01,3400.0,0.28,870158.7,188.85,0.04,True,64.97,0.06,-0.01,0.07,2025-11-05,11.4,1.32,0,,11.19,ATH,False,False
05-11-2025 16:00,EUPWR,29.08,30.58,29.02,30.42,8739616.0,0.16,1.34,0.18,661.36,1.34,1273350.5,586.35,0.12,True,76.05,0.15,0.14,0.01,2025-11-05,28.32,7.42,1,30.58,28.04,30.58,False,False
05-11-2025 16:00,GSDHO,4.76,4.81,4.76,4.8,860666.0,0.01,0.04,0.0,1233.33,0.04,509243.9,69.01,0.25,True,50.0,-0.01,-0.0,-0.01,2025-11-05,4.78,0.42,0,,4.74,4.98,False,False
05-11-2025 16:00,GESAN,47.96,50.7,47.94,50.4,4944421.0,0.3,2.44,0.3,718.79,2.44,751819.8,557.66,0.12,True,77.96,0.27,0.15,0.12,2025-11-05,47.42,6.28,1,50.7,46.98,50.7,False,False
05-11-2025 15:00,SMRTG,27.34,28.3,27.2,28.3,813179.0,0.0,0.96,0.08,1042.86,0.96,393118.0,106.85,0.0,True,72.21,0.11,0.07,0.04,2025-11-05,26.92,5.13,0,,26.9,ATH,False,False
05-11-2025 15:00,TKNSA,27.2,27.76,27.18,27.6,943081.0,0.16,0.4,0.07,440.54,0.4,397038.6,137.53,0.4,True,70.85,0.37,-0.03,0.4,2025-11-05,27.18,1.55,0,,24.28,27.62,False,False
05-11-2025 15:00,BLUME,55.3,56.65,55.2,56.45,339137.0,0.2,1.15,0.08,1433.33,1.15,174725.2,94.1,0.17,True,55.21,-0.28,0.02,-0.3,2025-11-05,55.75,1.26,1,56.65,54.45,56.65,False,False
05-11-2025 14:00,BAGFS,33.56,34.78,33.54,34.46,470326.0,0.32,0.9,0.06,1451.72,0.9,125423.5,274.99,0.36,True,56.7,-0.2,0.03,-0.23,2025-11-05,33.9,1.65,0,,33.48,35.84,True,True
05-11-2025 14:00,MAGEN,29.44,30.4,29.38,30.38,1790587.0,0.02,0.94,0.18,416.48,0.94,990138.6,80.84,0.02,True,70.9,0.28,0.16,0.13,2025-11-05,28.5,6.6,0,,27.74,ATH,False,False
05-11-2025 13:00,GUBRF,291.75,300.75,289.5,299.25,811126.0,1.5,7.5,1.0,650.0,7.5,335622.1,141.68,0.2,True,50.38,-4.22,0.66,-4.88,2025-11-05,292.25,2.4,0,,285.75,321.25,True,True
05-11-2025 13:00,PAPIL,17.61,18.74,17.33,18.74,12017582.0,0.0,1.13,0.18,538.42,1.13,3711860.4,223.76,0.0,True,85.37,0.38,0.13,0.25,2025-11-05,17.39,7.76,0,,15.93,ATH,False,False
05-11-2025 12:00,ARMGD,36.56,37.3,36.48,37.26,415200.0,0.04,0.7,0.06,993.75,0.7,171800.4,141.68,0.06,True,57.13,-0.12,0.05,-0.16,2025-11-05,36.72,1.47,0,,36.34,38.4,True,True
05-11-2025 11:00,BIGEN,11.11,11.41,11.1,11.37,2873940.0,0.04,0.26,0.03,900.0,0.26,1193869.8,140.72,0.15,True,65.76,0.04,0.01,0.04,2025-11-05,11.14,2.06,0,,11.04,ATH,False,False
05-11-2025 11:00,MARTI,3.52,3.57,3.51,3.56,3985749.0,0.01,0.04,0.0,1233.33,0.04,1611037.9,147.4,0.25,True,49.71,0.0,-0.01,0.01,2025-11-05,3.55,0.28,1,3.57,3.49,3.57,False,False
05-11-2025 11:00,VESTL,33.94,34.18,33.88,34.12,1242580.0,0.06,0.18,0.03,462.5,0.18,514612.7,141.46,0.33,True,58.88,0.08,-0.02,0.1,2025-11-05,33.92,0.59,0,,32.68,34.8,False,False
05-11-2025 11:00,ARCLK,112.4,113.5,112.1,113.4,442322.0,0.1,1.0,0.09,1011.11,1.0,249353.5,77.39,0.1,True,62.69,0.41,-0.14,0.55,2025-11-05,112.1,1.16,0,,111.1,114.9,False,False
05-11-2025 11:00,BTCIM,4.67,4.7,4.66,4.7,32420643.0,0.0,0.03,0.0,650.0,0.03,21092894.2,53.7,0.0,True,75.79,0.06,-0.01,0.07,2025-11-05,4.68,0.43,0,,4.61,ATH,False,False
05-11-2025 11:00,PETKM,17.52,17.98,17.49,17.97,18094169.0,0.01,0.45,0.04,1084.21,0.45,6821436.6,165.25,0.02,True,72.78,0.07,0.0,0.06,2025-11-05,17.43,3.1,0,,17.26,ATH,False,False
05-11-2025 11:00,BASGZ,41.88,42.78,41.78,42.76,174067.0,0.02,0.88,0.07,1122.22,0.88,69578.5,150.17,0.02,True,75.78,0.28,0.01,0.27,2025-11-05,41.76,2.39,0,,41.62,ATH,False,False
05-11-2025 11:00,RYSAS,15.23,15.53,15.22,15.52,3392051.0,0.01,0.29,0.06,417.86,0.29,677270.1,400.84,0.03,True,75.19,0.06,0.04,0.02,2025-11-05,15.0,3.47,0,,14.81,ATH,False,False
05-11-2025 11:00,PGSUS,211.8,215.0,211.5,214.5,4194016.0,0.5,2.7,0.05,5300.0,2.7,1907456.8,119.87,0.19,True,60.74,1.1,-0.21,1.32,2025-11-05,213.8,0.33,1,215.0,211.2,215.0,False,False
05-11-2025 10:00,PCILT,25.16,26.3,25.16,26.06,806231.0,0.24,0.9,0.1,782.35,0.9,189206.1,326.11,0.27,True,68.42,0.35,-0.05,0.39,2025-11-05,25.14,3.66,0,,24.98,26.78,False,False
05-11-2025 10:00,IHYAY,2.54,2.72,2.54,2.72,25549349.0,0.0,0.18,0.01,1400.0,0.18,3038424.4,740.87,0.0,True,79.05,0.02,0.01,0.01,2025-11-05,2.52,7.94,0,,2.49,ATH,False,False
05-11-2025 10:00,ALKA,10.95,11.47,10.88,11.38,4834468.0,0.09,0.43,0.02,2766.67,0.43,999279.5,383.8,0.21,True,54.24,-0.17,0.05,-0.22,2025-11-05,10.91,4.31,1,11.47,10.85,11.47,True,True
05-11-2025 10:00,VSNMD,136.4,140.6,135.6,139.5,1737496.0,1.1,3.1,0.19,1531.58,3.1,474862.7,265.89,0.35,True,66.99,0.86,0.21,0.65,2025-11-05,135.5,2.95,1,140.6,131.3,140.6,False,False
05-11-2025 10:00,IHEVA,2.65,2.69,2.65,2.69,898655.0,0.0,0.04,0.01,566.67,0.04,293646.0,206.03,0.0,True,62.96,0.01,-0.0,0.01,2025-11-05,2.65,1.51,0,,2.61,2.71,False,False
04-11-2025 17:00,YYAPI,2.75,2.92,2.73,2.91,132194424.0,0.01,0.16,0.01,1130.77,0.16,68726481.8,92.35,0.06,True,80.42,0.11,-0.0,0.11,2025-11-04,2.66,9.4,0,,2.61,ATH,False,False
04-11-2025 17:00,SKBNK,8.1,8.19,8.06,8.19,8532571.0,0.0,0.09,0.01,1185.71,0.09,4727789.8,80.48,0.0,True,64.4,0.06,-0.01,0.07,2025-11-04,8.14,0.61,2,8.06,8.06,8.24,False,False
04-11-2025 17:00,BERA,19.13,19.6,19.05,19.49,9516803.0,0.11,0.36,0.02,1614.29,0.36,2017459.3,371.72,0.31,True,65.88,0.18,-0.0,0.19,2025-11-04,19.17,1.67,1,19.6,18.9,19.6,False,False
04-11-2025 17:00,EFOR,143.3,148.9,143.3,148.9,236851.0,0.0,5.6,0.58,865.52,5.6,137036.1,72.84,0.0,True,70.4,,,,2025-11-04,143.8,3.55,0,,137.2,ATH,False,False
04-11-2025 16:00,KAYSE,18.2,19.39,18.19,19.29,4170105.0,0.1,1.09,0.1,1047.37,1.09,824718.6,405.64,0.09,True,81.44,0.09,0.05,0.04,2025-11-04,18.25,5.7,0,,17.9,ATH,False,False
04-11-2025 16:00,KIMMR,15.79,16.32,15.78,16.2,988065.0,0.12,0.41,0.05,772.34,0.41,395243.1,149.99,0.29,True,70.44,0.28,0.04,0.24,2025-11-04,15.25,6.23,1,16.32,15.09,16.32,False,False
04-11-2025 16:00,USAK,3.47,3.64,3.46,3.6,24428789.0,0.04,0.13,0.0,2500.0,0.13,8601609.8,184.0,0.31,True,66.66,0.01,-0.0,0.01,2025-11-04,3.53,1.98,2,3.46,3.46,ATH,False,False
04-11-2025 15:00,ALCTL,126.4,136.0,126.4,136.0,2163468.0,0.0,9.6,0.82,1070.73,9.6,482876.9,348.04,0.0,True,74.06,2.78,-0.18,2.96,2025-11-04,123.7,9.94,1,136.0,119.8,ATH,False,False
04-11-2025 13:00,SRVGY,3.2,3.29,3.2,3.29,17530974.0,0.0,0.09,0.0,2150.0,0.09,3634273.6,382.38,0.0,True,66.07,0.03,-0.0,0.04,2025-11-04,3.22,2.17,0,,3.18,ATH,False,False
04-11-2025 10:00,BVSAN,126.2,134.5,126.0,133.7,1281403.0,0.8,7.5,0.49,1430.61,7.5,243409.7,426.44,0.11,True,60.46,-1.26,0.31,-1.57,2025-11-04,125.0,6.96,1,134.5,124.1,134.5,True,True
04-11-2025 10:00,TAVHL,268.75,271.5,266.75,271.0,446139.0,0.5,2.25,0.48,373.68,2.25,204570.2,118.09,0.22,True,68.2,2.09,0.3,1.8,2025-11-04,269.0,0.74,2,266.75,266.75,271.5,False,False
04-11-2025 10:00,MARMR,3.32,3.64,3.15,3.64,62457459.0,0.0,0.32,0.04,700.0,0.32,10507954.4,494.38,0.0,True,80.01,0.05,0.05,0.0,2025-11-04,3.31,9.97,3,,2.97,ATH,False,False
04-11-2025 10:00,ANHYT,102.3,107.5,101.5,106.8,798191.0,0.7,4.5,0.42,971.43,4.5,204747.1,289.84,0.16,True,74.64,0.96,0.04,0.91,2025-11-04,102.3,4.4,3,,98.45,ATH,False,False
04-11-2025 10:00,ICBCT,15.3,15.42,15.16,15.41,564430.0,0.01,0.11,0.01,900.0,0.11,158633.5,255.81,0.09,True,61.85,0.08,-0.0,0.08,2025-11-04,15.28,0.85,0,,14.96,15.56,False,False
04-11-2025 10:00,AHSGY,54.4,56.95,53.4,56.95,869863.0,0.0,2.55,0.69,272.26,2.55,318318.5,173.27,0.0,True,84.83,2.04,0.57,1.47,2025-11-04,51.8,9.94,1,56.95,46.52,ATH,False,False
04-11-2025 10:00,THYAO,294.0,295.0,293.5,294.75,5771362.0,0.25,0.75,0.2,275.0,0.75,3442637.7,67.64,0.33,True,65.06,0.36,0.26,0.09,2025-11-04,294.0,0.26,1,295.0,289.0,295.0,False,False
04-11-2025 10:00,SUWEN,11.64,12.1,11.64,12.04,7976074.0,0.06,0.4,0.04,852.38,0.4,2500218.1,219.02,0.15,True,67.76,0.22,-0.02,0.23,2025-11-04,11.65,3.35,1,12.1,10.68,12.1,False,False
04-11-2025 10:00,DOFRB,106.9,112.2,104.6,112.2,2603709.0,0.0,5.3,0.53,900.0,5.3,312000.1,734.52,0.0,True,90.68,4.37,1.14,3.23,2025-11-04,102.0,10.0,1,112.2,82.5,ATH,False,False
04-11-2025 10:00,DURDO,3.99,4.12,3.97,4.1,2500685.0,0.02,0.11,0.01,2100.0,0.11,1162611.9,115.09,0.18,True,71.98,0.07,0.0,0.06,2025-11-04,3.95,3.8,0,,3.95,ATH,False,False
04-11-2025 10:00,KMPUR,19.12,20.08,19.0,19.86,7083190.0,0.22,0.74,0.22,237.9,0.74,1288368.2,449.78,0.3,True,91.76,0.6,0.22,0.38,2025-11-04,18.64,6.55,1,20.08,16.81,20.08,False,False
04-11-2025 10:00,EREGL,28.86,29.4,28.82,29.3,69835135.0,0.1,0.44,0.13,233.33,0.44,27974674.2,149.64,0.23,True,81.48,0.36,0.1,0.26,2025-11-04,28.84,1.6,0,,27.4,ATH,False,False
03-11-2025 17:00,SAMAT,6.75,7.1,6.75,7.1,1590527.0,0.0,0.35,0.06,473.77,0.35,361463.7,340.02,0.0,True,80.57,0.08,0.05,0.02,2025-11-03,6.46,9.91,0,,6.42,ATH,False,False
03-11-2025 17:00,HUNER,3.88,3.94,3.86,3.94,3580860.0,0.0,0.06,0.02,275.0,0.06,2021826.5,77.11,0.0,True,64.75,0.03,0.01,0.02,2025-11-03,3.79,3.96,0,,3.7,ATH,False,False
03-11-2025 17:00,PASEU,142.4,146.3,142.0,146.3,2731937.0,0.0,3.9,1.3,200.0,3.9,1320877.9,106.83,0.0,True,74.34,0.95,1.21,-0.26,2025-11-03,133.0,10.0,0,,133.0,ATH,False,False
03-11-2025 17:00,DCTTR,32.36,32.92,32.36,32.88,343494.0,0.04,0.52,0.08,519.05,0.52,211218.1,62.63,0.08,True,64.46,0.36,0.0,0.36,2025-11-03,32.02,2.69,0,,31.4,33.14,False,False
03-11-2025 17:00,UNLU,15.89,16.2,15.87,16.16,390636.0,0.04,0.27,0.02,1700.0,0.27,204662.3,90.87,0.15,True,71.56,0.25,-0.01,0.26,2025-11-03,15.89,1.7,0,,15.17,16.25,False,False
03-11-2025 16:00,MNDTR,8.59,8.94,8.58,8.91,1789648.0,0.03,0.32,0.06,442.37,0.32,964968.0,85.46,0.09,True,77.44,0.18,0.02,0.16,2025-11-03,8.38,6.32,0,,8.21,ATH,False,False
03-11-2025 15:00,ADEL,30.86,32.0,30.82,31.9,1069891.0,0.1,1.04,0.14,642.86,1.04,334829.4,219.53,0.1,True,70.54,0.32,0.04,0.27,2025-11-03,30.96,3.04,0,,29.62,31.92,False,False
03-11-2025 15:00,NTGAZ,11.18,11.48,11.16,11.43,2225705.0,0.05,0.25,0.03,733.33,0.25,1423702.2,56.33,0.2,True,69.71,0.25,-0.01,0.26,2025-11-03,11.2,2.05,0,,ATL,ATH,False,False
03-11-2025 14:00,KZGYO,27.04,27.66,26.94,27.54,656895.0,0.12,0.5,0.08,557.89,0.5,300381.8,118.69,0.24,True,64.44,0.17,-0.0,0.18,2025-11-03,27.02,1.92,0,,26.18,27.74,False,False
03-11-2025 14:00,TOASO,264.5,267.75,264.25,267.5,944988.0,0.25,3.0,0.38,700.0,3.0,611277.3,54.59,0.08,True,59.72,0.24,0.24,0.01,2025-11-03,264.25,1.23,0,,259.5,272.25,False,False
03-11-2025 13:00,PINSU,13.95,14.35,13.92,14.32,2755873.0,0.03,0.37,0.04,848.72,0.37,849238.3,224.51,0.08,True,67.19,0.07,0.01,0.06,2025-11-03,13.87,3.24,0,,13.73,ATH,False,False
03-11-2025 13:00,HUBVC,3.75,4.0,3.75,4.0,2269876.0,0.0,0.25,0.03,762.07,0.25,1303459.8,74.14,0.0,True,68.11,0.09,-0.03,0.11,2025-11-03,3.78,5.82,0,,3.6,ATH,False,False
03-11-2025 12:00,MEKAG,4.87,4.93,4.87,4.92,2945765.0,0.01,0.05,0.01,525.0,0.05,1210452.5,143.36,0.2,True,68.39,0.0,0.01,-0.01,2025-11-03,4.79,2.71,0,,4.77,ATH,False,False
03-11-2025 12:00,ASTOR,99.45,101.2,99.45,100.7,3090144.0,0.5,1.25,0.29,338.6,1.25,1917643.6,61.14,0.4,True,75.82,1.02,0.21,0.81,2025-11-03,98.2,2.55,1,101.2,95.1,101.2,False,False
03-11-2025 11:00,ZEDUR,8.95,9.15,8.92,9.14,480962.0,0.01,0.19,0.01,1800.0,0.19,142364.2,237.84,0.05,True,80.26,0.16,0.03,0.13,2025-11-03,8.69,5.18,1,9.15,8.27,9.15,False,False
03-11-2025 11:00,ISDMR,39.06,39.48,39.06,39.44,542007.0,0.04,0.38,0.06,533.33,0.38,240309.8,125.55,0.11,True,68.21,0.07,0.06,0.02,2025-11-03,38.64,2.07,0,,38.28,ATH,False,False
03-11-2025 11:00,AKSEN,52.9,54.3,52.8,53.95,3434262.0,0.35,1.05,0.24,346.81,1.05,1843717.3,86.27,0.33,True,75.34,1.21,0.15,1.05,2025-11-03,52.0,3.75,0,,49.0,ATH,False,False
03-11-2025 11:00,JANTS,21.32,21.52,21.32,21.52,643214.0,0.0,0.2,0.01,1328.57,0.2,368861.0,74.38,0.0,True,60.79,0.03,0.05,-0.02,2025-11-03,21.26,1.22,0,,20.94,ATH,False,False
03-11-2025 11:00,BAYRK,36.12,38.38,36.1,38.38,1455628.0,0.0,2.26,0.24,849.58,2.26,386872.1,276.26,0.0,True,75.7,0.2,0.09,0.1,2025-11-03,35.54,7.99,0,,35.34,ATH,False,False
03-11-2025 11:00,PENGD,8.98,9.14,8.9,9.12,2297267.0,0.02,0.14,0.02,460.0,0.14,625868.6,267.05,0.14,True,71.03,0.02,0.02,0.0,2025-11-03,8.84,3.17,0,,8.76,ATH,False,False
03-11-2025 11:00,AFYON,13.21,13.36,13.19,13.34,1977057.0,0.02,0.13,0.02,465.22,0.13,652321.1,203.08,0.15,True,73.63,0.09,0.03,0.07,2025-11-03,13.25,0.68,0,,12.95,ATH,False,False
03-11-2025 11:00,GOKNR,23.2,23.6,23.18,23.58,833175.0,0.02,0.38,0.07,413.51,0.38,429250.5,94.1,0.05,True,80.86,0.23,0.09,0.14,2025-11-03,23.06,2.25,0,,22.22,ATH,False,False
03-11-2025 11:00,GEREL,19.24,19.6,19.21,19.55,1829961.0,0.05,0.31,0.02,1723.53,0.31,788285.2,132.14,0.16,True,54.75,-0.02,-0.01,-0.02,2025-11-03,19.27,1.45,2,19.21,19.21,ATH,False,False
03-11-2025 11:00,OSMEN,10.75,10.95,10.75,10.93,928489.0,0.02,0.18,0.03,592.31,0.18,525247.8,76.77,0.11,True,76.46,0.17,0.01,0.16,2025-11-03,10.63,2.82,0,,10.03,ATH,False,False
03-11-2025 11:00,YKSLN,6.18,6.29,6.18,6.27,1301169.0,0.02,0.09,0.01,650.0,0.09,676629.0,92.3,0.22,True,74.04,0.03,0.02,0.01,2025-11-03,6.11,2.62,0,,5.95,ATH,False,False
03-11-2025 11:00,MAVI,40.66,41.54,40.58,41.32,2390384.0,0.22,0.66,0.12,440.98,0.66,1034851.3,130.99,0.33,True,76.87,0.27,0.13,0.14,2025-11-03,40.3,2.53,1,41.54,38.36,41.54,False,False
03-11-2025 10:00,TRILC,21.3,21.5,21.3,21.48,492031.0,0.02,0.18,0.04,309.09,0.18,250692.6,96.27,0.11,True,59.07,-0.01,0.03,-0.04,2025-11-03,21.2,1.32,0,,20.78,21.98,False,False
03-11-2025 10:00,TUCLK,9.77,10.05,9.75,10.02,2175616.0,0.03,0.25,0.02,1566.67,0.25,654070.9,232.63,0.12,True,71.11,0.13,0.0,0.13,2025-11-03,9.74,2.87,0,,9.28,ATH,False,False
03-11-2025 10:00,YESIL,2.76,3.02,2.75,2.97,77586472.0,0.05,0.21,0.02,775.0,0.21,24019757.3,223.01,0.24,True,74.09,0.08,-0.01,0.09,2025-11-03,2.75,8.0,1,3.02,2.56,3.02,False,False
03-11-2025 10:00,SILVR,3.01,3.09,2.97,3.07,1471479.0,0.02,0.06,0.02,233.33,0.06,450944.3,226.31,0.33,True,63.86,0.01,0.01,-0.0,2025-11-03,3.02,1.66,0,,2.8,ATH,False,False
03-11-2025 10:00,ALARK,81.65,82.75,81.6,82.5,1558710.0,0.25,0.85,0.21,304.76,0.85,538153.3,189.64,0.29,True,72.6,0.14,0.31,-0.17,2025-11-03,80.7,2.23,0,,79.4,ATH,False,False
03-11-2025 10:00,SERNT,10.35,10.77,10.34,10.68,4662607.0,0.09,0.33,0.03,870.59,0.33,981628.7,374.99,0.27,True,72.69,0.05,0.01,0.03,2025-11-03,10.34,3.29,1,10.77,10.25,10.77,False,False
03-11-2025 10:00,AVGYO,17.45,18.18,16.66,18.02,813502.0,0.16,0.57,0.06,850.0,0.57,230948.4,252.24,0.28,True,57.83,-0.2,0.08,-0.28,2025-11-03,17.33,3.98,2,16.66,16.66,19.4,False,False
03-11-2025 10:00,TEZOL,13.38,13.5,13.33,13.48,807866.0,0.02,0.1,0.02,426.32,0.1,410749.0,96.68,0.2,True,69.53,0.06,0.01,0.05,2025-11-03,13.3,1.35,0,,13.0,ATH,False,False
03-11-2025 10:00,SOKE,11.75,11.97,11.75,11.93,291424.0,0.04,0.18,0.03,520.69,0.18,129311.8,125.37,0.22,True,73.41,0.05,0.01,0.04,2025-11-03,11.71,1.88,0,,11.57,ATH,False,False
03-11-2025 10:00,ALKLC,91.95,94.85,91.75,94.5,995816.0,0.35,2.55,0.35,639.13,2.55,546973.1,82.06,0.14,True,58.51,-0.96,0.79,-1.75,2025-11-03,92.0,2.72,0,,89.0,ATH,False,False
03-11-2025 10:00,AGROT,7.6,7.72,7.59,7.69,3051724.0,0.03,0.09,0.02,429.41,0.09,1000112.7,205.14,0.33,True,70.62,0.05,0.0,0.04,2025-11-03,7.58,1.45,0,,7.47,ATH,False,False
03-11-2025 10:00,ALTNY,67.3,68.25,67.2,68.2,1193216.0,0.05,0.9,0.12,620.0,0.9,425318.7,180.55,0.06,True,50.37,-0.54,0.07,-0.62,2025-11-03,67.25,1.41,0,,66.7,71.75,False,False
03-11-2025 10:00,YUNSA,7.56,7.67,7.55,7.66,920362.0,0.01,0.1,0.03,244.83,0.1,515283.7,78.61,0.1,True,71.11,0.06,0.01,0.05,2025-11-03,7.55,1.46,0,,7.33,ATH,False,False
03-11-2025 10:00,VESBE,8.86,9.11,8.86,9.1,5759931.0,0.01,0.24,0.03,585.71,0.24,1746562.5,229.79,0.04,True,78.54,0.09,0.03,0.06,2025-11-03,8.79,3.53,0,,8.44,ATH,False,False
03-11-2025 10:00,REEDR,10.21,10.42,10.2,10.39,9714218.0,0.03,0.18,0.03,462.5,0.18,3068809.2,216.55,0.17,True,70.93,0.04,0.02,0.02,2025-11-03,10.16,2.26,0,,9.98,ATH,False,False
03-11-2025 10:00,ZOREN,3.43,3.53,3.42,3.52,42356934.0,0.01,0.09,0.01,900.0,0.09,9718341.2,335.85,0.11,True,79.07,0.03,0.01,0.02,2025-11-03,3.35,5.07,0,,3.31,ATH,False,False
03-11-2025 10:00,DERHL,16.99,17.16,16.98,17.15,1507133.0,0.01,0.16,0.02,540.0,0.16,487743.5,209.0,0.06,True,58.55,0.02,0.01,0.01,2025-11-03,16.93,1.3,0,,16.68,17.36,False,False
03-11-2025 10:00,EPLAS,6.5,6.75,6.43,6.7,3997555.0,0.05,0.2,0.04,376.19,0.2,919750.0,334.63,0.25,True,58.72,0.05,0.01,0.04,2025-11-03,6.72,-0.3,0,,6.37,6.79,False,False
03-11-2025 10:00,BUCIM,6.49,6.57,6.49,6.56,1445764.0,0.01,0.07,0.01,438.46,0.07,658213.1,119.65,0.14,True,77.09,0.03,0.01,0.02,2025-11-03,6.47,1.39,0,,6.39,ATH,False,False
03-11-2025 10:00,MNDRS,14.45,15.0,14.45,14.93,1464226.0,0.07,0.48,0.08,540.0,0.48,299438.5,388.99,0.15,True,80.08,0.1,0.05,0.05,2025-11-03,14.4,3.68,0,,14.12,ATH,False,False
03-11-2025 10:00,EGPRO,27.1,28.12,27.1,28.12,343174.0,0.0,1.02,0.15,562.34,1.02,106630.0,221.84,0.0,True,88.2,0.24,0.13,0.11,2025-11-03,26.92,4.46,0,,26.2,ATH,False,False
03-11-2025 10:00,PRDGS,7.13,7.83,7.12,7.83,8509362.0,0.0,0.7,0.05,1358.33,0.7,2914381.4,191.98,0.0,True,77.7,0.31,-0.02,0.33,2025-11-03,7.12,9.97,1,7.83,6.17,ATH,False,False
03-11-2025 10:00,KONTR,31.44,33.24,31.28,33.02,33256415.0,0.22,1.58,0.43,270.89,1.58,10655032.5,212.12,0.14,True,87.15,0.8,0.43,0.37,2025-11-03,31.5,4.83,0,,28.46,ATH,False,False
03-11-2025 10:00,BURCE,40.34,43.0,38.5,42.44,1542520.0,0.56,2.1,0.04,5150.0,2.1,364200.2,323.54,0.27,True,72.52,1.94,-0.47,2.42,2025-11-03,40.38,5.1,3,,ATL,ATH,False,False
03-11-2025 10:00,CELHA,9.05,9.3,9.05,9.29,759945.0,0.01,0.24,0.03,650.0,0.24,227564.3,233.95,0.04,True,73.33,0.06,0.01,0.05,2025-11-03,9.05,2.65,0,,8.71,9.33,False,False
03-11-2025 10:00,DYOBY,14.15,14.37,14.14,14.31,412941.0,0.06,0.16,0.02,540.0,0.16,153440.3,169.12,0.37,True,64.94,0.04,0.01,0.03,2025-11-03,14.11,1.42,0,,14.04,ATH,False,False
03-11-2025 10:00,BOBET,20.34,20.56,20.34,20.54,1118317.0,0.02,0.2,0.03,525.0,0.2,306507.2,264.86,0.1,True,59.05,-0.0,0.01,-0.02,2025-11-03,20.26,1.38,1,20.56,20.02,20.56,False,False
03-11-2025 10:00,MAKTK,15.24,16.1,15.13,15.98,3890428.0,0.12,0.74,0.09,687.23,0.74,915353.7,325.02,0.16,True,76.25,0.16,0.08,0.08,2025-11-03,15.03,6.32,0,,14.59,ATH,False,False
03-11-2025 10:00,BSOKE,16.13,17.06,16.13,16.99,6989428.0,0.07,0.86,0.1,751.49,0.86,1585536.0,340.82,0.08,True,80.43,0.21,0.03,0.19,2025-11-03,16.1,5.53,0,,15.73,ATH,False,False
03-11-2025 10:00,HEKTS,3.61,3.74,3.59,3.71,51197501.0,0.03,0.1,0.02,400.0,0.1,20030279.2,155.6,0.3,True,75.05,0.01,0.03,-0.02,2025-11-03,3.57,3.92,0,,3.45,ATH,False,False
03-11-2025 10:00,ISMEN,43.88,45.32,43.8,44.92,1780476.0,0.4,1.04,0.17,497.7,1.04,691518.9,157.47,0.38,True,64.29,0.18,0.09,0.09,2025-11-03,43.96,2.18,0,,42.36,ATH,False,False
03-11-2025 10:00,PATEK,30.9,32.24,30.5,32.1,17091968.0,0.14,1.2,0.2,494.06,1.2,5506293.2,210.41,0.12,True,72.23,0.72,0.04,0.68,2025-11-03,30.0,7.0,0,,28.98,ATH,False,False
03-11-2025 10:00,HURGZ,6.35,6.46,6.35,6.44,1576937.0,0.02,0.09,0.01,650.0,0.09,510101.6,209.14,0.22,True,59.31,-0.02,0.02,-0.04,2025-11-03,6.29,2.38,0,,6.26,ATH,False,False
03-11-2025 10:00,PENTA,15.45,15.75,15.45,15.68,721459.0,0.07,0.23,0.04,475.0,0.23,276853.3,160.59,0.3,True,78.21,0.22,-0.0,0.22,2025-11-03,15.4,1.82,0,,14.53,ATH,False,False
03-11-2025 10:00,HKTM,12.85,13.08,12.84,13.08,1032042.0,0.0,0.23,0.03,641.94,0.23,363327.0,184.05,0.0,True,74.54,0.17,0.01,0.16,2025-11-03,12.79,2.27,0,,12.11,ATH,False,False
03-11-2025 10:00,LKMNH,16.91,17.04,16.85,17.02,261462.0,0.02,0.11,0.01,685.71,0.11,150884.8,73.29,0.18,True,62.67,0.04,0.01,0.03,2025-11-03,16.82,1.19,0,,16.72,17.18,False,False
03-11-2025 10:00,EDIP,34.6,35.1,34.58,35.08,392985.0,0.02,0.48,0.1,389.8,0.48,184848.7,112.6,0.04,True,71.51,0.13,0.12,0.01,2025-11-03,34.52,1.62,0,,33.86,ATH,False,False
31-10-2025 17:00,KRDMA,28.54,28.84,28.48,28.8,450861.0,0.04,0.26,0.02,1525.0,0.26,178483.2,152.61,0.15,True,47.93,-0.18,,,2025-10-31,28.64,0.56,0,,28.36,29.68,False,False
31-10-2025 17:00,CONSE,3.34,3.41,3.33,3.39,1645068.0,0.02,0.05,0.01,900.0,0.05,585580.3,180.93,0.4,True,65.03,0.04,,,2025-10-31,3.33,1.8,0,,3.31,ATH,False,False
31-10-2025 17:00,DGNMO,6.22,6.36,6.21,6.32,813191.0,0.04,0.1,0.02,334.78,0.1,300190.4,170.89,0.4,True,74.26,0.05,,,2025-10-31,6.13,3.1,0,,6.04,ATH,False,False
31-10-2025 17:00,ARENA,30.84,31.16,30.84,31.1,147555.0,0.06,0.26,0.05,465.22,0.26,70398.5,109.6,0.23,True,68.67,0.3,,,2025-10-31,30.7,1.3,0,,29.56,31.22,False,False
31-10-2025 17:00,AKFIS,25.08,25.74,24.92,25.68,1716254.0,0.06,0.6,0.07,757.14,0.6,598736.4,186.65,0.1,True,72.44,0.22,,,2025-10-31,24.84,3.38,0,,24.48,ATH,False,False
31-10-2025 17:00,BJKAS,1.93,1.95,1.93,1.95,7664992.0,0.0,0.02,0.0,400.0,0.02,3918829.0,95.59,0.0,True,53.97,-0.0,,,2025-10-31,1.92,1.56,0,,1.91,ATH,False,False
31-10-2025 17:00,ISKPL,9.13,9.55,9.11,9.53,2939622.0,0.02,0.4,0.03,1438.46,0.4,679583.9,332.56,0.05,True,64.63,0.0,,,2025-10-31,9.18,3.81,0,,9.0,ATH,False,False
31-10-2025 17:00,FONET,3.16,3.25,3.14,3.25,28795770.0,0.0,0.09,0.03,246.15,0.09,12389687.2,132.42,0.0,True,77.72,0.06,,,2025-10-31,2.96,9.8,0,,2.9,ATH,False,False
31-10-2025 16:00,ARZUM,3.17,3.23,3.16,3.22,7385077.0,0.01,0.05,0.0,1566.67,0.05,2964225.6,149.14,0.2,True,61.77,0.01,,,2025-10-31,3.1,3.87,0,,3.1,ATH,False,False
31-10-2025 16:00,NATEN,9.08,9.19,9.07,9.17,1756178.0,0.02,0.09,0.01,650.0,0.09,791358.9,121.92,0.22,True,67.87,0.07,,,2025-10-31,8.97,2.23,0,,8.89,9.3,False,False
31-10-2025 16:00,EKSUN,6.43,6.5,6.41,6.49,543815.0,0.01,0.06,0.01,400.0,0.06,233166.8,133.23,0.17,True,66.27,0.01,,,2025-10-31,6.36,2.04,0,,6.32,6.5,False,False
31-10-2025 15:00,CVKMD,20.88,21.48,20.86,21.42,8812242.0,0.06,0.54,0.0,26900.0,0.54,3431307.8,156.82,0.11,True,67.67,0.37,,,2025-10-31,20.7,3.48,0,,19.49,ATH,False,False
31-10-2025 15:00,BARMA,20.2,20.56,20.08,20.54,451218.0,0.02,0.34,0.04,709.52,0.34,161199.9,179.91,0.06,True,65.97,0.05,,,2025-10-31,20.04,2.5,0,,19.94,ATH,False,False
31-10-2025 12:00,VAKBN,24.0,24.42,24.0,24.36,5926948.0,0.06,0.36,0.05,620.0,0.36,3105006.3,90.88,0.17,True,67.21,0.09,,,2025-10-31,23.98,1.58,0,,ATL,ATH,False,False
31-10-2025 12:00,TSKB,12.74,12.96,12.73,12.92,4881001.0,0.04,0.18,0.01,1536.36,0.18,2361304.1,106.71,0.22,True,53.18,-0.11,,,2025-10-31,12.69,1.81,0,,12.56,ATH,False,False
31-10-2025 12:00,OSTIM,3.38,3.42,3.38,3.41,1914106.0,0.01,0.03,0.0,1400.0,0.03,1047177.1,82.79,0.33,True,70.26,0.02,,,2025-10-31,3.34,2.1,0,,3.33,ATH,False,False
31-10-2025 12:00,BRKVY,80.0,83.85,79.65,83.7,242776.0,0.15,3.7,0.26,1350.98,3.7,122118.6,98.8,0.04,True,65.28,0.88,,,2025-10-31,82.6,1.33,0,,78.7,83.75,False,False
31-10-2025 12:00,MERKO,14.1,14.5,14.09,14.48,993892.0,0.02,0.38,0.03,1087.5,0.38,477670.3,108.07,0.05,True,62.99,0.05,,,2025-10-31,14.22,1.83,0,,13.74,ATH,False,False
31-10-2025 11:00,GSDDE,10.48,10.72,10.47,10.69,702766.0,0.03,0.21,0.04,438.46,0.21,299917.5,134.32,0.14,True,79.28,,,,2025-10-31,10.42,2.59,0,,ATL,ATH,False,False
31-10-2025 11:00,SISE,36.34,36.9,36.32,36.76,7256505.0,0.14,0.42,0.06,577.42,0.42,4017758.3,80.61,0.33,True,62.55,,,,2025-10-31,36.76,0.0,0,,35.6,ATH,False,False
31-10-2025 11:00,GLYHO,11.2,11.43,11.2,11.41,3589852.0,0.02,0.21,0.03,650.0,0.21,1272825.6,182.04,0.1,True,62.82,,,,2025-10-31,11.17,2.15,0,,11.08,11.52,False,False
31-10-2025 10:00,KBORU,13.66,14.57,13.43,14.39,9728126.0,0.18,0.73,0.12,503.31,0.73,1740870.4,458.81,0.25,True,61.91,,,,2025-10-31,14.35,0.28,2,13.43,13.43,ATH,False,False
31-10-2025 10:00,SEGMN,21.84,22.24,21.84,22.18,591928.0,0.06,0.34,0.03,962.5,0.34,229579.2,157.83,0.18,True,67.91,,,,2025-10-31,21.84,1.56,1,22.24,21.5,22.24,False,False
31-10-2025 10:00,ADGYO,51.35,54.55,51.0,53.95,462220.0,0.6,2.6,0.57,359.36,2.6,184920.1,149.96,0.23,True,90.01,,,,2025-10-31,51.35,5.06,1,54.55,45.36,54.55,False,False
31-10-2025 10:00,GLRMK,191.0,195.7,190.7,194.4,1482963.0,1.3,3.4,0.24,1316.67,3.4,283225.2,423.6,0.38,True,68.36,,,,2025-10-31,186.9,4.01,0,,185.5,ATH,False,False
31-10-2025 10:00,VRGYO,3.34,3.43,3.32,3.42,10831674.0,0.01,0.08,0.01,788.89,0.08,3668017.8,195.3,0.13,True,68.82,,,,2025-10-31,3.36,1.79,2,3.32,3.32,ATH,False,False
31-10-2025 10:00,CEMTS,11.01,11.29,10.93,11.25,1647639.0,0.04,0.24,0.03,727.59,0.24,735942.1,123.88,0.17,True,62.52,,,,2025-10-31,11.03,1.99,2,10.93,10.93,ATH,False,False
31-10-2025 10:00,MAKIM,17.55,18.42,17.52,18.22,2006325.0,0.2,0.67,0.06,980.65,0.67,255402.7,685.55,0.3,True,83.87,,,,2025-10-31,17.0,7.18,0,,16.75,ATH,False,False
31-10-2025 10:00,AVOD,4.2,4.42,4.11,4.39,2221149.0,0.03,0.19,0.03,578.57,0.19,511149.9,334.54,0.16,True,76.63,,,,2025-10-31,4.22,4.03,1,4.42,4.0,4.42,False,False
30-10-2025 17:00,BIGCH,67.65,70.35,67.45,70.3,156482.0,0.05,2.65,0.13,1938.46,2.65,48758.0,220.94,0.02,True,68.93,,,,2025-10-30,69.3,1.44,0,,65.75,ATH,False,False
30-10-2025 16:00,ANGEN,12.16,12.95,12.06,12.95,5023256.0,0.0,0.79,0.05,1512.24,0.79,1738611.2,188.92,0.0,True,76.72,,,,2025-10-30,12.2,6.15,0,,ATL,ATH,False,False
30-10-2025 15:00,KARSN,10.22,10.62,10.21,10.55,6654539.0,0.07,0.33,0.06,450.0,0.33,1594036.2,317.46,0.21,True,82.46,,,,2025-10-30,9.96,5.92,0,,ATL,ATH,False,False
30-10-2025 14:00,ENJSA,81.95,83.25,81.9,83.15,568197.0,0.1,1.2,0.17,605.88,1.2,242046.0,134.75,0.08,True,73.31,,,,2025-10-30,80.9,2.78,0,,80.55,ATH,False,False
30-10-2025 13:00,DZGYO,7.02,7.24,7.0,7.23,1779130.0,0.01,0.21,0.03,577.42,0.21,659377.2,169.82,0.05,True,78.38,,,,2025-10-30,6.81,6.17,0,,6.8,ATH,False,False
30-10-2025 13:00,ETILR,4.3,4.44,4.29,4.43,3086103.0,0.01,0.13,0.01,766.67,0.13,885013.6,248.71,0.08,True,69.8,,,,2025-10-30,4.25,4.24,0,,4.23,ATH,False,False
30-10-2025 10:00,ALKIM,18.61,20.48,18.55,20.0,5605253.0,0.48,1.39,0.12,1039.34,1.39,762840.4,634.79,0.35,True,,,,,2025-10-30,18.62,7.41,3,,ATL,ATH,False,False
30-10-2025 10:00,BINBN,181.7,202.5,180.1,200.5,844492.0,2.0,18.8,1.66,1032.53,18.8,307567.0,174.57,0.11,True,,,,,2025-10-30,185.0,8.38,0,,180.0,ATH,False,False
30-10-2025 10:00,INFO,4.59,5.04,4.59,5.04,38494533.0,0.0,0.45,0.07,508.11,0.45,12607660.2,205.33,0.0,True,,,,,2025-10-30,4.59,9.8,1,5.04,ATL,ATH,False,False
30-10-2025 10:00,AZTEK,51.75,52.7,51.55,52.6,290421.0,0.1,0.85,0.11,639.13,0.85,103096.5,181.7,0.12,True,,,,,2025-10-30,51.25,2.63,0,,51.15,ATH,False,False
30-10-2025 10:00,GEDZA,28.0,28.42,27.94,28.38,282850.0,0.04,0.38,0.07,427.78,0.38,55541.6,409.26,0.11,True,,,,,2025-10-30,27.82,2.01,0,,27.68,ATH,False,False
30-10-2025 10:00,SKYMD,13.15,13.46,13.13,13.41,776419.0,0.05,0.26,0.01,2500.0,0.26,356613.5,117.72,0.19,True,,,,,2025-10-30,13.15,1.98,0,,13.06,ATH,False,False
30-10-2025 10:00,CWENE,22.46,23.65,22.44,23.44,5896402.11,0.2,0.98,0.11,754.84,0.98,1258567.65,368.5,0.21,True,,,,,2025-10-30,22.44,4.46,0,,ATL,ATH,False,False
30-10-2025 10:00,ULUFA,4.0,4.17,4.0,4.13,8811548.0,0.04,0.13,0.01,900.0,0.13,2597467.5,239.24,0.31,True,,,,,2025-10-30,3.97,4.03,1,4.17,3.96,4.17,False,False
30-10-2025 10:00,MOPAS,34.9,35.32,34.9,35.2,747824.0,0.12,0.3,0.04,650.0,0.3,313091.1,138.85,0.4,True,,,,,2025-10-30,34.8,1.15,0,,34.34,ATH,False,False
30-10-2025 10:00,KNFRT,13.26,14.03,13.22,13.94,973892.0,0.09,0.68,0.06,1136.36,0.68,235787.4,313.04,0.13,True,,,,,2025-10-30,13.19,5.69,0,,12.95,ATH,False,False
30-10-2025 10:00,TURGG,28.5,31.04,28.46,31.04,1001405.0,0.0,2.54,0.22,1054.55,2.54,241757.1,314.22,0.0,True,,,,,2025-10-30,28.22,9.99,1,31.04,ATL,ATH,False,False
30-10-2025 10:00,TUREX,8.04,8.43,8.0,8.38,19424258.0,0.05,0.34,0.06,466.67,0.34,6182749.7,214.17,0.15,True,,,,,2025-10-30,8.0,4.75,0,,7.72,ATH,False,False
30-10-2025 10:00,ARDYZ,27.82,29.76,27.82,29.5,4803386.0,0.26,1.68,0.25,572.0,1.68,1050290.6,357.34,0.15,True,,,,,2025-10-30,27.68,6.58,0,,ATL,ATH,False,False
30-10-2025 10:00,KOPOL,7.06,7.33,7.06,7.32,3233218.0,0.01,0.26,0.02,1525.0,0.26,1330110.0,143.08,0.04,True,,,,,2025-10-30,7.02,4.27,0,,ATL,ATH,False,False
30-10-2025 10:00,PRKME,17.56,17.94,17.56,17.93,385240.0,0.01,0.37,0.01,4525.0,0.37,151266.9,154.68,0.03,True,,,,,2025-10-30,17.52,2.34,0,,17.52,ATH,False,False
28-10-2025 11:30,BORLS,27.32,27.92,27.16,27.78,491369.0,0.14,0.46,0.05,784.62,0.46,182399.1,169.39,0.3,True,,,,,2025-10-28,27.64,0.51,2,27.16,27.16,ATH,False,False
28-10-2025 10:30,ULUUN,7.6,7.71,7.59,7.71,622020.0,0.0,0.11,0.01,1733.33,0.11,246552.7,152.29,0.0,True,,,,,2025-10-28,7.62,1.18,0,,7.53,ATH,False,False
22-10-2025 11:00,TRHOL,388.5,402.25,376.0,400.25,96648.0,2.0,11.75,1.62,623.08,11.75,64033.9,50.93,0.17,True,90.88,,,,2025-10-22,372.5,7.45,0,,ATL,408.75,False,False
