Tarih,Hisse,open,high,low,close,volume,YuksekKapanis_Fark,AcilisKapanis_Fark,AcilisKapanisFark_Ort,AcilisKapanisFark_OrtalamayaGoreDegisim,AcilisKapanisFarkOrt_MaxSon10,HacimOrtalama,%Hacim_HacimOrtalama,Fark_Orani,Kosul,rsi,MACD_12_26_9,MACDh_12_26_9,MACDs_12_26_9,Tarih1,%Deg,isPivot,pointpos,destek,direnc,Tsinyal_Banker_Dip,Tsinyal_Banker_DipKarar
05-11-2025 09:00,BMSTL,72.3,79.5,72.2,79.5,7006912.0,0.0,7.2,1.38,421.74,7.2,3640874.1,92.45,0.0,True,74.33,1.9,1.4,0.51,2025-11-05,9.96,0,,62.4,ATH,False,False
05-11-2025 09:00,BIENY,40.2,43.98,40.0,43.36,10704062.0,0.62,3.16,0.19,1598.92,3.16,4696049.9,127.94,0.2,True,63.4,-0.14,0.35,-0.49,2025-11-05,8.13,0,,39.14,51.1,True,False
05-11-2025 09:00,OTKAR,469.75,497.75,462.25,497.0,894326.0,0.75,27.25,5.48,397.72,27.25,494727.3,80.77,0.03,True,60.74,-6.22,7.37,-13.59,2025-11-05,5.58,0,,410.0,569.0,False,False
05-11-2025 09:00,CCOLA,52.5,55.05,52.5,54.95,19873201.0,0.1,2.45,0.34,631.34,2.45,9332231.2,112.95,0.04,True,76.08,1.47,0.45,1.03,2025-11-05,5.37,0,,45.44,ATH,False,False
05-11-2025 09:00,ULAS,31.94,35.12,30.64,35.1,1117998.0,0.02,3.16,0.67,371.64,3.16,615515.2,81.64,0.01,True,64.56,1.57,0.3,1.27,2025-11-05,9.89,0,,25.66,ATH,False,False
05-11-2025 09:00,GESAN,47.42,50.7,46.98,49.8,8354841.0,0.9,2.38,0.49,387.7,2.38,4836454.8,72.75,0.38,True,69.38,0.82,0.73,0.09,2025-11-05,5.02,0,,41.48,52.65,False,False
05-11-2025 09:00,MEPET,16.99,18.68,16.55,18.68,1534091.0,0.0,1.69,0.27,516.79,1.69,630539.5,143.3,0.0,True,69.49,0.44,0.16,0.28,2025-11-05,9.95,0,,14.71,20.48,False,False
05-11-2025 09:00,BLCYT,25.8,28.38,25.0,28.38,6508525.0,0.0,2.58,0.53,390.49,2.58,1929707.0,237.28,0.0,True,68.02,0.54,0.26,0.28,2025-11-05,10.0,0,,22.5,28.98,False,False
05-11-2025 09:00,PAPIL,17.39,19.12,17.2,19.12,51250635.0,0.0,1.73,0.25,581.1,1.73,24457162.9,109.55,0.0,True,66.85,0.02,0.43,-0.41,2025-11-05,9.95,0,,15.01,19.6,False,False
05-11-2025 09:00,RYSAS,15.1,15.77,14.94,15.76,19860488.0,0.01,0.66,0.02,2650.0,0.66,6233571.8,218.61,0.02,True,58.21,-0.01,0.14,-0.15,2025-11-05,5.07,0,,13.45,16.27,False,False
05-11-2025 09:00,TATEN,81.3,89.2,80.65,88.4,5634337.0,0.8,7.1,0.65,1000.78,7.1,2475472.6,127.61,0.11,True,66.61,3.22,-0.31,3.53,2025-11-05,8.8,0,,75.85,90.5,False,False
05-11-2025 09:00,TTKOM,52.7,55.0,52.6,55.0,112588006.0,0.0,2.3,0.23,887.12,2.3,31677971.2,255.41,0.0,True,61.79,0.0,0.31,-0.31,2025-11-05,10.0,0,,47.48,61.9,False,False
05-11-2025 09:00,YBTAS,25.86,27.34,25.86,27.34,464907.0,0.0,1.48,0.26,469.23,1.48,215527.3,115.71,0.0,True,58.6,-1.35,0.78,-2.13,2025-11-05,9.98,0,,20.6,47.42,True,False
05-11-2025 09:00,AGESA,210.7,224.3,207.0,223.0,981940.0,1.3,12.3,2.04,502.94,12.3,485352.9,102.31,0.11,True,74.95,9.09,1.25,7.84,2025-11-05,5.84,0,,152.9,ATH,False,False
05-11-2025 09:00,RGYAS,148.0,155.0,147.7,155.0,920132.0,0.0,7.0,0.43,1527.91,7.0,550193.1,67.24,0.0,True,58.08,1.59,0.1,1.5,2025-11-05,4.73,0,,142.9,156.9,False,False
05-11-2025 09:00,BASGZ,42.0,44.4,41.62,44.16,1906282.0,0.24,2.16,0.46,367.53,2.16,1209297.3,57.64,0.11,True,72.56,1.45,0.26,1.19,2025-11-05,5.75,0,,37.46,ATH,False,False
05-11-2025 09:00,FORTE,74.7,78.55,73.5,78.5,2136562.0,0.05,3.8,0.51,645.1,3.8,1324273.3,61.34,0.01,True,58.8,0.87,0.3,0.57,2025-11-05,6.8,0,,64.55,83.25,False,False
04-11-2025 09:00,AVOD,4.5,4.78,4.45,4.78,9819289.0,0.0,0.28,0.02,1020.0,0.28,4751948.4,106.64,0.0,True,60.37,-0.0,0.03,-0.03,2025-11-04,9.89,0,,3.95,6.22,False,False
04-11-2025 09:00,KATMR,3.2,3.52,3.18,3.52,362383200.0,0.0,0.32,0.06,442.37,0.32,198226941.9,82.81,0.0,True,74.17,0.06,0.07,-0.01,2025-11-04,10.0,0,,2.68,3.59,False,False
04-11-2025 09:00,AKSEN,55.0,57.6,54.5,57.5,27256125.0,0.1,2.5,0.61,312.54,2.5,16629971.7,63.9,0.04,True,85.26,3.47,0.76,2.72,2025-11-04,5.02,0,,36.18,ATH,False,False
04-11-2025 09:00,YUNSA,7.73,8.33,7.46,8.22,16780214.0,0.11,0.49,0.1,400.0,0.49,6473213.0,159.23,0.22,True,65.93,0.06,0.09,-0.03,2025-11-04,6.34,0,,6.91,9.74,False,False
04-11-2025 09:00,AKENR,10.76,11.7,10.61,11.7,79685568.0,0.0,0.94,0.14,566.67,0.94,13415254.6,493.99,0.0,True,71.8,0.02,0.15,-0.13,2025-11-04,9.96,0,,9.82,12.02,False,False
04-11-2025 09:00,OYYAT,54.55,59.65,53.75,59.65,1690085.0,0.0,5.1,0.5,909.9,5.1,729671.6,131.62,0.0,True,83.21,2.57,0.26,2.31,2025-11-04,9.95,0,,44.56,ATH,False,False
04-11-2025 09:00,TBORG,197.3,209.0,195.5,208.1,848804.0,0.9,10.8,2.3,369.57,10.8,330795.7,156.59,0.08,True,76.43,6.01,2.18,3.83,2025-11-04,5.69,0,,166.0,ATH,False,False
04-11-2025 09:00,SKYLP,170.0,187.0,153.5,187.0,577117.0,0.0,17.0,3.46,391.33,17.0,293153.1,96.87,0.0,True,70.71,10.34,4.31,6.03,2025-11-04,10.0,0,,120.1,ATH,False,False
04-11-2025 09:00,TUKAS,2.89,3.06,2.85,3.03,415586000.0,0.03,0.14,0.02,723.53,0.14,247409069.8,67.98,0.21,True,59.71,-0.03,0.06,-0.1,2025-11-04,5.21,0,,2.56,4.3,True,False
04-11-2025 09:00,VKING,32.0,34.02,31.4,33.9,2086830.0,0.12,1.9,0.21,787.85,1.9,895982.7,132.91,0.06,True,64.01,0.71,0.34,0.37,2025-11-04,6.34,0,,26.74,48.78,False,False
03-11-2025 09:00,EUHOL,12.36,13.12,12.36,13.12,2034080.0,0.0,0.76,0.27,181.48,0.76,928261.4,119.13,0.0,True,77.26,0.26,0.32,-0.06,2025-11-03,9.97,0,,9.27,13.3,False,False
03-11-2025 09:00,TMPOL,201.0,221.1,201.0,221.1,269897.0,0.0,20.1,1.57,1180.25,20.1,110985.4,143.18,0.0,True,65.26,9.28,-1.95,11.23,2025-11-03,10.0,0,,173.7,225.0,False,False
03-11-2025 09:00,TKNSA,25.02,27.46,25.02,26.88,7797305.0,0.58,1.86,0.28,573.91,1.86,3200068.9,143.66,0.31,True,63.41,-0.12,0.24,-0.35,2025-11-03,7.61,0,,23.34,28.86,False,False
03-11-2025 09:00,SMART,25.52,27.64,25.52,27.32,2854543.0,0.32,1.8,0.3,508.11,1.8,910180.5,213.62,0.18,True,67.72,-0.01,0.3,-0.31,2025-11-03,7.05,0,,23.7,29.02,False,False
03-11-2025 09:00,LYDHO,200.2,213.7,191.9,213.7,4802592.0,0.0,13.5,5.2,159.62,13.5,1784748.3,169.09,0.0,True,85.32,15.14,9.57,5.57,2025-11-03,9.98,0,,113.2,ATH,False,False
03-11-2025 09:00,POLHO,17.61,19.29,17.45,19.21,23530371.0,0.08,1.6,0.13,1169.84,1.6,6938309.7,239.14,0.05,True,57.63,-0.47,0.04,-0.51,2025-11-03,9.52,0,,15.37,24.56,True,True
03-11-2025 09:00,TDGYO,26.5,28.98,26.28,28.94,2583880.0,0.04,2.44,0.68,258.82,2.44,1392139.2,85.61,0.02,True,89.94,1.83,0.6,1.23,2025-11-03,9.79,0,,19.0,ATH,False,False
03-11-2025 09:00,AYCES,435.75,460.5,430.25,454.5,103774.0,6.0,18.75,1.27,1370.59,18.75,56157.8,84.79,0.32,True,62.08,-6.51,4.96,-11.47,2025-11-03,6.5,0,,405.0,461.0,True,False
03-11-2025 09:00,FMIZP,342.75,367.25,342.75,360.75,183017.0,6.5,18.0,5.48,228.77,18.0,100545.0,82.02,0.36,True,72.17,5.37,5.58,-0.21,2025-11-03,5.25,0,,296.5,408.5,False,False
03-11-2025 09:00,MAKTK,15.25,16.53,15.13,16.53,10159992.0,0.0,1.28,0.04,2809.09,1.28,6470004.9,57.03,0.0,True,52.08,-0.87,0.2,-1.06,2025-11-03,9.98,0,,13.95,22.86,True,False
03-11-2025 09:00,PRDGS,7.12,7.83,7.12,7.83,16928357.0,0.0,0.71,0.17,327.71,0.71,7211045.5,134.76,0.0,True,74.61,0.09,0.19,-0.1,2025-11-03,9.97,0,,5.81,8.23,False,False
03-11-2025 09:00,MEGAP,4.5,5.0,4.5,4.94,1501631.0,0.06,0.44,0.11,311.21,0.44,837319.6,79.34,0.14,True,69.61,-0.01,0.11,-0.12,2025-11-03,8.33,0,,3.88,5.91,False,False
03-11-2025 09:00,GENTS,9.2,10.06,9.19,9.96,26355235.0,0.1,0.76,0.02,3700.0,0.76,11217487.6,134.95,0.13,True,64.2,0.19,0.05,0.14,2025-11-03,8.26,0,,8.16,10.2,False,False
03-11-2025 09:00,BRKVY,86.65,95.3,86.25,95.3,3374563.0,0.0,8.65,2.25,284.44,8.65,1458517.5,131.37,0.0,True,72.09,1.38,1.92,-0.54,2025-11-03,9.98,0,,69.45,111.8,False,False
03-11-2025 09:00,SAMAT,6.49,7.1,6.49,7.1,3599433.0,0.0,0.61,0.05,1029.63,0.61,1495342.4,140.71,0.0,True,60.09,-0.09,0.1,-0.19,2025-11-03,9.91,0,,5.94,8.74,True,False
03-11-2025 09:00,OYAYO,39.96,43.34,38.08,43.34,416910.0,0.0,3.38,0.77,338.96,3.38,183069.7,127.73,0.0,True,74.58,1.04,0.75,0.29,2025-11-03,10.0,0,,33.08,ATH,False,False
03-11-2025 09:00,PKENT,233.6,253.0,232.1,253.0,473267.0,0.0,19.4,2.76,602.9,19.4,224902.5,110.43,0.0,True,71.11,-0.08,3.83,-3.92,2025-11-03,10.0,0,,207.9,273.0,True,False
03-11-2025 09:00,YESIL,2.75,3.02,2.75,3.02,191372439.0,0.0,0.27,0.08,255.26,0.27,89045656.3,114.91,0.0,True,71.24,0.08,0.07,0.01,2025-11-03,9.82,0,,2.18,3.52,False,False
03-11-2025 09:00,AHSGY,47.5,51.8,46.52,51.8,2615351.0,0.0,4.3,0.26,1566.67,4.3,1335721.3,95.8,0.0,True,72.97,1.78,0.61,1.17,2025-11-03,9.93,0,,39.6,ATH,False,False
03-11-2025 09:00,IZENR,9.9,10.48,9.83,10.46,43192717.0,0.02,0.56,0.18,216.38,0.56,21119960.1,104.51,0.04,True,68.32,0.11,0.2,-0.08,2025-11-03,8.51,0,,7.79,10.76,False,False
03-11-2025 09:00,PARSN,93.35,98.05,93.35,98.0,413049.0,0.05,4.65,1.1,322.73,4.65,257152.9,60.62,0.01,True,57.3,-0.91,0.83,-1.74,2025-11-03,5.04,0,,87.8,112.8,True,False
03-11-2025 09:00,DOGUB,53.0,58.85,53.0,58.85,2724307.0,0.0,5.85,1.23,375.61,5.85,1463388.6,86.16,0.0,True,79.7,9.62,2.61,7.01,2025-11-03,0.0,0,,20.18,ATH,False,False
03-11-2025 09:00,OZYSR,35.64,38.5,35.1,37.92,2068094.0,0.58,2.28,0.66,244.41,2.28,1050735.5,96.82,0.25,True,72.65,0.9,0.45,0.45,2025-11-03,7.12,0,,30.5,ATH,False,False
03-11-2025 09:00,ERBOS,195.4,204.4,195.1,202.0,101989.0,2.4,6.6,1.23,436.59,6.6,64668.7,57.71,0.36,True,67.82,1.76,2.14,-0.38,2025-11-03,3.86,0,,175.6,212.2,False,False
03-11-2025 09:00,SURGY,47.66,50.6,47.14,50.6,6865925.0,0.0,2.94,0.36,712.15,2.94,3341994.6,105.44,0.0,True,63.41,-0.16,0.77,-0.94,2025-11-03,7.2,0,,42.94,73.5,False,False
03-11-2025 09:00,BTCIM,4.37,4.7,4.32,4.66,284812770.0,0.04,0.29,0.04,544.44,0.29,147327292.5,93.32,0.14,True,64.66,0.01,0.05,-0.04,2025-11-03,6.15,0,,4.02,5.09,False,False
03-11-2025 09:00,ENDAE,16.3,16.87,16.3,16.79,4536849.0,0.08,0.49,0.08,504.94,0.49,2226953.2,103.72,0.16,True,59.72,-0.04,0.18,-0.22,2025-11-03,3.2,0,,15.07,17.63,False,False
03-11-2025 09:00,SEKUR,13.58,14.67,13.33,14.64,1698621.0,0.03,1.06,0.0,26400.0,1.06,735389.2,130.98,0.03,True,51.72,-0.39,0.04,-0.43,2025-11-03,7.89,0,,13.99,18.82,True,True
03-11-2025 09:00,KMPUR,16.95,18.64,16.95,18.64,6134349.0,0.0,1.69,0.11,1408.93,1.69,2007864.2,205.52,0.0,True,64.31,-0.16,0.13,-0.29,2025-11-03,9.97,0,,16.07,20.18,True,True
03-11-2025 09:00,SILVR,3.02,3.24,2.97,3.19,7131391.0,0.05,0.17,0.01,1316.67,0.17,4540476.7,57.06,0.29,True,57.51,0.01,-0.01,0.02,2025-11-03,5.63,0,,2.64,3.59,False,False
31-10-2025 09:00,BEYAZ,29.2,31.34,29.2,31.34,3956713.0,0.0,2.14,0.09,2331.82,2.14,1679990.6,135.52,0.0,True,54.74,-0.86,0.22,-1.08,2025-10-31,9.96,0,,27.56,44.0,True,True
31-10-2025 09:00,FADE,15.1,15.87,14.85,15.8,2562185.0,0.07,0.7,0.04,1791.89,0.7,1343362.4,90.73,0.1,True,58.1,-0.03,0.06,-0.09,2025-10-31,4.64,0,,13.66,16.17,False,False
31-10-2025 09:00,RUBNS,19.6,20.24,19.1,20.2,1661628.0,0.04,0.6,0.07,745.07,0.6,961865.7,72.75,0.07,True,44.64,-0.53,0.08,-0.61,2025-10-31,1.76,0,,18.8,23.98,True,False
31-10-2025 09:00,NTGAZ,10.71,11.29,10.57,11.2,10928366.0,0.09,0.49,0.17,180.0,0.49,6927718.2,57.75,0.18,True,74.51,0.26,0.19,0.08,2025-10-31,4.67,0,,9.04,11.87,False,False
31-10-2025 09:00,DENGE,3.32,3.57,3.31,3.57,127099144.0,0.0,0.25,0.07,247.22,0.25,49214224.8,158.26,0.0,True,78.06,0.08,0.08,-0.0,2025-10-31,9.85,0,,2.57,ATH,False,False
31-10-2025 09:00,IPEKE,72.9,77.95,72.65,77.9,4092242.0,0.05,5.0,0.39,1182.05,5.0,2726888.3,50.07,0.01,True,63.72,1.13,0.12,1.01,2025-10-31,7.45,0,,66.5,80.8,False,False
31-10-2025 09:00,BNTAS,6.78,7.1,6.74,7.07,9682146.0,0.03,0.29,0.03,974.07,0.29,5551677.7,74.4,0.1,True,61.22,-0.05,0.07,-0.12,2025-10-31,4.74,0,,6.32,7.14,False,False
31-10-2025 09:00,SUWEN,10.75,11.78,10.75,11.78,34039256.0,0.0,1.03,0.12,787.93,1.03,7464121.7,356.04,0.0,True,66.99,-0.01,0.13,-0.14,2025-10-31,9.99,0,,10.0,12.54,False,False
31-10-2025 09:00,KBORU,13.67,15.7,13.43,15.4,36764902.0,0.3,1.73,0.2,748.04,1.73,9682032.8,279.72,0.17,True,62.4,-0.19,0.17,-0.36,2025-10-31,7.32,0,,13.02,17.18,True,False
31-10-2025 09:00,KIMMR,14.36,15.21,14.11,15.07,8938938.0,0.14,0.71,0.11,576.19,0.71,2248431.1,297.56,0.2,True,58.01,-0.11,0.11,-0.22,2025-10-31,8.97,0,,12.62,17.5,False,False
31-10-2025 09:00,LIDFA,4.09,4.29,4.08,4.26,12742777.0,0.03,0.17,0.03,466.67,0.17,7882189.7,61.67,0.18,True,64.96,0.05,0.05,-0.0,2025-10-31,4.16,0,,3.59,4.46,False,False
31-10-2025 09:00,VRGYO,3.34,3.56,3.32,3.53,62528737.0,0.03,0.19,0.03,458.82,0.19,33700769.9,85.54,0.16,True,65.16,0.01,0.05,-0.04,2025-10-31,5.06,0,,2.9,3.7,False,False
31-10-2025 09:00,KRTEK,35.0,37.04,34.26,37.04,2582692.0,0.0,2.04,0.3,589.19,2.04,1178413.7,119.17,0.0,True,68.84,0.61,0.49,0.13,2025-10-31,9.98,0,,29.16,ATH,False,False
31-10-2025 09:00,ANHYT,99.2,104.4,98.55,103.2,2669216.0,1.2,4.0,0.78,409.55,4.0,1595588.8,67.29,0.3,True,69.76,3.16,0.62,2.54,2025-10-31,4.35,0,,86.65,ATH,False,False
30-10-2025 09:00,OZSUB,17.81,19.19,17.81,19.01,2737804.0,0.18,1.2,0.23,428.63,1.2,1306608.2,109.54,0.15,True,57.63,-0.24,0.22,-0.46,2025-10-30,6.74,0,,16.53,22.14,False,False
30-10-2025 09:00,BRSAN,407.25,447.0,407.25,438.0,3262349.0,9.0,30.75,2.48,1142.42,30.75,1224358.6,166.45,0.29,True,58.99,-4.04,3.74,-7.78,2025-10-30,7.75,0,,383.5,480.0,True,False
30-10-2025 09:00,TUREX,8.04,8.8,8.0,8.8,86543807.0,0.0,0.76,0.06,1188.14,0.76,34107249.4,153.74,0.0,True,60.52,-0.2,0.12,-0.32,2025-10-30,10.0,0,,7.54,9.42,True,False
30-10-2025 09:00,ONRYT,79.8,85.4,79.75,84.45,1221593.0,0.95,4.65,0.75,520.0,4.65,691015.4,76.78,0.2,True,59.94,-0.16,0.94,-1.1,2025-10-30,5.83,0,,72.0,94.55,False,False
30-10-2025 09:00,HUBVC,3.55,3.91,3.45,3.91,20333955.0,0.0,0.36,0.1,267.35,0.36,9247983.3,119.87,0.0,True,72.0,0.18,0.08,0.1,2025-10-30,9.83,0,,2.72,ATH,False,False
30-10-2025 09:00,ALKIM,18.62,20.48,18.55,20.18,10170824.0,0.3,1.56,0.04,3900.0,1.56,3180289.8,219.81,0.19,True,54.59,-0.22,-0.09,-0.14,2025-10-30,8.38,0,,17.94,25.34,False,False
30-10-2025 09:00,BRYAT,2129.0,2321.0,2127.0,2321.0,146300.0,0.0,192.0,19.8,869.7,192.0,92316.1,58.48,0.0,True,59.26,-38.27,33.36,-71.63,2025-10-30,10.0,0,,1898.0,2557.5,False,False
30-10-2025 09:00,ALFAS,42.3,44.44,42.3,43.9,2260167.0,0.54,1.6,0.08,1851.22,1.6,1176835.6,92.05,0.34,True,52.03,-0.95,0.27,-1.22,2025-10-30,3.78,0,,40.18,51.3,True,False
30-10-2025 09:00,VAKFN,1.82,1.93,1.82,1.92,189766359.0,0.01,0.1,0.01,1566.67,0.1,88542005.7,114.32,0.1,True,57.29,-0.01,0.01,-0.02,2025-10-30,5.49,0,,1.74,2.2,False,False
30-10-2025 09:00,KARSN,9.97,10.95,9.97,10.8,32419430.0,0.15,0.83,0.06,1306.78,0.83,11826123.5,174.13,0.18,True,56.89,-0.22,0.09,-0.3,2025-10-30,8.43,0,,9.38,12.12,True,False
30-10-2025 09:00,YIGIT,25.1,27.26,25.1,26.68,5100472.0,0.58,1.58,0.18,768.13,1.58,2480782.8,105.6,0.37,True,58.69,-0.43,0.22,-0.65,2025-10-30,6.55,0,,23.26,29.38,True,False
30-10-2025 09:00,ADGYO,47.74,51.8,45.36,51.35,1542112.0,0.45,3.61,0.55,557.56,3.61,961214.7,60.43,0.12,True,56.77,-0.5,0.18,-0.68,2025-10-30,7.56,0,,43.74,60.1,False,False
30-10-2025 09:00,ADEL,29.66,31.92,29.64,31.74,3140371.0,0.18,2.08,0.05,3751.85,2.08,1693911.1,85.39,0.09,True,55.92,-0.7,0.31,-1.01,2025-10-30,7.01,0,,28.56,32.84,True,False
30-10-2025 09:00,A1YEN,28.8,31.46,28.8,30.78,4151344.0,0.68,1.98,0.14,1275.0,1.98,1541769.8,169.26,0.34,True,59.23,-0.34,0.26,-0.6,2025-10-30,7.02,0,,27.0,33.96,True,False
30-10-2025 09:00,SEKFK,8.47,9.0,8.38,8.96,1082236.0,0.04,0.49,0.1,375.73,0.49,552589.1,95.85,0.08,True,65.54,0.0,0.1,-0.1,2025-10-30,5.16,0,,7.75,9.59,False,False
30-10-2025 09:00,PRKAB,32.86,36.04,32.86,36.04,1630672.0,0.0,3.18,0.39,719.59,3.18,489885.6,232.87,0.0,True,65.14,-0.19,0.4,-0.58,2025-10-30,9.95,0,,30.04,37.2,False,False
30-10-2025 09:00,KLMSN,34.0,36.9,34.0,36.72,1745396.0,0.18,2.72,0.36,655.56,2.72,887725.2,96.61,0.07,True,54.9,-1.4,0.23,-1.63,2025-10-30,8.45,0,,30.84,55.25,True,True
30-10-2025 09:00,ENTRA,10.45,11.16,10.45,11.09,15571838.0,0.07,0.64,0.09,652.94,0.64,9349640.4,66.55,0.11,True,57.93,-0.17,0.11,-0.29,2025-10-30,6.12,0,,9.91,12.36,True,False
30-10-2025 09:00,ARDYZ,27.8,29.8,27.8,29.46,11169873.0,0.34,1.66,0.29,476.39,1.66,3910059.1,185.67,0.2,True,69.91,0.16,0.47,-0.31,2025-10-30,6.43,0,,24.42,34.16,False,False
30-10-2025 09:00,KTLEV,13.45,14.44,13.35,14.18,73857359.0,0.26,0.73,0.08,873.33,0.73,44432989.6,66.22,0.36,True,64.15,0.24,0.02,0.22,2025-10-30,5.43,0,,12.22,15.74,False,False
30-10-2025 09:00,ARMGD,37.0,38.4,37.0,38.4,6309902.0,0.0,1.4,0.26,438.46,1.4,4206386.6,50.01,0.0,True,73.14,0.95,0.24,0.71,2025-10-30,4.07,0,,31.38,38.5,False,False
30-10-2025 09:00,ETILR,4.24,4.53,4.24,4.48,28932352.0,0.05,0.24,0.02,943.48,0.24,10797718.0,167.95,0.21,True,52.54,-0.1,0.04,-0.14,2025-10-30,5.41,0,,3.99,5.04,True,False
30-10-2025 09:00,METRO,5.54,6.09,5.54,6.09,35858063.0,0.0,0.55,0.07,697.1,0.55,21660859.3,65.54,0.0,True,78.54,0.35,0.07,0.28,2025-10-30,9.93,0,,3.8,ATH,False,False
30-10-2025 09:00,SKTAS,4.63,5.17,4.62,5.17,13547832.0,0.0,0.54,0.06,785.25,0.54,7421628.7,82.55,0.0,True,63.32,0.18,-0.03,0.21,2025-10-30,10.0,0,,4.27,5.9,False,False
30-10-2025 09:00,KOZAL,25.52,27.42,25.4,27.2,139742706.0,0.22,1.68,0.2,731.68,1.68,88886023.3,57.22,0.13,True,62.58,0.3,0.2,0.1,2025-10-30,7.09,0,,23.62,ATH,False,False
28-10-2025 09:30,GARFA,26.6,27.92,26.38,27.82,861662.0,0.1,1.22,0.21,486.54,1.22,471013.0,82.94,0.08,True,58.87,-0.39,0.24,-0.63,2025-10-28,8.42,0,,23.72,30.5,True,False
28-10-2025 09:30,BULGS,40.4,43.38,40.24,43.38,23249181.0,0.0,2.98,0.9,231.11,2.98,11891412.0,95.51,0.0,True,78.44,1.14,1.03,0.11,2025-10-28,9.99,0,,30.44,ATH,False,False
27-10-2025 09:00,MARTI,3.27,3.39,3.26,3.37,46011253.0,0.02,0.1,0.0,2400.0,0.1,28119970.4,63.62,0.2,True,47.15,-0.16,0.03,-0.19,2025-10-27,3.06,0,,2.93,4.38,True,False
27-10-2025 09:00,RUZYE,12.7,13.97,12.69,13.72,27605391.0,0.25,1.02,0.1,962.5,1.02,15626542.1,76.66,0.25,True,64.29,0.31,0.04,0.27,2025-10-27,7.19,0,,11.51,14.82,False,False
27-10-2025 09:00,IZINV,61.95,68.65,61.95,68.65,482877.0,0.0,6.7,0.07,9471.43,6.7,215887.9,123.67,0.0,True,50.97,-2.28,-0.14,-2.14,2025-10-27,9.93,0,,60.75,84.25,True,True
27-10-2025 09:00,VAKKO,65.05,69.25,64.55,69.0,1876657.0,0.25,3.95,0.68,480.88,3.95,1017216.7,84.49,0.06,True,67.54,1.23,0.71,0.51,2025-10-27,6.07,0,,57.0,ATH,False,False
27-10-2025 09:00,MAGEN,23.5,25.7,22.7,25.7,19727261.0,0.0,2.2,0.34,539.53,2.2,9686534.3,103.66,0.0,True,64.89,0.83,0.14,0.68,2025-10-27,9.92,0,,21.16,ATH,False,False
27-10-2025 09:00,BAGFS,33.04,35.78,32.88,35.1,3993957.0,0.68,2.06,0.22,853.7,2.06,1911648.9,108.93,0.33,True,58.92,-0.53,0.38,-0.91,2025-10-27,5.91,0,,30.3,36.56,True,False
27-10-2025 09:00,PCILT,21.18,22.84,21.0,22.84,3085988.0,0.0,1.66,0.12,1260.66,1.66,2029310.0,52.07,0.0,True,49.35,-1.7,0.13,-1.83,2025-10-27,9.91,0,,18.59,37.0,True,True
27-10-2025 09:00,KOPOL,6.6,7.14,6.54,7.02,18772460.0,0.12,0.42,0.08,412.2,0.42,8755881.3,114.4,0.29,True,62.5,-0.04,0.07,-0.11,2025-10-27,5.56,0,,5.76,8.42,False,False
27-10-2025 09:00,BOBET,19.46,20.72,19.45,20.36,9789986.0,0.36,0.9,0.08,1039.24,0.9,4658051.2,110.17,0.4,True,61.23,-0.18,0.15,-0.33,2025-10-27,4.62,0,,17.88,21.06,False,False
27-10-2025 09:00,EGEGY,25.32,27.84,25.32,27.84,2912544.0,0.0,2.52,0.27,826.47,2.52,1169901.1,148.96,0.0,True,61.7,-0.4,0.29,-0.69,2025-10-27,9.95,0,,23.08,29.9,False,False
27-10-2025 09:00,KOCMT,2.73,2.94,2.72,2.91,59826457.0,0.03,0.18,0.02,757.14,0.18,38526532.6,55.29,0.17,True,58.05,-0.05,0.02,-0.07,2025-10-27,6.59,0,,2.49,3.21,False,False
27-10-2025 09:00,DAGI,8.11,8.9,8.06,8.7,25638172.0,0.2,0.59,0.01,8328.57,0.59,12572006.5,103.93,0.34,True,62.12,0.1,0.01,0.09,2025-10-27,7.27,0,,7.69,8.72,False,False
24-10-2025 09:00,GOODY,15.54,16.57,15.42,16.39,9743023.0,0.18,0.85,0.02,4622.22,0.85,1954733.9,398.43,0.21,True,34.18,-0.43,-0.05,-0.37,2025-10-24,-2.56,0,,ATL,19.95,False,False
24-10-2025 09:00,OBASE,36.5,39.0,36.0,38.62,1088376.0,0.38,2.12,0.11,1827.27,2.12,444856.7,144.66,0.18,True,57.13,-0.47,0.29,-0.76,2025-10-24,8.54,0,,34.1,42.14,True,False
24-10-2025 09:00,ISMEN,42.9,46.04,41.94,45.82,18658339.0,0.22,2.92,0.35,724.86,2.92,7678069.6,143.01,0.08,True,63.76,-0.21,0.37,-0.57,2025-10-24,9.46,0,,38.16,46.8,False,False
24-10-2025 09:00,KRDMD,26.9,28.82,26.84,28.44,105966149.0,0.38,1.54,0.25,511.11,1.54,59201917.1,78.99,0.25,True,59.46,-0.38,0.2,-0.58,2025-10-24,6.84,0,,23.72,30.88,False,False
24-10-2025 09:00,DURKN,15.16,15.69,15.13,15.6,3845207.0,0.09,0.44,0.03,1366.67,0.44,2142304.2,79.49,0.2,True,50.09,-0.33,0.07,-0.39,2025-10-24,2.97,0,,14.7,18.09,True,True
24-10-2025 09:00,KCAER,12.73,13.59,12.73,13.59,12567960.0,0.0,0.86,0.05,1769.57,0.86,6111648.3,105.64,0.0,True,53.45,-0.32,0.05,-0.37,2025-10-24,6.84,0,,11.97,15.02,True,True
24-10-2025 09:00,ELITE,31.96,33.48,31.96,33.48,1490208.0,0.0,1.52,0.15,900.0,1.52,970915.0,53.48,0.0,True,54.18,-0.45,0.08,-0.53,2025-10-24,4.76,0,,30.4,36.32,False,False
24-10-2025 09:00,ERCB,72.95,76.55,72.95,76.55,380668.0,0.0,3.6,0.04,8900.0,3.6,226080.6,68.38,0.0,True,51.77,-1.48,0.16,-1.64,2025-10-24,5.37,0,,70.6,87.0,True,True
24-10-2025 09:00,ISCTR,12.25,13.26,12.25,13.18,1474775810.0,0.08,0.93,0.09,944.94,0.93,617612601.0,138.79,0.09,True,54.04,-0.5,0.1,-0.6,2025-10-24,9.29,0,,11.11,15.51,True,False
24-10-2025 09:00,BIMAS,553.0,587.0,548.0,579.5,9761770.0,7.5,26.5,2.9,813.79,26.5,5689896.3,71.56,0.28,True,64.86,4.83,0.54,4.3,2025-10-24,5.94,0,,518.5,ATH,False,False
24-10-2025 09:00,SAFKR,22.86,25.14,22.3,25.14,20340798.0,0.0,2.28,0.16,1325.0,2.28,9748212.7,108.66,0.0,True,69.01,0.61,0.29,0.33,2025-10-24,9.97,0,,19.5,ATH,False,False
24-10-2025 09:00,TATGD,12.3,13.33,12.3,13.33,7343358.0,0.0,1.03,0.09,1044.44,1.03,2053610.8,257.58,0.0,True,59.83,-0.21,0.06,-0.27,2025-10-24,9.98,0,,11.78,13.93,True,True
24-10-2025 09:00,TMSN,100.4,106.4,100.4,106.4,1069239.0,0.0,6.0,0.02,39900.0,6.0,669818.5,59.63,0.0,True,46.95,-4.12,0.4,-4.51,2025-10-24,5.98,0,,97.8,124.4,True,True
24-10-2025 09:00,BEGYO,5.58,6.11,5.58,6.11,72422128.0,0.0,0.53,0.03,1666.67,0.53,28631731.6,152.94,0.0,True,50.49,-0.46,0.15,-0.61,2025-10-24,9.89,0,,5.0,6.21,True,False
24-10-2025 09:00,CATES,32.3,34.0,32.3,33.54,1747964.0,0.46,1.24,0.19,552.63,1.24,1026191.2,70.34,0.37,True,58.33,-0.39,0.26,-0.65,2025-10-24,4.03,0,,29.46,35.68,False,False
24-10-2025 09:00,BIGCH,62.5,66.95,61.0,66.95,677802.0,0.0,4.45,0.79,466.88,4.45,412159.3,64.45,0.0,True,67.78,2.12,0.05,2.07,2025-10-24,6.44,0,,50.0,ATH,False,False
24-10-2025 09:00,BINBN,158.6,176.0,157.2,175.8,2803622.0,0.2,17.2,2.05,739.02,17.2,1322393.9,112.01,0.01,True,67.7,0.07,3.64,-3.57,2025-10-24,9.88,0,,140.3,220.8,False,False
24-10-2025 09:00,TSKB,12.45,13.56,12.41,13.34,56582601.0,0.22,0.89,0.03,2681.25,0.89,31719989.8,78.38,0.25,True,56.87,-0.29,0.05,-0.34,2025-10-24,8.1,0,,11.24,14.26,False,False
24-10-2025 09:00,ARASE,51.9,55.0,51.9,54.4,850521.0,0.6,2.5,0.12,1900.0,2.5,351571.9,141.92,0.24,True,53.93,-0.79,0.18,-0.98,2025-10-24,4.72,0,,49.8,59.25,True,True
24-10-2025 09:00,BIZIM,26.42,27.4,26.42,27.3,633500.0,0.1,0.88,0.0,21900.0,0.88,385517.5,64.32,0.11,True,54.9,-0.22,0.1,-0.33,2025-10-24,3.49,0,,24.98,30.0,False,False
24-10-2025 09:00,BUCIM,6.21,6.41,6.2,6.41,11587157.0,0.0,0.2,0.01,1233.33,0.2,5329763.8,117.4,0.0,True,49.88,-0.15,0.04,-0.19,2025-10-24,3.39,0,,5.99,7.14,True,False
24-10-2025 09:00,TTRAK,553.5,568.0,552.0,564.0,281241.0,4.0,10.5,0.15,6900.0,10.5,155352.1,81.03,0.38,True,48.69,-8.16,1.28,-9.45,2025-10-24,2.64,0,,540.0,608.5,True,True
24-10-2025 09:00,BMSCH,18.57,19.85,18.2,19.85,8954408.0,0.0,1.28,0.27,379.4,1.28,3817019.3,134.59,0.0,True,76.52,0.88,0.3,0.57,2025-10-24,9.97,0,,14.06,ATH,False,False
24-10-2025 09:00,ALARK,80.0,83.35,78.5,82.45,10282183.0,0.9,2.45,0.27,807.41,2.45,4402333.1,133.56,0.37,True,56.81,-0.95,0.56,-1.5,2025-10-24,3.39,0,,75.3,87.15,False,False
24-10-2025 09:00,SEYKM,5.95,6.96,5.95,6.8,3799568.0,0.16,0.85,0.08,924.1,0.85,1615147.4,135.25,0.19,True,56.79,-0.16,-0.02,-0.14,2025-10-24,7.42,0,,5.44,7.94,False,False
24-10-2025 09:00,VKFYO,21.34,22.68,21.1,22.48,212942.0,0.2,1.14,0.04,2614.29,1.14,128817.9,65.3,0.18,True,53.23,-0.36,-0.01,-0.35,2025-10-24,6.84,0,,20.0,26.94,True,True
24-10-2025 09:00,BRKSN,8.15,8.52,8.13,8.5,1121728.0,0.02,0.35,0.03,1150.0,0.35,631168.4,77.72,0.06,True,50.51,-0.16,0.01,-0.16,2025-10-24,4.94,0,,7.81,10.18,False,False
24-10-2025 09:00,AGHOL,25.38,26.56,25.12,26.3,10056801.0,0.26,0.92,0.04,1990.91,0.92,5703265.3,76.33,0.28,True,53.87,-0.38,0.19,-0.57,2025-10-24,4.28,0,,23.9,29.18,True,False
23-10-2025 09:00,DMRGD,25.26,27.72,24.88,27.72,9559158.0,0.0,2.46,0.17,1313.79,2.46,3183721.7,200.25,0.0,True,53.89,-0.76,0.29,-1.05,2025-10-23,10.0,2,24.88,24.88,27.82,True,False
23-10-2025 09:00,HEKTS,3.34,3.66,3.34,3.66,256456129.0,0.0,0.32,0.03,1003.45,0.32,128803501.1,99.11,0.0,True,54.51,-0.14,0.04,-0.18,2025-10-23,9.91,0,,3.12,4.14,True,False
23-10-2025 09:00,ORCAY,3.55,3.98,3.55,3.97,4394254.67,0.02,0.41,0.07,501.16,0.41,2189902.62,100.66,0.04,True,63.13,-0.01,0.02,-0.03,2025-10-23,8.97,0,,3.34,4.54,False,False
23-10-2025 09:00,KAREL,9.65,10.18,9.59,10.07,22823017.0,0.11,0.42,0.05,677.78,0.42,9812988.0,132.58,0.26,True,62.82,-0.02,0.1,-0.12,2025-10-23,4.57,0,,8.42,10.53,False,False
23-10-2025 09:00,GRNYO,14.0,16.4,13.81,16.0,1489128.0,0.4,2.0,0.5,300.0,2.0,812926.6,83.18,0.2,True,64.84,-0.1,0.28,-0.38,2025-10-23,6.67,0,,11.02,18.5,False,False
23-10-2025 09:00,LRSHO,5.64,6.2,5.58,6.12,89766747.0,0.08,0.48,0.01,3900.0,0.48,42032553.4,113.56,0.17,True,57.0,0.03,-0.03,0.06,2025-10-23,8.51,0,,5.38,6.82,False,False
22-10-2025 09:00,GLBMD,13.0,13.98,12.84,13.87,1231168.0,0.11,0.87,0.16,430.49,0.87,492945.1,149.76,0.13,True,58.05,-0.05,0.04,-0.09,2025-10-22,6.53,0,,12.5,14.26,False,False
22-10-2025 09:00,SEGYO,4.19,4.6,4.18,4.6,28830142.0,0.0,0.41,0.01,6733.33,0.41,7724151.0,273.25,0.0,True,57.3,-0.11,0.01,-0.12,2025-10-22,9.79,0,,4.07,5.06,True,True
22-10-2025 09:00,CANTE,1.98,2.16,1.97,2.16,881217560.0,0.0,0.18,0.01,2900.0,0.18,538449170.0,63.66,0.0,True,51.94,-0.06,0.0,-0.07,2025-10-22,9.64,0,,1.93,2.53,True,True
22-10-2025 09:00,ODAS,5.14,5.62,5.13,5.62,96858146.0,0.0,0.48,0.03,1500.0,0.48,39025417.6,148.19,0.0,True,56.49,-0.12,0.02,-0.14,2025-10-22,9.98,0,,4.97,6.07,True,True
22-10-2025 09:00,TSPOR,1.2,1.32,1.19,1.32,1413985690.0,0.0,0.12,0.0,3900.0,0.12,612260243.3,130.95,0.0,True,63.77,-0.01,0.01,-0.01,2025-10-22,10.0,0,,1.15,1.38,True,True
22-10-2025 09:00,AKFIS,22.26,24.38,22.06,24.38,12452709.0,0.0,2.12,0.24,798.31,2.12,6229975.3,99.88,0.0,True,61.37,-0.06,0.23,-0.28,2025-10-22,9.92,0,,20.8,25.36,False,False
21-10-2025 09:00,KZGYO,22.78,25.0,22.38,25.0,5608615.0,0.0,2.22,0.18,1161.36,2.22,1539262.3,264.37,0.0,True,64.05,-0.29,0.23,-0.52,2025-10-21,9.94,0,,21.02,25.38,True,False
21-10-2025 09:00,GSRAY,1.45,1.54,1.44,1.52,771061230.0,0.02,0.07,0.01,677.78,0.07,352769973.5,118.57,0.29,True,59.33,-0.02,0.01,-0.03,2025-10-21,5.56,0,,1.33,1.63,True,False
21-10-2025 09:00,ANSGR,21.9,22.56,21.86,22.52,18367795.0,0.04,0.62,0.1,545.83,0.62,9607827.2,91.18,0.06,True,60.36,0.02,0.15,-0.14,2025-10-21,3.3,0,,20.28,25.58,False,False
21-10-2025 09:00,KLKIM,32.14,34.24,32.08,33.8,4349211.0,0.44,1.66,0.08,1975.0,1.66,2196692.8,97.99,0.27,True,51.68,-0.7,-0.05,-0.66,2025-10-21,5.23,0,,30.12,38.4,True,True
21-10-2025 09:00,MTRKS,25.18,27.68,25.16,27.24,5154001.0,0.44,2.06,0.29,605.48,2.06,1764635.1,192.07,0.21,True,60.68,-0.25,0.11,-0.37,2025-10-21,8.18,0,,23.22,30.8,False,False
21-10-2025 09:00,TURSG,10.1,10.94,9.79,10.72,167475411.0,0.22,0.62,0.08,629.41,0.62,36651571.8,356.94,0.35,True,69.15,0.15,0.12,0.03,2025-10-21,7.74,0,,8.99,ATH,False,False
21-10-2025 09:00,IEYHO,24.06,29.38,24.06,29.08,66639825.0,0.3,5.02,0.46,986.58,5.02,30860820.2,115.94,0.06,True,50.49,2.58,-1.26,3.84,2025-10-21,8.83,2,24.06,24.06,39.32,False,False
21-10-2025 09:00,GSDHO,4.27,4.68,4.2,4.68,30114375.0,0.0,0.41,0.0,10150.0,0.41,9892940.4,204.4,0.0,True,56.89,-0.11,0.01,-0.11,2025-10-21,9.86,0,,4.09,5.11,True,True
21-10-2025 09:00,PSDTC,146.3,161.1,146.3,161.1,157070.0,0.0,14.8,0.5,2860.0,14.8,83015.0,89.21,0.0,True,54.67,-0.91,-0.27,-0.63,2025-10-21,9.97,0,,143.1,170.6,False,False
21-10-2025 09:00,CEMZY,36.28,39.98,35.92,39.58,4000659.0,0.4,3.3,0.82,302.44,3.3,2443283.1,63.74,0.12,True,74.84,1.97,0.46,1.51,2025-10-21,8.44,0,,27.14,ATH,False,False
21-10-2025 09:00,OFSYM,73.65,80.85,73.65,80.6,5171873.0,0.25,6.95,1.6,333.02,6.95,1594378.4,224.38,0.04,True,81.09,3.55,0.95,2.6,2025-10-21,9.66,0,,63.5,ATH,False,False
21-10-2025 09:00,BURCE,25.0,29.3,24.3,29.3,16790003.0,0.0,4.3,0.25,1592.91,4.3,11184753.7,50.12,0.0,True,72.69,2.44,1.01,1.43,2025-10-21,9.98,0,,18.04,ATH,False,False
21-10-2025 09:00,DGATE,72.0,76.8,71.95,76.8,912892.0,0.0,4.8,0.57,742.11,4.8,487281.9,87.34,0.0,True,58.0,-1.45,0.48,-1.93,2025-10-21,8.17,0,,68.3,82.55,False,False
20-10-2025 09:00,PASEU,137.5,151.2,131.7,151.2,14941628.0,0.0,13.7,4.53,202.43,13.7,6684200.2,123.54,0.0,True,76.27,7.11,2.79,4.32,2025-10-20,9.96,0,,104.7,ATH,False,False
20-10-2025 09:00,BRISA,84.05,91.6,84.05,91.4,1881798.0,0.2,7.35,1.22,502.46,7.35,660222.5,185.02,0.03,True,70.35,1.21,0.81,0.4,2025-10-20,9.0,0,,75.0,ATH,False,False
20-10-2025 09:00,INTEM,280.0,309.0,278.0,309.0,331644.0,0.0,29.0,3.01,861.86,29.0,209424.4,58.36,0.0,True,67.87,6.32,2.77,3.55,2025-10-20,9.96,0,,248.7,ATH,False,False
20-10-2025 09:00,INFO,3.73,4.07,3.73,4.07,112420547.0,0.0,0.34,0.04,794.74,0.34,71052554.0,58.22,0.0,True,57.64,0.03,0.04,-0.01,2025-10-20,10.0,0,,3.4,4.17,False,False
17-10-2025 09:00,BAYRK,32.3,35.52,30.04,35.52,10027407.0,0.0,3.22,0.51,526.46,3.22,4741692.9,111.47,0.0,True,58.9,0.43,-0.06,0.49,2025-10-17,9.97,2,30.04,30.04,41.32,False,False
17-10-2025 09:00,ONCSM,159.8,175.7,151.0,173.4,4850875.0,2.3,13.6,1.71,695.32,13.6,2860006.6,69.61,0.17,True,72.95,12.41,5.45,6.96,2025-10-17,8.51,0,,106.9,ATH,False,False
16-10-2025 09:00,HOROZ,62.25,67.5,61.7,66.4,4244002.0,1.1,4.15,0.49,755.67,4.15,2478527.3,71.23,0.27,True,67.21,0.97,0.52,0.44,2025-10-16,6.58,0,,58.95,74.4,False,False
16-10-2025 09:00,PINSU,12.74,14.03,12.7,14.03,47287597.0,0.0,1.29,0.12,948.78,1.29,16216523.4,191.6,0.0,True,68.66,0.35,0.22,0.13,2025-10-16,9.95,0,,11.01,14.75,False,False
15-10-2025 09:00,SNPAM,23.72,24.8,23.72,24.8,192735.0,0.0,1.08,0.01,10700.0,1.08,123524.9,56.03,0.0,True,52.42,-0.58,0.41,-1.0,2025-10-15,4.73,0,,22.3,37.94,True,False
15-10-2025 09:00,BAHKM,49.96,54.95,49.96,54.95,3755595.0,0.0,4.99,0.42,1082.46,4.99,1257474.0,198.66,0.0,True,56.0,-0.78,0.44,-1.22,2025-10-15,9.99,0,,49.0,60.7,True,False
15-10-2025 09:00,MACKO,39.66,42.64,39.66,41.82,2028689.0,0.82,2.16,0.37,483.78,2.16,1012998.7,100.27,0.38,True,60.05,0.35,0.17,0.17,2025-10-15,5.98,0,,37.44,43.14,False,False
15-10-2025 09:00,OYLUM,10.35,11.04,10.23,10.98,2719311.0,0.06,0.63,0.0,62900.0,0.63,1634278.8,66.39,0.1,True,60.41,0.36,-0.08,0.44,2025-10-15,5.78,0,,10.14,11.82,False,False
15-10-2025 09:00,ENKAI,69.5,74.1,68.35,73.65,21554931.0,0.45,4.15,0.23,1704.35,4.15,13108132.4,64.44,0.11,True,58.87,-0.29,0.03,-0.32,2025-10-15,5.97,0,,67.75,77.65,False,False
14-10-2025 09:00,HDFGS,3.94,4.33,3.55,4.3,154592531.0,0.03,0.36,0.06,542.86,0.36,98656397.5,56.7,0.08,True,78.12,0.31,0.15,0.16,2025-10-14,9.14,0,,2.43,ATH,False,False
14-10-2025 09:00,OSMEN,8.86,9.44,8.8,9.35,9809053.0,0.09,0.49,0.04,1066.67,0.49,3223268.1,204.32,0.18,True,56.94,-0.17,0.07,-0.24,2025-10-14,5.77,0,,8.24,9.62,True,False
14-10-2025 09:00,BORLS,24.16,26.5,23.8,25.98,5926782.0,0.52,1.82,0.14,1181.69,1.82,2572649.9,130.38,0.29,True,58.59,0.42,-0.05,0.47,2025-10-14,7.53,2,23.8,23.8,29.94,False,False
14-10-2025 09:00,MARMR,5.08,5.94,5.08,5.94,164988018.0,0.0,0.86,0.02,4677.78,0.86,73105537.9,125.68,0.0,True,67.25,,,,2025-10-14,10.0,0,,ATL,8.12,False,False
13-10-2025 09:00,MMCAS,69.0,72.0,69.0,72.0,235008.0,0.0,3.0,0.01,29900.0,3.0,57596.6,308.02,0.0,True,46.86,-0.09,-0.91,0.81,2025-10-13,1.41,0,,67.5,80.0,False,False
13-10-2025 09:00,BVSAN,132.5,147.2,131.0,143.0,2822891.0,4.2,10.5,2.59,305.41,10.5,1824137.3,54.75,0.4,True,71.8,6.49,2.01,4.49,2025-10-13,6.72,0,,108.0,ATH,False,False
13-10-2025 09:00,EKOS,24.7,27.68,24.64,27.16,15578441.0,0.52,2.46,0.26,846.15,2.46,4745352.2,228.29,0.21,True,59.3,0.08,0.13,-0.06,2025-10-13,7.78,1,27.68,23.62,27.68,False,False
13-10-2025 09:00,BURVA,131.5,145.5,130.0,144.0,178416.0,1.5,12.5,2.01,521.89,12.5,105324.9,69.4,0.12,True,70.65,3.92,1.35,2.57,2025-10-13,5.49,0,,117.0,ATH,False,False
10-10-2025 09:00,OZRDN,10.5,11.5,9.98,11.4,2019790.0,0.1,0.9,0.18,405.62,0.9,834873.7,141.93,0.11,True,70.64,0.26,0.1,0.16,2025-10-10,8.88,0,,9.04,ATH,False,False
10-10-2025 09:00,AYES,15.1,15.99,15.1,15.99,184942.0,0.0,0.89,0.04,2442.86,0.89,98552.7,87.66,0.0,True,59.32,-0.29,0.17,-0.45,2025-10-10,9.97,0,,13.66,19.05,True,False
10-10-2025 09:00,ARZUM,3.3,3.63,3.14,3.63,88783794.0,0.0,0.33,0.07,385.29,0.33,29884370.4,197.09,0.0,True,72.0,0.08,0.06,0.01,2025-10-10,10.0,0,,2.77,ATH,False,False
10-10-2025 09:00,CLEBI,1547.0,1644.0,1543.0,1638.0,180369.0,6.0,91.0,7.7,1081.82,91.0,74186.6,143.13,0.07,True,59.26,-9.73,10.59,-20.33,2025-10-10,6.36,1,1644.0,1490.0,1644.0,False,False
10-10-2025 09:00,DUNYH,107.0,130.6,107.0,130.6,3182785.0,0.0,23.6,0.46,4975.27,23.6,1275641.7,149.5,0.0,True,72.7,10.15,5.28,4.87,2025-10-10,9.93,0,,73.0,145.2,False,False
10-10-2025 09:00,NUHCM,246.2,269.0,234.0,265.75,529495.0,3.25,19.55,2.84,587.17,19.55,280651.0,88.67,0.17,True,77.13,4.73,3.94,0.8,2025-10-10,8.47,0,,216.6,ATH,False,False
10-10-2025 09:00,KERVN,2.41,2.71,2.41,2.71,1004487.0,0.0,0.3,0.01,2627.27,0.3,620790.2,61.81,0.0,True,49.77,-0.1,-0.0,-0.1,2025-10-10,9.72,1,2.71,2.6,4.08,True,True
10-10-2025 09:00,YYAPI,1.99,2.16,1.96,2.14,634182210.0,0.02,0.15,0.01,1400.0,0.15,275186690.7,130.46,0.13,True,62.75,0.03,-0.0,0.04,2025-10-10,8.08,0,,1.78,2.19,False,False
10-10-2025 09:00,ESCOM,2.98,3.25,2.96,3.25,90285240.0,0.0,0.27,0.01,2900.0,0.27,21705449.0,315.96,0.0,True,59.32,-0.04,0.01,-0.05,2025-10-10,9.8,0,,2.94,3.4,False,False
09-10-2025 09:00,PEKGY,9.3,10.15,9.23,10.15,795189880.0,0.0,0.85,0.14,490.28,0.85,497526417.0,59.83,0.0,True,74.67,0.56,0.13,0.43,2025-10-09,9.97,0,,6.29,ATH,False,False
09-10-2025 09:00,RNPOL,36.64,39.98,36.64,39.98,421828.0,0.0,3.34,0.21,1505.77,3.34,226728.1,86.05,0.0,True,56.62,-0.34,-0.1,-0.24,2025-10-09,9.18,0,,35.02,42.9,False,False
09-10-2025 09:00,ERSU,19.06,20.96,18.5,20.96,1693220.0,0.0,1.9,0.26,630.77,1.9,670004.5,152.72,0.0,True,64.22,0.28,-0.0,0.28,2025-10-09,9.97,0,,18.19,21.3,False,False
09-10-2025 09:00,TABGD,229.4,243.0,228.9,240.6,2491282.0,2.4,11.2,0.03,37233.33,11.2,1015563.2,145.31,0.21,True,67.13,4.34,-0.78,5.12,2025-10-09,5.16,0,,224.0,ATH,False,False
09-10-2025 09:00,SARKY,14.74,15.71,14.69,15.5,4576374.0,0.21,0.76,0.03,2351.61,0.76,2997402.2,52.68,0.28,True,69.07,0.52,-0.02,0.54,2025-10-09,5.66,1,15.71,12.35,15.71,False,False
09-10-2025 09:00,DOFER,59.5,65.45,59.25,65.45,4349773.0,0.0,5.95,1.04,472.12,5.95,2274209.3,91.27,0.0,True,78.7,3.06,0.52,2.54,2025-10-09,10.0,1,65.45,45.1,ATH,False,False
09-10-2025 09:00,SMRVA,285.0,308.0,277.0,308.0,6859610.0,0.0,23.0,1.45,1486.21,23.0,2341285.8,192.98,0.0,True,64.29,13.23,-0.81,14.04,2025-10-09,10.0,0,,240.1,318.5,False,False
09-10-2025 09:00,FONET,2.46,2.7,2.46,2.7,114189175.27,0.0,0.24,0.02,1172.73,0.24,37852540.99,201.67,0.0,True,59.91,0.0,0.0,0.0,2025-10-09,9.96,0,,2.44,2.77,False,False
08-10-2025 09:00,AVGYO,15.34,17.91,14.67,17.91,6936000.0,0.0,2.57,0.2,1204.57,2.57,3341016.5,107.6,0.0,True,67.59,1.01,0.43,0.59,2025-10-08,9.94,0,,12.3,19.89,False,False
08-10-2025 09:00,TRCAS,36.8,38.76,36.68,38.52,2850633.0,0.24,1.72,0.12,1333.33,1.72,1373246.7,107.58,0.14,True,58.33,0.43,-0.01,0.44,2025-10-08,4.33,0,,33.34,39.66,False,False
08-10-2025 09:00,ALKLC,88.65,97.5,88.5,97.1,5486169.0,0.4,8.45,0.5,1590.0,8.45,2667462.5,105.67,0.05,True,71.54,3.25,0.35,2.89,2025-10-08,9.53,0,,73.3,ATH,False,False
07-10-2025 09:00,HEDEF,56.9,67.8,56.9,66.85,12707961.0,0.95,9.95,2.33,327.04,9.95,7094682.2,79.12,0.1,True,79.73,12.05,2.12,9.93,2025-10-07,5.78,0,,9.65,74.95,False,False
07-10-2025 09:00,GUNDG,90.85,101.0,89.6,100.9,3312245.0,0.1,10.05,0.88,1042.05,10.05,846030.3,291.5,0.01,True,59.65,1.39,-0.97,2.36,2025-10-07,9.79,2,89.6,89.6,110.9,False,False
07-10-2025 09:00,TOASO,268.5,279.5,265.25,278.75,7167757.0,0.75,10.25,1.35,659.26,10.25,3820405.8,87.62,0.07,True,67.53,7.8,0.7,7.1,2025-10-07,3.62,0,,251.75,ATH,False,False
07-10-2025 09:00,GLYHO,8.97,9.83,8.93,9.83,56786898.0,0.0,0.86,0.11,688.99,0.86,31837640.7,78.36,0.0,True,64.68,0.02,0.09,-0.06,2025-10-07,9.96,0,,8.11,9.88,False,False
07-10-2025 09:00,TGSAS,180.0,199.8,179.0,199.8,241715.0,0.0,19.8,2.2,800.0,19.8,149527.7,61.65,0.0,True,52.66,-3.64,-1.51,-2.13,2025-10-07,9.96,0,,176.1,256.5,False,False
06-10-2025 09:00,GRTHO,519.5,563.0,512.0,552.0,1529116.0,11.0,32.5,2.4,1254.17,32.5,670125.3,128.18,0.34,True,65.0,15.35,1.74,13.61,2025-10-06,6.56,0,,470.75,ATH,False,False
06-10-2025 09:00,CRFSA,93.0,100.0,92.85,100.0,2187250.0,0.0,7.0,1.2,483.33,7.0,612974.4,256.83,0.0,True,75.0,1.87,1.4,0.47,2025-10-06,9.95,0,,81.75,ATH,False,False
06-10-2025 09:00,CEMTS,11.44,12.32,11.4,12.32,20519363.0,0.0,0.88,0.04,2344.44,0.88,6895837.0,197.56,0.0,True,62.82,-0.11,0.07,-0.18,2025-10-06,10.0,0,,10.76,13.31,False,False
06-10-2025 09:00,TERA,151.65,166.5,147.94,166.5,19080124.44,0.0,14.85,1.8,725.0,14.85,11109242.67,71.75,0.0,True,74.16,5.58,0.44,5.14,2025-10-06,9.96,0,,134.78,ATH,False,False
06-10-2025 09:00,ODINE,156.2,167.4,156.2,165.9,1639204.0,1.5,9.7,0.83,1068.67,9.7,814972.5,101.14,0.15,True,69.41,4.66,0.47,4.19,2025-10-06,6.21,0,,144.0,ATH,False,False
03-10-2025 09:00,OZATD,226.4,242.8,222.5,240.8,837526.0,2.0,14.4,0.51,2723.53,14.4,349094.5,139.91,0.14,True,60.53,2.55,0.22,2.33,2025-10-03,6.36,0,,210.5,248.1,False,False
03-10-2025 09:00,PAMEL,93.6,100.8,93.6,99.7,746878.0,1.1,6.1,1.1,454.55,6.1,374612.0,99.37,0.18,True,38.34,-5.33,-2.21,-3.12,2025-10-03,3.58,0,,86.35,138.6,False,False
03-10-2025 09:00,RTALB,4.13,4.52,4.0,4.52,271513870.0,0.0,0.39,0.02,1460.0,0.39,118362431.2,129.39,0.0,True,69.26,0.13,0.06,0.07,2025-10-03,9.98,0,,3.28,ATH,False,False
02-10-2025 09:00,DEVA,68.9,72.45,68.9,71.95,1882977.0,0.5,3.05,0.43,609.3,3.05,846369.5,122.48,0.16,True,66.47,0.97,0.37,0.61,2025-10-02,4.58,0,,61.4,ATH,False,False
01-10-2025 09:00,PAGYO,87.0,95.7,86.55,95.65,622484.0,0.05,8.65,0.68,1172.06,8.65,198287.7,213.93,0.01,True,73.55,2.74,0.28,2.46,2025-10-01,9.94,0,,77.75,ATH,False,False
01-10-2025 09:00,KZBGY,15.34,16.58,14.8,16.44,35754506.0,0.14,1.1,0.16,570.73,1.1,21738758.3,64.47,0.13,True,63.95,0.66,0.1,0.56,2025-10-01,6.34,0,,13.04,ATH,False,False
01-10-2025 09:00,SANFM,7.71,8.48,7.64,8.48,73269631.0,0.0,0.77,0.1,708.82,0.77,32210633.45,127.47,0.0,True,64.6,0.14,0.1,0.04,2025-10-01,9.99,0,,6.54,8.5,False,False
01-10-2025 09:00,NETAS,76.3,83.7,75.5,83.7,1790156.0,0.0,7.4,0.01,73900.0,7.4,900979.9,98.69,0.0,True,60.99,2.32,-0.38,2.7,2025-10-01,9.99,2,75.5,75.5,94.95,False,False
01-10-2025 09:00,GEREL,20.44,22.44,20.32,22.44,18868619.0,0.0,2.0,0.08,2431.65,2.0,7820212.6,141.28,0.0,True,60.23,-0.01,0.05,-0.07,2025-10-01,10.0,0,,19.53,22.92,False,False
01-10-2025 09:00,GENIL,184.9,196.0,182.5,194.5,2041960.0,1.5,9.6,2.81,241.64,9.6,1258966.9,62.19,0.16,True,67.66,1.67,3.54,-1.88,2025-10-01,5.19,0,,150.0,216.0,False,False
01-10-2025 09:00,DSTKF,621.0,704.5,600.5,700.0,5935189.0,4.5,79.0,5.7,1285.96,79.0,3286813.7,80.58,0.06,True,51.4,18.5,-2.11,20.61,2025-10-01,4.95,0,,526.5,874.0,False,False
01-10-2025 09:00,FORMT,3.86,4.09,3.82,4.03,107285141.0,0.06,0.17,0.0,8400.0,0.17,65275926.9,64.36,0.35,True,61.2,0.02,0.01,0.01,2025-10-01,4.95,0,,3.74,4.61,False,False
30-09-2025 09:00,ETYAT,21.76,24.04,21.76,23.9,2290498.0,0.14,2.14,0.69,211.5,2.14,1066251.9,114.82,0.07,True,83.54,1.36,0.74,0.62,2025-09-30,7.75,0,,14.38,ATH,False,False
30-09-2025 09:00,TARKM,420.5,462.0,420.5,462.0,1379558.0,0.0,41.5,3.12,1228.0,41.5,334154.3,312.85,0.0,True,67.04,9.61,2.04,7.57,2025-09-30,10.0,0,,369.0,463.0,False,False
30-09-2025 09:00,MOPAS,35.92,39.3,35.44,39.28,15554950.0,0.02,3.36,0.53,531.58,3.36,7174257.8,116.82,0.01,True,73.36,0.53,0.8,-0.26,2025-09-30,9.84,1,39.3,30.22,39.3,False,False
30-09-2025 09:00,GRSEL,341.5,368.0,341.0,368.0,1621601.0,0.0,26.5,1.68,1482.09,26.5,835657.6,94.05,0.0,True,62.97,8.47,-0.25,8.72,2025-09-30,7.76,0,,315.75,ATH,False,False
29-09-2025 09:00,YAYLA,37.04,41.02,36.76,39.9,1440977.0,1.12,2.86,0.39,640.93,2.86,723733.8,99.1,0.39,True,56.78,-0.12,-0.12,0.01,2025-09-29,6.97,0,,35.32,47.28,False,False
26-09-2025 09:00,ECZYT,251.0,276.75,247.1,276.75,1688339.0,0.0,25.75,6.34,306.15,25.75,600287.1,181.26,0.0,True,76.25,7.19,3.68,3.51,2025-09-26,9.93,0,,207.9,ATH,False,False
26-09-2025 09:00,MTRYO,8.21,9.14,8.21,9.14,2439146.0,0.0,0.93,0.15,532.65,0.93,572974.9,325.7,0.0,True,70.08,0.16,0.08,0.08,2025-09-26,9.99,0,,7.45,ATH,False,False
26-09-2025 09:00,DOFRB,94.25,115.1,94.25,115.1,60466195.0,0.0,20.85,1.95,966.5,20.85,23962865.7,152.33,0.0,True,,,,,2025-09-26,9.93,0,,ATL,ATH,False,False
25-09-2025 09:00,VANGD,44.98,50.25,44.24,50.25,1417804.0,0.0,5.27,0.68,678.43,5.27,601237.4,135.81,0.0,True,71.56,1.43,0.94,0.5,2025-09-25,9.91,0,,36.0,52.4,False,False
25-09-2025 09:00,SKYMD,16.12,17.71,16.1,17.71,21918705.0,0.0,1.59,0.33,380.36,1.59,7381122.6,196.96,0.0,True,69.79,0.24,0.31,-0.07,2025-09-25,10.0,0,,12.97,19.1,False,False
25-09-2025 09:00,MOBTL,7.39,7.88,7.3,7.82,21847793.0,0.06,0.43,0.05,814.89,0.43,11360871.8,92.31,0.14,True,56.32,-0.02,0.05,-0.07,2025-09-25,6.39,0,,6.84,7.91,False,False
25-09-2025 09:00,A1CAP,10.16,11.13,10.04,11.13,44857031.0,0.0,0.97,0.17,467.25,0.97,18271023.7,145.51,0.0,True,68.98,0.08,0.17,-0.1,2025-09-25,9.98,0,,8.63,12.26,False,False
25-09-2025 09:00,ISKPL,7.07,7.76,6.95,7.63,37213106.0,0.13,0.56,0.01,3633.33,0.56,20996973.1,77.23,0.23,True,59.46,0.43,-0.04,0.47,2025-09-25,8.07,0,,6.82,8.37,False,False
25-09-2025 09:00,CVKMD,15.17,16.5,14.76,16.35,80114445.0,0.15,1.18,0.27,338.66,1.18,38449013.8,108.37,0.13,True,72.42,0.4,0.17,0.23,2025-09-25,9.0,0,,12.75,ATH,False,False
25-09-2025 09:00,EUYO,14.89,16.43,14.51,16.26,2068239.0,0.17,1.37,0.44,208.56,1.37,845666.0,144.57,0.12,True,75.63,0.59,0.15,0.43,2025-09-25,8.84,1,16.43,12.62,16.43,False,False
25-09-2025 09:00,ECILC,75.5,81.05,71.75,80.7,21107185.0,0.35,5.2,2.49,109.26,5.2,8875650.9,137.81,0.07,True,77.82,4.57,1.57,3.0,2025-09-25,7.39,0,,53.45,ATH,False,False
25-09-2025 09:00,CRDFA,21.0,22.92,21.0,22.92,2767276.0,0.0,1.92,0.1,1820.0,1.92,1242489.4,122.72,0.0,True,64.44,0.53,-0.09,0.62,2025-09-25,9.98,0,,19.71,ATH,False,False
24-09-2025 09:00,KRPLS,8.94,9.71,8.85,9.63,7320780.0,0.08,0.69,0.1,569.9,0.69,4001474.9,82.95,0.12,True,72.45,0.32,0.13,0.19,2025-09-24,7.84,0,,7.63,ATH,False,False
24-09-2025 09:00,ALKA,14.54,15.99,13.9,15.99,47615364.0,0.0,1.45,0.62,134.25,1.45,23522732.2,102.42,0.0,True,89.69,1.6,0.66,0.94,2025-09-24,9.97,0,,7.38,ATH,False,False
24-09-2025 09:00,FLAP,10.71,11.78,10.55,11.78,6319100.0,0.0,1.07,0.15,603.95,1.07,2196974.1,187.63,0.0,True,72.92,0.33,0.07,0.26,2025-09-24,9.99,0,,9.29,ATH,False,False
24-09-2025 09:00,SNICA,5.06,5.4,4.97,5.37,50662180.0,0.03,0.31,0.07,362.69,0.31,25281513.6,100.39,0.1,True,75.34,0.15,0.08,0.07,2025-09-24,6.13,0,,4.23,ATH,False,False
24-09-2025 09:00,PRKME,22.2,24.06,22.12,24.06,2387696.0,0.0,1.86,0.26,623.74,1.86,1287361.6,85.47,0.0,True,74.41,0.59,0.2,0.38,2025-09-24,9.96,0,,19.44,ATH,False,False
24-09-2025 09:00,ATAKP,53.05,55.9,52.8,55.25,1261581.0,0.65,2.2,0.18,1122.22,2.2,759017.4,66.21,0.3,True,65.98,1.14,-0.0,1.15,2025-09-24,4.15,0,,48.88,ATH,False,False
24-09-2025 09:00,SELVA,2.05,2.25,2.01,2.25,52839747.22,0.0,0.2,0.08,142.86,0.2,34582405.51,52.79,0.0,True,80.07,0.12,0.07,0.04,2025-09-24,9.83,0,,1.33,ATH,False,False
24-09-2025 09:00,GWIND,24.58,26.22,24.14,26.18,9267373.0,0.04,1.6,0.19,733.33,1.6,4775265.7,94.07,0.02,True,59.18,-0.24,0.25,-0.49,2025-09-24,6.68,0,,21.64,28.6,False,False
23-09-2025 09:00,MZHLD,7.1,7.77,6.94,7.77,3310920.0,0.0,0.67,0.09,628.26,0.67,776179.6,326.57,0.0,True,73.36,0.09,0.07,0.03,2025-09-23,9.9,0,,6.31,ATH,False,False
23-09-2025 09:00,EREGL,29.12,32.3,29.1,31.66,516898400.0,0.64,2.54,0.49,422.63,2.54,218647232.8,136.41,0.25,True,73.11,0.33,0.39,-0.06,2025-09-23,6.89,0,,25.42,ATH,False,False
23-09-2025 09:00,AKCNS,139.4,152.7,138.2,149.5,2558101.0,3.2,10.1,0.9,1022.22,10.1,1009915.5,153.3,0.32,True,66.67,1.32,1.26,0.06,2025-09-23,7.09,1,152.7,128.5,152.7,False,False
23-09-2025 09:00,UNLU,16.07,17.5,16.0,17.26,9344248.0,0.24,1.19,0.25,374.1,1.19,2955479.5,216.17,0.2,True,67.4,-0.02,0.21,-0.22,2025-09-23,7.27,0,,13.95,17.64,False,False
23-09-2025 09:00,BLUME,52.3,58.6,51.7,58.5,6820623.0,0.1,6.2,0.6,933.33,6.2,4245784.9,60.64,0.02,True,58.13,-0.45,-0.33,-0.12,2025-09-23,9.76,0,,47.6,74.4,False,False
22-09-2025 09:00,BFREN,194.2,202.4,194.1,202.4,827754.0,0.0,8.2,0.01,81900.0,8.2,457341.3,80.99,0.0,True,60.77,3.43,-0.65,4.09,2025-09-22,5.2,1,202.4,177.4,227.2,False,False
22-09-2025 09:00,ESEN,12.51,13.65,12.45,13.5,35091328.0,0.15,0.99,0.26,277.86,0.99,19361453.2,81.24,0.15,True,63.54,-0.07,0.36,-0.42,2025-09-22,7.91,0,,9.37,20.3,True,False
22-09-2025 09:00,EUREN,9.19,9.98,9.09,9.96,148785078.0,0.02,0.77,0.15,420.27,0.77,91413219.8,62.76,0.03,True,70.6,0.47,0.06,0.41,2025-09-22,9.69,0,,7.78,10.1,False,False
22-09-2025 09:00,MARKA,47.38,52.0,47.38,52.0,3628904.0,0.0,4.62,0.31,1390.32,4.62,1039079.0,249.24,0.0,True,59.91,-0.79,0.28,-1.07,2025-09-22,9.94,0,,44.12,61.05,True,True
22-09-2025 09:00,FRIGO,9.25,10.0,9.13,10.0,22243666.0,0.0,0.75,0.15,410.2,0.75,14654387.6,51.79,0.0,True,81.62,0.43,0.13,0.31,2025-09-22,9.65,0,,7.19,ATH,False,False
22-09-2025 09:00,CWENE,21.92,23.76,21.92,23.76,36265516.0,0.0,1.84,0.42,334.99,1.84,16361324.9,121.65,0.0,True,77.58,0.98,0.55,0.42,2025-09-22,10.0,0,,16.42,ATH,False,False
19-09-2025 09:00,AVPGY,63.3,67.15,63.0,67.15,1894967.0,0.0,3.85,0.34,1049.25,3.85,1152558.9,64.41,0.0,True,62.58,-0.04,0.41,-0.46,2025-09-19,6.25,0,,58.65,68.3,False,False
19-09-2025 09:00,HRKET,81.05,88.05,80.55,88.05,6147500.0,0.0,7.0,0.68,937.04,7.0,1722175.3,256.96,0.0,True,64.78,0.23,0.62,-0.39,2025-09-19,9.99,0,,74.05,89.0,False,False
19-09-2025 09:00,YGGYO,104.5,113.3,103.1,113.3,517308.0,0.0,8.8,1.22,624.28,8.8,174665.7,196.17,0.0,True,78.32,3.84,0.79,3.05,2025-09-19,10.0,0,,85.05,ATH,False,False
19-09-2025 09:00,KTSKR,76.2,82.85,76.2,82.85,1911472.0,0.0,6.65,0.78,747.13,6.65,731742.3,161.22,0.0,True,76.98,2.14,1.04,1.1,2025-09-19,9.3,0,,64.75,ATH,False,False
18-09-2025 09:00,DYOBY,15.12,16.57,15.11,16.57,16088011.0,0.0,1.45,0.08,1807.89,1.45,3351859.9,379.97,0.0,True,63.38,-0.08,0.08,-0.16,2025-09-18,9.95,0,,13.98,17.11,False,False
18-09-2025 09:00,EPLAS,6.6,7.18,6.6,7.18,22568583.0,0.0,0.58,0.02,2661.9,0.58,6582865.5,242.84,0.0,True,62.25,0.07,-0.01,0.08,2025-09-18,9.95,0,,6.05,7.62,False,False
18-09-2025 09:00,BRKO,8.89,9.55,8.89,9.55,2080805.0,0.0,0.66,0.13,400.0,0.66,1156002.9,80.0,0.0,True,73.69,0.4,0.1,0.29,2025-09-18,9.9,0,,7.11,ATH,False,False
18-09-2025 09:00,IHEVA,2.81,3.08,2.81,3.07,17398818.0,0.01,0.26,0.03,687.88,0.26,3971098.0,338.14,0.04,True,69.29,0.03,0.02,0.02,2025-09-18,9.64,0,,2.35,ATH,False,False
18-09-2025 09:00,YAPRK,297.25,325.5,297.25,325.5,1033930.0,0.0,28.25,1.48,1815.25,28.25,266767.0,287.58,0.0,True,61.22,-2.48,0.54,-3.02,2025-09-18,9.97,0,,274.5,357.5,False,False
17-09-2025 09:00,KONTR,26.78,29.44,26.4,29.44,67251457.0,0.0,2.66,0.28,836.62,2.66,21288408.2,215.91,0.0,True,64.82,0.22,0.03,0.2,2025-09-17,9.93,0,,23.58,33.3,False,False
17-09-2025 09:00,BSOKE,15.74,17.31,15.66,16.94,63937839.0,0.37,1.2,0.26,363.32,1.2,27688681.8,130.92,0.31,True,80.34,0.41,0.2,0.21,2025-09-17,7.62,1,17.31,13.44,17.31,False,False
17-09-2025 09:00,CELHA,9.23,10.07,9.16,10.07,16766173.0,0.0,0.84,0.03,2609.68,0.84,3916071.3,328.14,0.0,True,57.25,-0.14,0.01,-0.15,2025-09-17,9.93,0,,8.32,10.53,True,True
17-09-2025 09:00,KUTPO,111.0,122.1,110.5,122.1,1800536.0,0.0,11.1,2.59,327.75,11.1,1191777.9,51.08,0.0,True,75.59,5.67,2.17,3.5,2025-09-17,10.0,0,,88.2,ATH,False,False
17-09-2025 09:00,AKYHO,3.5,3.74,3.5,3.68,11031496.0,0.06,0.18,0.02,718.18,0.18,3844259.5,186.96,0.33,True,60.14,-0.01,0.0,-0.01,2025-09-17,8.24,0,,3.16,4.07,False,False
16-09-2025 09:00,QUAGR,9.98,10.96,9.71,10.94,147848631.0,0.02,0.96,0.28,238.03,0.96,90124978.4,64.05,0.02,True,81.22,0.77,0.2,0.57,2025-09-16,9.62,0,,ATL,ATH,False,False
16-09-2025 09:00,AFYON,13.26,13.87,13.26,13.81,5053116.0,0.06,0.55,0.01,6011.11,0.55,3049017.4,65.73,0.11,True,51.52,-0.24,-0.04,-0.2,2025-09-16,3.83,0,,12.58,14.73,True,True
16-09-2025 09:00,DERHL,19.9,21.82,19.66,21.82,30948504.0,0.0,1.92,0.05,4073.91,1.92,16062934.7,92.67,0.0,True,48.76,-1.34,0.14,-1.48,2025-09-16,9.98,0,,18.23,24.68,True,True
16-09-2025 09:00,SEGMN,24.7,26.8,24.6,26.34,6096555.0,0.46,1.64,0.3,450.34,1.64,3831988.6,59.1,0.28,True,67.58,0.11,0.25,-0.14,2025-09-16,7.16,0,,22.0,27.22,False,False
16-09-2025 09:00,SDTTR,200.8,219.4,200.8,219.4,4050705.0,0.0,18.6,2.07,798.55,18.6,2225504.7,82.01,0.0,True,63.89,3.69,1.0,2.69,2025-09-16,9.97,0,,183.3,ATH,False,False
16-09-2025 09:00,EBEBK,55.85,58.7,55.65,58.4,2046222.0,0.3,2.55,0.12,2025.0,2.55,795033.8,157.38,0.12,True,67.56,1.34,0.01,1.33,2025-09-16,5.13,1,58.7,52.1,58.7,False,False
16-09-2025 09:00,ALTNY,75.4,79.65,75.0,79.1,17890346.0,0.55,3.7,0.51,625.49,3.7,6498959.0,175.28,0.15,True,57.37,-1.32,0.61,-1.93,2025-09-16,5.61,0,,70.5,79.6,True,True
16-09-2025 09:00,EGPRO,26.04,28.62,26.04,28.62,5630733.0,0.0,2.58,0.27,862.69,2.58,1665563.4,238.07,0.0,True,71.94,0.97,0.03,0.94,2025-09-16,9.99,0,,23.5,ATH,False,False
16-09-2025 09:00,SMRTG,28.18,30.28,27.98,30.0,5444902.0,0.28,1.82,0.06,3037.93,1.82,2970857.5,83.28,0.15,True,52.42,-0.91,-0.11,-0.8,2025-09-16,6.69,0,,26.08,34.7,True,True
15-09-2025 09:00,GLRMK,177.5,195.1,172.9,195.1,10108159.0,0.0,17.6,1.96,797.96,17.6,3900661.1,159.14,0.0,True,79.58,6.41,0.93,5.49,2025-09-15,9.98,0,,162.0,ATH,False,False
15-09-2025 09:00,FZLGY,14.05,15.4,13.84,15.4,35455902.0,0.0,1.35,0.32,324.53,1.35,18938757.1,87.21,0.0,True,84.83,0.96,0.14,0.82,2025-09-15,9.45,0,,11.51,ATH,False,False
15-09-2025 09:00,KLSYN,6.91,7.45,6.9,7.45,23518522.0,0.0,0.54,0.09,535.29,0.54,7061771.1,233.04,0.0,True,70.01,0.1,0.07,0.03,2025-09-15,9.88,0,,5.94,ATH,False,False
15-09-2025 09:00,ALCTL,109.3,120.1,108.3,119.9,565849.0,0.2,10.6,0.16,6525.0,10.6,364169.1,55.38,0.02,True,57.33,-0.1,-0.18,0.08,2025-09-15,8.8,2,108.3,108.3,124.0,False,False
15-09-2025 09:00,DMSAS,7.5,7.81,7.41,7.76,7704407.0,0.05,0.26,0.03,828.57,0.26,4741738.9,62.48,0.19,True,56.91,0.02,-0.01,0.03,2025-09-15,4.16,0,,7.22,8.25,False,False
15-09-2025 09:00,BIOEN,23.6,26.04,23.28,26.04,9184829.0,0.0,2.44,0.1,2441.67,2.44,5821351.0,57.78,0.0,True,74.01,0.78,0.19,0.6,2025-09-15,9.97,0,,19.73,ATH,False,False
11-09-2025 09:00,KNFRT,17.8,19.41,17.59,19.41,6282353.0,0.0,1.61,0.1,1448.08,1.61,2414508.4,160.19,0.0,True,66.37,0.45,0.01,0.45,2025-09-11,9.97,0,,16.3,ATH,False,False
11-09-2025 09:00,KRSTL,11.11,12.23,11.01,12.23,29550868.0,0.0,1.12,0.19,502.15,1.12,10837482.4,172.67,0.0,True,78.51,0.59,0.03,0.56,2025-09-11,9.98,0,,9.77,ATH,False,False
09-09-2025 09:00,GSDDE,10.59,11.24,10.51,11.24,10494917.0,0.0,0.65,0.04,1411.63,0.65,4977618.2,110.84,0.0,True,67.8,0.29,0.03,0.26,2025-09-09,6.14,0,,9.22,ATH,False,False
09-09-2025 09:00,KAPLM,330.0,363.0,320.25,363.0,1266001.0,0.0,33.0,7.88,318.52,33.0,548024.2,131.01,0.0,True,87.01,27.19,13.75,13.44,2025-09-09,10.0,0,,206.5,ATH,False,False
09-09-2025 09:00,PENGD,9.0,9.86,8.95,9.86,22184258.0,0.0,0.86,0.02,4426.32,0.86,9658248.8,129.69,0.0,True,59.44,0.01,-0.04,0.05,2025-09-09,9.92,0,,8.48,10.63,False,False
08-09-2025 09:00,EUKYO,13.35,14.68,13.06,14.68,1604612.0,0.0,1.33,0.12,1036.75,1.33,499409.8,221.3,0.0,True,64.48,0.06,0.05,0.01,2025-09-08,9.96,0,,12.57,16.25,False,False
08-09-2025 09:00,ICBCT,16.13,17.85,15.89,17.65,8211182.0,0.2,1.52,0.11,1233.33,1.52,3885855.2,111.31,0.13,True,66.09,0.4,0.12,0.28,2025-09-08,7.23,0,,14.39,ATH,False,False
05-09-2025 09:00,PNSUT,12.72,13.99,12.68,13.99,10716020.0,0.0,1.27,0.11,1014.04,1.27,5374304.8,99.39,0.0,True,70.83,0.57,-0.01,0.58,2025-09-05,9.98,0,,11.66,ATH,False,False
04-09-2025 09:00,REEDR,10.33,10.97,10.24,10.84,74208096.0,0.13,0.51,0.03,1940.0,0.51,43677355.9,69.9,0.25,True,59.4,0.17,-0.02,0.18,2025-09-04,4.94,0,,9.8,11.06,False,False
04-09-2025 09:00,LILAK,29.98,31.88,29.86,31.64,15304140.0,0.24,1.66,0.16,912.2,1.66,9747431.8,57.01,0.14,True,73.19,1.2,0.01,1.18,2025-09-04,6.1,0,,22.32,ATH,False,False
04-09-2025 09:00,HURGZ,7.91,8.7,7.9,8.66,23581792.0,0.04,0.75,0.14,443.48,0.75,9773699.1,141.28,0.05,True,61.91,0.21,0.03,0.18,2025-09-04,9.48,0,,7.02,8.67,False,False
03-09-2025 09:00,INVES,545.0,611.0,523.0,608.5,321543.0,2.5,63.5,9.65,558.03,63.5,140805.6,128.36,0.04,True,83.96,57.48,0.77,56.71,2025-09-03,9.54,0,,ATL,ATH,False,False
03-09-2025 09:00,IZMDC,8.09,8.78,7.44,8.78,86664722.0,0.0,0.69,0.13,414.93,0.69,22103867.3,292.08,0.0,True,88.9,0.57,0.19,0.38,2025-09-03,9.89,0,,5.71,ATH,False,False
03-09-2025 09:00,GMTAS,22.46,23.84,22.2,23.68,2512750.0,0.16,1.22,0.22,449.55,1.22,1206990.1,108.18,0.13,True,73.48,0.93,0.23,0.7,2025-09-03,5.9,0,,18.73,ATH,False,False
03-09-2025 09:00,ALTIN,51.61,52.93,51.61,52.8,42930976.0,0.13,1.19,0.45,166.82,1.19,22430851.0,91.39,0.11,True,87.81,0.86,0.5,0.36,2025-09-03,2.66,0,,47.22,ATH,False,False
02-09-2025 09:00,TRHOL,281.5,308.5,280.5,308.5,1009440.0,0.0,27.0,6.76,299.41,27.0,441823.4,128.47,0.0,True,75.93,27.46,1.26,26.2,2025-09-02,9.98,0,,233.9,ATH,False,False
02-09-2025 09:00,BARMA,19.58,21.24,19.4,21.24,15037473.0,0.0,1.66,0.14,1111.68,1.66,3387270.8,343.94,0.0,True,71.74,0.41,0.06,0.35,2025-09-02,9.94,0,,18.15,ATH,False,False
02-09-2025 09:00,DERIM,39.76,42.84,39.7,42.68,3102303.0,0.16,2.92,0.19,1436.84,2.92,1116938.2,177.75,0.05,True,60.54,0.4,-0.07,0.47,2025-09-02,7.4,0,,39.28,43.84,False,False
01-09-2025 09:00,KOTON,18.55,20.0,18.55,19.83,18527151.0,0.17,1.28,0.28,360.43,1.28,9648554.7,92.02,0.13,True,84.54,0.79,0.21,0.58,2025-09-01,7.31,0,,16.01,ATH,False,False
01-09-2025 09:00,MOGAN,10.02,10.75,10.02,10.63,20716388.0,0.12,0.61,0.02,2441.67,0.61,11077204.6,87.02,0.2,True,65.56,0.24,-0.02,0.26,2025-09-01,6.3,1,10.75,9.79,10.75,False,False
01-09-2025 09:00,SOKE,12.95,13.8,12.95,13.76,9906665.0,0.04,0.81,0.09,752.63,0.81,4095401.3,141.9,0.05,True,75.87,0.38,0.02,0.35,2025-09-01,6.92,0,,ATL,ATH,False,False
29-08-2025 09:00,EGGUB,103.4,113.7,103.4,113.7,5571312.0,0.0,10.3,0.75,1273.33,10.3,1072463.5,419.49,0.0,True,66.91,2.17,-0.01,2.17,2025-08-29,9.96,0,,101.5,ATH,False,False
29-08-2025 09:00,FENER,12.51,13.49,12.51,13.25,155092414.0,0.24,0.74,0.09,704.35,0.74,49958102.9,210.44,0.32,True,54.22,-0.03,-0.04,0.01,2025-08-29,5.92,0,,12.42,14.88,False,False
29-08-2025 09:00,GIPTA,138.8,147.2,138.2,147.0,1953782.0,0.2,8.2,1.01,711.88,8.2,1148232.7,70.16,0.02,True,68.27,5.82,-0.1,5.93,2025-08-29,5.91,0,,127.4,ATH,False,False
28-08-2025 09:00,TRILC,23.1,25.26,22.84,25.26,23615075.0,0.0,2.16,0.25,770.97,2.16,8100124.6,191.54,0.0,True,67.68,0.72,0.15,0.58,2025-08-28,9.92,0,,21.24,ATH,False,False
28-08-2025 09:00,KAYSE,20.66,21.58,20.6,21.46,6938861.0,0.12,0.8,0.11,633.94,0.8,4453297.0,55.81,0.15,True,60.51,0.33,-0.03,0.35,2025-08-28,4.17,0,,19.88,22.64,False,False
28-08-2025 09:00,MNDRS,13.69,15.01,13.69,15.01,14540374.0,0.0,1.32,0.15,791.89,1.32,5513853.9,163.71,0.0,True,68.22,0.5,-0.07,0.57,2025-08-28,9.96,0,,13.18,ATH,False,False
27-08-2025 09:00,TURGG,43.82,49.69,42.98,49.69,6576514.13,0.0,5.87,1.13,421.09,5.87,2986438.74,120.21,0.0,True,68.57,3.76,0.88,2.88,2025-08-27,9.96,0,,35.1,53.02,False,False
27-08-2025 09:00,MHRGY,4.27,4.65,4.22,4.56,37703566.9,0.09,0.29,0.03,780.0,0.29,11174888.38,237.4,0.32,True,75.7,0.12,0.02,0.1,2025-08-27,6.87,0,,4.03,ATH,False,False
27-08-2025 09:00,MANAS,9.25,10.15,9.25,10.15,16133134.0,0.0,0.9,0.13,603.12,0.9,6942908.3,132.37,0.0,True,63.18,0.54,-0.11,0.65,2025-08-27,9.97,0,,8.42,11.05,False,False
27-08-2025 09:00,KUVVA,90.0,93.0,90.0,93.0,232020.0,0.0,3.0,0.22,1263.64,3.0,108610.9,113.62,0.0,True,60.74,-0.09,0.59,-0.68,2025-08-27,3.45,0,,85.0,97.5,False,False
27-08-2025 09:00,KORDS,66.9,72.0,66.4,70.75,2875236.0,1.25,3.85,0.76,406.58,3.85,1108585.4,159.36,0.32,True,76.2,2.52,0.51,2.01,2025-08-27,5.75,1,72.0,55.0,72.0,False,False
26-08-2025 09:00,ULUFA,3.69,4.01,3.63,4.0,61372052.0,0.01,0.31,0.03,900.0,0.31,36510443.5,68.09,0.03,True,59.37,-0.01,-0.02,0.01,2025-08-26,8.11,0,,3.5,4.27,False,False
26-08-2025 09:00,TUCLK,11.34,12.48,10.99,12.48,42377004.0,0.0,1.14,0.28,311.55,1.14,15148365.9,179.75,0.0,True,85.71,0.47,0.29,0.18,2025-08-26,9.96,0,,9.15,ATH,False,False
26-08-2025 09:00,ARSAN,2.91,3.16,2.9,3.16,42071524.0,0.0,0.25,0.04,518.22,0.25,15966402.22,163.5,0.0,True,83.47,0.13,0.02,0.11,2025-08-26,9.72,0,,ATL,ATH,False,False
26-08-2025 09:00,TLMAN,108.7,119.3,106.0,118.3,1216447.0,1.0,9.6,1.57,513.42,9.6,581961.5,109.03,0.1,True,84.65,7.36,1.4,5.96,2025-08-26,9.03,1,119.3,75.1,119.3,False,False
25-08-2025 09:00,VESBE,10.79,11.38,10.79,11.3,14908074.0,0.08,0.51,0.08,571.05,0.51,8543257.5,74.5,0.16,True,70.88,0.19,0.01,0.18,2025-08-25,5.02,0,,9.99,ATH,False,False
25-08-2025 09:00,BALSU,25.88,28.1,25.82,27.64,22763181.0,0.46,1.76,0.17,911.49,1.76,12149209.5,87.36,0.26,True,73.69,0.96,0.03,0.93,2025-08-25,7.8,1,28.1,23.78,28.1,False,False
25-08-2025 09:00,BERA,17.55,18.52,17.52,18.33,31455841.0,0.19,0.78,0.06,1158.06,0.78,11792584.4,166.74,0.24,True,71.94,0.61,-0.02,0.63,2025-08-25,5.41,0,,16.35,ATH,False,False
25-08-2025 09:00,BRMEN,13.1,14.4,13.1,14.4,880789.0,0.0,1.3,0.34,277.91,1.3,580707.9,51.68,0.0,True,72.56,1.74,0.08,1.66,2025-08-25,9.92,0,,ATL,ATH,False,False
25-08-2025 09:00,ACSEL,120.1,126.9,120.1,125.3,410144.0,1.6,5.2,0.99,425.25,5.2,270687.4,51.52,0.31,True,74.65,3.99,0.51,3.49,2025-08-25,4.77,0,,107.5,ATH,False,False
25-08-2025 09:00,CUSAN,34.12,37.0,34.12,37.0,8181885.0,0.0,2.88,0.09,3172.73,2.88,5316257.0,53.9,0.0,True,80.23,3.63,0.72,2.91,2025-08-25,9.99,0,,ATL,ATH,False,False
25-08-2025 09:00,DARDL,2.57,2.8,2.55,2.76,140008649.0,0.04,0.19,0.02,955.56,0.19,69412036.3,101.71,0.21,True,72.49,0.15,-0.0,0.15,2025-08-25,8.24,0,,2.32,ATH,False,False
22-08-2025 09:00,KFEIN,10.76,11.42,10.51,11.27,18351324.0,0.15,0.51,0.03,1721.43,0.51,11259466.4,62.99,0.29,True,60.99,0.31,-0.08,0.39,2025-08-22,4.93,0,,10.15,12.3,False,False
22-08-2025 09:00,BIGEN,11.88,12.89,11.87,12.74,73613053.0,0.15,0.86,0.04,2050.0,0.86,21797563.6,237.71,0.17,True,62.87,0.09,-0.02,0.12,2025-08-22,7.97,0,,11.28,12.8,False,False
22-08-2025 09:00,HATEK,18.35,20.24,17.7,20.24,13530807.0,0.0,1.89,0.19,874.23,1.89,3534313.9,282.84,0.0,True,60.68,-0.47,0.42,-0.89,2025-08-22,9.94,0,,16.91,ATH,False,False
22-08-2025 09:00,EGSER,3.63,3.8,3.6,3.8,11913857.0,0.0,0.17,0.03,431.25,0.17,6817954.2,74.74,0.0,True,70.97,0.1,-0.01,0.11,2025-08-22,4.68,0,,3.4,ATH,False,False
21-08-2025 09:00,KONKA,13.19,14.32,13.07,14.03,9913167.62,0.29,0.84,0.14,505.77,0.84,4017560.1,146.75,0.35,True,82.36,0.54,0.09,0.45,2025-08-21,6.42,0,,11.8,ATH,False,False
21-08-2025 09:00,GUBRF,273.75,288.5,273.0,284.5,5080543.0,4.0,10.75,0.78,1287.1,10.75,2677179.8,89.77,0.37,True,71.97,9.35,0.33,9.02,2025-08-21,4.5,0,,ATL,ATH,False,False
21-08-2025 09:00,SASA,3.98,4.35,3.98,4.35,2546825220.0,0.0,0.37,0.11,227.43,0.37,1586000820.0,60.58,0.0,True,74.46,0.28,0.1,0.18,2025-08-21,9.85,0,,3.08,ATH,False,False
21-08-2025 09:00,BAKAB,40.4,43.24,40.02,42.82,1994597.0,0.42,2.42,0.33,624.55,2.42,733680.2,171.86,0.17,True,68.14,1.62,-0.1,1.73,2025-08-21,5.99,0,,36.38,43.8,False,False
21-08-2025 09:00,ZEDUR,10.38,10.9,10.03,10.89,17029717.0,0.01,0.51,0.08,529.63,0.51,6147196.0,177.03,0.02,True,78.76,0.55,0.07,0.48,2025-08-21,7.29,0,,ATL,ATH,False,False
21-08-2025 09:00,NTHOL,49.32,52.5,49.08,52.15,2900180.0,0.35,2.83,0.09,2943.01,2.83,1415841.6,104.84,0.12,True,62.51,1.05,-0.21,1.26,2025-08-21,5.91,0,,48.56,52.85,False,False
21-08-2025 09:00,ULKER,116.0,120.6,115.6,120.2,13260580.0,0.4,4.2,0.44,854.55,4.2,7468667.7,77.55,0.1,True,66.5,2.36,0.07,2.29,2025-08-21,4.34,0,,113.1,ATH,False,False
20-08-2025 09:00,DGNMO,7.59,7.88,7.31,7.84,19389978.0,0.04,0.25,0.05,380.77,0.25,9116697.1,112.69,0.16,True,66.55,0.29,0.01,0.28,2025-08-20,-0.88,0,,7.16,8.06,False,False
20-08-2025 09:00,ATATP,117.0,126.8,115.6,126.8,4100041.0,0.0,9.8,1.44,580.56,9.8,1808020.0,126.77,0.0,True,89.64,7.86,2.36,5.5,2025-08-20,9.97,0,,ATL,ATH,False,False
20-08-2025 09:00,SANEL,27.02,30.58,27.02,29.86,428081.0,0.72,2.84,0.43,566.67,2.84,174379.9,145.49,0.25,True,62.71,1.03,-0.1,1.13,2025-08-20,-0.27,2,27.02,27.02,31.36,False,False
20-08-2025 09:00,ANELE,21.58,23.94,21.58,23.52,11603262.0,0.42,1.94,0.22,766.07,1.94,4324499.9,168.31,0.22,True,79.78,1.15,0.1,1.05,2025-08-20,7.99,0,,16.5,ATH,False,False
20-08-2025 09:00,SKBNK,6.79,7.49,6.75,7.49,269879410.0,0.0,0.7,0.15,382.76,0.7,153821669.7,75.45,0.0,True,73.71,0.13,0.13,-0.0,2025-08-20,9.99,0,,5.58,7.74,False,False
20-08-2025 09:00,OYAKC,24.5,25.64,24.18,25.58,50279598.0,0.06,1.08,0.09,1127.27,1.08,27053042.7,85.86,0.06,True,68.51,0.44,0.04,0.4,2025-08-20,4.84,0,,23.1,ATH,False,False
20-08-2025 09:00,KRONT,13.8,14.9,13.7,14.6,7896705.0,0.3,0.8,0.06,1211.48,0.8,5067023.8,55.85,0.38,True,72.24,0.84,-0.08,0.92,2025-08-20,5.8,0,,12.76,ATH,False,False
20-08-2025 09:00,AKSA,9.97,10.35,9.81,10.31,32666837.0,0.04,0.34,0.01,4757.14,0.34,17726237.1,84.29,0.12,True,63.99,0.2,-0.01,0.22,2025-08-20,3.83,0,,9.67,10.4,False,False
20-08-2025 09:00,ZOREN,3.65,4.02,3.57,4.0,298272780.0,0.02,0.35,0.06,514.04,0.35,118982756.3,150.69,0.06,True,76.06,0.15,0.03,0.12,2025-08-20,9.29,0,,3.28,ATH,False,False
20-08-2025 09:00,VESTL,36.6,39.5,36.26,38.9,21457978.0,0.6,2.3,0.13,1725.4,2.3,8070892.9,165.87,0.26,True,57.22,0.7,-0.2,0.9,2025-08-20,0.99,2,36.26,36.26,40.04,False,False
20-08-2025 09:00,BORSK,24.3,25.82,24.24,25.56,9921603.0,0.26,1.26,0.14,775.0,1.26,3850247.5,157.69,0.21,True,68.17,0.81,-0.12,0.93,2025-08-20,5.53,0,,23.5,ATH,False,False
20-08-2025 09:00,PETKM,18.59,19.8,18.43,19.72,162331415.0,0.08,1.13,0.13,782.81,1.13,64279041.1,152.54,0.07,True,78.53,0.44,0.14,0.3,2025-08-20,6.08,0,,16.95,ATH,False,False
19-08-2025 09:00,TAVHL,253.75,260.75,251.75,260.25,4456361.0,0.5,6.5,0.38,1633.33,6.5,2504876.2,77.91,0.08,True,55.58,0.63,-0.36,0.99,2025-08-19,3.27,0,,247.2,279.75,False,False
19-08-2025 09:00,LIDER,46.66,51.15,46.24,51.15,2659850.0,0.0,4.49,0.52,755.24,4.49,1304740.0,103.86,0.0,True,69.13,0.37,0.46,-0.09,2025-08-19,10.0,0,,45.0,54.4,False,False
18-08-2025 09:00,YATAS,31.06,32.34,30.74,32.3,2516915.0,0.04,1.24,0.31,294.9,1.24,1559291.4,61.41,0.03,True,78.56,1.17,0.19,0.97,2025-08-18,4.46,0,,27.02,ATH,False,False
18-08-2025 09:00,ISDMR,39.06,40.74,39.04,40.6,3331713.0,0.14,1.54,0.08,1778.05,1.54,2000494.1,66.54,0.09,True,70.52,0.95,-0.03,0.98,2025-08-18,3.73,0,,37.56,ATH,False,False
15-08-2025 09:00,RODRG,18.2,20.1,17.93,20.1,1404468.0,0.0,1.9,0.1,1858.76,1.9,477246.9,194.29,0.0,True,69.84,0.62,-0.02,0.64,2025-08-15,9.96,0,,17.17,ATH,False,False
15-08-2025 09:00,GZNMI,270.0,282.0,268.5,282.0,1064634.0,0.0,12.0,2.68,347.76,12.0,370316.4,187.49,0.0,True,70.56,7.83,2.01,5.81,2025-08-15,9.94,0,,219.8,ATH,False,False
15-08-2025 09:00,DOKTA,23.62,25.98,23.52,25.98,2569711.0,0.0,2.36,0.08,3005.26,2.36,709804.2,262.03,0.0,True,70.03,0.81,-0.08,0.89,2025-08-15,9.99,2,23.52,23.52,26.18,False,False
15-08-2025 09:00,ALVES,32.5,34.22,31.6,34.22,18519329.0,0.0,1.72,0.35,385.88,1.72,9792763.0,89.11,0.0,True,68.51,1.21,0.29,0.92,2025-08-15,9.96,0,,ATL,ATH,False,False
15-08-2025 09:00,SOKM,36.7,39.14,36.68,38.88,11980627.0,0.26,2.18,0.16,1279.75,2.18,7473770.7,60.3,0.12,True,65.5,0.86,-0.14,1.0,2025-08-15,4.24,2,36.68,36.68,ATH,False,False
14-08-2025 09:00,DESPC,56.0,61.0,56.0,60.5,1528034.0,0.5,4.5,0.38,1084.21,4.5,713089.0,114.28,0.11,True,77.7,2.57,0.55,2.02,2025-08-14,7.46,0,,43.7,ATH,False,False
14-08-2025 09:00,DOHOL,18.2,18.99,18.09,18.99,32411381.0,0.0,0.79,0.29,170.55,0.79,19353094.5,67.47,0.0,True,83.03,0.71,0.22,0.48,2025-08-14,4.8,0,,14.9,ATH,False,False
14-08-2025 09:00,JANTS,24.0,25.84,24.0,25.84,34985299.0,0.0,1.84,0.23,693.1,1.84,10466890.7,234.25,0.0,True,78.37,0.99,0.13,0.85,2025-08-14,9.96,0,,ATL,ATH,False,False
14-08-2025 09:00,EDATA,6.3,6.98,6.13,6.98,63720167.0,0.0,0.68,0.13,419.08,0.68,26506480.8,140.39,0.0,True,82.61,0.52,0.11,0.41,2025-08-14,9.92,0,,ATL,ATH,False,False
14-08-2025 09:00,EFOR,102.1,124.7,102.1,124.7,5686086.0,0.0,22.6,1.65,1269.7,22.6,3628926.6,56.69,0.0,True,42.77,2.15,-3.69,5.84,2025-08-14,9.96,2,102.1,102.1,160.4,False,False
14-08-2025 09:00,SRVGY,3.47,3.81,3.43,3.8,248747738.0,0.01,0.33,0.04,746.15,0.33,98340058.9,152.95,0.03,True,71.05,0.21,0.02,0.19,2025-08-14,9.51,0,,2.5,ATH,False,False
14-08-2025 09:00,ASTOR,111.5,115.0,110.8,114.8,18349966.0,0.2,3.3,0.45,633.33,3.3,11771803.8,55.88,0.06,True,82.94,4.86,0.59,4.27,2025-08-14,1.86,0,,89.5,ATH,False,False
14-08-2025 09:00,LUKSK,99.0,107.9,96.55,107.8,1097756.0,0.1,8.8,1.53,477.05,8.8,558720.8,96.48,0.01,True,83.61,5.18,1.37,3.81,2025-08-14,8.89,0,,ATL,ATH,False,False
14-08-2025 09:00,VBTYZ,24.32,26.0,24.16,25.76,5820100.0,0.24,1.44,0.1,1369.39,1.44,2772532.9,109.92,0.17,True,69.57,0.89,-0.09,0.98,2025-08-14,5.92,1,26.0,20.06,26.0,False,False
13-08-2025 09:00,EGEPO,8.2,9.0,8.17,9.0,31752836.0,0.0,0.8,0.1,733.33,0.8,11085970.6,186.42,0.0,True,66.05,0.12,0.01,0.11,2025-08-13,9.89,0,,7.55,9.1,False,False
13-08-2025 09:00,MEKAG,4.21,4.63,4.17,4.6,59906572.8,0.03,0.39,0.09,329.31,0.39,24931027.2,140.29,0.08,True,72.46,0.31,0.06,0.24,2025-08-13,9.18,1,4.63,ATL,4.63,False,False
13-08-2025 09:00,DESA,13.19,14.16,13.05,14.09,8293316.0,0.07,0.9,0.24,267.35,0.9,3466274.7,139.26,0.08,True,85.87,0.93,0.2,0.74,2025-08-13,7.39,0,,8.9,ATH,False,False
13-08-2025 09:00,ENJSA,66.15,69.1,65.5,68.9,6017622.0,0.2,2.75,0.35,685.71,2.75,3554487.1,69.3,0.07,True,69.92,1.96,-0.29,2.25,2025-08-13,4.08,0,,ATL,ATH,False,False
12-08-2025 09:00,MERCN,39.74,43.38,39.44,43.38,16360996.0,0.0,3.64,0.97,274.49,3.64,7249415.9,125.69,0.0,True,96.91,4.95,0.63,4.31,2025-08-12,8.78,0,,ATL,ATH,False,False
12-08-2025 09:00,HKTM,12.3,13.08,11.99,12.89,15847667.0,0.19,0.59,0.1,521.05,0.59,7747006.8,104.57,0.32,True,76.99,0.54,0.05,0.49,2025-08-12,4.97,0,,10.32,ATH,False,False
12-08-2025 09:00,DAPGM,13.65,15.01,13.45,15.01,215444942.0,0.0,1.36,0.16,729.27,1.36,74000002.4,191.14,0.0,True,84.13,1.36,0.16,1.2,2025-08-12,9.96,0,,ATL,ATH,False,False
12-08-2025 09:00,INDES,7.77,8.07,7.75,8.0,9165487.0,0.07,0.23,0.04,489.74,0.23,5503614.5,66.54,0.3,True,81.01,0.33,-0.02,0.35,2025-08-12,2.96,0,,ATL,ATH,False,False
12-08-2025 09:00,INVEO,12.57,13.79,12.35,13.79,47033722.0,0.0,1.22,0.19,532.12,1.22,28956089.2,62.43,0.0,True,84.11,1.17,0.31,0.87,2025-08-12,9.97,0,,7.6,ATH,False,False
12-08-2025 09:00,HTTBT,45.0,47.98,45.0,47.4,4799970.0,0.58,2.4,0.3,700.0,2.4,1092469.7,339.37,0.24,True,69.3,1.66,-0.1,1.77,2025-08-12,5.85,0,,ATL,ATH,False,False
11-08-2025 09:00,PGSUS,266.0,274.5,263.25,274.0,21646274.0,0.5,8.0,1.37,486.08,8.0,14428301.3,50.03,0.06,True,67.54,4.9,0.22,4.67,2025-08-11,3.89,1,274.5,245.8,274.5,False,False
11-08-2025 09:00,AKFYE,18.02,19.72,18.02,19.36,19105261.0,0.36,1.34,0.04,3090.48,1.34,6802661.0,180.85,0.27,True,78.57,0.64,0.06,0.58,2025-08-11,7.92,0,,17.85,ATH,False,False
11-08-2025 09:00,TEZOL,16.1,17.04,16.09,16.87,21806740.0,0.17,0.77,0.1,693.81,0.77,13480294.9,61.77,0.22,True,53.81,-0.86,0.43,-1.29,2025-08-11,5.44,1,17.04,15.15,17.04,True,True
11-08-2025 09:00,MIATK,36.88,39.32,36.78,38.94,37136465.0,0.38,2.06,0.16,1220.51,2.06,20447768.6,81.62,0.18,True,71.28,1.99,0.03,1.97,2025-08-11,6.22,0,,30.0,39.52,False,False
08-08-2025 09:00,PENTA,16.42,17.62,16.18,17.5,13127113.0,0.12,1.08,0.14,688.32,1.08,7216980.8,81.89,0.11,True,81.59,0.98,0.15,0.82,2025-08-08,6.64,0,,ATL,ATH,False,False
08-08-2025 09:00,MAKIM,20.2,21.98,20.0,21.66,7617226.0,0.32,1.46,0.22,579.07,1.46,2295442.9,231.84,0.22,True,68.83,-0.1,0.28,-0.39,2025-08-08,7.33,0,,18.31,22.2,False,False
08-08-2025 09:00,VERUS,357.75,388.5,352.5,380.0,108267.0,8.5,22.25,2.58,764.08,22.25,56107.8,92.96,0.38,True,81.14,22.31,-2.65,24.96,2025-08-08,7.04,0,,ATL,ATH,False,False
08-08-2025 09:00,ORGE,76.0,83.45,75.6,82.55,5319070.0,0.9,6.55,0.7,842.45,6.55,1820479.2,192.18,0.14,True,71.64,2.23,0.56,1.67,2025-08-08,8.76,1,83.45,67.35,83.45,False,False
08-08-2025 09:00,IHLAS,2.81,3.1,2.78,3.1,308141690.0,0.0,0.29,0.03,728.57,0.29,126669394.7,143.26,0.0,True,72.51,0.17,-0.01,0.18,2025-08-08,9.93,0,,ATL,ATH,False,False
07-08-2025 09:00,TCKRC,49.4,54.25,49.24,53.55,5745903.0,0.7,4.15,0.67,514.81,4.15,3016535.9,90.48,0.17,True,87.36,4.13,0.64,3.49,2025-08-07,8.49,0,,33.5,ATH,False,False
07-08-2025 09:00,IHYAY,2.48,2.71,2.48,2.67,64925272.0,0.04,0.19,0.02,726.09,0.19,33187375.2,95.63,0.21,True,80.39,0.13,0.01,0.12,2025-08-07,8.1,0,,1.97,ATH,False,False
07-08-2025 09:00,DCTTR,37.96,41.78,37.08,40.84,18694733.0,0.94,2.88,0.16,1722.78,2.88,4620470.4,304.61,0.33,True,71.76,1.16,0.15,1.01,2025-08-07,7.36,0,,33.1,ATH,False,False
07-08-2025 09:00,CGCAM,33.3,36.4,33.3,36.4,13955423.0,0.0,3.1,0.58,438.19,3.1,9242945.8,50.98,0.0,True,86.25,1.8,0.75,1.05,2025-08-07,9.97,0,,26.12,ATH,False,False
06-08-2025 09:00,THYAO,298.5,311.25,298.0,308.5,70872223.0,2.75,10.0,0.28,3536.36,10.0,29016212.0,144.25,0.28,True,70.64,6.21,-0.35,6.56,2025-08-06,4.4,0,,285.25,ATH,False,False
06-08-2025 09:00,SANKO,22.26,23.98,21.74,23.98,2841478.0,0.0,1.72,0.26,561.54,1.72,979009.5,190.24,0.0,True,80.27,0.8,0.15,0.65,2025-08-06,10.0,0,,ATL,ATH,False,False
06-08-2025 09:00,ESCAR,47.9,52.55,47.9,52.55,2715412.0,0.0,4.65,0.37,1173.97,4.65,1273455.0,113.23,0.0,True,53.68,-3.84,2.03,-5.87,2025-08-06,9.94,0,,39.68,72.0,False,False
06-08-2025 09:00,SISE,37.94,40.16,37.9,39.78,124749082.0,0.38,1.84,0.13,1273.13,1.84,37369779.7,233.82,0.21,True,73.92,0.98,0.01,0.97,2025-08-06,6.25,0,,ATL,ATH,False,False
06-08-2025 09:00,AHGAZ,30.46,33.16,30.24,33.1,15372651.0,0.06,2.64,0.49,440.98,2.64,6076177.1,153.0,0.02,True,83.16,0.82,0.53,0.29,2025-08-06,9.68,0,,26.56,ATH,False,False
05-08-2025 09:00,BRLSM,16.68,17.46,16.53,17.34,5653105.0,0.12,0.66,0.08,725.0,0.66,3273310.9,72.7,0.18,True,78.24,0.63,0.07,0.56,2025-08-05,4.39,0,,ATL,ATH,False,False
05-08-2025 09:00,EKSUN,6.31,6.67,6.29,6.61,22376256.0,0.06,0.3,0.04,757.14,0.3,7282465.8,207.26,0.2,True,75.88,0.24,0.01,0.23,2025-08-05,5.09,0,,ATL,ATH,False,False
05-08-2025 09:00,OSTIM,3.95,4.33,3.92,4.26,98001397.0,0.07,0.31,0.01,2718.18,0.31,24130683.7,306.13,0.23,True,69.68,0.02,0.04,-0.02,2025-08-05,8.12,0,,3.64,ATH,False,False
05-08-2025 09:00,USAK,5.37,5.85,5.36,5.85,381617870.0,0.0,0.48,0.06,727.59,0.48,122179159.6,212.34,0.0,True,78.47,0.1,0.09,0.01,2025-08-05,9.96,0,,4.66,ATH,False,False
05-08-2025 09:00,TEKTU,13.99,15.66,13.86,15.66,17730643.0,0.0,1.67,0.38,340.63,1.67,10196588.5,73.89,0.0,True,69.17,1.66,-0.08,1.75,2025-08-05,9.97,0,,ATL,ATH,False,False
05-08-2025 09:00,ATLAS,5.44,5.98,5.42,5.93,4346314.0,0.05,0.49,0.05,920.83,0.49,1512147.7,187.43,0.1,True,75.6,0.2,0.02,0.18,2025-08-05,9.01,0,,4.7,ATH,False,False
05-08-2025 09:00,BYDNR,23.52,25.54,23.12,25.46,3563038.0,0.08,1.94,0.24,695.08,1.94,934808.9,281.15,0.04,True,78.06,1.17,-0.02,1.18,2025-08-05,8.9,1,25.54,ATL,25.54,False,False
04-08-2025 09:00,AYDEM,18.5,19.7,18.5,19.41,11446528.0,0.29,0.91,0.04,2175.0,0.91,6908726.7,65.68,0.32,True,69.46,0.51,-0.02,0.54,2025-08-04,5.95,1,19.7,17.26,19.7,False,False
04-08-2025 09:00,CEOEM,30.74,32.58,29.88,32.58,3952600.0,0.0,1.84,0.34,441.18,1.84,2395952.3,64.97,0.0,True,66.86,0.31,0.42,-0.11,2025-08-04,6.33,0,,26.8,ATH,False,False
04-08-2025 09:00,CONSE,3.56,3.78,3.56,3.76,34485706.0,0.02,0.2,0.02,1150.0,0.2,21368059.0,61.39,0.1,True,71.34,0.18,0.0,0.18,2025-08-04,6.21,0,,ATL,ATH,False,False
04-08-2025 09:00,KRVGD,2.25,2.36,2.24,2.35,62964561.0,0.01,0.1,0.01,669.23,0.1,23059338.0,173.05,0.1,True,76.46,0.08,0.01,0.08,2025-08-04,5.38,0,,ATL,ATH,False,False
04-08-2025 09:00,ARTMS,32.02,34.82,31.66,34.82,3831790.0,0.0,2.8,0.42,569.86,2.8,2035709.3,88.23,0.0,True,82.08,1.35,0.45,0.9,2025-08-04,9.98,0,,27.2,ATH,False,False
01-08-2025 09:00,YYLGD,10.32,10.8,10.3,10.72,24569886.0,0.08,0.4,0.05,751.06,0.4,14925777.8,64.61,0.2,True,65.85,0.22,,,2025-08-01,3.88,0,,9.76,ATH,False,False
01-08-2025 09:00,MPARK,350.5,392.25,350.0,381.0,3457754.0,11.25,30.5,5.08,500.99,30.5,780578.3,342.97,0.37,True,67.25,13.91,,,2025-08-01,-0.59,1,392.25,ATL,392.25,False,False
31-07-2025 09:00,AVHOL,45.92,49.5,45.64,49.5,5760379.0,0.0,3.58,0.6,498.66,3.58,3496643.7,64.74,0.0,True,75.69,2.39,,,2025-07-31,8.55,0,,38.72,ATH,False,False
31-07-2025 09:00,MARBL,14.9,16.08,14.9,15.93,8205621.0,0.15,1.03,0.01,10200.0,1.03,4273470.7,92.01,0.15,True,68.07,0.6,,,2025-07-31,7.2,0,,ATL,ATH,False,False
31-07-2025 09:00,DURDO,3.92,4.25,3.87,4.25,35226770.0,0.0,0.33,0.05,573.47,0.33,19761723.9,78.26,0.0,True,75.38,0.29,,,2025-07-31,9.82,0,,2.91,ATH,False,False
31-07-2025 09:00,ISSEN,8.04,8.83,8.04,8.61,7467223.0,0.22,0.57,0.07,702.82,0.57,2338917.9,219.26,0.39,True,82.5,0.36,,,2025-07-31,7.22,0,,ATL,ATH,False,False
31-07-2025 09:00,CIMSA,49.58,52.0,49.42,51.75,16275974.0,0.25,2.17,0.05,4722.22,2.17,8932247.3,82.22,0.12,True,61.28,0.86,,,2025-07-31,4.59,0,,48.44,53.2,False,False
31-07-2025 09:00,ARENA,37.0,40.38,37.0,39.94,7097080.0,0.44,2.94,0.32,830.38,2.94,2733933.5,159.59,0.15,True,74.63,2.41,,,2025-07-31,8.18,0,,ATL,ATH,False,False
30-07-2025 09:00,BASCM,14.72,16.18,14.72,16.18,826756.0,0.0,1.46,0.2,622.77,1.46,257055.3,221.63,0.0,True,86.12,1.3,,,2025-07-30,9.92,0,,9.5,ATH,False,False
30-07-2025 09:00,IHAAS,39.5,43.74,37.7,43.04,6766031.0,0.7,3.54,0.07,4816.67,3.54,3615142.0,87.16,0.2,True,68.36,3.93,,,2025-07-30,8.2,2,37.7,37.7,43.34,False,False
30-07-2025 09:00,KLSER,30.92,33.98,30.92,33.98,9480022.0,0.0,3.06,0.5,516.94,3.06,3167625.0,199.28,0.0,True,82.53,1.07,,,2025-07-30,9.97,0,,ATL,ATH,False,False
29-07-2025 09:00,BOSSA,6.48,7.09,6.47,7.09,12677738.0,0.0,0.61,0.08,692.21,0.61,5269724.7,140.58,0.0,True,87.19,0.19,,,2025-07-29,9.92,0,,5.91,ATH,False,False
29-07-2025 09:00,LMKDC,28.94,30.34,28.94,30.1,9336684.0,0.24,1.16,0.17,598.8,1.16,4475651.3,108.61,0.21,True,71.63,1.19,,,2025-07-29,2.94,0,,ATL,ATH,False,False
29-07-2025 09:00,YKSLN,5.57,6.07,5.45,6.07,25847427.0,0.0,0.5,0.05,880.39,0.5,16872167.9,53.2,0.0,True,75.03,0.32,,,2025-07-29,9.96,0,,4.57,ATH,False,False
25-07-2025 09:00,ENSRI,26.34,28.88,26.28,28.88,4957624.0,0.0,2.54,0.58,336.43,2.54,2293104.5,116.2,0.0,True,81.59,1.43,,,2025-07-25,9.98,0,,ATL,ATH,False,False
25-07-2025 09:00,ENERY,7.84,8.23,7.84,8.23,71174114.0,0.0,0.39,0.08,375.61,0.39,44560004.1,59.73,0.0,True,77.26,0.42,,,2025-07-25,5.24,0,,ATL,ATH,False,False
25-07-2025 09:00,GEDZA,23.4,25.66,23.4,25.66,5978035.0,0.0,2.26,0.3,648.34,2.26,1829006.8,226.85,0.0,True,78.83,1.25,,,2025-07-25,9.75,0,,ATL,ATH,False,False
25-07-2025 09:00,NIBAS,22.9,25.7,22.64,25.68,2163919.0,0.02,2.78,0.73,281.34,2.78,1124170.1,92.49,0.01,True,80.87,1.68,,,2025-07-25,9.84,0,,ATL,ATH,False,False
24-07-2025 09:00,PKART,69.2,76.25,69.1,74.65,1409431.0,1.6,5.45,0.91,495.63,5.45,575858.0,144.75,0.29,True,75.51,3.12,,,2025-07-24,6.95,0,,60.95,ATH,False,False
24-07-2025 09:00,SERNT,9.64,10.59,9.64,10.59,33008980.0,0.0,0.95,0.07,1238.03,0.95,15020350.3,119.76,0.0,True,68.47,0.14,,,2025-07-24,9.97,0,,9.29,ATH,False,False
24-07-2025 09:00,GOLTS,348.25,365.0,348.25,361.5,569364.0,3.5,13.25,1.18,1027.66,13.25,264573.1,115.2,0.26,True,71.64,10.8,,,2025-07-24,4.18,1,365.0,327.0,365.0,False,False
22-07-2025 09:00,PRZMA,13.58,14.41,13.06,14.19,1010478.0,0.22,0.61,0.08,653.09,0.61,626240.1,61.36,0.36,True,60.1,,,,2025-07-22,3.65,0,,12.5,ATH,False,False
22-07-2025 09:00,BINHO,7.66,8.39,7.62,8.39,175069093.3,0.0,0.74,0.1,665.15,0.74,76398822.37,129.15,0.0,True,82.34,,,,2025-07-22,9.98,0,,6.9,ATH,False,False
21-07-2025 09:00,VSNMD,605.0,676.0,600.5,663.0,2083678.0,13.0,58.0,11.18,419.02,58.0,524674.4,297.14,0.22,True,68.26,,,,2025-07-21,7.8,0,,362.75,ATH,False,False
21-07-2025 09:00,PETUN,10.0,10.28,10.0,10.28,3072465.0,0.0,0.28,0.05,428.3,0.28,1650231.1,86.18,0.0,True,78.42,,,,2025-07-21,2.9,0,,ATL,ATH,False,False
21-07-2025 09:00,ZRGYO,23.28,24.26,23.1,24.04,5302095.0,0.22,0.76,0.06,1210.34,0.76,2525244.0,109.96,0.29,True,57.72,,,,2025-07-21,3.18,0,,22.74,24.48,False,False
21-07-2025 09:00,TKFEN,110.2,115.3,110.2,114.3,5256267.0,1.0,4.1,0.11,3627.27,4.1,3272992.7,60.6,0.24,True,50.94,,,,2025-07-21,3.91,0,,106.3,ATH,False,False
21-07-2025 09:00,KARTN,85.05,87.0,85.05,86.7,406564.0,0.3,1.65,0.0,32900.0,1.65,239558.9,69.71,0.18,True,68.57,,,,2025-07-21,2.48,0,,ATL,89.15,False,False
21-07-2025 09:00,GOKNR,24.32,25.0,24.26,25.0,6480083.0,0.0,0.68,0.02,2733.33,0.68,3452926.4,87.67,0.0,True,67.1,,,,2025-07-21,3.65,0,,ATL,ATH,False,False
21-07-2025 09:00,ASUZU,56.9,62.2,56.75,62.2,2850114.0,0.0,5.3,0.28,1759.65,5.3,819920.1,247.61,0.0,True,75.75,,,,2025-07-21,9.99,0,,55.5,ATH,False,False
18-07-2025 09:00,ULUSE,188.0,205.9,186.1,205.9,213423.0,0.0,17.9,3.33,437.54,17.9,121970.6,74.98,0.0,True,72.84,,,,2025-07-18,9.99,0,,ATL,210.0,False,False
18-07-2025 09:00,IMASM,3.81,4.16,3.81,4.16,160994583.0,0.0,0.35,0.09,293.26,0.35,103950750.7,54.88,0.0,True,75.17,,,,2025-07-18,9.76,0,,3.02,ATH,False,False
18-07-2025 09:00,ICUGS,2.83,3.1,2.79,3.1,185057489.0,0.0,0.27,0.01,1828.57,0.27,75018797.8,146.68,0.0,True,63.46,,,,2025-07-18,9.93,0,,2.67,ATH,False,False
18-07-2025 09:00,GOZDE,18.7,20.48,18.52,20.26,10782432.0,0.22,1.56,0.24,558.23,1.56,4664064.6,131.18,0.14,True,77.99,,,,2025-07-18,8.63,0,,ATL,ATH,False,False
18-07-2025 09:00,MERIT,16.23,17.7,16.04,17.67,13903033.0,0.03,1.44,0.26,462.5,1.44,8444376.4,64.64,0.02,True,80.49,,,,2025-07-18,9.28,0,,ATL,ATH,False,False
18-07-2025 09:00,GLRYH,4.1,4.51,4.1,4.51,58528638.0,0.0,0.41,0.03,1418.52,0.41,27149139.9,115.58,0.0,True,71.09,,,,2025-07-18,10.0,0,,ATL,ATH,False,False
18-07-2025 09:00,QNBFK,36.0,39.56,36.0,39.56,147699.0,0.0,3.56,0.58,518.06,3.56,49834.6,196.38,0.0,True,76.25,,,,2025-07-18,9.95,0,,ATL,ATH,False,False
17-07-2025 09:00,ISFIN,13.44,14.09,13.4,14.03,9653620.0,0.06,0.59,0.08,676.32,0.59,4445764.8,117.14,0.1,True,83.82,,,,2025-07-17,6.13,0,,ATL,ATH,False,False
17-07-2025 09:00,HUNER,4.0,4.35,4.0,4.25,121634372.0,0.1,0.25,0.04,455.56,0.25,49367474.2,146.39,0.4,True,82.54,,,,2025-07-17,7.05,0,,ATL,ATH,False,False
17-07-2025 09:00,EDIP,30.32,32.56,30.22,32.16,9573034.0,0.4,1.84,0.11,1514.04,1.84,4724248.1,102.64,0.22,True,68.08,,,,2025-07-17,7.34,0,,ATL,32.96,False,False
17-07-2025 09:00,LKMNH,15.26,16.35,15.22,16.2,4762695.0,0.15,0.94,0.14,561.97,0.94,2491622.3,91.15,0.16,True,68.3,,,,2025-07-17,6.65,0,,ATL,ATH,False,False
14-07-2025 09:00,TNZTP,23.71,26.03,23.5,25.92,6537354.83,0.11,2.22,0.51,333.76,2.22,3672241.73,78.02,0.05,True,87.9,,,,2025-07-14,9.35,0,,ATL,ATH,False,False
14-07-2025 09:00,ADESE,2.26,2.48,2.26,2.48,644545720.0,0.0,0.22,0.06,280.95,0.22,337968120.0,90.71,0.0,True,76.13,,,,2025-07-14,9.93,0,,ATL,ATH,False,False
14-07-2025 09:00,KLNMA,7.0,7.51,7.0,7.51,577565.0,0.0,0.51,0.1,410.0,0.51,291988.0,97.8,0.0,True,82.88,,,,2025-07-14,9.96,0,,ATL,ATH,False,False
14-07-2025 09:00,SAYAS,50.95,55.9,50.95,55.9,5133996.0,0.0,4.95,0.92,436.88,4.95,3226349.8,59.13,0.0,True,74.32,,,,2025-07-14,9.93,0,,42.42,ATH,False,False
10-07-2025 09:00,KRDMB,25.7,28.02,25.5,27.9,6598145.0,0.12,2.2,0.21,957.69,2.2,2782325.3,137.14,0.05,True,72.18,,,,2025-07-10,9.41,0,,ATL,ATH,False,False
08-07-2025 09:00,DZGYO,6.19,6.78,6.19,6.78,21363464.0,0.0,0.59,0.12,404.27,0.59,9575981.5,123.09,0.0,True,77.69,,,,2025-07-08,9.89,0,,ATL,ATH,False,False
04-07-2025 09:00,HATSN,39.24,42.6,38.7,42.06,4858319.0,0.54,2.82,0.31,809.68,2.82,1748240.2,177.9,0.19,True,,,,,2025-07-04,7.19,0,,ATL,ATH,False,False
04-07-2025 09:00,DITAS,22.5,25.3,22.5,25.3,1999802.0,0.0,2.8,0.31,803.23,2.8,1003171.9,99.35,0.0,True,,,,,2025-07-04,10.0,0,,21.5,ATH,False,False
02-07-2025 09:00,BANVT,192.0,206.0,190.0,206.0,1090134.0,0.0,14.0,1.21,1057.02,14.0,425568.7,156.16,0.0,True,,,,,2025-07-02,9.98,0,,ATL,ATH,False,False
02-07-2025 09:00,OBAMS,52.95,57.45,52.8,56.6,26160235.0,0.85,3.65,0.6,512.42,3.65,13020697.6,100.91,0.23,True,,,,,2025-07-02,8.33,0,,45.58,ATH,False,False
01-07-2025 09:00,DOAS,174.2,182.3,173.2,180.0,2542753.0,2.3,5.8,0.25,2220.0,5.8,1667190.4,52.52,0.4,True,,,,,2025-07-01,3.33,0,,ATL,ATH,False,False
30-06-2025 09:00,GARAN,124.5,135.0,124.2,135.0,48827913.0,0.0,10.5,0.97,982.47,10.5,28552154.5,71.01,0.0,True,,,,,2025-06-30,9.93,0,,ATL,ATH,False,False
30-06-2025 09:00,TCELL,89.9,96.15,89.9,96.15,31869770.0,0.0,6.25,0.18,3471.43,6.25,19599658.2,62.6,0.0,True,,,,,2025-06-30,7.67,0,,ATL,ATH,False,False
30-06-2025 09:00,BJKAS,1.88,1.99,1.88,1.98,134343315.0,0.01,0.1,0.0,9900.0,0.1,64412770.3,108.57,0.1,True,,,,,2025-06-30,5.88,0,,ATL,ATH,False,False
30-06-2025 09:00,MGROS,469.5,498.0,469.5,494.75,2828210.0,3.25,25.25,0.4,6212.5,25.25,1474035.4,91.87,0.13,True,,,,,2025-06-30,5.38,0,,ATL,ATH,False,False
30-06-2025 09:00,YKBNK,29.14,31.7,28.98,31.7,351890890.0,0.0,2.56,0.18,1354.55,2.56,208396445.2,68.86,0.0,True,,,,,2025-06-30,9.99,0,,ATL,ATH,False,False
30-06-2025 09:00,AEFES,14.17,15.0,14.11,14.97,95765547.0,0.03,0.8,0.02,3233.33,0.8,63062364.3,51.86,0.04,True,,,,,2025-06-30,5.8,0,,ATL,ATH,False,False
30-06-2025 09:00,VAKBN,24.68,26.6,24.66,26.46,56805157.0,0.14,1.78,0.18,888.89,1.78,28432738.4,99.79,0.08,True,,,,,2025-06-30,8.09,0,,ATL,ATH,False,False
30-06-2025 09:00,ALBRK,7.46,8.18,7.46,8.18,46757608.0,0.0,0.72,0.04,1656.1,0.72,20214392.1,131.31,0.0,True,,,,,2025-06-30,9.95,0,,ATL,ATH,False,False
30-06-2025 09:00,FROTO,84.2,89.25,83.7,89.25,24183382.0,0.0,5.05,0.23,2048.94,5.05,11395631.6,112.22,0.0,True,,,,,2025-06-30,6.06,0,,ATL,ATH,False,False
30-06-2025 09:00,AKBNK,62.9,68.2,62.65,68.2,181852024.0,0.0,5.3,0.36,1372.22,5.3,94769431.6,91.89,0.0,True,,,,,2025-06-30,10.0,0,,ATL,ATH,False,False
30-06-2025 09:00,SAHOL,82.55,89.65,82.4,89.65,49064067.0,0.0,7.1,0.24,2921.28,7.1,24684247.8,98.77,0.0,True,,,,,2025-06-30,10.0,0,,ATL,ATH,False,False
30-06-2025 09:00,XU100,9452.86,9949.51,9450.8,9948.51,5684619507.0,1.0,495.65,20.41,2328.47,495.65,3160865995.7,79.84,0.0,True,,,,,2025-06-30,5.78,0,,ATL,ATH,False,False
30-06-2025 09:00,XU030,10548.27,11164.11,10540.45,11160.54,3934092847.0,3.57,612.27,28.99,2011.93,612.27,2078620247.3,89.26,0.01,True,,,,,2025-06-30,6.44,0,,ATL,ATH,False,False
30-06-2025 09:00,MEDTR,29.5,31.98,29.36,31.98,1711936.0,0.0,2.48,0.41,504.88,2.48,984341.4,73.92,0.0,True,,,,,2025-06-30,8.33,0,,ATL,ATH,False,False
30-06-2025 09:00,LINK,615.5,660.5,614.0,660.5,181731.0,0.0,45.0,3.7,1116.22,45.0,96145.5,89.02,0.0,True,,,,,2025-06-30,9.99,0,,ATL,ATH,False,False
30-06-2025 09:00,MAVI,35.3,38.6,35.04,38.46,23340252.0,0.14,3.16,0.15,2064.38,3.16,12366221.0,88.74,0.04,True,,,,,2025-06-30,8.95,0,,ATL,ATH,False,False
30-06-2025 09:00,LOGO,145.3,159.1,144.5,159.0,1040925.0,0.1,13.7,0.51,2586.27,13.7,646796.6,60.94,0.01,True,,,,,2025-06-30,9.88,0,,ATL,ATH,False,False
30-06-2025 09:00,AKGRT,5.81,6.22,5.8,6.19,19732388.0,0.03,0.38,0.04,927.03,0.38,7733960.1,155.14,0.08,True,,,,,2025-06-30,6.54,0,,ATL,ATH,False,False
30-06-2025 09:00,XBANK,14195.14,15371.14,14151.83,15368.82,2206947598.0,2.32,1173.68,103.74,1031.41,1173.68,945867954.3,133.33,0.0,True,,,,,2025-06-30,9.64,0,,ATL,ATH,False,False
