Tarih,Hisse,open,high,low,close,volume,YuksekKapanis_Fark,AcilisKapanis_Fark,AcilisKapanisFark_Ort,AcilisKapanisFark_OrtalamayaGoreDegisim,AcilisKapanisFarkOrt_MaxSon10,HacimOrtalama,%Hacim_HacimOrtalama,Fark_Orani,Kosul,rsi,MACD_12_26_9,MACDh_12_26_9,MACDs_12_26_9,Tarih1,prev_close,%Deg,isPivot,pointpos,destek,direnc,Tsinyal_Banker_Dip,Tsinyal_Banker_DipKarar
05-11-2025 17:00,BLCYT,25.46,25.84,25.02,25.8,2120484.0,0.04,0.34,0.01,5566.67,0.34,318218.7,566.36,0.12,True,66.44,0.21,0.04,0.17,2025-11-05,25.8,0.0,0,,24.2,26.22,False,False
05-11-2025 16:00,KTLEV,14.42,14.86,14.4,14.77,18882000.0,0.09,0.35,0.05,629.17,0.35,5857234.6,222.37,0.26,True,73.89,0.12,0.04,0.08,2025-11-05,14.22,3.87,0,,13.79,ATH,False,False
05-11-2025 16:00,FZLGY,14.15,14.53,14.12,14.49,2688583.0,0.04,0.34,0.0,33900.0,0.34,1514248.8,77.55,0.12,True,55.06,-0.04,0.0,-0.05,2025-11-05,14.3,1.33,0,,14.09,14.8,False,False
05-11-2025 16:00,NTHOL,50.15,51.45,50.15,51.45,589919.0,0.0,1.3,0.15,790.41,1.3,254966.8,131.37,0.0,True,67.74,0.19,0.07,0.12,2025-11-05,49.64,3.65,0,,48.9,ATH,False,False
05-11-2025 16:00,ANSGR,23.58,23.88,23.56,23.88,2875825.0,0.0,0.3,0.05,552.17,0.3,865363.7,232.33,0.0,True,64.44,0.04,0.02,0.02,2025-11-05,23.44,1.88,0,,23.14,23.94,False,False
05-11-2025 16:00,MOGAN,9.62,10.34,9.62,10.18,6752408.0,0.16,0.56,0.05,998.04,0.56,984762.2,585.69,0.29,True,75.33,0.04,0.02,0.02,2025-11-05,9.67,5.27,0,,9.54,ATH,False,False
05-11-2025 16:00,LILAK,30.24,30.66,30.2,30.58,705730.0,0.08,0.34,0.05,639.13,0.34,459094.3,53.72,0.24,True,57.01,-0.03,-0.02,-0.01,2025-11-05,30.06,1.73,0,,29.0,31.68,False,False
05-11-2025 16:00,KRSTL,12.1,12.4,12.09,12.32,1869167.0,0.08,0.22,0.06,272.88,0.22,687315.5,171.95,0.36,True,71.65,0.12,0.04,0.08,2025-11-05,11.85,3.97,0,,11.44,ATH,False,False
05-11-2025 16:00,KLSYN,5.88,6.07,5.88,6.03,2829814.0,0.04,0.15,0.02,614.29,0.15,485519.0,482.84,0.27,True,70.81,0.01,0.02,-0.01,2025-11-05,5.78,4.33,0,,5.76,6.08,False,False
05-11-2025 16:00,AYDEM,19.32,19.73,19.32,19.64,565483.0,0.09,0.32,0.02,1500.0,0.32,234572.1,141.07,0.28,True,62.98,0.07,-0.01,0.08,2025-11-05,19.43,1.08,0,,19.22,19.68,False,False
05-11-2025 16:00,IHGZT,1.93,1.97,1.92,1.97,25510512.0,0.0,0.04,0.01,185.71,0.04,15644946.8,63.06,0.0,True,74.92,0.02,0.01,0.01,2025-11-05,1.85,6.49,0,,1.82,ATH,False,False
05-11-2025 16:00,GSDHO,4.76,4.81,4.76,4.8,860666.0,0.01,0.04,0.0,1233.33,0.04,509243.9,69.01,0.25,True,50.27,-0.02,-0.0,-0.01,2025-11-05,4.78,0.42,0,,4.64,4.98,False,False
05-11-2025 16:00,GIPTA,80.4,91.0,79.4,88.15,2758367.0,2.85,7.75,0.88,785.71,7.75,466647.6,491.1,0.37,True,46.41,-5.15,0.41,-5.56,2025-11-05,88.2,-0.06,0,,79.4,101.9,True,True
05-11-2025 16:00,GESAN,47.96,50.7,47.94,50.4,4944421.0,0.3,2.44,0.3,718.79,2.44,751819.8,557.66,0.12,True,77.9,0.27,0.15,0.12,2025-11-05,47.42,6.28,0,,47.14,ATH,False,False
05-11-2025 16:00,FORTE,76.55,78.25,76.55,77.8,508433.0,0.45,1.25,0.36,247.22,1.25,170166.6,198.79,0.36,True,75.11,0.57,0.41,0.16,2025-11-05,73.5,5.85,0,,72.8,78.5,False,False
05-11-2025 16:00,ALVES,28.58,28.98,28.56,28.92,863756.0,0.06,0.34,0.02,2025.0,0.34,559275.6,54.44,0.18,True,55.09,-0.01,-0.05,0.04,2025-11-05,28.78,0.49,0,,26.16,29.52,False,False
05-11-2025 16:00,FENER,10.18,10.26,10.18,10.25,2739894.0,0.01,0.07,0.01,775.0,0.07,1780778.6,53.86,0.14,True,56.76,-0.0,-0.0,-0.0,2025-11-05,10.18,0.69,0,,10.15,10.68,False,False
05-11-2025 16:00,EUPWR,29.08,30.58,29.02,30.42,8739616.0,0.16,1.34,0.18,661.36,1.34,1273350.5,586.35,0.12,True,76.03,0.14,0.14,0.0,2025-11-05,28.32,7.42,0,,28.1,ATH,False,False
05-11-2025 16:00,ENTRA,11.41,11.97,11.4,11.88,10439741.0,0.09,0.47,0.06,683.33,0.47,1792821.2,482.31,0.19,True,70.81,0.05,0.02,0.04,2025-11-05,11.45,3.76,0,,11.13,11.89,False,False
05-11-2025 16:00,ENDAE,16.55,16.86,16.55,16.86,642102.0,0.0,0.31,0.03,1092.31,0.31,252916.8,153.88,0.0,True,65.53,0.06,-0.01,0.06,2025-11-05,16.55,1.87,0,,15.85,16.98,False,False
05-11-2025 16:00,EMKEL,61.45,67.2,61.35,67.2,4387111.0,0.0,5.75,0.61,842.62,5.75,1538164.1,185.22,0.0,True,83.37,1.89,0.0,1.89,2025-11-05,61.1,9.98,0,,59.45,ATH,False,False
05-11-2025 16:00,BRLSM,14.97,15.25,14.96,15.2,397768.0,0.05,0.23,0.02,1337.5,0.23,212543.6,87.15,0.22,True,54.99,-0.04,-0.0,-0.03,2025-11-05,15.1,0.66,0,,14.93,15.59,False,False
05-11-2025 16:00,ELITE,35.16,36.7,35.08,36.4,686685.0,0.3,1.24,0.1,1115.69,1.24,190767.2,259.96,0.24,True,75.51,0.27,-0.03,0.3,2025-11-05,35.58,2.3,0,,32.96,ATH,False,False
05-11-2025 16:00,EDATA,5.75,5.86,5.72,5.85,1168018.0,0.01,0.1,0.01,669.23,0.1,602018.3,94.02,0.1,True,62.17,0.04,-0.0,0.04,2025-11-05,5.8,0.86,0,,5.65,ATH,False,False
05-11-2025 16:00,DOFER,61.25,63.1,60.9,63.0,709453.0,0.1,1.75,0.25,600.0,1.75,194892.3,264.02,0.06,True,60.74,-0.19,0.31,-0.51,2025-11-05,60.7,3.79,0,,58.3,66.1,False,False
05-11-2025 16:00,DOAS,180.6,183.4,180.5,183.4,414633.0,0.0,2.8,0.31,803.23,2.8,196980.6,110.49,0.0,True,63.51,0.46,0.14,0.32,2025-11-05,181.2,1.21,0,,178.7,183.6,False,False
05-11-2025 16:00,OZSUB,19.95,20.26,19.8,20.2,306114.0,0.06,0.25,0.06,290.63,0.25,181186.3,68.95,0.24,True,68.83,0.22,0.03,0.19,2025-11-05,19.42,4.02,0,,18.58,ATH,False,False
05-11-2025 16:00,CIMSA,44.56,44.92,44.46,44.82,1817411.0,0.1,0.26,0.01,2500.0,0.26,1162214.8,56.37,0.38,True,41.96,-0.44,0.04,-0.48,2025-11-05,44.7,0.27,0,,44.44,47.92,True,True
05-11-2025 16:00,ALFAS,44.56,46.5,44.3,46.06,1955724.0,0.44,1.5,0.24,530.25,1.5,329694.6,493.19,0.29,True,75.44,0.13,0.15,-0.02,2025-11-05,43.52,5.84,0,,43.52,ATH,False,False
05-11-2025 16:00,QUAGR,9.04,9.37,9.03,9.31,22246278.0,0.06,0.27,0.04,558.54,0.27,6320525.5,251.97,0.22,True,76.6,0.06,0.04,0.02,2025-11-05,8.8,5.8,0,,8.72,ATH,False,False
05-11-2025 16:00,TATEN,84.5,88.5,82.05,88.4,1650083.0,0.1,3.9,0.57,584.21,3.9,526387.0,213.47,0.03,True,75.86,1.31,0.51,0.79,2025-11-05,81.25,8.8,0,,76.65,ATH,False,False
05-11-2025 16:00,AKFYE,17.63,17.89,17.61,17.85,1972561.0,0.04,0.22,0.04,464.1,0.22,589037.7,234.88,0.18,True,69.91,0.06,0.03,0.04,2025-11-05,17.45,2.29,0,,17.3,ATH,False,False
05-11-2025 16:00,ALBRK,8.34,8.46,8.34,8.44,2597468.0,0.02,0.1,0.01,809.09,0.1,1142887.6,127.27,0.2,True,65.76,0.03,-0.01,0.03,2025-11-05,8.35,1.08,0,,8.27,8.52,False,False
05-11-2025 16:00,TKFEN,81.65,82.7,81.65,82.6,734165.0,0.1,0.95,0.02,4650.0,0.95,311588.6,135.62,0.11,True,50.31,-0.61,0.01,-0.63,2025-11-05,81.35,1.54,0,,81.45,85.95,True,True
05-11-2025 16:00,SOKM,44.68,45.12,44.6,45.06,1663796.0,0.06,0.38,0.01,2614.29,0.38,954216.6,74.36,0.16,True,55.56,0.03,0.02,0.0,2025-11-05,44.86,0.45,0,,43.72,45.58,False,False
05-11-2025 16:00,TNZTP,22.3,22.7,22.3,22.6,396798.0,0.1,0.3,0.03,1053.85,0.3,163942.3,142.04,0.33,True,51.54,-0.14,0.01,-0.15,2025-11-05,22.32,1.25,0,,22.14,23.4,True,True
05-11-2025 16:00,PLTUR,26.76,27.4,26.76,27.4,969326.0,0.0,0.64,0.1,553.06,0.64,262622.9,269.09,0.0,True,70.8,0.2,0.04,0.16,2025-11-05,26.56,3.16,0,,26.12,ATH,False,False
05-11-2025 16:00,VBTYZ,18.78,19.01,18.77,19.0,138631.0,0.01,0.22,0.01,1900.0,0.22,79302.5,74.81,0.05,True,56.08,-0.03,-0.01,-0.02,2025-11-05,18.87,0.69,0,,17.93,19.59,False,False
05-11-2025 16:00,YYLGD,11.27,11.56,11.27,11.55,2513461.0,0.01,0.28,0.01,3400.0,0.28,870158.7,188.85,0.04,True,65.08,0.06,-0.01,0.07,2025-11-05,11.4,1.32,0,,11.19,ATH,False,False
05-11-2025 16:00,AKSA,11.67,12.04,11.67,12.0,8601389.0,0.04,0.33,0.02,1220.0,0.33,2270826.4,278.78,0.12,True,52.96,-0.13,0.01,-0.14,2025-11-05,11.74,2.21,0,,11.96,12.65,True,True
05-11-2025 15:00,BMSTL,74.5,77.3,74.2,77.0,4221746.0,0.3,2.5,0.46,449.45,2.5,564370.2,648.05,0.12,True,74.88,0.49,0.22,0.27,2025-11-05,72.3,6.5,0,,72.15,ATH,False,False
05-11-2025 15:00,TKNSA,27.2,27.76,27.18,27.6,943081.0,0.16,0.4,0.07,440.54,0.4,397038.6,137.53,0.4,True,70.75,0.37,-0.04,0.4,2025-11-05,27.18,1.55,0,,24.28,27.62,False,False
05-11-2025 15:00,SMRTG,27.34,28.3,27.2,28.3,813179.0,0.0,0.96,0.08,1042.86,0.96,393118.0,106.85,0.0,True,72.09,0.11,0.07,0.03,2025-11-05,26.92,5.13,0,,26.9,ATH,False,False
05-11-2025 15:00,BLUME,55.3,56.65,55.2,56.45,339137.0,0.2,1.15,0.08,1433.33,1.15,174725.2,94.1,0.17,True,55.13,-0.24,0.01,-0.25,2025-11-05,55.75,1.26,0,,53.7,57.95,False,False
05-11-2025 15:00,TERA,217.6,227.1,217.2,226.1,5639367.0,1.0,8.5,0.92,823.91,8.5,1420398.5,297.03,0.12,True,66.84,1.5,0.31,1.2,2025-11-05,220.0,2.77,0,,210.4,228.3,False,False
05-11-2025 14:00,BAGFS,33.56,34.78,33.54,34.46,470326.0,0.32,0.9,0.06,1451.72,0.9,125423.5,274.99,0.36,True,57.22,-0.16,0.01,-0.17,2025-11-05,33.9,1.65,0,,33.72,35.84,True,True
05-11-2025 14:00,A1CAP,13.21,13.6,13.16,13.5,3217766.0,0.1,0.29,0.01,3122.22,0.29,1498667.1,114.71,0.34,True,55.12,-0.04,0.01,-0.05,2025-11-05,13.44,0.45,0,,13.03,13.62,True,True
05-11-2025 14:00,MAGEN,29.44,30.4,29.38,30.38,1790587.0,0.02,0.94,0.18,416.48,0.94,990138.6,80.84,0.02,True,70.78,0.28,0.16,0.12,2025-11-05,28.5,6.6,0,,27.74,ATH,False,False
05-11-2025 13:00,PAPIL,17.61,18.74,17.33,18.74,12017582.0,0.0,1.13,0.18,538.42,1.13,3711860.4,223.76,0.0,True,85.3,0.4,0.13,0.27,2025-11-05,17.39,7.76,0,,15.93,ATH,False,False
05-11-2025 13:00,GUBRF,291.75,300.75,289.5,299.25,811126.0,1.5,7.5,1.0,650.0,7.5,335622.1,141.68,0.2,True,50.65,-4.14,0.62,-4.76,2025-11-05,292.25,2.4,0,,285.75,321.25,True,True
05-11-2025 12:00,ARMGD,36.56,37.3,36.48,37.26,415200.0,0.04,0.7,0.06,993.75,0.7,171800.4,141.68,0.06,True,56.92,-0.12,0.05,-0.18,2025-11-05,36.72,1.47,0,,36.34,38.4,True,False
05-11-2025 12:00,HOROZ,62.05,62.45,61.45,62.45,153037.0,0.0,0.4,0.01,3900.0,0.4,94464.5,62.0,0.0,True,51.56,-0.09,0.02,-0.12,2025-11-05,62.1,0.56,0,,61.5,64.35,False,False
05-11-2025 12:00,BORSK,24.46,25.3,24.4,25.26,1795630.0,0.04,0.8,0.17,381.93,0.8,464404.6,286.65,0.05,True,81.4,0.26,0.12,0.14,2025-11-05,23.78,6.22,0,,23.4,ATH,False,False
05-11-2025 12:00,CGCAM,38.68,39.2,38.4,39.08,673798.0,0.12,0.4,0.09,365.12,0.4,444708.5,51.51,0.3,True,70.11,0.66,-0.04,0.7,2025-11-05,38.42,1.72,0,,33.1,39.42,False,False
05-11-2025 11:00,ARCLK,112.4,113.5,112.1,113.4,442322.0,0.1,1.0,0.09,1011.11,1.0,249353.5,77.39,0.1,True,62.69,0.45,-0.16,0.62,2025-11-05,112.1,1.16,0,,106.7,114.9,False,False
05-11-2025 11:00,PETKM,17.52,17.98,17.49,17.97,18094169.0,0.01,0.45,0.04,1084.21,0.45,6821436.6,165.25,0.02,True,72.59,0.06,0.0,0.06,2025-11-05,17.43,3.1,0,,17.01,ATH,False,False
05-11-2025 11:00,YKBNK,33.52,34.2,33.5,34.06,37924614.0,0.14,0.54,0.04,1400.0,0.54,19506750.9,94.42,0.26,True,62.89,0.11,-0.03,0.14,2025-11-05,33.28,2.34,0,,33.12,34.4,False,False
05-11-2025 11:00,BTCIM,4.67,4.7,4.66,4.7,32420643.0,0.0,0.03,0.0,650.0,0.03,21092894.2,53.7,0.0,True,75.4,0.06,-0.01,0.07,2025-11-05,4.68,0.43,0,,4.32,ATH,False,False
05-11-2025 11:00,EGEPO,7.75,7.86,7.73,7.83,595999.0,0.03,0.08,0.0,1900.0,0.08,375312.8,58.8,0.38,True,51.09,-0.02,-0.01,-0.01,2025-11-05,7.79,0.51,0,,7.7,8.13,False,False
05-11-2025 11:00,AEFES,14.49,14.7,14.47,14.69,18235479.0,0.01,0.2,0.01,2122.22,0.2,6949070.3,162.42,0.05,True,62.87,-0.01,0.0,-0.02,2025-11-05,14.4,2.01,0,,14.28,14.85,False,False
05-11-2025 11:00,VESTL,33.94,34.18,33.88,34.12,1242580.0,0.06,0.18,0.03,462.5,0.18,514612.7,141.46,0.33,True,58.97,0.08,-0.02,0.1,2025-11-05,33.92,0.59,0,,32.68,34.8,False,False
05-11-2025 11:00,AGHOL,25.6,25.94,25.58,25.86,801941.0,0.08,0.26,0.03,828.57,0.26,427126.1,87.75,0.31,True,56.63,-0.06,0.0,-0.06,2025-11-05,25.42,1.73,0,,25.3,26.3,False,False
05-11-2025 11:00,BOSSA,7.13,7.26,7.13,7.23,644450.0,0.03,0.1,0.0,3233.33,0.1,371105.9,73.66,0.3,True,40.51,-0.08,-0.01,-0.07,2025-11-05,7.16,0.98,0,,ATL,7.58,False,False
05-11-2025 11:00,PGSUS,211.8,215.0,211.5,214.5,4194016.0,0.5,2.7,0.05,5300.0,2.7,1907456.8,119.87,0.19,True,60.55,1.05,-0.19,1.24,2025-11-05,213.8,0.33,0,,204.8,215.3,False,False
05-11-2025 11:00,BASGZ,41.88,42.78,41.78,42.76,174067.0,0.02,0.88,0.07,1122.22,0.88,69578.5,150.17,0.02,True,75.44,0.28,0.01,0.27,2025-11-05,41.76,2.39,0,,41.06,ATH,False,False
05-11-2025 11:00,MARTI,3.52,3.57,3.51,3.56,3985749.0,0.01,0.04,0.0,1233.33,0.04,1611037.9,147.4,0.25,True,50.06,-0.0,-0.01,0.01,2025-11-05,3.55,0.28,0,,3.49,3.67,False,False
05-11-2025 11:00,RYSAS,15.23,15.53,15.22,15.52,3392051.0,0.01,0.29,0.06,417.86,0.29,677270.1,400.84,0.03,True,74.69,0.06,0.04,0.02,2025-11-05,15.0,3.47,0,,14.81,15.73,False,False
05-11-2025 11:00,KCHOL,171.1,173.0,170.9,172.8,3650528.0,0.2,1.7,0.05,3300.0,1.7,2071805.8,76.2,0.12,True,55.9,0.01,-0.28,0.28,2025-11-05,170.9,1.11,0,,169.1,176.6,False,False
05-11-2025 11:00,ISCTR,12.9,13.06,12.88,13.02,98143618.0,0.04,0.12,0.01,1100.0,0.12,50006208.8,96.26,0.33,True,60.4,0.05,-0.01,0.06,2025-11-05,12.89,1.01,0,,12.79,13.18,False,False
05-11-2025 11:00,BIGEN,11.11,11.41,11.1,11.37,2873940.0,0.04,0.26,0.03,900.0,0.26,1193869.8,140.72,0.15,True,65.86,0.05,0.0,0.04,2025-11-05,11.14,2.06,0,,11.0,ATH,False,False
05-11-2025 11:00,IHLGM,2.95,3.03,2.94,3.03,18747545.0,0.0,0.08,0.0,1500.0,0.08,7316755.9,156.23,0.0,True,61.49,-0.0,-0.0,-0.0,2025-11-05,2.92,3.77,0,,2.85,3.14,False,False
05-11-2025 11:00,IHLAS,3.41,3.57,3.39,3.56,86320993.0,0.01,0.15,0.03,435.71,0.15,26562996.2,224.97,0.07,True,78.63,0.04,0.02,0.03,2025-11-05,3.31,7.55,0,,3.25,ATH,False,False
05-11-2025 10:00,IHEVA,2.65,2.69,2.65,2.69,898655.0,0.0,0.04,0.01,566.67,0.04,293646.0,206.03,0.0,True,62.97,0.01,-0.0,0.01,2025-11-05,2.65,1.51,0,,2.61,2.71,False,False
05-11-2025 10:00,ULKER,108.5,110.9,108.1,110.3,1597235.0,0.6,1.8,0.06,2900.0,1.8,460414.2,246.91,0.33,True,65.76,0.17,-0.03,0.2,2025-11-05,108.6,1.57,0,,107.5,110.9,False,False
05-11-2025 10:00,KZBGY,15.67,16.08,15.67,16.05,3471547.0,0.03,0.38,0.0,12566.67,0.38,1317330.7,163.53,0.08,True,55.03,-0.07,-0.02,-0.05,2025-11-05,15.64,2.62,0,,15.6,16.53,False,False
05-11-2025 10:00,SELVA,2.01,2.14,2.0,2.12,10933037.0,0.02,0.11,0.01,1275.0,0.11,2467206.2,343.13,0.18,True,49.05,-0.03,-0.0,-0.03,2025-11-05,2.07,2.42,0,,2.06,2.49,False,False
05-11-2025 10:00,GMTAS,43.06,44.24,43.0,44.2,254314.0,0.04,1.14,0.06,1681.25,1.14,129371.0,96.58,0.04,True,69.83,0.36,0.04,0.32,2025-11-05,43.0,2.79,0,,42.6,44.8,False,False
05-11-2025 10:00,VSNMD,136.4,140.6,135.6,139.5,1737496.0,1.1,3.1,0.19,1531.58,3.1,474862.7,265.89,0.35,True,66.8,0.78,0.24,0.53,2025-11-05,135.5,2.95,0,,131.3,139.7,False,False
05-11-2025 10:00,IHAAS,42.0,44.08,41.68,43.62,526767.0,0.46,1.62,0.41,293.2,1.62,183965.7,186.34,0.28,True,72.86,0.66,0.16,0.5,2025-11-05,42.12,3.56,0,,39.56,ATH,False,False
05-11-2025 10:00,DITAS,28.42,29.72,28.18,29.64,710049.0,0.08,1.22,0.2,522.45,1.22,188089.5,277.51,0.07,True,71.47,0.32,0.14,0.18,2025-11-05,27.96,6.01,0,,26.9,ATH,False,False
05-11-2025 10:00,PCILT,25.16,26.3,25.16,26.06,806231.0,0.24,0.9,0.1,782.35,0.9,189206.1,326.11,0.27,True,68.77,0.39,-0.07,0.45,2025-11-05,25.14,3.66,0,,24.98,26.78,False,False
05-11-2025 10:00,IHYAY,2.54,2.72,2.54,2.72,25549349.0,0.0,0.18,0.01,1400.0,0.18,3038424.4,740.87,0.0,True,78.89,0.02,0.01,0.01,2025-11-05,2.52,7.94,0,,2.49,ATH,False,False
05-11-2025 10:00,ALKA,10.95,11.47,10.88,11.38,4834468.0,0.09,0.43,0.02,2766.67,0.43,999279.5,383.8,0.21,True,54.08,-0.16,0.04,-0.21,2025-11-05,10.91,4.31,0,,10.85,13.46,True,True
04-11-2025 17:00,KATMR,3.25,3.52,3.22,3.52,160750410.0,0.0,0.27,0.03,831.03,0.27,36446406.2,341.06,0.0,True,77.12,0.06,0.01,0.06,2025-11-04,3.2,10.0,0,,3.18,ATH,False,False
04-11-2025 17:00,YYAPI,2.75,2.92,2.73,2.91,132194424.0,0.01,0.16,0.01,1130.77,0.16,68726481.8,92.35,0.06,True,80.36,0.11,0.0,0.11,2025-11-04,2.66,9.4,0,,2.61,ATH,False,False
04-11-2025 17:00,BERA,19.13,19.6,19.05,19.49,9516803.0,0.11,0.36,0.02,1614.29,0.36,2017459.3,371.72,0.31,True,65.82,0.19,-0.0,0.19,2025-11-04,19.17,1.67,1,19.6,18.9,19.6,False,False
04-11-2025 17:00,SKBNK,8.1,8.19,8.06,8.19,8532571.0,0.0,0.09,0.01,1185.71,0.09,4727789.8,80.48,0.0,True,64.2,0.06,-0.01,0.07,2025-11-04,8.14,0.61,2,8.06,8.06,8.24,False,False
04-11-2025 16:00,YATAS,37.08,37.44,37.08,37.38,215350.0,0.06,0.3,0.03,971.43,0.3,83758.7,157.11,0.2,True,59.21,0.06,0.01,0.05,2025-11-04,37.0,1.03,0,,36.8,37.62,False,False
04-11-2025 16:00,KIMMR,15.79,16.32,15.78,16.2,988065.0,0.12,0.41,0.05,772.34,0.41,395243.1,149.99,0.29,True,70.53,0.29,0.03,0.25,2025-11-04,15.25,6.23,1,16.32,15.09,16.32,False,False
04-11-2025 16:00,USAK,3.47,3.64,3.46,3.6,24428789.0,0.04,0.13,0.0,2500.0,0.13,8601609.8,184.0,0.31,True,66.52,0.01,-0.0,0.01,2025-11-04,3.53,1.98,2,3.46,3.46,ATH,False,False
04-11-2025 16:00,KAYSE,18.2,19.39,18.19,19.29,4170105.0,0.1,1.09,0.1,1047.37,1.09,824718.6,405.64,0.09,True,81.21,0.1,0.05,0.05,2025-11-04,18.25,5.7,0,,17.9,ATH,False,False
04-11-2025 15:00,AHGAZ,28.6,29.3,28.6,29.14,1081225.0,0.16,0.54,0.02,2150.0,0.54,493683.6,119.01,0.3,True,65.76,0.11,-0.03,0.14,2025-11-04,28.62,1.82,1,29.3,27.74,29.3,False,False
04-11-2025 15:00,ENERY,9.71,10.34,9.7,10.33,25248698.0,0.01,0.62,0.04,1450.0,0.62,5232349.5,382.55,0.02,True,74.01,0.06,0.01,0.05,2025-11-04,9.9,4.34,0,,9.65,ATH,False,False
04-11-2025 15:00,OYLUM,10.49,10.72,10.49,10.72,155506.0,0.0,0.23,0.01,3185.71,0.23,85145.8,82.63,0.0,True,45.98,-0.06,-0.04,-0.02,2025-11-04,10.89,-1.56,0,,10.41,11.0,False,False
04-11-2025 15:00,ALCTL,126.4,136.0,126.4,136.0,2163468.0,0.0,9.6,0.82,1070.73,9.6,482792.2,348.12,0.0,True,73.77,2.31,0.05,2.26,2025-11-04,123.7,9.94,1,136.0,119.8,ATH,False,False
04-11-2025 13:00,SRVGY,3.2,3.29,3.2,3.29,17530974.0,0.0,0.09,0.0,2150.0,0.09,3634273.6,382.38,0.0,True,65.96,0.03,-0.0,0.04,2025-11-04,3.22,2.17,0,,3.18,ATH,False,False
04-11-2025 13:00,SEYKM,6.32,6.71,6.32,6.6,481756.0,0.11,0.28,0.01,3400.0,0.28,171637.2,180.68,0.39,True,51.7,-0.08,-0.01,-0.07,2025-11-04,6.47,2.01,1,6.71,6.14,6.71,False,False
04-11-2025 12:00,ONCSM,207.3,218.2,205.0,215.4,508995.0,2.8,8.1,0.73,1009.59,8.1,192000.2,165.1,0.35,True,59.13,0.73,-0.61,1.35,2025-11-04,206.3,4.41,1,218.2,198.6,218.2,False,False
04-11-2025 11:00,MANAS,7.24,7.5,7.23,7.44,5956186.0,0.06,0.2,0.02,769.57,0.2,1617190.8,268.3,0.3,True,64.99,0.03,0.01,0.03,2025-11-04,7.22,3.05,0,,7.1,7.62,False,False
04-11-2025 11:00,ESCOM,3.52,3.57,3.52,3.57,19530395.0,0.0,0.05,0.01,400.0,0.05,9024570.2,116.41,0.0,True,78.76,0.06,0.01,0.05,2025-11-04,3.45,3.48,0,,3.22,ATH,False,False
04-11-2025 10:00,EREGL,28.86,29.4,28.82,29.3,69835128.0,0.1,0.44,0.13,233.33,0.44,27974673.5,149.64,0.23,True,81.02,0.38,0.1,0.28,2025-11-04,28.84,1.6,0,,27.4,ATH,False,False
04-11-2025 10:00,DURDO,3.99,4.12,3.97,4.1,2500685.0,0.02,0.11,0.01,2100.0,0.11,1162611.9,115.09,0.18,True,71.91,0.07,-0.0,0.07,2025-11-04,3.95,3.8,0,,3.95,ATH,False,False
04-11-2025 10:00,ORCAY,3.99,4.48,3.78,4.48,3419745.0,0.0,0.49,0.07,627.78,0.49,1072685.3,218.8,0.0,True,62.83,0.02,0.02,-0.01,2025-11-04,4.08,9.8,1,4.48,3.71,ATH,False,False
04-11-2025 10:00,ANHYT,102.3,107.5,101.5,106.8,798191.0,0.7,4.5,0.42,971.43,4.5,204747.1,289.84,0.16,True,73.79,0.96,0.04,0.92,2025-11-04,102.3,4.4,3,,98.45,ATH,False,False
04-11-2025 10:00,RALYH,199.0,201.7,197.7,201.7,83638.0,0.0,2.7,0.51,429.41,2.7,41116.9,103.42,0.0,True,69.03,0.94,0.13,0.8,2025-11-04,198.5,1.61,0,,195.3,ATH,False,False
04-11-2025 10:00,SMRVA,340.0,364.25,339.0,363.5,2843179.0,0.75,23.5,3.02,676.86,23.5,495486.5,473.82,0.03,True,76.17,5.68,3.81,1.86,2025-11-04,339.0,7.23,0,,301.75,388.0,False,False
04-11-2025 10:00,GUNDG,96.0,98.0,94.55,97.5,77020.0,0.5,1.5,0.36,310.96,1.5,37350.9,106.21,0.33,True,48.49,-0.63,0.17,-0.8,2025-11-04,96.0,1.56,2,94.55,94.55,102.6,False,False
04-11-2025 10:00,MARMR,3.32,3.64,3.15,3.64,62457459.0,0.0,0.32,0.04,700.0,0.32,10507954.4,494.38,0.0,True,78.7,0.06,0.05,0.01,2025-11-04,3.31,9.97,3,,2.97,ATH,False,False
04-11-2025 10:00,SUWEN,11.64,12.1,11.64,12.04,7976074.0,0.06,0.4,0.04,852.38,0.4,2500218.1,219.02,0.15,True,67.97,0.22,-0.02,0.24,2025-11-04,11.65,3.35,1,12.1,10.68,12.1,False,False
04-11-2025 10:00,NIBAS,24.44,26.3,24.02,26.3,3991265.0,0.0,1.86,0.21,802.91,1.86,459284.3,769.02,0.0,True,87.01,0.56,0.14,0.42,2025-11-04,23.92,9.95,1,26.3,22.36,ATH,False,False
04-11-2025 10:00,THYAO,294.0,295.0,293.5,294.75,5771362.0,0.25,0.75,0.2,275.0,0.75,3442637.7,67.64,0.33,True,64.0,0.49,0.2,0.29,2025-11-04,294.0,0.26,1,295.0,289.0,295.0,False,False
04-11-2025 10:00,AKBNK,60.8,62.05,60.75,61.95,27352543.0,0.1,1.15,0.03,3733.33,1.15,11075149.6,146.97,0.09,True,62.25,0.46,-0.03,0.49,2025-11-04,61.1,1.39,0,,58.3,63.1,False,False
04-11-2025 10:00,TAVHL,268.75,271.5,266.75,271.0,446139.0,0.5,2.25,0.48,373.68,2.25,204570.2,118.09,0.22,True,68.71,2.48,0.11,2.37,2025-11-04,269.0,0.74,2,266.75,266.75,271.5,False,False
04-11-2025 10:00,AHSGY,54.4,56.95,53.4,56.95,869863.0,0.0,2.55,0.69,272.26,2.55,318318.5,173.27,0.0,True,84.53,2.06,0.57,1.5,2025-11-04,51.8,9.94,1,56.95,46.52,ATH,False,False
04-11-2025 10:00,BULGS,44.34,48.44,44.0,47.92,16824254.0,0.52,3.58,0.06,6292.86,3.58,5258661.0,219.93,0.15,True,56.42,0.03,-0.59,0.62,2025-11-04,45.0,6.49,3,,32.9,52.15,False,False
04-11-2025 10:00,KLKIM,34.32,35.92,34.04,35.68,2254493.0,0.24,1.36,0.1,1233.33,1.36,477129.7,372.51,0.18,True,75.4,0.34,0.04,0.3,2025-11-04,34.24,4.21,1,35.92,33.98,35.92,False,False
04-11-2025 10:00,ICBCT,15.3,15.42,15.16,15.41,564430.0,0.01,0.11,0.01,900.0,0.11,158633.5,255.81,0.09,True,61.66,0.08,-0.0,0.08,2025-11-04,15.28,0.85,0,,14.96,15.56,False,False
04-11-2025 10:00,CANTE,2.46,2.6,2.45,2.59,302944286.0,0.01,0.13,0.01,1344.44,0.13,73636075.2,311.41,0.08,True,79.54,0.06,0.0,0.05,2025-11-04,2.46,5.28,0,,2.23,ATH,False,False
04-11-2025 10:00,BVSAN,126.2,134.5,126.0,133.7,1281403.0,0.8,7.5,0.49,1430.61,7.5,243409.7,426.44,0.11,True,60.99,-0.96,0.19,-1.15,2025-11-04,125.0,6.96,1,134.5,124.1,134.5,True,True
04-11-2025 10:00,KLMSN,37.66,39.02,37.48,38.8,199294.0,0.22,1.14,0.08,1400.0,1.14,80689.3,146.99,0.19,True,73.53,0.72,-0.05,0.78,2025-11-04,37.56,3.3,0,,32.46,ATH,False,False
04-11-2025 10:00,TUKAS,2.89,3.04,2.85,3.03,124556644.0,0.01,0.14,0.01,1455.56,0.14,29345558.0,324.45,0.07,True,73.7,0.04,-0.0,0.04,2025-11-04,2.88,5.21,2,2.85,2.85,ATH,False,False
04-11-2025 10:00,KMPUR,19.12,20.08,19.0,19.86,7083190.0,0.22,0.74,0.22,237.9,0.74,1288368.2,449.78,0.3,True,91.25,0.59,0.23,0.36,2025-11-04,18.64,6.55,1,20.08,16.81,20.08,False,False
04-11-2025 10:00,DOFRB,106.9,112.2,104.6,112.2,2603709.0,0.0,5.3,0.53,900.0,5.3,312000.1,734.52,0.0,True,88.59,4.2,1.19,3.0,2025-11-04,102.0,10.0,1,112.2,82.5,ATH,False,False
03-11-2025 17:00,SURGY,47.26,49.82,47.14,49.76,3581835.0,0.06,2.5,0.21,1090.48,2.5,667862.3,436.31,0.02,True,71.7,0.44,0.07,0.37,2025-11-03,47.2,5.42,2,47.14,47.14,ATH,False,False
03-11-2025 17:00,UNLU,15.89,16.2,15.87,16.16,390636.0,0.04,0.27,0.02,1700.0,0.27,204662.3,90.87,0.15,True,70.58,0.24,-0.01,0.25,2025-11-03,15.89,1.7,0,,15.17,16.25,False,False
03-11-2025 17:00,PASEU,142.4,146.3,142.0,146.3,2731937.0,0.0,3.9,1.3,200.0,3.9,1320877.9,106.83,0.0,True,72.74,0.87,1.23,-0.35,2025-11-03,133.0,10.0,0,,133.0,ATH,False,False
03-11-2025 17:00,HUNER,3.88,3.94,3.86,3.94,3580860.0,0.0,0.06,0.02,275.0,0.06,2021826.5,77.11,0.0,True,65.37,0.03,0.01,0.03,2025-11-03,3.79,3.96,0,,3.7,ATH,False,False
03-11-2025 17:00,SAMAT,6.75,7.1,6.75,7.1,1590527.0,0.0,0.35,0.06,473.77,0.35,361463.7,340.02,0.0,True,80.36,0.09,0.05,0.04,2025-11-03,6.46,9.91,0,,6.42,ATH,False,False
03-11-2025 17:00,DCTTR,32.36,32.92,32.36,32.88,343494.0,0.04,0.52,0.08,519.05,0.52,211218.1,62.63,0.08,True,64.9,0.36,0.01,0.35,2025-11-03,32.02,2.69,0,,31.4,33.14,False,False
03-11-2025 17:00,LIDER,64.7,66.8,64.7,66.2,175859.0,0.6,1.5,0.27,455.56,1.5,60217.5,192.04,0.4,True,60.26,0.17,0.09,0.07,2025-11-03,63.65,4.01,0,,63.2,67.1,False,False
03-11-2025 17:00,KOZAL,27.26,27.58,27.02,27.52,16655488.0,0.06,0.26,0.05,381.48,0.26,9725746.3,71.25,0.23,True,66.02,0.25,-0.03,0.27,2025-11-03,26.88,2.38,0,,26.66,27.64,False,False
03-11-2025 17:00,MOBTL,8.09,8.29,8.08,8.29,3088506.0,0.0,0.2,0.03,669.23,0.2,2040086.1,51.39,0.0,True,63.87,0.12,0.01,0.11,2025-11-03,8.0,3.62,0,,7.54,ATH,False,False
03-11-2025 16:00,TDGYO,27.16,28.68,27.16,28.66,505696.0,0.02,1.5,0.28,443.48,1.5,211728.8,138.84,0.01,True,94.72,0.81,0.13,0.68,2025-11-03,26.36,8.73,0,,21.5,ATH,False,False
03-11-2025 16:00,BESLR,14.36,14.77,14.32,14.66,2054338.0,0.11,0.3,0.05,476.92,0.3,630130.0,226.02,0.37,True,77.63,0.19,0.04,0.15,2025-11-03,14.04,4.42,0,,13.65,ATH,False,False
03-11-2025 16:00,MNDTR,8.59,8.94,8.58,8.91,1789648.0,0.03,0.32,0.06,442.37,0.32,964968.0,85.46,0.09,True,77.04,0.16,0.03,0.14,2025-11-03,8.38,6.32,0,,8.21,ATH,False,False
03-11-2025 15:00,TATGD,14.19,14.46,14.19,14.43,1571319.0,0.03,0.24,0.08,207.69,0.24,429846.1,265.55,0.13,True,83.71,0.26,0.05,0.21,2025-11-03,13.82,4.41,0,,13.35,ATH,False,False
03-11-2025 15:00,AKENR,10.63,10.84,10.6,10.81,1551534.0,0.03,0.18,0.05,291.3,0.18,926695.1,67.43,0.17,True,81.89,0.1,0.04,0.06,2025-11-03,10.29,5.05,0,,10.22,ATH,False,False
03-11-2025 15:00,CATES,35.24,36.16,35.14,35.96,488372.0,0.2,0.72,0.13,462.5,0.72,193104.6,152.91,0.28,True,72.66,0.55,0.11,0.44,2025-11-03,34.34,4.72,1,36.16,32.74,36.16,False,False
03-11-2025 15:00,NTGAZ,11.18,11.48,11.16,11.43,2225705.0,0.05,0.25,0.03,733.33,0.25,1423702.2,56.33,0.2,True,69.16,0.21,0.01,0.21,2025-11-03,11.2,2.05,0,,9.88,ATH,False,False
03-11-2025 15:00,BNTAS,7.29,7.42,7.29,7.4,1974265.0,0.02,0.11,0.03,279.31,0.11,1238239.1,59.44,0.18,True,86.72,0.15,0.03,0.12,2025-11-03,7.07,4.67,1,7.42,6.74,7.42,False,False
03-11-2025 15:00,ADEL,30.86,32.0,30.82,31.9,1069891.0,0.1,1.04,0.14,642.86,1.04,334829.4,219.53,0.1,True,70.08,0.3,0.05,0.25,2025-11-03,30.96,3.04,0,,29.62,31.92,False,False
03-11-2025 14:00,TOASO,264.5,267.75,264.25,267.5,944988.0,0.25,3.0,0.38,700.0,3.0,611277.3,54.59,0.08,True,58.59,0.04,0.31,-0.27,2025-11-03,264.25,1.23,0,,259.5,272.25,False,False
03-11-2025 14:00,KZGYO,27.04,27.66,26.94,27.54,656895.0,0.12,0.5,0.08,557.89,0.5,300381.8,118.69,0.24,True,65.59,0.2,-0.01,0.21,2025-11-03,27.02,1.92,0,,26.18,27.74,False,False
03-11-2025 13:00,PINSU,13.95,14.35,13.92,14.32,2755873.0,0.03,0.37,0.04,848.72,0.37,849238.3,224.51,0.08,True,66.03,0.04,0.03,0.02,2025-11-03,13.87,3.24,0,,13.73,14.61,False,False
03-11-2025 13:00,HUBVC,3.75,4.0,3.75,4.0,2269876.0,0.0,0.25,0.03,762.07,0.25,1303459.8,74.14,0.0,True,67.16,0.07,-0.02,0.08,2025-11-03,3.78,5.82,0,,3.6,ATH,False,False
03-11-2025 12:00,MEKAG,4.87,4.93,4.87,4.92,2945765.0,0.01,0.05,0.01,525.0,0.05,1210452.5,143.36,0.2,True,66.11,0.0,0.01,-0.01,2025-11-03,4.79,2.71,0,,4.77,4.98,False,False
03-11-2025 12:00,ASTOR,99.45,101.2,99.45,100.7,3090144.0,0.5,1.25,0.29,338.6,1.25,1917633.4,61.14,0.4,True,74.91,0.93,0.25,0.68,2025-11-03,98.2,2.55,1,101.2,95.1,101.2,False,False
03-11-2025 12:00,KRVGD,2.6,2.66,2.59,2.65,3157782.0,0.01,0.05,0.01,525.0,0.05,919351.7,243.48,0.2,True,71.17,0.01,0.01,0.0,2025-11-03,2.57,3.11,0,,2.51,ATH,False,False
03-11-2025 11:00,OFSYM,70.85,72.5,70.75,72.15,201400.0,0.35,1.3,0.12,1030.43,1.3,86593.6,132.58,0.27,True,52.88,-0.3,0.03,-0.33,2025-11-03,71.0,1.62,0,,70.05,74.8,False,False
03-11-2025 11:00,BAYRK,36.12,38.38,36.1,38.38,1455628.0,0.0,2.26,0.24,849.58,2.26,386872.1,276.26,0.0,True,74.51,0.16,0.1,0.06,2025-11-03,35.54,7.99,0,,35.34,ATH,False,False
03-11-2025 11:00,ZEDUR,8.95,9.15,8.92,9.14,480962.0,0.01,0.19,0.01,1800.0,0.19,142364.2,237.84,0.05,True,79.75,0.15,0.03,0.12,2025-11-03,8.69,5.18,1,9.15,8.27,9.15,False,False
03-11-2025 11:00,AFYON,13.21,13.36,13.19,13.34,1977057.0,0.02,0.13,0.02,465.22,0.13,651991.1,203.23,0.15,True,73.28,0.09,0.02,0.07,2025-11-03,13.25,0.68,0,,12.95,ATH,False,False
03-11-2025 11:00,MAVI,40.66,41.54,40.58,41.32,2390384.0,0.22,0.66,0.12,440.98,0.66,1034304.4,131.11,0.33,True,76.19,0.29,0.12,0.17,2025-11-03,40.3,2.53,1,41.54,38.36,41.54,False,False
03-11-2025 11:00,JANTS,21.32,21.52,21.32,21.52,643214.0,0.0,0.2,0.01,1328.57,0.2,368861.0,74.38,0.0,True,61.62,0.09,0.02,0.07,2025-11-03,21.26,1.22,0,,20.94,21.88,False,False
03-11-2025 11:00,KLSER,32.16,33.1,31.98,33.08,675823.0,0.02,0.92,0.17,454.22,0.92,369489.8,82.91,0.02,True,82.34,0.66,0.15,0.51,2025-11-03,31.42,5.28,0,,29.52,ATH,False,False
03-11-2025 11:00,TSPOR,1.3,1.34,1.3,1.33,117678936.0,0.01,0.03,0.01,500.0,0.03,49459384.6,137.93,0.33,True,64.09,-0.0,0.01,-0.01,2025-11-03,1.27,4.72,0,,1.26,1.48,True,False
03-11-2025 11:00,AKSEN,52.9,54.3,52.8,53.95,3434262.0,0.35,1.05,0.24,346.81,1.05,1843198.8,86.32,0.33,True,74.46,1.03,0.23,0.81,2025-11-03,52.0,3.75,0,,49.0,ATH,False,False
03-11-2025 11:00,ISDMR,39.06,39.48,39.06,39.44,542007.0,0.04,0.38,0.06,533.33,0.38,240053.2,125.79,0.11,True,69.12,0.13,0.04,0.09,2025-11-03,38.64,2.07,0,,38.28,ATH,False,False
03-11-2025 11:00,ARSAN,3.09,3.15,3.08,3.14,3170761.0,0.01,0.05,0.02,212.5,0.05,1740228.7,82.2,0.2,True,80.64,0.05,0.02,0.04,2025-11-03,3.03,3.63,0,,2.81,ATH,False,False
03-11-2025 11:00,YKSLN,6.18,6.29,6.18,6.27,1301169.0,0.02,0.09,0.01,650.0,0.09,676459.1,92.35,0.22,True,73.7,0.04,0.02,0.02,2025-11-03,6.11,2.62,0,,5.95,ATH,False,False
03-11-2025 11:00,CEOEM,27.0,27.98,26.98,27.76,605221.0,0.22,0.76,0.04,1709.52,0.76,230707.6,162.33,0.29,True,64.26,0.14,0.04,0.11,2025-11-03,26.7,3.97,0,,26.3,29.24,False,False
03-11-2025 11:00,GOKNR,23.2,23.6,23.18,23.58,833175.0,0.02,0.38,0.07,413.51,0.38,429250.5,94.1,0.05,True,80.37,0.26,0.07,0.19,2025-11-03,23.06,2.25,0,,22.22,ATH,False,False
03-11-2025 11:00,OSMEN,10.75,10.95,10.75,10.93,928489.0,0.02,0.18,0.03,592.31,0.18,524116.6,77.15,0.11,True,74.37,0.15,0.02,0.13,2025-11-03,10.63,2.82,0,,10.03,ATH,False,False
03-11-2025 11:00,GLRYH,4.92,5.11,4.92,5.1,5927762.0,0.01,0.18,0.02,718.18,0.18,1699866.3,248.72,0.06,True,86.02,0.1,0.01,0.08,2025-11-03,4.8,6.25,0,,4.34,ATH,False,False
03-11-2025 11:00,A1YEN,31.38,32.1,31.38,32.04,553262.0,0.06,0.66,0.07,900.0,0.66,301276.1,83.64,0.09,True,75.71,0.51,0.03,0.49,2025-11-03,30.78,4.09,0,,28.7,ATH,False,False
03-11-2025 11:00,GEREL,19.24,19.6,19.21,19.55,1829961.0,0.05,0.31,0.02,1723.53,0.31,788285.2,132.14,0.16,True,54.76,-0.03,-0.0,-0.02,2025-11-03,19.27,1.45,2,19.21,19.21,19.96,False,False
03-11-2025 11:00,MARBL,14.39,14.57,14.39,14.52,407633.0,0.05,0.13,0.0,6400.0,0.13,204911.0,98.93,0.38,True,63.55,0.12,-0.0,0.12,2025-11-03,14.3,1.54,0,,14.11,14.58,False,False
03-11-2025 11:00,PENGD,8.98,9.14,8.9,9.12,2297267.0,0.02,0.14,0.02,460.0,0.14,625868.6,267.05,0.14,True,70.71,0.03,0.02,0.02,2025-11-03,8.84,3.17,0,,8.76,ATH,False,False
03-11-2025 10:00,CELHA,9.05,9.3,9.05,9.29,759945.0,0.01,0.24,0.03,650.0,0.24,227561.8,233.95,0.04,True,73.35,0.07,0.01,0.06,2025-11-03,9.05,2.65,0,,8.71,9.33,False,False
03-11-2025 10:00,KONTR,31.44,33.24,31.28,33.02,33256415.0,0.22,1.58,0.43,270.89,1.58,10654980.6,212.12,0.14,True,85.3,0.76,0.39,0.37,2025-11-03,31.5,4.83,0,,28.46,ATH,False,False
03-11-2025 10:00,LKMNH,16.91,17.04,16.85,17.02,261462.0,0.02,0.11,0.01,685.71,0.11,150625.0,73.58,0.18,True,63.42,0.06,-0.0,0.06,2025-11-03,16.82,1.19,0,,16.72,17.18,False,False
03-11-2025 10:00,LRSHO,6.12,6.52,6.07,6.41,30368874.0,0.11,0.29,0.05,447.17,0.29,7126206.7,326.16,0.38,True,73.64,0.06,0.04,0.02,2025-11-03,6.05,5.95,0,,5.78,6.49,False,False
03-11-2025 10:00,MAKTK,15.24,16.1,15.13,15.98,3890428.0,0.12,0.74,0.09,687.23,0.74,915353.7,325.02,0.16,True,75.99,0.16,0.07,0.09,2025-11-03,15.03,6.32,0,,14.59,ATH,False,False
03-11-2025 10:00,PENTA,15.45,15.75,15.45,15.68,721459.0,0.07,0.23,0.04,475.0,0.23,276853.3,160.59,0.3,True,77.58,0.19,0.01,0.17,2025-11-03,15.4,1.82,0,,14.53,ATH,False,False
03-11-2025 10:00,METRO,6.11,6.52,5.9,6.46,9849776.0,0.06,0.35,0.0,8650.0,0.35,3332500.4,195.57,0.17,True,70.58,0.17,-0.02,0.19,2025-11-03,6.1,5.9,3,,5.41,6.56,False,False
03-11-2025 10:00,SERNT,10.35,10.77,10.34,10.68,4662607.0,0.09,0.33,0.03,870.59,0.33,983574.8,374.05,0.27,True,72.87,0.05,0.01,0.03,2025-11-03,10.34,3.29,1,10.77,10.25,10.77,False,False
03-11-2025 10:00,YEOTK,34.2,35.24,34.2,35.18,1501833.0,0.06,0.98,0.13,642.42,0.98,429064.8,250.02,0.06,True,76.08,0.23,0.06,0.17,2025-11-03,34.32,2.51,0,,33.7,ATH,False,False
03-11-2025 10:00,YUNSA,7.56,7.67,7.55,7.66,920362.0,0.01,0.1,0.03,244.83,0.1,515283.7,78.61,0.1,True,70.58,0.06,0.01,0.04,2025-11-03,7.55,1.46,0,,7.33,ATH,False,False
03-11-2025 10:00,VESBE,8.86,9.11,8.86,9.1,5759931.0,0.01,0.24,0.03,585.71,0.24,1746516.7,229.8,0.04,True,77.69,0.08,0.03,0.05,2025-11-03,8.79,3.53,0,,8.44,ATH,False,False
03-11-2025 10:00,AGROT,7.6,7.72,7.59,7.69,3051724.0,0.03,0.09,0.02,429.41,0.09,997848.0,205.83,0.33,True,70.12,0.04,0.0,0.04,2025-11-03,7.58,1.45,0,,7.47,ATH,False,False
03-11-2025 10:00,TURSG,12.45,12.97,12.35,12.96,21689353.0,0.01,0.51,0.03,1600.0,0.51,7975712.6,171.94,0.02,True,67.93,0.12,-0.02,0.14,2025-11-03,12.35,4.94,0,,12.13,ATH,False,False
03-11-2025 10:00,TUCLK,9.77,10.05,9.75,10.02,2175616.0,0.03,0.25,0.02,1566.67,0.25,654070.9,232.63,0.12,True,70.57,0.11,0.01,0.11,2025-11-03,9.74,2.87,0,,9.28,ATH,False,False
03-11-2025 10:00,TRILC,21.3,21.5,21.3,21.48,492031.0,0.02,0.18,0.04,309.09,0.18,250692.6,96.27,0.11,True,59.8,0.03,0.0,0.03,2025-11-03,21.2,1.32,0,,20.78,21.98,False,False
03-11-2025 10:00,TEZOL,13.38,13.5,13.33,13.48,807866.0,0.02,0.1,0.02,426.32,0.1,410749.0,96.68,0.2,True,69.32,0.07,0.01,0.06,2025-11-03,13.3,1.35,0,,13.0,ATH,False,False
03-11-2025 10:00,SOKE,11.75,11.97,11.75,11.93,291424.0,0.04,0.18,0.03,520.69,0.18,129311.8,125.37,0.22,True,73.83,0.06,0.01,0.05,2025-11-03,11.71,1.88,0,,11.57,ATH,False,False
03-11-2025 10:00,AKYHO,3.18,3.21,3.17,3.21,1301559.0,0.0,0.03,0.01,200.0,0.03,317459.7,309.99,0.0,True,61.36,0.01,0.0,0.01,2025-11-03,3.18,0.94,0,,3.11,3.26,False,False
03-11-2025 10:00,SKTAS,5.36,5.8,5.11,5.76,12851022.0,0.04,0.4,0.02,1566.67,0.4,1826904.8,603.43,0.1,True,78.95,0.17,0.03,0.14,2025-11-03,5.28,9.09,1,5.8,4.4,5.8,False,False
03-11-2025 10:00,SILVR,3.01,3.09,2.97,3.07,1471479.0,0.02,0.06,0.02,233.33,0.06,450946.8,226.31,0.33,True,62.87,0.02,0.01,0.01,2025-11-03,3.02,1.66,0,,2.8,ATH,False,False
03-11-2025 10:00,ALARK,81.65,82.75,81.6,82.5,1558710.0,0.25,0.85,0.21,304.76,0.85,537975.2,189.74,0.29,True,70.98,0.23,0.23,0.0,2025-11-03,80.7,2.23,0,,79.4,82.65,False,False
03-11-2025 10:00,MHRGY,3.96,4.08,3.96,4.07,1567873.0,0.01,0.11,0.01,1000.0,0.11,565077.7,177.46,0.09,True,72.26,0.04,-0.0,0.04,2025-11-03,3.96,2.78,0,,3.94,ATH,False,False
03-11-2025 10:00,SANFM,7.3,7.6,7.27,7.52,3477156.0,0.08,0.22,0.03,609.68,0.22,662432.1,424.91,0.36,True,68.05,0.01,0.02,-0.02,2025-11-03,7.24,3.87,0,,7.11,7.6,False,False
03-11-2025 10:00,REEDR,10.21,10.42,10.2,10.39,9714218.0,0.03,0.18,0.03,462.5,0.18,3068809.2,216.55,0.17,True,70.41,0.04,0.02,0.03,2025-11-03,10.16,2.26,0,,9.98,ATH,False,False
03-11-2025 10:00,AVPGY,58.5,59.7,58.5,59.5,299372.0,0.2,1.0,0.14,614.29,1.0,120676.9,148.08,0.2,True,57.89,0.07,-0.04,0.11,2025-11-03,59.0,0.85,0,,57.35,60.6,False,False
03-11-2025 10:00,PRDGS,7.13,7.83,7.12,7.83,8509362.0,0.0,0.7,0.05,1358.33,0.7,2914376.4,191.98,0.0,True,77.48,0.24,0.01,0.23,2025-11-03,7.12,9.97,1,7.83,6.17,ATH,False,False
03-11-2025 10:00,POLHO,17.62,18.83,17.45,18.78,6165423.0,0.05,1.16,0.21,444.6,1.16,1026860.3,500.41,0.04,True,85.5,0.4,0.14,0.26,2025-11-03,17.54,7.07,0,,16.3,ATH,False,False
03-11-2025 10:00,ALKLC,91.95,94.85,91.75,94.5,995816.0,0.35,2.55,0.35,639.13,2.55,546973.1,82.06,0.14,True,58.34,-0.37,0.4,-0.77,2025-11-03,92.0,2.72,0,,89.0,99.3,False,False
03-11-2025 10:00,YESIL,2.76,3.02,2.75,2.97,77586472.0,0.05,0.21,0.02,775.0,0.21,24017585.5,223.04,0.24,True,74.28,0.07,-0.0,0.08,2025-11-03,2.75,8.0,1,3.02,2.56,3.02,False,False
03-11-2025 10:00,ALTNY,67.3,68.25,67.2,68.2,1193216.0,0.05,0.9,0.12,620.0,0.9,425286.2,180.57,0.06,True,55.14,-0.03,-0.19,0.16,2025-11-03,67.25,1.41,0,,66.7,71.75,False,False
03-11-2025 10:00,PATEK,30.9,32.24,30.5,32.1,17091968.0,0.14,1.2,0.2,494.06,1.2,5504888.4,210.49,0.12,True,71.36,0.57,0.11,0.47,2025-11-03,30.0,7.0,0,,28.98,ATH,False,False
03-11-2025 10:00,OBAMS,44.62,45.32,44.58,45.16,1012170.0,0.16,0.54,0.08,610.53,0.54,422510.3,139.56,0.3,True,67.8,0.28,0.02,0.26,2025-11-03,44.56,1.35,0,,43.5,ATH,False,False
03-11-2025 10:00,MNDRS,14.45,15.0,14.45,14.93,1464226.0,0.07,0.48,0.08,540.0,0.48,299438.5,388.99,0.15,True,80.03,0.13,0.04,0.09,2025-11-03,14.4,3.68,0,,14.12,ATH,False,False
03-11-2025 10:00,MIATK,37.42,39.14,37.42,38.94,11920126.0,0.2,1.52,0.16,838.27,1.52,2207977.4,439.87,0.13,True,80.95,0.14,0.15,-0.01,2025-11-03,37.32,4.34,0,,36.86,ATH,False,False
03-11-2025 10:00,CCOLA,51.4,52.5,51.4,52.3,1443423.0,0.2,0.9,0.05,1536.36,0.9,668774.7,115.83,0.22,True,65.76,0.08,0.05,0.03,2025-11-03,51.4,1.75,0,,50.75,52.5,False,False
03-11-2025 10:00,AVGYO,17.45,18.18,16.66,18.02,813502.0,0.16,0.57,0.06,850.0,0.57,230573.2,252.82,0.28,True,58.78,-0.05,0.03,-0.09,2025-11-03,17.33,3.98,2,16.66,16.66,19.4,True,True
03-11-2025 10:00,ZOREN,3.43,3.53,3.42,3.52,42356934.0,0.01,0.09,0.01,900.0,0.09,9718339.3,335.85,0.11,True,77.96,0.03,0.01,0.02,2025-11-03,3.35,5.07,0,,3.31,ATH,False,False
03-11-2025 10:00,BUCIM,6.49,6.57,6.49,6.56,1445764.0,0.01,0.07,0.01,438.46,0.07,658213.1,119.65,0.14,True,76.38,0.03,0.01,0.03,2025-11-03,6.47,1.39,0,,6.39,ATH,False,False
03-11-2025 10:00,HURGZ,6.35,6.46,6.35,6.44,1576937.0,0.02,0.09,0.01,650.0,0.09,510101.6,209.14,0.22,True,58.66,-0.02,0.01,-0.03,2025-11-03,6.29,2.38,0,,6.26,6.62,True,False
03-11-2025 10:00,HATSN,46.54,46.8,46.0,46.8,278427.0,0.0,0.26,0.09,202.33,0.26,118776.6,134.41,0.0,True,81.96,0.36,0.14,0.22,2025-11-03,46.14,1.43,0,,44.5,48.2,False,False
03-11-2025 10:00,HALKB,26.78,27.38,26.76,27.22,22018332.0,0.16,0.44,0.05,856.52,0.44,5676482.5,287.89,0.36,True,72.58,0.12,0.07,0.05,2025-11-03,26.66,2.1,0,,25.98,28.18,False,False
03-11-2025 10:00,GOODY,16.19,16.53,16.18,16.5,835567.0,0.03,0.31,0.04,715.79,0.31,185410.3,350.66,0.1,True,68.13,0.0,0.05,-0.04,2025-11-03,16.18,1.98,0,,15.99,16.76,False,False
03-11-2025 10:00,GENTS,9.2,9.78,9.19,9.75,7507410.0,0.03,0.55,0.07,697.1,0.55,1596978.7,370.1,0.05,True,70.24,0.0,0.04,-0.03,2025-11-03,9.2,5.98,0,,8.93,ATH,False,False
03-11-2025 10:00,FROTO,99.5,101.7,99.5,101.3,3330626.0,0.4,1.8,0.3,500.0,1.8,2104235.6,58.28,0.22,True,71.61,0.66,0.3,0.36,2025-11-03,99.25,2.07,0,,95.85,101.9,False,False
03-11-2025 10:00,BMSCH,20.42,21.92,20.34,21.68,1548792.0,0.24,1.26,0.22,462.5,1.26,512838.2,202.0,0.19,True,81.09,0.54,0.2,0.34,2025-11-03,20.32,6.69,0,,17.26,ATH,False,False
03-11-2025 10:00,EPLAS,6.5,6.75,6.43,6.7,3997555.0,0.05,0.2,0.04,376.19,0.2,919750.0,334.63,0.25,True,58.34,0.04,0.01,0.03,2025-11-03,6.72,-0.3,0,,6.37,6.79,False,False
03-11-2025 10:00,BOBET,20.34,20.56,20.34,20.54,1118317.0,0.02,0.2,0.03,525.0,0.2,306507.2,264.86,0.1,True,63.11,0.08,-0.02,0.11,2025-11-03,20.26,1.38,1,20.56,20.02,20.56,False,False
03-11-2025 10:00,HKTM,12.85,13.08,12.84,13.08,1032042.0,0.0,0.23,0.03,641.94,0.23,363327.0,184.05,0.0,True,74.12,0.16,0.02,0.14,2025-11-03,12.79,2.27,0,,12.11,ATH,False,False
03-11-2025 10:00,EGPRO,27.1,28.12,27.1,28.12,343174.0,0.0,1.02,0.15,562.34,1.02,106630.0,221.84,0.0,True,87.13,0.24,0.11,0.13,2025-11-03,26.92,4.46,0,,26.2,ATH,False,False
03-11-2025 10:00,BSOKE,16.13,17.06,16.13,16.99,6989428.0,0.07,0.86,0.1,751.49,0.86,1585536.0,340.82,0.08,True,78.66,0.17,0.04,0.13,2025-11-03,16.1,5.53,0,,15.73,ATH,False,False
03-11-2025 10:00,EDIP,34.6,35.1,34.58,35.08,392985.0,0.02,0.48,0.1,389.8,0.48,184848.7,112.6,0.04,True,70.56,0.19,0.08,0.11,2025-11-03,34.52,1.62,0,,33.86,35.16,False,False
03-11-2025 10:00,EGSER,3.37,3.46,3.37,3.46,1224780.0,0.0,0.09,0.01,650.0,0.09,385879.4,217.4,0.0,True,72.66,0.01,0.01,-0.0,2025-11-03,3.37,2.67,0,,3.31,3.53,False,False
03-11-2025 10:00,HEKTS,3.61,3.74,3.59,3.71,51197501.0,0.03,0.1,0.02,400.0,0.1,20030279.2,155.6,0.3,True,73.6,0.02,0.02,-0.0,2025-11-03,3.57,3.92,0,,3.45,3.88,False,False
03-11-2025 10:00,BURCE,40.34,43.0,38.5,42.44,1542520.0,0.56,2.1,0.04,5150.0,2.1,364200.2,323.54,0.27,True,70.96,1.67,-0.26,1.93,2025-11-03,40.38,5.1,3,,27.26,ATH,False,False
03-11-2025 10:00,DERHL,16.99,17.16,16.98,17.15,1507133.0,0.01,0.16,0.02,540.0,0.16,487743.5,209.0,0.06,True,59.96,0.04,-0.0,0.04,2025-11-03,16.93,1.3,0,,16.68,17.36,False,False
03-11-2025 10:00,DYOBY,14.15,14.37,14.14,14.31,412941.0,0.06,0.16,0.02,540.0,0.16,153440.3,169.12,0.37,True,65.71,0.05,0.01,0.04,2025-11-03,14.11,1.42,0,,14.04,ATH,False,False
03-11-2025 10:00,IZMDC,6.48,6.64,6.46,6.62,1643764.0,0.02,0.14,0.02,636.84,0.14,650841.3,152.56,0.14,True,72.69,0.07,0.01,0.06,2025-11-03,6.39,3.6,0,,6.31,ATH,False,False
03-11-2025 10:00,DOHOL,17.17,17.34,17.13,17.3,5949899.0,0.04,0.13,0.04,209.52,0.13,3593756.1,65.56,0.31,True,66.91,0.1,0.03,0.07,2025-11-03,17.1,1.17,0,,16.76,ATH,False,False
03-11-2025 10:00,DOGUB,53.0,58.85,53.0,58.75,1525872.0,0.1,5.75,0.57,900.0,5.75,196175.9,677.81,0.02,True,50.84,0.23,-1.03,1.26,2025-11-03,58.85,-0.17,3,,53.0,65.35,False,False
03-11-2025 10:00,ISMEN,43.88,45.32,43.8,44.92,1780476.0,0.4,1.04,0.17,497.7,1.04,691485.8,157.49,0.38,True,63.92,0.2,0.1,0.11,2025-11-03,43.96,2.18,0,,42.36,46.04,False,False
03-11-2025 10:00,DMLKT,6.0,6.01,5.99,6.01,3351980.0,0.0,0.01,0.0,900.0,0.01,1619554.4,106.97,0.0,True,58.88,0.0,0.0,-0.0,2025-11-03,6.0,0.17,1,6.01,5.98,6.02,False,False
31-10-2025 17:00,CONSE,3.34,3.41,3.33,3.39,1645068.0,0.02,0.05,0.01,900.0,0.05,585580.3,180.93,0.4,True,65.87,0.03,-0.0,0.03,2025-10-31,3.33,1.8,0,,3.31,ATH,False,False
31-10-2025 17:00,DGNMO,6.22,6.36,6.21,6.32,813191.0,0.04,0.1,0.02,334.78,0.1,300190.4,170.89,0.4,True,73.84,0.06,0.02,0.04,2025-10-31,6.13,3.1,0,,6.04,ATH,False,False
31-10-2025 17:00,BIENY,40.48,40.82,40.36,40.78,600961.0,0.04,0.3,0.02,1263.64,0.3,261157.2,130.11,0.13,True,59.38,0.06,0.03,0.03,2025-10-31,40.4,0.94,0,,40.06,40.92,False,False
31-10-2025 17:00,OYAKC,21.04,21.3,21.04,21.28,8166445.0,0.02,0.24,0.01,3900.0,0.24,4016722.0,103.31,0.08,True,53.32,-0.11,0.05,-0.16,2025-10-31,20.82,2.21,0,,20.7,22.28,True,False
31-10-2025 17:00,ANELE,16.12,16.52,16.05,16.52,606217.0,0.0,0.4,0.04,1042.86,0.4,225223.1,169.16,0.0,True,62.32,0.0,0.01,-0.01,2025-10-31,16.16,2.23,0,,15.93,16.94,False,False
31-10-2025 17:00,KRDMA,28.54,28.84,28.48,28.8,450861.0,0.04,0.26,0.02,1525.0,0.26,178483.2,152.61,0.15,True,49.68,-0.09,-0.05,-0.04,2025-10-31,28.64,0.56,0,,28.36,29.68,False,False
31-10-2025 17:00,BJKAS,1.93,1.95,1.93,1.95,7664992.0,0.0,0.02,0.0,400.0,0.02,3918829.0,95.59,0.0,True,54.64,-0.0,0.0,-0.0,2025-10-31,1.92,1.56,0,,1.91,2.04,False,False
31-10-2025 17:00,KOZAA,88.55,90.7,88.3,90.4,1232145.0,0.3,1.85,0.34,452.24,1.85,747834.1,64.76,0.16,True,66.95,0.78,0.15,0.63,2025-10-31,86.85,4.09,0,,86.85,ATH,False,False
31-10-2025 17:00,FONET,3.16,3.25,3.14,3.25,28795770.0,0.0,0.09,0.03,246.15,0.09,12389597.5,132.42,0.0,True,75.72,0.06,0.02,0.03,2025-10-31,2.96,9.8,0,,2.9,ATH,False,False
31-10-2025 17:00,BRSAN,463.5,481.75,460.0,481.75,1789429.0,0.0,18.25,2.65,588.68,18.25,507447.8,252.63,0.0,True,78.68,13.38,2.12,11.26,2025-10-31,438.0,9.99,0,,406.5,ATH,False,False
31-10-2025 17:00,ATATP,139.0,144.3,138.6,143.2,418161.0,1.1,4.2,0.83,406.02,4.2,118116.0,254.03,0.26,True,75.46,2.1,0.56,1.54,2025-10-31,134.6,6.39,0,,128.9,ATH,False,False
31-10-2025 17:00,ISKPL,9.13,9.55,9.11,9.53,2939622.0,0.02,0.4,0.03,1438.46,0.4,679583.9,332.56,0.05,True,63.24,-0.0,0.02,-0.02,2025-10-31,9.18,3.81,0,,9.0,9.55,False,False
31-10-2025 17:00,AVHOL,43.96,44.58,43.78,44.58,244063.0,0.0,0.62,0.16,282.72,0.62,158266.3,54.21,0.0,True,77.29,0.47,0.13,0.34,2025-10-31,42.84,4.06,0,,41.6,ATH,False,False
31-10-2025 17:00,AKFIS,25.08,25.74,24.92,25.68,1716254.0,0.06,0.6,0.07,757.14,0.6,598514.2,186.75,0.1,True,71.51,0.2,0.04,0.16,2025-10-31,24.84,3.38,0,,24.48,ATH,False,False
31-10-2025 17:00,IMASM,4.95,5.35,4.95,5.35,67742749.0,0.0,0.4,0.02,1639.13,0.4,21888808.6,209.49,0.0,True,75.84,0.18,0.0,0.18,2025-10-31,4.87,9.86,0,,4.17,ATH,False,False
31-10-2025 16:00,EKSUN,6.43,6.5,6.41,6.49,543815.0,0.01,0.06,0.01,400.0,0.06,233166.8,133.23,0.17,True,67.41,0.03,0.0,0.03,2025-10-31,6.36,2.04,0,,6.32,6.5,False,False
31-10-2025 16:00,NATEN,9.08,9.19,9.07,9.17,1756178.0,0.02,0.09,0.01,650.0,0.09,791358.9,121.92,0.22,True,67.72,0.08,0.0,0.08,2025-10-31,8.97,2.23,0,,8.89,9.3,False,False
31-10-2025 16:00,KCAER,13.62,13.83,13.62,13.8,1579964.0,0.03,0.18,0.03,500.0,0.18,785963.1,101.02,0.17,True,67.7,0.04,0.01,0.04,2025-10-31,13.43,2.76,0,,13.27,13.95,False,False
31-10-2025 16:00,MEGMT,38.18,39.98,38.08,39.56,1837025.0,0.42,1.38,0.14,885.71,1.38,580966.7,216.2,0.3,True,83.75,0.57,0.0,0.56,2025-10-31,38.2,3.56,0,,37.64,ATH,False,False
31-10-2025 16:00,ARZUM,3.17,3.23,3.16,3.22,7385077.0,0.01,0.05,0.0,1566.67,0.05,2964225.6,149.14,0.2,True,64.12,0.02,0.01,0.02,2025-10-31,3.1,3.87,0,,3.1,3.3,False,False
31-10-2025 15:00,MERIT,22.32,22.96,22.32,22.8,830083.0,0.16,0.48,0.15,211.69,0.48,498973.3,66.36,0.33,True,81.53,0.31,0.1,0.2,2025-10-31,21.58,5.65,0,,21.16,ATH,False,False
31-10-2025 15:00,CVKMD,20.88,21.48,20.86,21.42,8812242.0,0.06,0.54,0.0,26900.0,0.54,3431083.4,156.84,0.11,True,64.94,0.24,0.03,0.21,2025-10-31,20.7,3.48,0,,19.49,ATH,False,False
31-10-2025 15:00,BARMA,20.2,20.56,20.08,20.54,451218.0,0.02,0.34,0.04,709.52,0.34,161199.9,179.91,0.06,True,67.66,0.11,0.01,0.1,2025-10-31,20.04,2.5,0,,19.94,20.6,False,False
31-10-2025 14:00,DSTKF,629.5,652.0,628.5,651.0,545538.0,1.0,21.5,1.15,1769.57,21.5,182089.0,199.6,0.05,True,78.32,17.05,-0.26,17.31,2025-10-31,629.0,3.5,0,,556.0,ATH,False,False
31-10-2025 14:00,VAKFN,1.94,1.99,1.93,1.99,44865823.0,0.0,0.05,0.01,455.56,0.05,12667596.3,254.18,0.0,True,74.75,0.03,0.01,0.02,2025-10-31,1.92,3.65,0,,1.88,ATH,False,False
31-10-2025 13:00,HDFGS,5.88,6.28,5.88,6.22,9589267.0,0.06,0.34,0.0,33900.0,0.34,6228329.9,53.96,0.18,True,66.48,0.21,-0.03,0.25,2025-10-31,5.99,3.84,0,,5.7,6.34,False,False
31-10-2025 13:00,KAREL,10.11,10.4,10.11,10.35,2691291.0,0.05,0.24,0.0,5900.0,0.24,1089147.6,147.1,0.21,True,64.49,0.06,0.0,0.06,2025-10-31,10.15,1.97,0,,9.95,ATH,False,False
31-10-2025 12:00,FLAP,10.16,10.42,10.16,10.35,222522.0,0.07,0.19,0.02,1087.5,0.19,98536.9,125.83,0.37,True,61.67,0.1,0.02,0.08,2025-10-31,10.2,1.47,1,10.42,9.8,10.42,False,False
31-10-2025 12:00,XBANK,14591.1,14893.49,14585.19,14845.27,257983024.0,48.22,254.17,38.68,557.19,254.17,120856502.6,113.46,0.19,True,68.42,27.17,25.2,1.97,2025-10-31,14499.48,2.38,0,,14333.7,15348.47,False,False
31-10-2025 12:00,GARAN,130.8,133.9,130.7,133.4,8504858.0,0.5,2.6,0.32,712.5,2.6,5347333.1,59.05,0.19,True,67.67,0.49,0.28,0.2,2025-10-31,130.0,2.62,0,,128.0,137.8,False,False
31-10-2025 12:00,DAPGM,13.54,14.3,13.51,14.3,8179523.0,0.0,0.76,0.12,533.33,0.76,3875925.6,111.03,0.0,True,73.83,0.17,0.08,0.1,2025-10-31,13.6,5.15,0,,12.92,ATH,False,False
31-10-2025 12:00,VAKBN,24.0,24.42,24.0,24.36,5926948.0,0.06,0.36,0.05,620.0,0.36,3105006.3,90.88,0.17,True,65.83,0.05,0.02,0.03,2025-10-31,23.98,1.58,0,,23.56,25.08,False,False
31-10-2025 12:00,OSTIM,3.38,3.42,3.38,3.41,1914106.0,0.01,0.03,0.0,1400.0,0.03,1047177.1,82.79,0.33,True,69.75,0.02,0.0,0.02,2025-10-31,3.34,2.1,0,,3.33,ATH,False,False
31-10-2025 12:00,LIDFA,4.12,4.22,4.12,4.22,2686247.0,0.0,0.1,0.01,809.09,0.1,814016.1,230.0,0.0,True,74.73,0.03,0.0,0.02,2025-10-31,4.09,3.18,0,,4.08,ATH,False,False
31-10-2025 12:00,MERKO,14.1,14.5,14.09,14.48,993892.0,0.02,0.38,0.03,1087.5,0.38,477670.3,108.07,0.05,True,63.24,0.07,-0.0,0.08,2025-10-31,14.22,1.83,0,,13.74,ATH,False,False
31-10-2025 12:00,ECZYT,270.75,285.25,269.25,283.5,584290.0,1.75,12.75,1.08,1086.05,12.75,225565.5,159.03,0.14,True,67.81,1.06,1.12,-0.05,2025-10-31,265.0,6.98,0,,259.75,ATH,False,False
31-10-2025 12:00,BRKVY,80.0,83.85,79.65,83.7,242776.0,0.15,3.7,0.26,1350.98,3.7,122118.6,98.8,0.04,True,64.78,0.65,0.03,0.62,2025-10-31,82.6,1.33,0,,78.7,83.75,False,False
31-10-2025 12:00,TSKB,12.74,12.96,12.73,12.92,4881001.0,0.04,0.18,0.01,1536.36,0.18,2361304.1,106.71,0.22,True,55.49,-0.04,-0.01,-0.03,2025-10-31,12.69,1.81,0,,12.56,13.56,False,False
31-10-2025 11:00,GSDDE,10.48,10.72,10.47,10.69,702766.0,0.03,0.21,0.04,438.46,0.21,299917.5,134.32,0.14,True,78.34,0.12,0.02,0.1,2025-10-31,10.42,2.59,0,,9.95,ATH,False,False
31-10-2025 11:00,OZYSR,35.08,35.7,35.08,35.64,177248.0,0.06,0.56,0.01,5500.0,0.56,68876.0,157.34,0.11,True,64.31,0.35,-0.08,0.44,2025-10-31,35.18,1.31,0,,34.86,36.08,False,False
31-10-2025 11:00,LYDHO,189.3,194.3,189.3,194.3,805610.0,0.0,5.0,0.03,16566.67,5.0,369038.1,118.3,0.0,True,88.18,12.66,1.1,11.57,2025-10-31,176.7,9.96,0,,120.9,ATH,False,False
31-10-2025 11:00,KRTEK,35.58,37.04,35.54,37.04,1123716.0,0.0,1.46,0.34,324.42,1.46,261075.9,330.42,0.0,True,87.33,1.07,0.33,0.74,2025-10-31,33.68,9.98,0,,31.08,ATH,False,False
31-10-2025 11:00,IPEKE,74.25,77.95,74.25,77.4,1075128.0,0.55,3.15,0.45,600.0,3.15,384768.8,179.42,0.17,True,77.63,1.08,0.34,0.74,2025-10-31,72.5,6.76,1,77.95,69.35,77.95,False,False
31-10-2025 11:00,ECILC,89.2,93.05,89.05,92.9,1330921.0,0.15,3.7,0.18,1955.56,3.7,562048.2,136.8,0.04,True,60.39,-0.06,0.13,-0.19,2025-10-31,89.5,3.8,0,,87.1,95.0,False,False
31-10-2025 11:00,GLYHO,11.2,11.43,11.2,11.41,3589852.0,0.02,0.21,0.03,650.0,0.21,1272825.6,182.04,0.1,True,63.66,0.04,-0.01,0.05,2025-10-31,11.17,2.15,0,,11.08,11.52,False,False
31-10-2025 11:00,SISE,36.34,36.9,36.32,36.76,7256505.0,0.14,0.42,0.06,577.42,0.42,4017758.3,80.61,0.33,True,63.7,0.31,-0.02,0.33,2025-10-31,36.76,0.0,0,,35.6,36.96,False,False
31-10-2025 11:00,GOZDE,21.74,22.16,21.72,22.08,411000.0,0.08,0.34,0.01,3300.0,0.34,223743.1,83.69,0.24,True,60.79,0.14,-0.02,0.16,2025-10-31,22.0,0.36,0,,21.26,22.2,False,False
31-10-2025 10:00,DENGE,3.31,3.57,3.31,3.57,36707572.0,0.0,0.26,0.04,534.15,0.26,9603576.6,282.23,0.0,True,92.8,0.13,0.04,0.1,2025-10-31,3.25,9.85,1,3.57,2.83,ATH,False,False
31-10-2025 10:00,KBORU,13.66,14.57,13.43,14.39,9728126.0,0.18,0.73,0.12,503.31,0.73,1740870.4,458.81,0.25,True,62.33,0.18,0.03,0.15,2025-10-31,14.35,0.28,2,13.43,13.43,ATH,False,False
31-10-2025 10:00,SEGMN,21.84,22.24,21.84,22.18,591928.0,0.06,0.34,0.03,962.5,0.34,229579.2,157.83,0.18,True,65.21,0.1,0.02,0.08,2025-10-31,21.84,1.56,1,22.24,21.5,22.24,False,False
31-10-2025 10:00,BAHKM,56.25,57.5,55.7,57.4,475729.0,0.1,1.15,0.1,995.24,1.15,164325.6,189.5,0.09,True,61.22,0.14,0.03,0.11,2025-10-31,56.2,2.14,0,,54.9,57.8,False,False
31-10-2025 10:00,GLRMK,191.0,195.7,190.7,194.4,1482963.0,1.3,3.4,0.24,1316.67,3.4,283225.2,423.6,0.38,True,66.75,0.76,0.42,0.35,2025-10-31,186.9,4.01,0,,185.5,ATH,False,False
31-10-2025 10:00,AVOD,4.2,4.42,4.11,4.39,2221149.0,0.03,0.19,0.03,578.57,0.19,511149.9,334.54,0.16,True,72.21,0.02,0.02,-0.0,2025-10-31,4.22,4.03,1,4.42,4.0,4.42,False,False
31-10-2025 10:00,ALTIN,68.64,70.17,68.63,69.94,13832330.0,0.23,1.3,0.24,430.61,1.3,4744240.8,191.56,0.18,True,65.71,0.02,0.39,-0.37,2025-10-31,68.28,2.43,1,70.17,65.0,70.17,False,False
31-10-2025 10:00,MAKIM,17.55,18.42,17.52,18.22,2006325.0,0.2,0.67,0.06,980.65,0.67,255402.7,685.55,0.3,True,82.2,0.16,0.09,0.07,2025-10-31,17.0,7.18,0,,16.75,ATH,False,False
31-10-2025 10:00,VRGYO,3.34,3.43,3.32,3.42,10831674.0,0.01,0.08,0.01,788.89,0.08,3668017.8,195.3,0.13,True,67.57,0.04,0.0,0.04,2025-10-31,3.36,1.79,2,3.32,3.32,ATH,False,False
31-10-2025 10:00,ADGYO,51.35,54.55,51.0,53.95,462220.0,0.6,2.6,0.57,359.36,2.6,184920.1,149.96,0.23,True,88.31,1.05,0.46,0.59,2025-10-31,51.35,5.06,1,54.55,45.36,54.55,False,False
31-10-2025 10:00,CEMZY,50.95,54.3,50.2,53.45,3214511.0,0.85,2.5,0.44,468.18,2.5,692467.6,364.21,0.34,True,92.3,2.03,0.41,1.62,2025-10-31,49.5,7.98,0,,41.12,ATH,False,False
31-10-2025 10:00,CEMTS,11.01,11.29,10.93,11.25,1647639.0,0.04,0.24,0.03,727.59,0.24,735942.1,123.88,0.17,True,64.05,0.08,0.01,0.08,2025-10-31,11.03,1.99,2,10.93,10.93,11.28,False,False
30-10-2025 17:00,SAHOL,80.25,80.75,80.0,80.7,4552124.0,0.05,0.45,0.08,462.5,0.45,3010517.0,51.21,0.11,True,57.92,0.05,0.03,0.02,2025-10-30,79.35,1.7,0,,79.2,84.65,False,False
30-10-2025 16:00,ANGEN,12.16,12.95,12.06,12.95,5023256.0,0.0,0.79,0.05,1512.24,0.79,1738611.2,188.92,0.0,True,76.36,0.21,0.05,0.16,2025-10-30,12.2,6.15,0,,11.54,ATH,False,False
30-10-2025 15:00,KARSN,10.22,10.62,10.21,10.55,6654539.0,0.07,0.33,0.06,450.0,0.33,1594036.2,317.46,0.21,True,79.64,0.08,0.04,0.04,2025-10-30,9.96,5.92,0,,9.93,ATH,False,False
30-10-2025 14:00,ENJSA,81.95,83.25,81.9,83.15,568197.0,0.1,1.2,0.17,605.88,1.2,242046.0,134.75,0.08,True,67.09,0.39,0.14,0.26,2025-10-30,80.9,2.78,0,,80.55,ATH,False,False
30-10-2025 13:00,DZGYO,7.02,7.24,7.0,7.23,1779130.0,0.01,0.21,0.03,577.42,0.21,659377.2,169.82,0.05,True,74.96,0.06,0.02,0.04,2025-10-30,6.81,6.17,0,,6.8,ATH,False,False
30-10-2025 13:00,ETILR,4.3,4.44,4.29,4.43,3086103.0,0.01,0.13,0.01,766.67,0.13,885013.6,248.71,0.08,True,69.4,0.01,0.01,0.0,2025-10-30,4.25,4.24,0,,4.23,4.44,False,False
30-10-2025 13:00,TCKRC,49.78,50.55,49.6,50.55,177836.0,0.0,0.77,0.31,147.59,0.77,113722.1,56.38,0.0,True,81.5,0.91,0.17,0.73,2025-10-30,47.94,5.44,0,,46.64,ATH,False,False
30-10-2025 11:00,PRKAB,33.56,35.16,33.54,35.02,324933.0,0.14,1.46,0.19,652.58,1.46,65557.9,395.64,0.1,True,77.38,0.36,0.07,0.29,2025-10-30,32.78,6.83,0,,32.66,ATH,False,False
30-10-2025 10:00,TUREX,8.04,8.43,8.0,8.38,19424258.0,0.05,0.34,0.06,466.67,0.34,6182749.7,214.17,0.15,True,78.19,0.09,0.04,0.06,2025-10-30,8.0,4.75,0,,7.72,ATH,False,False
30-10-2025 10:00,TURGG,28.5,31.04,28.46,31.04,1001405.0,0.0,2.54,0.22,1054.55,2.54,241757.1,314.22,0.0,True,76.9,0.44,0.16,0.27,2025-10-30,28.22,9.99,1,31.04,27.76,ATH,False,False
30-10-2025 10:00,AZTEK,51.75,52.7,51.55,52.6,290421.0,0.1,0.85,0.11,639.13,0.85,103096.5,181.7,0.12,True,57.86,-0.31,0.13,-0.44,2025-10-30,51.25,2.63,0,,51.15,53.8,True,True
30-10-2025 10:00,ICUGS,3.24,3.5,3.21,3.45,29899752.0,0.05,0.21,0.04,400.0,0.21,13859989.7,115.73,0.24,True,66.25,0.04,0.03,0.01,2025-10-30,3.34,3.29,1,3.5,3.09,3.5,False,False
30-10-2025 10:00,KOPOL,7.06,7.33,7.06,7.32,3233218.0,0.01,0.26,0.02,1525.0,0.26,1330110.0,143.08,0.04,True,79.72,0.18,0.01,0.17,2025-10-30,7.02,4.27,0,,6.2,ATH,False,False
30-10-2025 10:00,ARDYZ,27.82,29.76,27.82,29.5,4803386.0,0.26,1.68,0.25,572.0,1.68,1050290.6,357.34,0.15,True,86.89,0.66,0.15,0.52,2025-10-30,27.68,6.58,0,,24.72,ATH,False,False
30-10-2025 10:00,MOPAS,34.9,35.32,34.9,35.2,747824.0,0.12,0.3,0.04,650.0,0.3,313091.1,138.85,0.4,True,61.17,0.04,0.06,-0.02,2025-10-30,34.8,1.15,0,,34.34,35.74,False,False
30-10-2025 10:00,SKYMD,13.15,13.46,13.13,13.41,776419.0,0.05,0.26,0.01,2500.0,0.26,356613.5,117.72,0.19,True,58.87,-0.0,-0.01,0.0,2025-10-30,13.15,1.98,0,,13.06,13.5,False,False
30-10-2025 10:00,KFEIN,9.54,10.26,9.53,10.15,6013429.0,0.11,0.61,0.06,853.12,0.61,943983.0,537.03,0.18,True,72.51,0.05,0.03,0.02,2025-10-30,9.46,7.29,1,10.26,9.32,10.26,False,False
30-10-2025 10:00,YIGIT,25.14,26.3,25.14,26.18,1341070.0,0.12,1.04,0.14,632.39,1.04,288709.0,364.51,0.12,True,78.4,0.23,0.05,0.17,2025-10-30,25.04,4.55,0,,24.66,ATH,False,False
30-10-2025 10:00,CWENE,24.22,25.5,24.2,25.28,5468288.0,0.22,1.06,0.12,754.84,1.06,1167188.1,368.5,0.21,True,74.58,0.11,0.04,0.07,2025-10-30,24.2,4.46,0,,24.0,ATH,False,False
30-10-2025 10:00,BINBN,181.7,202.5,180.1,200.5,844492.0,2.0,18.8,1.66,1032.53,18.8,307567.0,174.57,0.11,True,68.12,6.67,-0.75,7.42,2025-10-30,185.0,8.38,0,,180.0,ATH,False,False
30-10-2025 10:00,GEDZA,28.0,28.42,27.94,28.38,282850.0,0.04,0.38,0.07,427.78,0.38,55541.6,409.26,0.11,True,64.21,0.03,0.09,-0.06,2025-10-30,27.82,2.01,0,,27.68,ATH,False,False
30-10-2025 10:00,INFO,4.59,5.04,4.59,5.04,38494533.0,0.0,0.45,0.07,508.11,0.45,12607660.2,205.33,0.0,True,81.82,0.08,0.07,0.01,2025-10-30,4.59,9.8,1,5.04,4.22,ATH,False,False
30-10-2025 10:00,TCELL,101.0,102.9,99.85,102.8,5599824.0,0.1,1.8,0.22,700.0,1.8,2233739.6,150.69,0.06,True,67.9,0.48,0.04,0.44,2025-10-30,100.6,2.19,0,,99.45,104.4,False,False
30-10-2025 10:00,ALKIM,18.61,20.48,18.55,20.0,5605253.0,0.48,1.39,0.12,1039.34,1.39,762840.4,634.79,0.35,True,71.5,0.06,0.05,0.0,2025-10-30,18.62,7.41,3,,17.94,ATH,False,False
30-10-2025 10:00,PRKME,17.56,17.94,17.56,17.93,385240.0,0.01,0.37,0.01,4525.0,0.37,151266.9,154.68,0.03,True,62.39,0.04,-0.02,0.07,2025-10-30,17.52,2.34,0,,17.52,18.18,False,False
30-10-2025 10:00,KNFRT,13.26,14.03,13.22,13.94,973892.0,0.09,0.68,0.06,1136.36,0.68,235787.4,313.04,0.13,True,76.62,0.05,0.05,0.0,2025-10-30,13.19,5.69,0,,12.95,ATH,False,False
30-10-2025 10:00,ULUFA,4.0,4.17,4.0,4.13,8811548.0,0.04,0.13,0.01,900.0,0.13,2597467.5,239.24,0.31,True,68.86,0.03,-0.0,0.03,2025-10-30,3.97,4.03,1,4.17,3.96,4.17,False,False
30-10-2025 10:00,RUZYE,13.4,14.45,13.39,14.22,9086296.0,0.23,0.82,0.04,2057.89,0.82,3066433.6,196.31,0.28,True,69.87,0.34,0.0,0.34,2025-10-30,13.4,6.12,2,13.39,13.39,ATH,False,False
30-10-2025 10:00,BINHO,11.41,12.13,11.41,12.03,41371112.0,0.1,0.62,0.07,798.55,0.62,23251933.0,77.93,0.16,True,72.29,0.39,0.02,0.36,2025-10-30,11.23,7.12,0,,9.84,ATH,False,False
28-10-2025 11:30,CEMAS,5.68,6.09,5.66,6.08,24906409.0,0.01,0.4,0.03,1328.57,0.4,7819135.1,218.53,0.02,True,68.34,0.03,0.01,0.02,2025-10-28,5.69,6.85,0,,5.6,6.11,False,False
28-10-2025 11:30,BORLS,27.32,27.92,27.16,27.78,491369.0,0.14,0.46,0.05,784.62,0.46,182399.1,169.39,0.3,True,57.07,0.09,-0.04,0.13,2025-10-28,27.64,0.51,2,27.16,27.16,28.7,False,False
28-10-2025 11:30,EKOS,27.24,28.28,27.16,28.08,2748896.0,0.2,0.84,0.17,400.0,0.84,736004.3,273.49,0.24,True,80.07,0.48,0.19,0.29,2025-10-28,26.46,6.12,0,,24.6,ATH,False,False
28-10-2025 10:30,INDES,8.11,8.24,8.1,8.22,927167.0,0.02,0.11,0.0,6.19244948763449e+16,0.11,566457.4,63.68,0.18,True,61.15,0.02,-0.01,0.03,2025-10-28,8.11,1.36,0,,8.04,8.33,False,False
28-10-2025 10:30,INVEO,10.91,11.32,10.89,11.29,3900581.0,0.03,0.38,0.02,2011.11,0.38,1481324.1,163.32,0.08,True,65.69,0.07,0.02,0.05,2025-10-28,10.92,3.39,0,,10.82,11.38,False,False
28-10-2025 10:30,ADESE,3.95,4.14,3.95,4.11,64285368.0,0.03,0.16,0.01,1130.77,0.16,31135082.3,106.47,0.19,True,50.2,-0.04,-0.01,-0.03,2025-10-28,3.99,3.01,1,4.14,ATL,4.14,False,False
28-10-2025 10:30,ULUUN,7.6,7.71,7.59,7.71,622020.0,0.0,0.11,0.01,1733.33,0.11,246552.7,152.29,0.0,True,67.23,0.05,-0.01,0.05,2025-10-28,7.62,1.18,0,,7.53,ATH,False,False
28-10-2025 10:30,KRDMD,27.74,28.62,27.7,28.52,11819651.0,0.1,0.78,0.03,2337.5,0.78,6696976.8,76.49,0.13,True,62.65,0.38,-0.09,0.47,2025-10-28,28.18,1.21,0,,27.62,28.7,False,False
28-10-2025 10:30,TEKTU,22.88,23.8,22.52,23.76,4703391.0,0.04,0.88,0.12,633.33,0.88,3112226.7,51.13,0.05,True,65.59,0.23,0.25,-0.02,2025-10-28,23.02,3.21,0,,20.32,24.26,False,False
28-10-2025 09:30,RTALB,4.13,4.27,3.99,4.27,29954567.0,0.0,0.14,0.01,833.33,0.14,7481175.9,300.4,0.0,True,86.09,0.05,0.03,0.02,2025-10-28,3.89,9.77,0,,3.79,ATH,False,False
28-10-2025 09:30,AKGRT,6.9,7.0,6.73,6.99,11098996.0,0.01,0.09,0.0,1700.0,0.09,2709246.7,309.67,0.11,True,74.0,0.06,0.01,0.05,2025-10-28,6.83,2.34,2,6.73,6.73,ATH,False,False
28-10-2025 09:30,SNICA,5.4,5.47,5.31,5.45,5265895.0,0.02,0.05,0.01,614.29,0.05,2516604.2,109.25,0.4,True,76.16,0.1,-0.01,0.11,2025-10-28,5.38,1.3,0,,4.83,5.52,False,False
27-10-2025 17:00,EGEGY,26.74,27.84,26.68,27.84,1580709.0,0.0,1.1,0.26,329.69,1.1,289969.3,445.13,0.0,True,86.61,0.51,0.2,0.31,2025-10-27,25.32,9.95,0,,24.04,ATH,False,False
27-10-2025 16:00,SEGYO,4.96,5.15,4.95,5.13,4076795.0,0.02,0.17,0.01,2025.0,0.17,1607838.7,153.56,0.12,True,70.4,0.13,-0.03,0.16,2025-10-27,4.95,3.64,0,,4.88,5.22,False,False
27-10-2025 15:00,DAGI,8.39,8.83,8.36,8.74,9324430.0,0.09,0.35,0.06,464.52,0.35,1816228.3,413.4,0.26,True,82.46,0.05,0.06,-0.02,2025-10-27,8.11,7.77,0,,8.06,ATH,False,False
27-10-2025 15:00,KOCMT,2.83,2.88,2.83,2.88,7442679.0,0.0,0.05,0.01,284.62,0.05,3320331.0,124.15,0.0,True,81.3,0.04,0.02,0.02,2025-10-27,2.73,5.49,0,,2.6,ATH,False,False
27-10-2025 13:00,CRFSA,125.7,129.6,124.8,129.0,167885.0,0.6,3.3,0.66,400.0,3.3,82000.1,104.74,0.18,True,76.13,0.89,0.69,0.2,2025-10-27,123.0,4.88,1,129.6,119.0,129.6,False,False
27-10-2025 12:00,HEDEF,79.45,85.5,79.0,84.05,4257958.0,1.45,4.6,0.31,1383.87,4.6,2234252.0,90.58,0.32,True,41.07,-1.87,-1.74,-0.14,2025-10-27,87.3,-3.72,0,,78.6,97.0,False,False
27-10-2025 11:00,IZENR,8.61,8.94,8.61,8.94,4583010.0,0.0,0.33,0.03,842.86,0.33,2260813.4,102.72,0.0,True,76.17,0.11,0.04,0.06,2025-10-27,8.47,5.55,0,,8.16,ATH,False,False
27-10-2025 10:00,BEGYO,6.4,6.61,6.38,6.57,27010842.0,0.04,0.17,0.05,220.75,0.17,6757686.0,299.71,0.24,True,96.86,0.32,0.06,0.26,2025-10-27,6.11,7.53,1,6.61,5.0,6.61,False,False
27-10-2025 10:00,FADE,14.89,15.8,14.88,15.67,1332816.0,0.13,0.78,0.11,584.21,0.78,245031.8,443.94,0.17,True,88.24,0.17,0.1,0.07,2025-10-27,14.78,6.02,0,,14.28,ATH,False,False
24-10-2025 17:00,MERCN,28.3,30.42,27.86,30.0,5310566.0,0.42,1.7,0.23,632.76,1.7,2171113.2,144.6,0.25,True,57.52,-1.17,0.5,-1.68,2025-10-24,27.88,7.6,1,30.42,26.48,30.42,True,False
24-10-2025 15:00,LINK,336.75,358.5,335.0,358.5,462299.0,0.0,21.75,3.15,590.48,21.75,94164.0,390.95,0.0,True,84.34,4.78,2.55,2.23,2025-10-24,326.0,9.97,0,,322.25,ATH,False,False
24-10-2025 15:00,MTRKS,28.28,29.0,28.28,28.94,244511.0,0.06,0.66,0.02,3200.0,0.66,146650.0,66.73,0.09,True,59.61,0.11,-0.05,0.17,2025-10-24,28.04,3.21,0,,27.7,29.5,False,False
24-10-2025 11:00,XU100,10734.18,11158.05,10723.76,11050.49,3969968650.0,107.56,316.31,42.13,650.83,316.31,1472604215.7,169.59,0.34,True,86.02,79.83,,,2025-10-24,10608.26,4.17,1,11158.05,10551.34,11158.05,False,False
24-10-2025 11:00,BIMAS,554.0,585.0,553.0,580.0,3919248.0,5.0,26.0,2.95,781.36,26.0,843460.7,364.66,0.19,True,85.74,9.26,,,2025-10-24,547.0,6.03,0,,ATL,ATH,False,False
24-10-2025 11:00,DARDL,2.45,2.54,2.44,2.52,19006701.0,0.02,0.07,0.0,2233.33,0.07,5681847.1,234.52,0.29,True,68.25,0.02,,,2025-10-24,2.42,4.13,0,,2.38,ATH,False,False
24-10-2025 11:00,SAFKR,22.68,23.54,22.64,23.52,2932139.0,0.02,0.84,0.19,342.11,0.84,1898627.1,54.43,0.02,True,84.29,0.93,,,2025-10-24,22.86,2.89,0,,ATL,ATH,False,False
24-10-2025 11:00,XU030,11730.87,12254.79,11716.46,12131.22,2727055314.0,123.57,400.35,55.11,626.47,400.35,979192663.5,178.5,0.31,True,86.4,102.33,,,2025-10-24,11567.76,4.87,1,12254.79,11487.77,12254.79,False,False
24-10-2025 11:00,KRDMB,25.7,26.4,25.66,26.26,451967.0,0.14,0.56,0.07,656.76,0.56,96184.2,369.9,0.25,True,75.09,0.31,,,2025-10-24,25.4,3.39,0,,23.82,ATH,False,False
24-10-2025 11:00,SARKY,14.45,15.07,14.45,15.01,796082.0,0.06,0.56,0.05,1042.86,0.56,167616.7,374.94,0.11,True,81.1,0.02,,,2025-10-24,14.35,4.6,0,,14.05,ATH,False,False
24-10-2025 11:00,GWIND,24.52,25.18,24.44,25.06,2148610.0,0.12,0.54,0.04,1185.71,0.54,582269.1,269.01,0.22,True,71.27,0.05,,,2025-10-24,24.24,3.38,0,,24.2,ATH,False,False
24-10-2025 11:00,DURKN,15.19,15.69,15.13,15.55,1707483.0,0.14,0.36,0.04,737.21,0.36,418622.7,307.88,0.39,True,80.67,0.09,,,2025-10-24,15.15,2.64,1,15.69,14.94,15.69,False,False
24-10-2025 11:00,DMSAS,8.99,9.09,8.99,9.07,1564090.0,0.02,0.08,0.01,788.89,0.08,352374.4,343.87,0.25,True,63.96,0.02,,,2025-10-24,8.96,1.23,0,,8.96,9.09,False,False
24-10-2025 11:00,ISFIN,18.8,19.44,18.68,19.44,5890316.0,0.0,0.64,0.05,1233.33,0.64,1282748.3,359.19,0.0,True,81.45,0.29,,,2025-10-24,17.68,9.95,1,19.44,17.67,ATH,False,False
24-10-2025 11:00,BEYAZ,28.18,29.1,28.12,28.88,573522.0,0.22,0.7,0.03,2233.33,0.7,185893.0,208.52,0.31,True,62.83,-0.09,,,2025-10-24,28.0,3.14,0,,28.0,28.92,False,False
24-10-2025 10:00,LMKDC,24.32,24.76,24.3,24.66,1330007.0,0.1,0.34,0.04,750.0,0.34,440652.2,201.83,0.29,True,70.06,0.03,,,2025-10-24,24.22,1.82,0,,24.08,ATH,False,False
23-10-2025 17:00,KONKA,16.75,17.05,16.73,17.0,529017.51,0.05,0.25,0.02,900.0,0.25,179764.97,194.28,0.2,True,57.56,-0.06,,,2025-10-23,16.87,0.79,0,,16.66,17.27,False,False
23-10-2025 14:00,SASA,3.05,3.21,3.02,3.19,1514921422.0,0.02,0.14,0.02,636.84,0.14,272781338.7,455.36,0.14,True,79.01,,,,2025-10-23,3.01,5.98,0,,3.0,ATH,False,False
23-10-2025 11:00,PETUN,12.56,12.78,12.56,12.72,338739.0,0.06,0.16,0.02,661.9,0.16,147608.3,129.49,0.37,True,77.11,,,,2025-10-23,12.44,2.25,1,12.78,12.35,12.78,False,False
23-10-2025 11:00,DESA,14.61,14.94,14.59,14.85,259624.0,0.09,0.24,0.02,1500.0,0.24,101996.1,154.54,0.37,True,59.0,,,,2025-10-23,14.54,2.13,0,,14.48,14.98,False,False
23-10-2025 11:00,DMRGD,24.9,26.36,24.88,26.0,1183630.0,0.36,1.1,0.02,4900.0,1.1,301478.0,292.61,0.33,True,60.18,,,,2025-10-23,25.2,3.17,2,24.88,24.88,ATH,False,False
23-10-2025 10:00,IEYHO,30.78,32.0,30.6,31.86,11422141.0,0.14,1.08,0.15,629.73,1.08,5186734.5,120.22,0.13,True,79.63,,,,2025-10-23,30.4,4.8,0,,ATL,ATH,False,False
23-10-2025 10:00,TUPRS,182.2,188.2,181.2,187.9,8808648.0,0.3,5.7,0.63,804.76,5.7,2256781.0,290.32,0.05,True,86.29,,,,2025-10-23,181.7,3.41,0,,ATL,ATH,False,False
22-10-2025 17:00,FRIGO,10.97,11.07,10.88,11.07,3799314.0,0.0,0.1,0.0,4900.0,0.1,1166932.9,225.58,0.0,True,56.55,,,,2025-10-22,11.04,0.27,2,10.88,10.88,ATH,False,False
22-10-2025 17:00,YAYLA,31.56,33.92,31.36,33.92,552711.0,0.0,2.36,0.21,1002.8,2.36,151109.1,265.77,0.0,True,85.42,,,,2025-10-22,31.78,6.73,2,31.36,31.36,ATH,False,False
22-10-2025 17:00,ODAS,5.4,5.62,5.39,5.61,47024113.0,0.01,0.21,0.05,356.52,0.21,9603136.9,389.67,0.05,True,91.81,,,,2025-10-22,5.11,9.78,0,,ATL,ATH,False,False
22-10-2025 17:00,EUREN,8.28,8.71,8.24,8.65,15356013.0,0.06,0.37,0.02,1661.9,0.37,5150779.3,198.13,0.16,True,71.84,,,,2025-10-22,8.4,2.98,0,,8.16,ATH,False,False
22-10-2025 13:00,GSRAY,1.53,1.56,1.52,1.56,248223748.0,0.0,0.03,0.0,1400.0,0.03,80109403.2,209.86,0.0,True,,,,,2025-10-22,1.52,2.63,0,,ATL,ATH,False,False
22-10-2025 13:00,BALSU,20.38,20.64,20.02,20.64,647633.0,0.0,0.26,0.05,381.48,0.26,332590.0,94.72,0.0,True,,,,,2025-10-22,20.2,2.18,2,20.02,20.02,ATH,False,False
22-10-2025 13:00,HATEK,14.76,15.62,14.76,15.54,587102.0,0.08,0.78,0.08,817.65,0.78,175749.7,234.06,0.1,True,,,,,2025-10-22,14.64,6.15,0,,14.58,ATH,False,False
22-10-2025 12:00,ENKAI,72.25,74.25,72.0,73.95,6696915.0,0.3,1.7,0.19,794.74,1.7,2117344.2,216.29,0.18,True,,,,,2025-10-22,71.2,3.86,0,,71.1,ATH,False,False
22-10-2025 11:00,TRCAS,37.1,38.0,37.08,37.78,431878.0,0.22,0.68,0.19,250.52,0.68,167260.3,158.21,0.32,True,,,,,2025-10-22,36.2,4.36,1,38.0,ATL,38.0,False,False
